[
  {
    "session_date_display": "14.04.2023",
    "session_date_iso": "2023-04-14T00:00:00",
    "gp_code": "XXVII",
    "chamber": "BRSITZ",
    "session_number": 952,
    "title": "952. Sitzung (952/BRSITZ/2023)",
    "citation": "952/BRSITZ/2023",
    "session_detail_url": "https://www.parlament.gv.at/gegenstand/BR/BRSITZ/952",
    "protocol_pdf_url": "https://www.parlament.gv.at/dokument/BR/BRSITZ/952/fname_1629065.pdf",
    "protocol_html_url": "https://www.parlament.gv.at/dokument/BR/BRSITZ/952/fnameorig_1629065.html",
    "uid": "XXVII_BRSITZ_952",
    "raw_path": "steno_protocols/raw_html/XXVII_BRSITZ_952.html",
    "txt_path": "steno_protocols/plain_text/XXVII_BRSITZ_952.txt"
  },
  {
    "session_date_display": "06.10.2022",
    "session_date_iso": "2022-10-06T00:00:00",
    "gp_code": "XXVII",
    "chamber": "BRSITZ",
    "session_number": 945,
    "title": "945. Sitzung (945/BRSITZ/2022)",
    "citation": "945/BRSITZ/2022",
    "session_detail_url": "https://www.parlament.gv.at/gegenstand/BR/BRSITZ/945",
    "protocol_pdf_url": "https://www.parlament.gv.at/dokument/BR/BRSITZ/945/fname_1578543.pdf",
    "protocol_html_url": "https://www.parlament.gv.at/dokument/BR/BRSITZ/945/fnameorig_1578543.html",
    "uid": "XXVII_BRSITZ_945",
    "raw_path": "steno_protocols/raw_html/XXVII_BRSITZ_945.html",
    "txt_path": "steno_protocols/plain_text/XXVII_BRSITZ_945.txt"
  },
  {
    "session_date_display": "20.10.2022",
    "session_date_iso": "2022-10-20T00:00:00",
    "gp_code": "XXVII",
    "chamber": "BRSITZ",
    "session_number": 946,
    "title": "946. Sitzung (946/BRSITZ/2022)",
    "citation": "946/BRSITZ/2022",
    "session_detail_url": "https://www.parlament.gv.at/gegenstand/BR/BRSITZ/946",
    "protocol_pdf_url": "https://www.parlament.gv.at/dokument/BR/BRSITZ/946/fname_1557178.pdf",
    "protocol_html_url": "https://www.parlament.gv.at/dokument/BR/BRSITZ/946/fnameorig_1557178.html",
    "uid": "XXVII_BRSITZ_946",
    "raw_path": "steno_protocols/raw_html/XXVII_BRSITZ_946.html",
    "txt_path": "steno_protocols/plain_text/XXVII_BRSITZ_946.txt"
  },
  {
    "session_date_display": "28.03.2008",
    "session_date_iso": "2008-03-28T00:00:00",
    "gp_code": "XXIII",
    "chamber": "BRSITZ",
    "session_number": 754,
    "title": "754. Sitzung (754/BRSITZ/2008)",
    "citation": "754/BRSITZ/2008",
    "session_detail_url": "https://www.parlament.gv.at/gegenstand/BR/BRSITZ/754",
    "protocol_pdf_url": "https://www.parlament.gv.at/dokument/BR/BRSITZ/754/fname_116944.pdf",
    "protocol_html_url": "https://www.parlament.gv.at/dokument/BR/BRSITZ/754/fnameorig_116944.html",
    "uid": "XXIII_BRSITZ_754",
    "raw_path": "steno_protocols/raw_html/XXIII_BRSITZ_754.html",
    "txt_path": "steno_protocols/plain_text/XXIII_BRSITZ_754.txt"
  },
  {
    "session_date_display": "21.10.2021",
    "session_date_iso": "2021-10-21T00:00:00",
    "gp_code": "XXVII",
    "chamber": "BRSITZ",
    "session_number": 931,
    "title": "931. Sitzung (931/BRSITZ/2021)",
    "citation": "931/BRSITZ/2021",
    "session_detail_url": "https://www.parlament.gv.at/gegenstand/BR/BRSITZ/931",
    "protocol_pdf_url": "https://www.parlament.gv.at/dokument/BR/BRSITZ/931/fname_1410379.pdf",
    "protocol_html_url": "https://www.parlament.gv.at/dokument/BR/BRSITZ/931/fnameorig_1410379.html",
    "uid": "XXVII_BRSITZ_931",
    "raw_path": "steno_protocols/raw_html/XXVII_BRSITZ_931.html",
    "txt_path": "steno_protocols/plain_text/XXVII_BRSITZ_931.txt"
  },
  {
    "session_date_display": "08.11.2018",
    "session_date_iso": "2018-11-08T00:00:00",
    "gp_code": "XXVI",
    "chamber": "BRSITZ",
    "session_number": 885,
    "title": "885. Sitzung (885/BRSITZ/2018)",
    "citation": "885/BRSITZ/2018",
    "session_detail_url": "https://www.parlament.gv.at/gegenstand/BR/BRSITZ/885",
    "protocol_pdf_url": "https://www.parlament.gv.at/dokument/BR/BRSITZ/885/fname_753675.pdf",
    "protocol_html_url": "https://www.parlament.gv.at/dokument/BR/BRSITZ/885/fnameorig_753675.html",
    "uid": "XXVI_BRSITZ_885",
    "raw_path": "steno_protocols/raw_html/XXVI_BRSITZ_885.html",
    "txt_path": "steno_protocols/plain_text/XXVI_BRSITZ_885.txt"
  },
  {
    "session_date_display": "28.06.2018",
    "session_date_iso": "2018-06-28T00:00:00",
    "gp_code": "XXVI",
    "chamber": "BRSITZ",
    "session_number": 881,
    "title": "881. Sitzung (881/BRSITZ/2018)",
    "citation": "881/BRSITZ/2018",
    "session_detail_url": "https://www.parlament.gv.at/gegenstand/BR/BRSITZ/881",
    "protocol_pdf_url": "https://www.parlament.gv.at/dokument/BR/BRSITZ/881/fname_740710.pdf",
    "protocol_html_url": "https://www.parlament.gv.at/dokument/BR/BRSITZ/881/fnameorig_740710.html",
    "uid": "XXVI_BRSITZ_881",
    "raw_path": "steno_protocols/raw_html/XXVI_BRSITZ_881.html",
    "txt_path": "steno_protocols/plain_text/XXVI_BRSITZ_881.txt"
  },
  {
    "session_date_display": "12.07.2018",
    "session_date_iso": "2018-07-12T00:00:00",
    "gp_code": "XXVI",
    "chamber": "BRSITZ",
    "session_number": 883,
    "title": "883. Sitzung (883/BRSITZ/2018)",
    "citation": "883/BRSITZ/2018",
    "session_detail_url": "https://www.parlament.gv.at/gegenstand/BR/BRSITZ/883",
    "protocol_pdf_url": "https://www.parlament.gv.at/dokument/BR/BRSITZ/883/fname_741079.pdf",
    "protocol_html_url": "https://www.parlament.gv.at/dokument/BR/BRSITZ/883/fnameorig_741079.html",
    "uid": "XXVI_BRSITZ_883",
    "raw_path": "steno_protocols/raw_html/XXVI_BRSITZ_883.html",
    "txt_path": "steno_protocols/plain_text/XXVI_BRSITZ_883.txt"
  },
  {
    "session_date_display": "28.01.2021",
    "session_date_iso": "2021-01-28T00:00:00",
    "gp_code": "XXVII",
    "chamber": "BRSITZ",
    "session_number": 921,
    "title": "921. Sitzung (921/BRSITZ/2021)",
    "citation": "921/BRSITZ/2021",
    "session_detail_url": "https://www.parlament.gv.at/gegenstand/BR/BRSITZ/921",
    "protocol_pdf_url": "https://www.parlament.gv.at/dokument/BR/BRSITZ/921/fname_949039.pdf",
    "protocol_html_url": "https://www.parlament.gv.at/dokument/BR/BRSITZ/921/fnameorig_949039.html",
    "uid": "XXVII_BRSITZ_921",
    "raw_path": "steno_protocols/raw_html/XXVII_BRSITZ_921.html",
    "txt_path": "steno_protocols/plain_text/XXVII_BRSITZ_921.txt"
  },
  {
    "session_date_display": "14.02.2019",
    "session_date_iso": "2019-02-14T00:00:00",
    "gp_code": "XXVI",
    "chamber": "BRSITZ",
    "session_number": 889,
    "title": "889. Sitzung (889/BRSITZ/2019)",
    "citation": "889/BRSITZ/2019",
    "session_detail_url": "https://www.parlament.gv.at/gegenstand/BR/BRSITZ/889",
    "protocol_pdf_url": "https://www.parlament.gv.at/dokument/BR/BRSITZ/889/fname_771169.pdf",
    "protocol_html_url": "https://www.parlament.gv.at/dokument/BR/BRSITZ/889/fnameorig_771169.html",
    "uid": "XXVI_BRSITZ_889",
    "raw_path": "steno_protocols/raw_html/XXVI_BRSITZ_889.html",
    "txt_path": "steno_protocols/plain_text/XXVI_BRSITZ_889.txt"
  },
  {
    "session_date_display": "13.07.2022",
    "session_date_iso": "2022-07-13T00:00:00",
    "gp_code": "XXVII",
    "chamber": "BRSITZ",
    "session_number": 943,
    "title": "943. Sitzung (943/BRSITZ/2022)",
    "citation": "943/BRSITZ/2022",
    "session_detail_url": "https://www.parlament.gv.at/gegenstand/BR/BRSITZ/943",
    "protocol_pdf_url": "https://www.parlament.gv.at/dokument/BR/BRSITZ/943/fname_1532585.pdf",
    "protocol_html_url": "https://www.parlament.gv.at/dokument/BR/BRSITZ/943/fnameorig_1532585.html",
    "uid": "XXVII_BRSITZ_943",
    "raw_path": "steno_protocols/raw_html/XXVII_BRSITZ_943.html",
    "txt_path": "steno_protocols/plain_text/XXVII_BRSITZ_943.txt"
  },
  {
    "session_date_display": "14.07.2021",
    "session_date_iso": "2021-07-14T00:00:00",
    "gp_code": "XXVII",
    "chamber": "BRSITZ",
    "session_number": 928,
    "title": "928. Sitzung (928/BRSITZ/2021)",
    "citation": "928/BRSITZ/2021",
    "session_detail_url": "https://www.parlament.gv.at/gegenstand/BR/BRSITZ/928",
    "protocol_pdf_url": "https://www.parlament.gv.at/dokument/BR/BRSITZ/928/fname_1016699.pdf",
    "protocol_html_url": "https://www.parlament.gv.at/dokument/BR/BRSITZ/928/fnameorig_1016699.html",
    "uid": "XXVII_BRSITZ_928",
    "raw_path": "steno_protocols/raw_html/XXVII_BRSITZ_928.html",
    "txt_path": "steno_protocols/plain_text/XXVII_BRSITZ_928.txt"
  },
  {
    "session_date_display": "09.05.2019",
    "session_date_iso": "2019-05-09T00:00:00",
    "gp_code": "XXVI",
    "chamber": "BRSITZ",
    "session_number": 892,
    "title": "892. Sitzung (892/BRSITZ/2019)",
    "citation": "892/BRSITZ/2019",
    "session_detail_url": "https://www.parlament.gv.at/gegenstand/BR/BRSITZ/892",
    "protocol_pdf_url": "https://www.parlament.gv.at/dokument/BR/BRSITZ/892/fname_775663.pdf",
    "protocol_html_url": "https://www.parlament.gv.at/dokument/BR/BRSITZ/892/fnameorig_775663.html",
    "uid": "XXVI_BRSITZ_892",
    "raw_path": "steno_protocols/raw_html/XXVI_BRSITZ_892.html",
    "txt_path": "steno_protocols/plain_text/XXVI_BRSITZ_892.txt"
  },
  {
    "session_date_display": "21.03.2020",
    "session_date_iso": "2020-03-21T00:00:00",
    "gp_code": "XXVII",
    "chamber": "BRSITZ",
    "session_number": 904,
    "title": "904. Sitzung (904/BRSITZ/2020)",
    "citation": "904/BRSITZ/2020",
    "session_detail_url": "https://www.parlament.gv.at/gegenstand/BR/BRSITZ/904",
    "protocol_pdf_url": "https://www.parlament.gv.at/dokument/BR/BRSITZ/904/fname_801876.pdf",
    "protocol_html_url": "https://www.parlament.gv.at/dokument/BR/BRSITZ/904/fnameorig_801876.html",
    "uid": "XXVII_BRSITZ_904",
    "raw_path": "steno_protocols/raw_html/XXVII_BRSITZ_904.html",
    "txt_path": "steno_protocols/plain_text/XXVII_BRSITZ_904.txt"
  },
  {
    "session_date_display": "02.06.2022",
    "session_date_iso": "2022-06-02T00:00:00",
    "gp_code": "XXVII",
    "chamber": "BRSITZ",
    "session_number": 941,
    "title": "941. Sitzung (941/BRSITZ/2022)",
    "citation": "941/BRSITZ/2022",
    "session_detail_url": "https://www.parlament.gv.at/gegenstand/BR/BRSITZ/941",
    "protocol_pdf_url": "https://www.parlament.gv.at/dokument/BR/BRSITZ/941/fname_1553810.pdf",
    "protocol_html_url": "https://www.parlament.gv.at/dokument/BR/BRSITZ/941/fnameorig_1553810.html",
    "uid": "XXVII_BRSITZ_941",
    "raw_path": "steno_protocols/raw_html/XXVII_BRSITZ_941.html",
    "txt_path": "steno_protocols/plain_text/XXVII_BRSITZ_941.txt"
  },
  {
    "session_date_display": "15.01.2021",
    "session_date_iso": "2021-01-15T00:00:00",
    "gp_code": "XXVII",
    "chamber": "BRSITZ",
    "session_number": 919,
    "title": "919. Sitzung (919/BRSITZ/2021)",
    "citation": "919/BRSITZ/2021",
    "session_detail_url": "https://www.parlament.gv.at/gegenstand/BR/BRSITZ/919",
    "protocol_pdf_url": "https://www.parlament.gv.at/dokument/BR/BRSITZ/919/fname_981371.pdf",
    "protocol_html_url": "https://www.parlament.gv.at/dokument/BR/BRSITZ/919/fnameorig_981371.html",
    "uid": "XXVII_BRSITZ_919",
    "raw_path": "steno_protocols/raw_html/XXVII_BRSITZ_919.html",
    "txt_path": "steno_protocols/plain_text/XXVII_BRSITZ_919.txt"
  },
  {
    "session_date_display": "19.06.2019",
    "session_date_iso": "2019-06-19T00:00:00",
    "gp_code": "XXVI",
    "chamber": "BRSITZ",
    "session_number": 894,
    "title": "894. Sitzung (894/BRSITZ/2019)",
    "citation": "894/BRSITZ/2019",
    "session_detail_url": "https://www.parlament.gv.at/gegenstand/BR/BRSITZ/894",
    "protocol_pdf_url": "https://www.parlament.gv.at/dokument/BR/BRSITZ/894/fname_782440.pdf",
    "protocol_html_url": "https://www.parlament.gv.at/dokument/BR/BRSITZ/894/fnameorig_782440.html",
    "uid": "XXVI_BRSITZ_894",
    "raw_path": "steno_protocols/raw_html/XXVI_BRSITZ_894.html",
    "txt_path": "steno_protocols/plain_text/XXVI_BRSITZ_894.txt"
  },
  {
    "session_date_display": "16.12.2020",
    "session_date_iso": "2020-12-16T00:00:00",
    "gp_code": "XXVII",
    "chamber": "BRSITZ",
    "session_number": 916,
    "title": "916. Sitzung (916/BRSITZ/2020)",
    "citation": "916/BRSITZ/2020",
    "session_detail_url": "https://www.parlament.gv.at/gegenstand/BR/BRSITZ/916",
    "protocol_pdf_url": "https://www.parlament.gv.at/dokument/BR/BRSITZ/916/fname_946662.pdf",
    "protocol_html_url": "https://www.parlament.gv.at/dokument/BR/BRSITZ/916/fnameorig_946662.html",
    "uid": "XXVII_BRSITZ_916",
    "raw_path": "steno_protocols/raw_html/XXVII_BRSITZ_916.html",
    "txt_path": "steno_protocols/plain_text/XXVII_BRSITZ_916.txt"
  },
  {
    "session_date_display": "26.04.2018",
    "session_date_iso": "2018-04-26T00:00:00",
    "gp_code": "XXVI",
    "chamber": "BRSITZ",
    "session_number": 879,
    "title": "879. Sitzung (879/BRSITZ/2018)",
    "citation": "879/BRSITZ/2018",
    "session_detail_url": "https://www.parlament.gv.at/gegenstand/BR/BRSITZ/879",
    "protocol_pdf_url": "https://www.parlament.gv.at/dokument/BR/BRSITZ/879/fname_717277.pdf",
    "protocol_html_url": "https://www.parlament.gv.at/dokument/BR/BRSITZ/879/fnameorig_717277.html",
    "uid": "XXVI_BRSITZ_879",
    "raw_path": "steno_protocols/raw_html/XXVI_BRSITZ_879.html",
    "txt_path": "steno_protocols/plain_text/XXVI_BRSITZ_879.txt"
  },
  {
    "session_date_display": "03.12.2015",
    "session_date_iso": "2015-12-03T00:00:00",
    "gp_code": "XXV",
    "chamber": "BRSITZ",
    "session_number": 848,
    "title": "848. Sitzung (848/BRSITZ/2015)",
    "citation": "848/BRSITZ/2015",
    "session_detail_url": "https://www.parlament.gv.at/gegenstand/BR/BRSITZ/848",
    "protocol_pdf_url": "https://www.parlament.gv.at/dokument/BR/BRSITZ/848/fname_561337.pdf",
    "protocol_html_url": "https://www.parlament.gv.at/dokument/BR/BRSITZ/848/fnameorig_561337.html",
    "uid": "XXV_BRSITZ_848",
    "raw_path": "steno_protocols/raw_html/XXV_BRSITZ_848.html",
    "txt_path": "steno_protocols/plain_text/XXV_BRSITZ_848.txt"
  },
  {
    "session_date_display": "05.11.2020",
    "session_date_iso": "2020-11-05T00:00:00",
    "gp_code": "XXVII",
    "chamber": "BRSITZ",
    "session_number": 914,
    "title": "914. Sitzung (914/BRSITZ/2020)",
    "citation": "914/BRSITZ/2020",
    "session_detail_url": "https://www.parlament.gv.at/gegenstand/BR/BRSITZ/914",
    "protocol_pdf_url": "https://www.parlament.gv.at/dokument/BR/BRSITZ/914/fname_882520.pdf",
    "protocol_html_url": "https://www.parlament.gv.at/dokument/BR/BRSITZ/914/fnameorig_882520.html",
    "uid": "XXVII_BRSITZ_914",
    "raw_path": "steno_protocols/raw_html/XXVII_BRSITZ_914.html",
    "txt_path": "steno_protocols/plain_text/XXVII_BRSITZ_914.txt"
  },
  {
    "session_date_display": "23.11.2021",
    "session_date_iso": "2021-11-23T00:00:00",
    "gp_code": "XXVII",
    "chamber": "BRSITZ",
    "session_number": 933,
    "title": "933. Sitzung (933/BRSITZ/2021)",
    "citation": "933/BRSITZ/2021",
    "session_detail_url": "https://www.parlament.gv.at/gegenstand/BR/BRSITZ/933",
    "protocol_pdf_url": "https://www.parlament.gv.at/dokument/BR/BRSITZ/933/fname_1429768.pdf",
    "protocol_html_url": "https://www.parlament.gv.at/dokument/BR/BRSITZ/933/fnameorig_1429768.html",
    "uid": "XXVII_BRSITZ_933",
    "raw_path": "steno_protocols/raw_html/XXVII_BRSITZ_933.html",
    "txt_path": "steno_protocols/plain_text/XXVII_BRSITZ_933.txt"
  },
  {
    "session_date_display": "15.07.2020",
    "session_date_iso": "2020-07-15T00:00:00",
    "gp_code": "XXVII",
    "chamber": "BRSITZ",
    "session_number": 910,
    "title": "910. Sitzung (910/BRSITZ/2020)",
    "citation": "910/BRSITZ/2020",
    "session_detail_url": "https://www.parlament.gv.at/gegenstand/BR/BRSITZ/910",
    "protocol_pdf_url": "https://www.parlament.gv.at/dokument/BR/BRSITZ/910/fname_846793.pdf",
    "protocol_html_url": "https://www.parlament.gv.at/dokument/BR/BRSITZ/910/fnameorig_846793.html",
    "uid": "XXVII_BRSITZ_910",
    "raw_path": "steno_protocols/raw_html/XXVII_BRSITZ_910.html",
    "txt_path": "steno_protocols/plain_text/XXVII_BRSITZ_910.txt"
  },
  {
    "session_date_display": "13.02.2020",
    "session_date_iso": "2020-02-13T00:00:00",
    "gp_code": "XXVII",
    "chamber": "BRSITZ",
    "session_number": 901,
    "title": "901. Sitzung (901/BRSITZ/2020)",
    "citation": "901/BRSITZ/2020",
    "session_detail_url": "https://www.parlament.gv.at/gegenstand/BR/BRSITZ/901",
    "protocol_pdf_url": "https://www.parlament.gv.at/dokument/BR/BRSITZ/901/fname_801818.pdf",
    "protocol_html_url": "https://www.parlament.gv.at/dokument/BR/BRSITZ/901/fnameorig_801818.html",
    "uid": "XXVII_BRSITZ_901",
    "raw_path": "steno_protocols/raw_html/XXVII_BRSITZ_901.html",
    "txt_path": "steno_protocols/plain_text/XXVII_BRSITZ_901.txt"
  },
  {
    "session_date_display": "15.07.2021",
    "session_date_iso": "2021-07-15T00:00:00",
    "gp_code": "XXVII",
    "chamber": "BRSITZ",
    "session_number": 929,
    "title": "929. Sitzung (929/BRSITZ/2021)",
    "citation": "929/BRSITZ/2021",
    "session_detail_url": "https://www.parlament.gv.at/gegenstand/BR/BRSITZ/929",
    "protocol_pdf_url": "https://www.parlament.gv.at/dokument/BR/BRSITZ/929/fname_1426399.pdf",
    "protocol_html_url": "https://www.parlament.gv.at/dokument/BR/BRSITZ/929/fnameorig_1426399.html",
    "uid": "XXVII_BRSITZ_929",
    "raw_path": "steno_protocols/raw_html/XXVII_BRSITZ_929.html",
    "txt_path": "steno_protocols/plain_text/XXVII_BRSITZ_929.txt"
  },
  {
    "session_date_display": "03.04.2018",
    "session_date_iso": "2018-04-03T00:00:00",
    "gp_code": "XXVI",
    "chamber": "BRSITZ",
    "session_number": 877,
    "title": "877. Sitzung (877/BRSITZ/2018)",
    "citation": "877/BRSITZ/2018",
    "session_detail_url": "https://www.parlament.gv.at/gegenstand/BR/BRSITZ/877",
    "protocol_pdf_url": "https://www.parlament.gv.at/dokument/BR/BRSITZ/877/fname_697174.pdf",
    "protocol_html_url": "https://www.parlament.gv.at/dokument/BR/BRSITZ/877/fnameorig_697174.html",
    "uid": "XXVI_BRSITZ_877",
    "raw_path": "steno_protocols/raw_html/XXVI_BRSITZ_877.html",
    "txt_path": "steno_protocols/plain_text/XXVI_BRSITZ_877.txt"
  },
  {
    "session_date_display": "04.07.2019",
    "session_date_iso": "2019-07-04T00:00:00",
    "gp_code": "XXVI",
    "chamber": "BRSITZ",
    "session_number": 895,
    "title": "895. Sitzung (895/BRSITZ/2019)",
    "citation": "895/BRSITZ/2019",
    "session_detail_url": "https://www.parlament.gv.at/gegenstand/BR/BRSITZ/895",
    "protocol_pdf_url": "https://www.parlament.gv.at/dokument/BR/BRSITZ/895/fname_790742.pdf",
    "protocol_html_url": "https://www.parlament.gv.at/dokument/BR/BRSITZ/895/fnameorig_790742.html",
    "uid": "XXVI_BRSITZ_895",
    "raw_path": "steno_protocols/raw_html/XXVI_BRSITZ_895.html",
    "txt_path": "steno_protocols/plain_text/XXVI_BRSITZ_895.txt"
  },
  {
    "session_date_display": "05.12.2019",
    "session_date_iso": "2019-12-05T00:00:00",
    "gp_code": "XXVII",
    "chamber": "BRSITZ",
    "session_number": 898,
    "title": "898. Sitzung (898/BRSITZ/2019)",
    "citation": "898/BRSITZ/2019",
    "session_detail_url": "https://www.parlament.gv.at/gegenstand/BR/BRSITZ/898",
    "protocol_pdf_url": "https://www.parlament.gv.at/dokument/BR/BRSITZ/898/fname_798100.pdf",
    "protocol_html_url": "https://www.parlament.gv.at/dokument/BR/BRSITZ/898/fnameorig_798100.html",
    "uid": "XXVII_BRSITZ_898",
    "raw_path": "steno_protocols/raw_html/XXVII_BRSITZ_898.html",
    "txt_path": "steno_protocols/plain_text/XXVII_BRSITZ_898.txt"
  },
  {
    "session_date_display": "30.05.2018",
    "session_date_iso": "2018-05-30T00:00:00",
    "gp_code": "XXVI",
    "chamber": "BRSITZ",
    "session_number": 880,
    "title": "880. Sitzung (880/BRSITZ/2018)",
    "citation": "880/BRSITZ/2018",
    "session_detail_url": "https://www.parlament.gv.at/gegenstand/BR/BRSITZ/880",
    "protocol_pdf_url": "https://www.parlament.gv.at/dokument/BR/BRSITZ/880/fname_717858.pdf",
    "protocol_html_url": "https://www.parlament.gv.at/dokument/BR/BRSITZ/880/fnameorig_717858.html",
    "uid": "XXVI_BRSITZ_880",
    "raw_path": "steno_protocols/raw_html/XXVI_BRSITZ_880.html",
    "txt_path": "steno_protocols/plain_text/XXVI_BRSITZ_880.txt"
  },
  {
    "session_date_display": "03.12.2020",
    "session_date_iso": "2020-12-03T00:00:00",
    "gp_code": "XXVII",
    "chamber": "BRSITZ",
    "session_number": 915,
    "title": "915. Sitzung (915/BRSITZ/2020)",
    "citation": "915/BRSITZ/2020",
    "session_detail_url": "https://www.parlament.gv.at/gegenstand/BR/BRSITZ/915",
    "protocol_pdf_url": "https://www.parlament.gv.at/dokument/BR/BRSITZ/915/fname_924432.pdf",
    "protocol_html_url": "https://www.parlament.gv.at/dokument/BR/BRSITZ/915/fnameorig_924432.html",
    "uid": "XXVII_BRSITZ_915",
    "raw_path": "steno_protocols/raw_html/XXVII_BRSITZ_915.html",
    "txt_path": "steno_protocols/plain_text/XXVII_BRSITZ_915.txt"
  },
  {
    "session_date_display": "26.02.2021",
    "session_date_iso": "2021-02-26T00:00:00",
    "gp_code": "XXVII",
    "chamber": "BRSITZ",
    "session_number": 922,
    "title": "922. Sitzung (922/BRSITZ/2021)",
    "citation": "922/BRSITZ/2021",
    "session_detail_url": "https://www.parlament.gv.at/gegenstand/BR/BRSITZ/922",
    "protocol_pdf_url": "https://www.parlament.gv.at/dokument/BR/BRSITZ/922/fname_954415.pdf",
    "protocol_html_url": "https://www.parlament.gv.at/dokument/BR/BRSITZ/922/fnameorig_954415.html",
    "uid": "XXVII_BRSITZ_922",
    "raw_path": "steno_protocols/raw_html/XXVII_BRSITZ_922.html",
    "txt_path": "steno_protocols/plain_text/XXVII_BRSITZ_922.txt"
  },
  {
    "session_date_display": "30.03.2021",
    "session_date_iso": "2021-03-30T00:00:00",
    "gp_code": "XXVII",
    "chamber": "BRSITZ",
    "session_number": 924,
    "title": "924. Sitzung (924/BRSITZ/2021)",
    "citation": "924/BRSITZ/2021",
    "session_detail_url": "https://www.parlament.gv.at/gegenstand/BR/BRSITZ/924",
    "protocol_pdf_url": "https://www.parlament.gv.at/dokument/BR/BRSITZ/924/fname_994651.pdf",
    "protocol_html_url": "https://www.parlament.gv.at/dokument/BR/BRSITZ/924/fnameorig_994651.html",
    "uid": "XXVII_BRSITZ_924",
    "raw_path": "steno_protocols/raw_html/XXVII_BRSITZ_924.html",
    "txt_path": "steno_protocols/plain_text/XXVII_BRSITZ_924.txt"
  },
  {
    "session_date_display": "02.12.2021",
    "session_date_iso": "2021-12-02T00:00:00",
    "gp_code": "XXVII",
    "chamber": "BRSITZ",
    "session_number": 934,
    "title": "934. Sitzung (934/BRSITZ/2021)",
    "citation": "934/BRSITZ/2021",
    "session_detail_url": "https://www.parlament.gv.at/gegenstand/BR/BRSITZ/934",
    "protocol_pdf_url": "https://www.parlament.gv.at/dokument/BR/BRSITZ/934/fname_1438612.pdf",
    "protocol_html_url": "https://www.parlament.gv.at/dokument/BR/BRSITZ/934/fnameorig_1438612.html",
    "uid": "XXVII_BRSITZ_934",
    "raw_path": "steno_protocols/raw_html/XXVII_BRSITZ_934.html",
    "txt_path": "steno_protocols/plain_text/XXVII_BRSITZ_934.txt"
  },
  {
    "session_date_display": "19.12.2018",
    "session_date_iso": "2018-12-19T00:00:00",
    "gp_code": "XXVI",
    "chamber": "BRSITZ",
    "session_number": 887,
    "title": "887. Sitzung (887/BRSITZ/2018)",
    "citation": "887/BRSITZ/2018",
    "session_detail_url": "https://www.parlament.gv.at/gegenstand/BR/BRSITZ/887",
    "protocol_pdf_url": "https://www.parlament.gv.at/dokument/BR/BRSITZ/887/fname_771166.pdf",
    "protocol_html_url": "https://www.parlament.gv.at/dokument/BR/BRSITZ/887/fnameorig_771166.html",
    "uid": "XXVI_BRSITZ_887",
    "raw_path": "steno_protocols/raw_html/XXVI_BRSITZ_887.html",
    "txt_path": "steno_protocols/plain_text/XXVI_BRSITZ_887.txt"
  },
  {
    "session_date_display": "08.02.2018",
    "session_date_iso": "2018-02-08T00:00:00",
    "gp_code": "XXVI",
    "chamber": "BRSITZ",
    "session_number": 875,
    "title": "875. Sitzung (875/BRSITZ/2018)",
    "citation": "875/BRSITZ/2018",
    "session_detail_url": "https://www.parlament.gv.at/gegenstand/BR/BRSITZ/875",
    "protocol_pdf_url": "https://www.parlament.gv.at/dokument/BR/BRSITZ/875/fname_685234.pdf",
    "protocol_html_url": "https://www.parlament.gv.at/dokument/BR/BRSITZ/875/fnameorig_685234.html",
    "uid": "XXVI_BRSITZ_875",
    "raw_path": "steno_protocols/raw_html/XXVI_BRSITZ_875.html",
    "txt_path": "steno_protocols/plain_text/XXVI_BRSITZ_875.txt"
  },
  {
    "session_date_display": "12.03.2020",
    "session_date_iso": "2020-03-12T00:00:00",
    "gp_code": "XXVII",
    "chamber": "BRSITZ",
    "session_number": 902,
    "title": "902. Sitzung (902/BRSITZ/2020)",
    "citation": "902/BRSITZ/2020",
    "session_detail_url": "https://www.parlament.gv.at/gegenstand/BR/BRSITZ/902",
    "protocol_pdf_url": "https://www.parlament.gv.at/dokument/BR/BRSITZ/902/fname_801849.pdf",
    "protocol_html_url": "https://www.parlament.gv.at/dokument/BR/BRSITZ/902/fnameorig_801849.html",
    "uid": "XXVII_BRSITZ_902",
    "raw_path": "steno_protocols/raw_html/XXVII_BRSITZ_902.html",
    "txt_path": "steno_protocols/plain_text/XXVII_BRSITZ_902.txt"
  },
  {
    "session_date_display": "08.10.2020",
    "session_date_iso": "2020-10-08T00:00:00",
    "gp_code": "XXVII",
    "chamber": "BRSITZ",
    "session_number": 913,
    "title": "913. Sitzung (913/BRSITZ/2020)",
    "citation": "913/BRSITZ/2020",
    "session_detail_url": "https://www.parlament.gv.at/gegenstand/BR/BRSITZ/913",
    "protocol_pdf_url": "https://www.parlament.gv.at/dokument/BR/BRSITZ/913/fname_858089.pdf",
    "protocol_html_url": "https://www.parlament.gv.at/dokument/BR/BRSITZ/913/fnameorig_858089.html",
    "uid": "XXVII_BRSITZ_913",
    "raw_path": "steno_protocols/raw_html/XXVII_BRSITZ_913.html",
    "txt_path": "steno_protocols/plain_text/XXVII_BRSITZ_913.txt"
  },
  {
    "session_date_display": "15.03.2020",
    "session_date_iso": "2020-03-15T00:00:00",
    "gp_code": "XXVII",
    "chamber": "BRSITZ",
    "session_number": 903,
    "title": "903. Sitzung (903/BRSITZ/2020)",
    "citation": "903/BRSITZ/2020",
    "session_detail_url": "https://www.parlament.gv.at/gegenstand/BR/BRSITZ/903",
    "protocol_pdf_url": "https://www.parlament.gv.at/dokument/BR/BRSITZ/903/fname_797704.pdf",
    "protocol_html_url": "https://www.parlament.gv.at/dokument/BR/BRSITZ/903/fnameorig_797704.html",
    "uid": "XXVII_BRSITZ_903",
    "raw_path": "steno_protocols/raw_html/XXVII_BRSITZ_903.html",
    "txt_path": "steno_protocols/plain_text/XXVII_BRSITZ_903.txt"
  },
  {
    "session_date_display": "11.07.2018",
    "session_date_iso": "2018-07-11T00:00:00",
    "gp_code": "XXVI",
    "chamber": "BRSITZ",
    "session_number": 882,
    "title": "882. Sitzung (882/BRSITZ/2018)",
    "citation": "882/BRSITZ/2018",
    "session_detail_url": "https://www.parlament.gv.at/gegenstand/BR/BRSITZ/882",
    "protocol_pdf_url": "https://www.parlament.gv.at/dokument/BR/BRSITZ/882/fname_747875.pdf",
    "protocol_html_url": "https://www.parlament.gv.at/dokument/BR/BRSITZ/882/fnameorig_747875.html",
    "uid": "XXVI_BRSITZ_882",
    "raw_path": "steno_protocols/raw_html/XXVI_BRSITZ_882.html",
    "txt_path": "steno_protocols/plain_text/XXVI_BRSITZ_882.txt"
  },
  {
    "session_date_display": "20.12.2018",
    "session_date_iso": "2018-12-20T00:00:00",
    "gp_code": "XXVI",
    "chamber": "BRSITZ",
    "session_number": 888,
    "title": "888. Sitzung (888/BRSITZ/2018)",
    "citation": "888/BRSITZ/2018",
    "session_detail_url": "https://www.parlament.gv.at/gegenstand/BR/BRSITZ/888",
    "protocol_pdf_url": "https://www.parlament.gv.at/dokument/BR/BRSITZ/888/fname_773108.pdf",
    "protocol_html_url": "https://www.parlament.gv.at/dokument/BR/BRSITZ/888/fnameorig_773108.html",
    "uid": "XXVI_BRSITZ_888",
    "raw_path": "steno_protocols/raw_html/XXVI_BRSITZ_888.html",
    "txt_path": "steno_protocols/plain_text/XXVI_BRSITZ_888.txt"
  },
  {
    "session_date_display": "27.01.2009",
    "session_date_iso": "2009-01-27T00:00:00",
    "gp_code": "XXIV",
    "chamber": "BRSITZ",
    "session_number": 764,
    "title": "764. Sitzung (764/BRSITZ/2009)",
    "citation": "764/BRSITZ/2009",
    "session_detail_url": "https://www.parlament.gv.at/gegenstand/BR/BRSITZ/764",
    "protocol_pdf_url": "https://www.parlament.gv.at/dokument/BR/BRSITZ/764/fname_151036.pdf",
    "protocol_html_url": "https://www.parlament.gv.at/dokument/BR/BRSITZ/764/fnameorig_151036.html",
    "uid": "XXIV_BRSITZ_764",
    "raw_path": "steno_protocols/raw_html/XXIV_BRSITZ_764.html",
    "txt_path": "steno_protocols/plain_text/XXIV_BRSITZ_764.txt"
  },
  {
    "session_date_display": "15.03.2018",
    "session_date_iso": "2018-03-15T00:00:00",
    "gp_code": "XXVI",
    "chamber": "BRSITZ",
    "session_number": 876,
    "title": "876. Sitzung (876/BRSITZ/2018)",
    "citation": "876/BRSITZ/2018",
    "session_detail_url": "https://www.parlament.gv.at/gegenstand/BR/BRSITZ/876",
    "protocol_pdf_url": "https://www.parlament.gv.at/dokument/BR/BRSITZ/876/fname_691752.pdf",
    "protocol_html_url": "https://www.parlament.gv.at/dokument/BR/BRSITZ/876/fnameorig_691752.html",
    "uid": "XXVI_BRSITZ_876",
    "raw_path": "steno_protocols/raw_html/XXVI_BRSITZ_876.html",
    "txt_path": "steno_protocols/plain_text/XXVI_BRSITZ_876.txt"
  },
  {
    "session_date_display": "11.07.2019",
    "session_date_iso": "2019-07-11T00:00:00",
    "gp_code": "XXVI",
    "chamber": "BRSITZ",
    "session_number": 896,
    "title": "896. Sitzung (896/BRSITZ/2019)",
    "citation": "896/BRSITZ/2019",
    "session_detail_url": "https://www.parlament.gv.at/gegenstand/BR/BRSITZ/896",
    "protocol_pdf_url": "https://www.parlament.gv.at/dokument/BR/BRSITZ/896/fname_794874.pdf",
    "protocol_html_url": "https://www.parlament.gv.at/dokument/BR/BRSITZ/896/fnameorig_794874.html",
    "uid": "XXVI_BRSITZ_896",
    "raw_path": "steno_protocols/raw_html/XXVI_BRSITZ_896.html",
    "txt_path": "steno_protocols/plain_text/XXVI_BRSITZ_896.txt"
  },
  {
    "session_date_display": "21.12.2021",
    "session_date_iso": "2021-12-21T00:00:00",
    "gp_code": "XXVII",
    "chamber": "BRSITZ",
    "session_number": 935,
    "title": "935. Sitzung (935/BRSITZ/2021)",
    "citation": "935/BRSITZ/2021",
    "session_detail_url": "https://www.parlament.gv.at/gegenstand/BR/BRSITZ/935",
    "protocol_pdf_url": "https://www.parlament.gv.at/dokument/BR/BRSITZ/935/fname_1463334.pdf",
    "protocol_html_url": "https://www.parlament.gv.at/dokument/BR/BRSITZ/935/fnameorig_1463334.html",
    "uid": "XXVII_BRSITZ_935",
    "raw_path": "steno_protocols/raw_html/XXVII_BRSITZ_935.html",
    "txt_path": "steno_protocols/plain_text/XXVII_BRSITZ_935.txt"
  },
  {
    "session_date_display": "14.03.2019",
    "session_date_iso": "2019-03-14T00:00:00",
    "gp_code": "XXVI",
    "chamber": "BRSITZ",
    "session_number": 890,
    "title": "890. Sitzung (890/BRSITZ/2019)",
    "citation": "890/BRSITZ/2019",
    "session_detail_url": "https://www.parlament.gv.at/gegenstand/BR/BRSITZ/890",
    "protocol_pdf_url": "https://www.parlament.gv.at/dokument/BR/BRSITZ/890/fname_771171.pdf",
    "protocol_html_url": "https://www.parlament.gv.at/dokument/BR/BRSITZ/890/fnameorig_771171.html",
    "uid": "XXVI_BRSITZ_890",
    "raw_path": "steno_protocols/raw_html/XXVI_BRSITZ_890.html",
    "txt_path": "steno_protocols/plain_text/XXVI_BRSITZ_890.txt"
  },
  {
    "session_date_display": "14.01.2020",
    "session_date_iso": "2020-01-14T00:00:00",
    "gp_code": "XXVII",
    "chamber": "BRSITZ",
    "session_number": 900,
    "title": "900. Sitzung (900/BRSITZ/2020)",
    "citation": "900/BRSITZ/2020",
    "session_detail_url": "https://www.parlament.gv.at/gegenstand/BR/BRSITZ/900",
    "protocol_pdf_url": "https://www.parlament.gv.at/dokument/BR/BRSITZ/900/fname_806733.pdf",
    "protocol_html_url": "https://www.parlament.gv.at/dokument/BR/BRSITZ/900/fnameorig_806733.html",
    "uid": "XXVII_BRSITZ_900",
    "raw_path": "steno_protocols/raw_html/XXVII_BRSITZ_900.html",
    "txt_path": "steno_protocols/plain_text/XXVII_BRSITZ_900.txt"
  },
  {
    "session_date_display": "20.12.2016",
    "session_date_iso": "2016-12-20T00:00:00",
    "gp_code": "XXV",
    "chamber": "BRSITZ",
    "session_number": 862,
    "title": "862. Sitzung (862/BRSITZ/2016)",
    "citation": "862/BRSITZ/2016",
    "session_detail_url": "https://www.parlament.gv.at/gegenstand/BR/BRSITZ/862",
    "protocol_pdf_url": "https://www.parlament.gv.at/dokument/BR/BRSITZ/862/fname_627794.pdf",
    "protocol_html_url": "https://www.parlament.gv.at/dokument/BR/BRSITZ/862/fnameorig_627794.html",
    "uid": "XXV_BRSITZ_862",
    "raw_path": "steno_protocols/raw_html/XXV_BRSITZ_862.html",
    "txt_path": "steno_protocols/plain_text/XXV_BRSITZ_862.txt"
  },
  {
    "session_date_display": "12.05.2022",
    "session_date_iso": "2022-05-12T00:00:00",
    "gp_code": "XXVII",
    "chamber": "BRSITZ",
    "session_number": 940,
    "title": "940. Sitzung (940/BRSITZ/2022)",
    "citation": "940/BRSITZ/2022",
    "session_detail_url": "https://www.parlament.gv.at/gegenstand/BR/BRSITZ/940",
    "protocol_pdf_url": "https://www.parlament.gv.at/dokument/BR/BRSITZ/940/fname_1474472.pdf",
    "protocol_html_url": "https://www.parlament.gv.at/dokument/BR/BRSITZ/940/fnameorig_1474472.html",
    "uid": "XXVII_BRSITZ_940",
    "raw_path": "steno_protocols/raw_html/XXVII_BRSITZ_940.html",
    "txt_path": "steno_protocols/plain_text/XXVII_BRSITZ_940.txt"
  },
  {
    "session_date_display": "07.10.2021",
    "session_date_iso": "2021-10-07T00:00:00",
    "gp_code": "XXVII",
    "chamber": "BRSITZ",
    "session_number": 930,
    "title": "930. Sitzung (930/BRSITZ/2021)",
    "citation": "930/BRSITZ/2021",
    "session_detail_url": "https://www.parlament.gv.at/gegenstand/BR/BRSITZ/930",
    "protocol_pdf_url": "https://www.parlament.gv.at/dokument/BR/BRSITZ/930/fname_1087924.pdf",
    "protocol_html_url": "https://www.parlament.gv.at/dokument/BR/BRSITZ/930/fnameorig_1087924.html",
    "uid": "XXVII_BRSITZ_930",
    "raw_path": "steno_protocols/raw_html/XXVII_BRSITZ_930.html",
    "txt_path": "steno_protocols/plain_text/XXVII_BRSITZ_930.txt"
  },
  {
    "session_date_display": "22.12.2021",
    "session_date_iso": "2021-12-22T00:00:00",
    "gp_code": "XXVII",
    "chamber": "BRSITZ",
    "session_number": 936,
    "title": "936. Sitzung (936/BRSITZ/2021)",
    "citation": "936/BRSITZ/2021",
    "session_detail_url": "https://www.parlament.gv.at/gegenstand/BR/BRSITZ/936",
    "protocol_pdf_url": "https://www.parlament.gv.at/dokument/BR/BRSITZ/936/fname_1438437.pdf",
    "protocol_html_url": "https://www.parlament.gv.at/dokument/BR/BRSITZ/936/fnameorig_1438437.html",
    "uid": "XXVII_BRSITZ_936",
    "raw_path": "steno_protocols/raw_html/XXVII_BRSITZ_936.html",
    "txt_path": "steno_protocols/plain_text/XXVII_BRSITZ_936.txt"
  },
  {
    "session_date_display": "06.12.2018",
    "session_date_iso": "2018-12-06T00:00:00",
    "gp_code": "XXVI",
    "chamber": "BRSITZ",
    "session_number": 886,
    "title": "886. Sitzung (886/BRSITZ/2018)",
    "citation": "886/BRSITZ/2018",
    "session_detail_url": "https://www.parlament.gv.at/gegenstand/BR/BRSITZ/886",
    "protocol_pdf_url": "https://www.parlament.gv.at/dokument/BR/BRSITZ/886/fname_758772.pdf",
    "protocol_html_url": "https://www.parlament.gv.at/dokument/BR/BRSITZ/886/fnameorig_758772.html",
    "uid": "XXVI_BRSITZ_886",
    "raw_path": "steno_protocols/raw_html/XXVI_BRSITZ_886.html",
    "txt_path": "steno_protocols/plain_text/XXVI_BRSITZ_886.txt"
  },
  {
    "session_date_display": "03.02.2022",
    "session_date_iso": "2022-02-03T00:00:00",
    "gp_code": "XXVII",
    "chamber": "BRSITZ",
    "session_number": 937,
    "title": "937. Sitzung (937/BRSITZ/2022)",
    "citation": "937/BRSITZ/2022",
    "session_detail_url": "https://www.parlament.gv.at/gegenstand/BR/BRSITZ/937",
    "protocol_pdf_url": "https://www.parlament.gv.at/dokument/BR/BRSITZ/937/fname_1438643.pdf",
    "protocol_html_url": "https://www.parlament.gv.at/dokument/BR/BRSITZ/937/fnameorig_1438643.html",
    "uid": "XXVII_BRSITZ_937",
    "raw_path": "steno_protocols/raw_html/XXVII_BRSITZ_937.html",
    "txt_path": "steno_protocols/plain_text/XXVII_BRSITZ_937.txt"
  },
  {
    "session_date_display": "05.04.2018",
    "session_date_iso": "2018-04-05T00:00:00",
    "gp_code": "XXVI",
    "chamber": "BRSITZ",
    "session_number": 878,
    "title": "878. Sitzung (878/BRSITZ/2018)",
    "citation": "878/BRSITZ/2018",
    "session_detail_url": "https://www.parlament.gv.at/gegenstand/BR/BRSITZ/878",
    "protocol_pdf_url": "https://www.parlament.gv.at/dokument/BR/BRSITZ/878/fname_710176.pdf",
    "protocol_html_url": "https://www.parlament.gv.at/dokument/BR/BRSITZ/878/fnameorig_710176.html",
    "uid": "XXVI_BRSITZ_878",
    "raw_path": "steno_protocols/raw_html/XXVI_BRSITZ_878.html",
    "txt_path": "steno_protocols/plain_text/XXVI_BRSITZ_878.txt"
  },
  {
    "session_date_display": "10.10.2019",
    "session_date_iso": "2019-10-10T00:00:00",
    "gp_code": "XXVI",
    "chamber": "BRSITZ",
    "session_number": 897,
    "title": "897. Sitzung (897/BRSITZ/2019)",
    "citation": "897/BRSITZ/2019",
    "session_detail_url": "https://www.parlament.gv.at/gegenstand/BR/BRSITZ/897",
    "protocol_pdf_url": "https://www.parlament.gv.at/dokument/BR/BRSITZ/897/fname_791923.pdf",
    "protocol_html_url": "https://www.parlament.gv.at/dokument/BR/BRSITZ/897/fnameorig_791923.html",
    "uid": "XXVI_BRSITZ_897",
    "raw_path": "steno_protocols/raw_html/XXVI_BRSITZ_897.html",
    "txt_path": "steno_protocols/plain_text/XXVI_BRSITZ_897.txt"
  },
  {
    "session_date_display": "10.03.2016",
    "session_date_iso": "2016-03-10T00:00:00",
    "gp_code": "XXV",
    "chamber": "BRSITZ",
    "session_number": 851,
    "title": "851. Sitzung (851/BRSITZ/2016)",
    "citation": "851/BRSITZ/2016",
    "session_detail_url": "https://www.parlament.gv.at/gegenstand/BR/BRSITZ/851",
    "protocol_pdf_url": "https://www.parlament.gv.at/dokument/BR/BRSITZ/851/fname_549857.pdf",
    "protocol_html_url": "https://www.parlament.gv.at/dokument/BR/BRSITZ/851/fnameorig_549857.html",
    "uid": "XXV_BRSITZ_851",
    "raw_path": "steno_protocols/raw_html/XXV_BRSITZ_851.html",
    "txt_path": "steno_protocols/plain_text/XXV_BRSITZ_851.txt"
  },
  {
    "session_date_display": "11.04.2019",
    "session_date_iso": "2019-04-11T00:00:00",
    "gp_code": "XXVI",
    "chamber": "BRSITZ",
    "session_number": 891,
    "title": "891. Sitzung (891/BRSITZ/2019)",
    "citation": "891/BRSITZ/2019",
    "session_detail_url": "https://www.parlament.gv.at/gegenstand/BR/BRSITZ/891",
    "protocol_pdf_url": "https://www.parlament.gv.at/dokument/BR/BRSITZ/891/fname_773788.pdf",
    "protocol_html_url": "https://www.parlament.gv.at/dokument/BR/BRSITZ/891/fnameorig_773788.html",
    "uid": "XXVI_BRSITZ_891",
    "raw_path": "steno_protocols/raw_html/XXVI_BRSITZ_891.html",
    "txt_path": "steno_protocols/plain_text/XXVI_BRSITZ_891.txt"
  },
  {
    "session_date_display": "27.05.2021",
    "session_date_iso": "2021-05-27T00:00:00",
    "gp_code": "XXVII",
    "chamber": "BRSITZ",
    "session_number": 926,
    "title": "926. Sitzung (926/BRSITZ/2021)",
    "citation": "926/BRSITZ/2021",
    "session_detail_url": "https://www.parlament.gv.at/gegenstand/BR/BRSITZ/926",
    "protocol_pdf_url": "https://www.parlament.gv.at/dokument/BR/BRSITZ/926/fname_1599599.pdf",
    "protocol_html_url": "https://www.parlament.gv.at/dokument/BR/BRSITZ/926/fnameorig_1599599.html",
    "uid": "XXVII_BRSITZ_926",
    "raw_path": "steno_protocols/raw_html/XXVII_BRSITZ_926.html",
    "txt_path": "steno_protocols/plain_text/XXVII_BRSITZ_926.txt"
  },
  {
    "session_date_display": "04.04.2020",
    "session_date_iso": "2020-04-04T00:00:00",
    "gp_code": "XXVII",
    "chamber": "BRSITZ",
    "session_number": 905,
    "title": "905. Sitzung (905/BRSITZ/2020)",
    "citation": "905/BRSITZ/2020",
    "session_detail_url": "https://www.parlament.gv.at/gegenstand/BR/BRSITZ/905",
    "protocol_pdf_url": "https://www.parlament.gv.at/dokument/BR/BRSITZ/905/fname_798102.pdf",
    "protocol_html_url": "https://www.parlament.gv.at/dokument/BR/BRSITZ/905/fnameorig_798102.html",
    "uid": "XXVII_BRSITZ_905",
    "raw_path": "steno_protocols/raw_html/XXVII_BRSITZ_905.html",
    "txt_path": "steno_protocols/plain_text/XXVII_BRSITZ_905.txt"
  },
  {
    "session_date_display": "07.04.2022",
    "session_date_iso": "2022-04-07T00:00:00",
    "gp_code": "XXVII",
    "chamber": "BRSITZ",
    "session_number": 939,
    "title": "939. Sitzung (939/BRSITZ/2022)",
    "citation": "939/BRSITZ/2022",
    "session_detail_url": "https://www.parlament.gv.at/gegenstand/BR/BRSITZ/939",
    "protocol_pdf_url": "https://www.parlament.gv.at/dokument/BR/BRSITZ/939/fname_1471889.pdf",
    "protocol_html_url": "https://www.parlament.gv.at/dokument/BR/BRSITZ/939/fnameorig_1471889.html",
    "uid": "XXVII_BRSITZ_939",
    "raw_path": "steno_protocols/raw_html/XXVII_BRSITZ_939.html",
    "txt_path": "steno_protocols/plain_text/XXVII_BRSITZ_939.txt"
  },
  {
    "session_date_display": "11.10.2018",
    "session_date_iso": "2018-10-11T00:00:00",
    "gp_code": "XXVI",
    "chamber": "BRSITZ",
    "session_number": 884,
    "title": "884. Sitzung (884/BRSITZ/2018)",
    "citation": "884/BRSITZ/2018",
    "session_detail_url": "https://www.parlament.gv.at/gegenstand/BR/BRSITZ/884",
    "protocol_pdf_url": "https://www.parlament.gv.at/dokument/BR/BRSITZ/884/fname_750693.pdf",
    "protocol_html_url": "https://www.parlament.gv.at/dokument/BR/BRSITZ/884/fnameorig_750693.html",
    "uid": "XXVI_BRSITZ_884",
    "raw_path": "steno_protocols/raw_html/XXVI_BRSITZ_884.html",
    "txt_path": "steno_protocols/plain_text/XXVI_BRSITZ_884.txt"
  },
  {
    "session_date_display": "29.05.2019",
    "session_date_iso": "2019-05-29T00:00:00",
    "gp_code": "XXVI",
    "chamber": "BRSITZ",
    "session_number": 893,
    "title": "893. Sitzung (893/BRSITZ/2019)",
    "citation": "893/BRSITZ/2019",
    "session_detail_url": "https://www.parlament.gv.at/gegenstand/BR/BRSITZ/893",
    "protocol_pdf_url": "https://www.parlament.gv.at/dokument/BR/BRSITZ/893/fname_785880.pdf",
    "protocol_html_url": "https://www.parlament.gv.at/dokument/BR/BRSITZ/893/fnameorig_785880.html",
    "uid": "XXVI_BRSITZ_893",
    "raw_path": "steno_protocols/raw_html/XXVI_BRSITZ_893.html",
    "txt_path": "steno_protocols/plain_text/XXVI_BRSITZ_893.txt"
  },
  {
    "session_date_display": "22.12.2020",
    "session_date_iso": "2020-12-22T00:00:00",
    "gp_code": "XXVII",
    "chamber": "BRSITZ",
    "session_number": 918,
    "title": "918. Sitzung (918/BRSITZ/2020)",
    "citation": "918/BRSITZ/2020",
    "session_detail_url": "https://www.parlament.gv.at/gegenstand/BR/BRSITZ/918",
    "protocol_pdf_url": "https://www.parlament.gv.at/dokument/BR/BRSITZ/918/fname_941938.pdf",
    "protocol_html_url": "https://www.parlament.gv.at/dokument/BR/BRSITZ/918/fnameorig_941938.html",
    "uid": "XXVII_BRSITZ_918",
    "raw_path": "steno_protocols/raw_html/XXVII_BRSITZ_918.html",
    "txt_path": "steno_protocols/plain_text/XXVII_BRSITZ_918.txt"
  },
  {
    "session_date_display": "19.12.2019",
    "session_date_iso": "2019-12-19T00:00:00",
    "gp_code": "XXVII",
    "chamber": "BRSITZ",
    "session_number": 899,
    "title": "899. Sitzung (899/BRSITZ/2019)",
    "citation": "899/BRSITZ/2019",
    "session_detail_url": "https://www.parlament.gv.at/gegenstand/BR/BRSITZ/899",
    "protocol_pdf_url": "https://www.parlament.gv.at/dokument/BR/BRSITZ/899/fname_798127.pdf",
    "protocol_html_url": "https://www.parlament.gv.at/dokument/BR/BRSITZ/899/fnameorig_798127.html",
    "uid": "XXVII_BRSITZ_899",
    "raw_path": "steno_protocols/raw_html/XXVII_BRSITZ_899.html",
    "txt_path": "steno_protocols/plain_text/XXVII_BRSITZ_899.txt"
  },
  {
    "session_date_display": "11.03.2021",
    "session_date_iso": "2021-03-11T00:00:00",
    "gp_code": "XXVII",
    "chamber": "BRSITZ",
    "session_number": 923,
    "title": "923. Sitzung (923/BRSITZ/2021)",
    "citation": "923/BRSITZ/2021",
    "session_detail_url": "https://www.parlament.gv.at/gegenstand/BR/BRSITZ/923",
    "protocol_pdf_url": "https://www.parlament.gv.at/dokument/BR/BRSITZ/923/fname_986167.pdf",
    "protocol_html_url": "https://www.parlament.gv.at/dokument/BR/BRSITZ/923/fnameorig_986167.html",
    "uid": "XXVII_BRSITZ_923",
    "raw_path": "steno_protocols/raw_html/XXVII_BRSITZ_923.html",
    "txt_path": "steno_protocols/plain_text/XXVII_BRSITZ_923.txt"
  },
  {
    "session_date_display": "17.12.2020",
    "session_date_iso": "2020-12-17T00:00:00",
    "gp_code": "XXVII",
    "chamber": "BRSITZ",
    "session_number": 917,
    "title": "917. Sitzung (917/BRSITZ/2020)",
    "citation": "917/BRSITZ/2020",
    "session_detail_url": "https://www.parlament.gv.at/gegenstand/BR/BRSITZ/917",
    "protocol_pdf_url": "https://www.parlament.gv.at/dokument/BR/BRSITZ/917/fname_941947.pdf",
    "protocol_html_url": "https://www.parlament.gv.at/dokument/BR/BRSITZ/917/fnameorig_941947.html",
    "uid": "XXVII_BRSITZ_917",
    "raw_path": "steno_protocols/raw_html/XXVII_BRSITZ_917.html",
    "txt_path": "steno_protocols/plain_text/XXVII_BRSITZ_917.txt"
  },
  {
    "session_date_display": "24.06.2020",
    "session_date_iso": "2020-06-24T00:00:00",
    "gp_code": "XXVII",
    "chamber": "BRSITZ",
    "session_number": 908,
    "title": "908. Sitzung (908/BRSITZ/2020)",
    "citation": "908/BRSITZ/2020",
    "session_detail_url": "https://www.parlament.gv.at/gegenstand/BR/BRSITZ/908",
    "protocol_pdf_url": "https://www.parlament.gv.at/dokument/BR/BRSITZ/908/fname_841386.pdf",
    "protocol_html_url": "https://www.parlament.gv.at/dokument/BR/BRSITZ/908/fnameorig_841386.html",
    "uid": "XXVII_BRSITZ_908",
    "raw_path": "steno_protocols/raw_html/XXVII_BRSITZ_908.html",
    "txt_path": "steno_protocols/plain_text/XXVII_BRSITZ_908.txt"
  },
  {
    "session_date_display": "04.06.2020",
    "session_date_iso": "2020-06-04T00:00:00",
    "gp_code": "XXVII",
    "chamber": "BRSITZ",
    "session_number": 907,
    "title": "907. Sitzung (907/BRSITZ/2020)",
    "citation": "907/BRSITZ/2020",
    "session_detail_url": "https://www.parlament.gv.at/gegenstand/BR/BRSITZ/907",
    "protocol_pdf_url": "https://www.parlament.gv.at/dokument/BR/BRSITZ/907/fname_841391.pdf",
    "protocol_html_url": "https://www.parlament.gv.at/dokument/BR/BRSITZ/907/fnameorig_841391.html",
    "uid": "XXVII_BRSITZ_907",
    "raw_path": "steno_protocols/raw_html/XXVII_BRSITZ_907.html",
    "txt_path": "steno_protocols/plain_text/XXVII_BRSITZ_907.txt"
  },
  {
    "session_date_display": "06.05.2021",
    "session_date_iso": "2021-05-06T00:00:00",
    "gp_code": "XXVII",
    "chamber": "BRSITZ",
    "session_number": 925,
    "title": "925. Sitzung (925/BRSITZ/2021)",
    "citation": "925/BRSITZ/2021",
    "session_detail_url": "https://www.parlament.gv.at/gegenstand/BR/BRSITZ/925",
    "protocol_pdf_url": "https://www.parlament.gv.at/dokument/BR/BRSITZ/925/fname_1007648.pdf",
    "protocol_html_url": "https://www.parlament.gv.at/dokument/BR/BRSITZ/925/fnameorig_1007648.html",
    "uid": "XXVII_BRSITZ_925",
    "raw_path": "steno_protocols/raw_html/XXVII_BRSITZ_925.html",
    "txt_path": "steno_protocols/plain_text/XXVII_BRSITZ_925.txt"
  },
  {
    "session_date_display": "22.07.1998",
    "session_date_iso": "1998-07-22T00:00:00",
    "gp_code": "XX",
    "chamber": "BRSITZ",
    "session_number": 643,
    "title": "643. Sitzung (643/BRSITZ/98)",
    "citation": "643/BRSITZ/98",
    "session_detail_url": "https://www.parlament.gv.at/gegenstand/BR/BRSITZ/643",
    "protocol_pdf_url": "https://www.parlament.gv.at/dokument/BR/BRSITZ/643/fname_113627.pdf",
    "protocol_html_url": "https://www.parlament.gv.at/dokument/BR/BRSITZ/643/fnameorig_113627.html",
    "uid": "XX_BRSITZ_643",
    "raw_path": "steno_protocols/raw_html/XX_BRSITZ_643.html",
    "txt_path": "steno_protocols/plain_text/XX_BRSITZ_643.txt"
  },
  {
    "session_date_display": "22.10.1998",
    "session_date_iso": "1998-10-22T00:00:00",
    "gp_code": "XX",
    "chamber": "BRSITZ",
    "session_number": 645,
    "title": "645. Sitzung (645/BRSITZ/98)",
    "citation": "645/BRSITZ/98",
    "session_detail_url": "https://www.parlament.gv.at/gegenstand/BR/BRSITZ/645",
    "protocol_pdf_url": "https://www.parlament.gv.at/dokument/BR/BRSITZ/645/fname_113631.pdf",
    "protocol_html_url": "https://www.parlament.gv.at/dokument/BR/BRSITZ/645/fnameorig_113631.html",
    "uid": "XX_BRSITZ_645",
    "raw_path": "steno_protocols/raw_html/XX_BRSITZ_645.html",
    "txt_path": "steno_protocols/plain_text/XX_BRSITZ_645.txt"
  },
  {
    "session_date_display": "06.06.2013",
    "session_date_iso": "2013-06-06T00:00:00",
    "gp_code": "XXIV",
    "chamber": "BRSITZ",
    "session_number": 821,
    "title": "821. Sitzung (821/BRSITZ/2013)",
    "citation": "821/BRSITZ/2013",
    "session_detail_url": "https://www.parlament.gv.at/gegenstand/BR/BRSITZ/821",
    "protocol_pdf_url": "https://www.parlament.gv.at/dokument/BR/BRSITZ/821/fname_326333.pdf",
    "protocol_html_url": "https://www.parlament.gv.at/dokument/BR/BRSITZ/821/fnameorig_326333.html",
    "uid": "XXIV_BRSITZ_821",
    "raw_path": "steno_protocols/raw_html/XXIV_BRSITZ_821.html",
    "txt_path": "steno_protocols/plain_text/XXIV_BRSITZ_821.txt"
  },
  {
    "session_date_display": "22.12.1998",
    "session_date_iso": "1998-12-22T00:00:00",
    "gp_code": "XX",
    "chamber": "BRSITZ",
    "session_number": 648,
    "title": "648. Sitzung (648/BRSITZ/98)",
    "citation": "648/BRSITZ/98",
    "session_detail_url": "https://www.parlament.gv.at/gegenstand/BR/BRSITZ/648",
    "protocol_pdf_url": "https://www.parlament.gv.at/dokument/BR/BRSITZ/648/fname_113637.pdf",
    "protocol_html_url": "https://www.parlament.gv.at/dokument/BR/BRSITZ/648/fnameorig_113637.html",
    "uid": "XX_BRSITZ_648",
    "raw_path": "steno_protocols/raw_html/XX_BRSITZ_648.html",
    "txt_path": "steno_protocols/plain_text/XX_BRSITZ_648.txt"
  },
  {
    "session_date_display": "18.07.2013",
    "session_date_iso": "2013-07-18T00:00:00",
    "gp_code": "XXIV",
    "chamber": "BRSITZ",
    "session_number": 823,
    "title": "823. Sitzung (823/BRSITZ/2013)",
    "citation": "823/BRSITZ/2013",
    "session_detail_url": "https://www.parlament.gv.at/gegenstand/BR/BRSITZ/823",
    "protocol_pdf_url": "https://www.parlament.gv.at/dokument/BR/BRSITZ/823/fname_333414.pdf",
    "protocol_html_url": "https://www.parlament.gv.at/dokument/BR/BRSITZ/823/fnameorig_333414.html",
    "uid": "XXIV_BRSITZ_823",
    "raw_path": "steno_protocols/raw_html/XXIV_BRSITZ_823.html",
    "txt_path": "steno_protocols/plain_text/XXIV_BRSITZ_823.txt"
  },
  {
    "session_date_display": "19.12.2013",
    "session_date_iso": "2013-12-19T00:00:00",
    "gp_code": "XXV",
    "chamber": "BRSITZ",
    "session_number": 825,
    "title": "825. Sitzung (825/BRSITZ/2013)",
    "citation": "825/BRSITZ/2013",
    "session_detail_url": "https://www.parlament.gv.at/gegenstand/BR/BRSITZ/825",
    "protocol_pdf_url": "https://www.parlament.gv.at/dokument/BR/BRSITZ/825/fname_339844.pdf",
    "protocol_html_url": "https://www.parlament.gv.at/dokument/BR/BRSITZ/825/fnameorig_339844.html",
    "uid": "XXV_BRSITZ_825",
    "raw_path": "steno_protocols/raw_html/XXV_BRSITZ_825.html",
    "txt_path": "steno_protocols/plain_text/XXV_BRSITZ_825.txt"
  },
  {
    "session_date_display": "13.12.2006",
    "session_date_iso": "2006-12-13T00:00:00",
    "gp_code": "XXIII",
    "chamber": "BRSITZ",
    "session_number": 739,
    "title": "739. Sitzung (739/BRSITZ/2006)",
    "citation": "739/BRSITZ/2006",
    "session_detail_url": "https://www.parlament.gv.at/gegenstand/BR/BRSITZ/739",
    "protocol_pdf_url": "https://www.parlament.gv.at/dokument/BR/BRSITZ/739/fname_073043.pdf",
    "protocol_html_url": "https://www.parlament.gv.at/dokument/BR/BRSITZ/739/fnameorig_073043.html",
    "uid": "XXIII_BRSITZ_739",
    "raw_path": "steno_protocols/raw_html/XXIII_BRSITZ_739.html",
    "txt_path": "steno_protocols/plain_text/XXIII_BRSITZ_739.txt"
  },
  {
    "session_date_display": "22.01.2021",
    "session_date_iso": "2021-01-22T00:00:00",
    "gp_code": "XXVII",
    "chamber": "BRSITZ",
    "session_number": 920,
    "title": "920. Sitzung (920/BRSITZ/2021)",
    "citation": "920/BRSITZ/2021",
    "session_detail_url": "https://www.parlament.gv.at/gegenstand/BR/BRSITZ/920",
    "protocol_pdf_url": "https://www.parlament.gv.at/dokument/BR/BRSITZ/920/fname_981385.pdf",
    "protocol_html_url": "https://www.parlament.gv.at/dokument/BR/BRSITZ/920/fnameorig_981385.html",
    "uid": "XXVII_BRSITZ_920",
    "raw_path": "steno_protocols/raw_html/XXVII_BRSITZ_920.html",
    "txt_path": "steno_protocols/plain_text/XXVII_BRSITZ_920.txt"
  },
  {
    "session_date_display": "04.06.1998",
    "session_date_iso": "1998-06-04T00:00:00",
    "gp_code": "XX",
    "chamber": "BRSITZ",
    "session_number": 641,
    "title": "641. Sitzung (641/BRSITZ/98)",
    "citation": "641/BRSITZ/98",
    "session_detail_url": "https://www.parlament.gv.at/gegenstand/BR/BRSITZ/641",
    "protocol_pdf_url": "https://www.parlament.gv.at/dokument/BR/BRSITZ/641/fname_113623.pdf",
    "protocol_html_url": "https://www.parlament.gv.at/dokument/BR/BRSITZ/641/fnameorig_113623.html",
    "uid": "XX_BRSITZ_641",
    "raw_path": "steno_protocols/raw_html/XX_BRSITZ_641.html",
    "txt_path": "steno_protocols/plain_text/XX_BRSITZ_641.txt"
  },
  {
    "session_date_display": "25.11.2004",
    "session_date_iso": "2004-11-25T00:00:00",
    "gp_code": "XXII",
    "chamber": "BRSITZ",
    "session_number": 715,
    "title": "715. Sitzung (715/BRSITZ/2004)",
    "citation": "715/BRSITZ/2004",
    "session_detail_url": "https://www.parlament.gv.at/gegenstand/BR/BRSITZ/715",
    "protocol_pdf_url": "https://www.parlament.gv.at/dokument/BR/BRSITZ/715/fname_035766.pdf",
    "protocol_html_url": "https://www.parlament.gv.at/dokument/BR/BRSITZ/715/fnameorig_035766.html",
    "uid": "XXII_BRSITZ_715",
    "raw_path": "steno_protocols/raw_html/XXII_BRSITZ_715.html",
    "txt_path": "steno_protocols/plain_text/XXII_BRSITZ_715.txt"
  },
  {
    "session_date_display": "19.11.1998",
    "session_date_iso": "1998-11-19T00:00:00",
    "gp_code": "XX",
    "chamber": "BRSITZ",
    "session_number": 646,
    "title": "646. Sitzung (646/BRSITZ/98)",
    "citation": "646/BRSITZ/98",
    "session_detail_url": "https://www.parlament.gv.at/gegenstand/BR/BRSITZ/646",
    "protocol_pdf_url": "https://www.parlament.gv.at/dokument/BR/BRSITZ/646/fname_113633.pdf",
    "protocol_html_url": "https://www.parlament.gv.at/dokument/BR/BRSITZ/646/fnameorig_113633.html",
    "uid": "XX_BRSITZ_646",
    "raw_path": "steno_protocols/raw_html/XX_BRSITZ_646.html",
    "txt_path": "steno_protocols/plain_text/XX_BRSITZ_646.txt"
  },
  {
    "session_date_display": "20.09.2006",
    "session_date_iso": "2006-09-20T00:00:00",
    "gp_code": "XXII",
    "chamber": "BRSITZ",
    "session_number": 738,
    "title": "738. Sitzung (738/BRSITZ/2006)",
    "citation": "738/BRSITZ/2006",
    "session_detail_url": "https://www.parlament.gv.at/gegenstand/BR/BRSITZ/738",
    "protocol_pdf_url": "https://www.parlament.gv.at/dokument/BR/BRSITZ/738/fname_070098.pdf",
    "protocol_html_url": "https://www.parlament.gv.at/dokument/BR/BRSITZ/738/fnameorig_070098.html",
    "uid": "XXII_BRSITZ_738",
    "raw_path": "steno_protocols/raw_html/XXII_BRSITZ_738.html",
    "txt_path": "steno_protocols/plain_text/XXII_BRSITZ_738.txt"
  },
  {
    "session_date_display": "17.04.1998",
    "session_date_iso": "1998-04-17T00:00:00",
    "gp_code": "XX",
    "chamber": "BRSITZ",
    "session_number": 639,
    "title": "639. Sitzung (639/BRSITZ/98)",
    "citation": "639/BRSITZ/98",
    "session_detail_url": "https://www.parlament.gv.at/gegenstand/BR/BRSITZ/639",
    "protocol_pdf_url": "https://www.parlament.gv.at/dokument/BR/BRSITZ/639/fname_113619.pdf",
    "protocol_html_url": "https://www.parlament.gv.at/dokument/BR/BRSITZ/639/fnameorig_113619.html",
    "uid": "XX_BRSITZ_639",
    "raw_path": "steno_protocols/raw_html/XX_BRSITZ_639.html",
    "txt_path": "steno_protocols/plain_text/XX_BRSITZ_639.txt"
  },
  {
    "session_date_display": "02.12.2004",
    "session_date_iso": "2004-12-02T00:00:00",
    "gp_code": "XXII",
    "chamber": "BRSITZ",
    "session_number": 716,
    "title": "716. Sitzung (716/BRSITZ/2004)",
    "citation": "716/BRSITZ/2004",
    "session_detail_url": "https://www.parlament.gv.at/gegenstand/BR/BRSITZ/716",
    "protocol_pdf_url": "https://www.parlament.gv.at/dokument/BR/BRSITZ/716/fname_035471.pdf",
    "protocol_html_url": "https://www.parlament.gv.at/dokument/BR/BRSITZ/716/fnameorig_035471.html",
    "uid": "XXII_BRSITZ_716",
    "raw_path": "steno_protocols/raw_html/XXII_BRSITZ_716.html",
    "txt_path": "steno_protocols/plain_text/XXII_BRSITZ_716.txt"
  },
  {
    "session_date_display": "28.06.2012",
    "session_date_iso": "2012-06-28T00:00:00",
    "gp_code": "XXIV",
    "chamber": "BRSITZ",
    "session_number": 810,
    "title": "810. Sitzung (810/BRSITZ/2012)",
    "citation": "810/BRSITZ/2012",
    "session_detail_url": "https://www.parlament.gv.at/gegenstand/BR/BRSITZ/810",
    "protocol_pdf_url": "https://www.parlament.gv.at/dokument/BR/BRSITZ/810/fname_271809.pdf",
    "protocol_html_url": "https://www.parlament.gv.at/dokument/BR/BRSITZ/810/fnameorig_271809.html",
    "uid": "XXIV_BRSITZ_810",
    "raw_path": "steno_protocols/raw_html/XXIV_BRSITZ_810.html",
    "txt_path": "steno_protocols/plain_text/XXIV_BRSITZ_810.txt"
  },
  {
    "session_date_display": "24.06.2021",
    "session_date_iso": "2021-06-24T00:00:00",
    "gp_code": "XXVII",
    "chamber": "BRSITZ",
    "session_number": 927,
    "title": "927. Sitzung (927/BRSITZ/2021)",
    "citation": "927/BRSITZ/2021",
    "session_detail_url": "https://www.parlament.gv.at/gegenstand/BR/BRSITZ/927",
    "protocol_pdf_url": "https://www.parlament.gv.at/dokument/BR/BRSITZ/927/fname_1599625.pdf",
    "protocol_html_url": "https://www.parlament.gv.at/dokument/BR/BRSITZ/927/fnameorig_1599625.html",
    "uid": "XXVII_BRSITZ_927",
    "raw_path": "steno_protocols/raw_html/XXVII_BRSITZ_927.html",
    "txt_path": "steno_protocols/plain_text/XXVII_BRSITZ_927.txt"
  },
  {
    "session_date_display": "07.02.2013",
    "session_date_iso": "2013-02-07T00:00:00",
    "gp_code": "XXIV",
    "chamber": "BRSITZ",
    "session_number": 817,
    "title": "817. Sitzung (817/BRSITZ/2013)",
    "citation": "817/BRSITZ/2013",
    "session_detail_url": "https://www.parlament.gv.at/gegenstand/BR/BRSITZ/817",
    "protocol_pdf_url": "https://www.parlament.gv.at/dokument/BR/BRSITZ/817/fname_302286.pdf",
    "protocol_html_url": "https://www.parlament.gv.at/dokument/BR/BRSITZ/817/fnameorig_302286.html",
    "uid": "XXIV_BRSITZ_817",
    "raw_path": "steno_protocols/raw_html/XXIV_BRSITZ_817.html",
    "txt_path": "steno_protocols/plain_text/XXIV_BRSITZ_817.txt"
  },
  {
    "session_date_display": "18.03.1999",
    "session_date_iso": "1999-03-18T00:00:00",
    "gp_code": "XX",
    "chamber": "BRSITZ",
    "session_number": 651,
    "title": "651. Sitzung (651/BRSITZ/99)",
    "citation": "651/BRSITZ/99",
    "session_detail_url": "https://www.parlament.gv.at/gegenstand/BR/BRSITZ/651",
    "protocol_pdf_url": "https://www.parlament.gv.at/dokument/BR/BRSITZ/651/fname_113643.pdf",
    "protocol_html_url": "https://www.parlament.gv.at/dokument/BR/BRSITZ/651/fnameorig_113643.html",
    "uid": "XX_BRSITZ_651",
    "raw_path": "steno_protocols/raw_html/XX_BRSITZ_651.html",
    "txt_path": "steno_protocols/plain_text/XX_BRSITZ_651.txt"
  },
  {
    "session_date_display": "16.07.2020",
    "session_date_iso": "2020-07-16T00:00:00",
    "gp_code": "XXVII",
    "chamber": "BRSITZ",
    "session_number": 911,
    "title": "911. Sitzung (911/BRSITZ/2020)",
    "citation": "911/BRSITZ/2020",
    "session_detail_url": "https://www.parlament.gv.at/gegenstand/BR/BRSITZ/911",
    "protocol_pdf_url": "https://www.parlament.gv.at/dokument/BR/BRSITZ/911/fname_852569.pdf",
    "protocol_html_url": "https://www.parlament.gv.at/dokument/BR/BRSITZ/911/fnameorig_852569.html",
    "uid": "XXVII_BRSITZ_911",
    "raw_path": "steno_protocols/raw_html/XXVII_BRSITZ_911.html",
    "txt_path": "steno_protocols/plain_text/XXVII_BRSITZ_911.txt"
  },
  {
    "session_date_display": "29.04.1998",
    "session_date_iso": "1998-04-29T00:00:00",
    "gp_code": "XX",
    "chamber": "BRSITZ",
    "session_number": 640,
    "title": "640. Sitzung (640/BRSITZ/98)",
    "citation": "640/BRSITZ/98",
    "session_detail_url": "https://www.parlament.gv.at/gegenstand/BR/BRSITZ/640",
    "protocol_pdf_url": "https://www.parlament.gv.at/dokument/BR/BRSITZ/640/fname_113621.pdf",
    "protocol_html_url": "https://www.parlament.gv.at/dokument/BR/BRSITZ/640/fnameorig_113621.html",
    "uid": "XX_BRSITZ_640",
    "raw_path": "steno_protocols/raw_html/XX_BRSITZ_640.html",
    "txt_path": "steno_protocols/plain_text/XX_BRSITZ_640.txt"
  },
  {
    "session_date_display": "06.07.2012",
    "session_date_iso": "2012-07-06T00:00:00",
    "gp_code": "XXIV",
    "chamber": "BRSITZ",
    "session_number": 811,
    "title": "811. Sitzung (811/BRSITZ/2012)",
    "citation": "811/BRSITZ/2012",
    "session_detail_url": "https://www.parlament.gv.at/gegenstand/BR/BRSITZ/811",
    "protocol_pdf_url": "https://www.parlament.gv.at/dokument/BR/BRSITZ/811/fname_276576.pdf",
    "protocol_html_url": "https://www.parlament.gv.at/dokument/BR/BRSITZ/811/fnameorig_276576.html",
    "uid": "XXIV_BRSITZ_811",
    "raw_path": "steno_protocols/raw_html/XXIV_BRSITZ_811.html",
    "txt_path": "steno_protocols/plain_text/XXIV_BRSITZ_811.txt"
  },
  {
    "session_date_display": "17.12.1998",
    "session_date_iso": "1998-12-17T00:00:00",
    "gp_code": "XX",
    "chamber": "BRSITZ",
    "session_number": 647,
    "title": "647. Sitzung (647/BRSITZ/98)",
    "citation": "647/BRSITZ/98",
    "session_detail_url": "https://www.parlament.gv.at/gegenstand/BR/BRSITZ/647",
    "protocol_pdf_url": "https://www.parlament.gv.at/dokument/BR/BRSITZ/647/fname_113635.pdf",
    "protocol_html_url": "https://www.parlament.gv.at/dokument/BR/BRSITZ/647/fnameorig_113635.html",
    "uid": "XX_BRSITZ_647",
    "raw_path": "steno_protocols/raw_html/XX_BRSITZ_647.html",
    "txt_path": "steno_protocols/plain_text/XX_BRSITZ_647.txt"
  },
  {
    "session_date_display": "31.01.2014",
    "session_date_iso": "2014-01-31T00:00:00",
    "gp_code": "XXV",
    "chamber": "BRSITZ",
    "session_number": 826,
    "title": "826. Sitzung (826/BRSITZ/2014)",
    "citation": "826/BRSITZ/2014",
    "session_detail_url": "https://www.parlament.gv.at/gegenstand/BR/BRSITZ/826",
    "protocol_pdf_url": "https://www.parlament.gv.at/dokument/BR/BRSITZ/826/fname_342119.pdf",
    "protocol_html_url": "https://www.parlament.gv.at/dokument/BR/BRSITZ/826/fnameorig_342119.html",
    "uid": "XXV_BRSITZ_826",
    "raw_path": "steno_protocols/raw_html/XXV_BRSITZ_826.html",
    "txt_path": "steno_protocols/plain_text/XXV_BRSITZ_826.txt"
  },
  {
    "session_date_display": "19.02.1999",
    "session_date_iso": "1999-02-19T00:00:00",
    "gp_code": "XX",
    "chamber": "BRSITZ",
    "session_number": 650,
    "title": "650. Sitzung (650/BRSITZ/99)",
    "citation": "650/BRSITZ/99",
    "session_detail_url": "https://www.parlament.gv.at/gegenstand/BR/BRSITZ/650",
    "protocol_pdf_url": "https://www.parlament.gv.at/dokument/BR/BRSITZ/650/fname_113641.pdf",
    "protocol_html_url": "https://www.parlament.gv.at/dokument/BR/BRSITZ/650/fnameorig_113641.html",
    "uid": "XX_BRSITZ_650",
    "raw_path": "steno_protocols/raw_html/XX_BRSITZ_650.html",
    "txt_path": "steno_protocols/plain_text/XX_BRSITZ_650.txt"
  },
  {
    "session_date_display": "20.12.2006",
    "session_date_iso": "2006-12-20T00:00:00",
    "gp_code": "XXIII",
    "chamber": "BRSITZ",
    "session_number": 740,
    "title": "740. Sitzung (740/BRSITZ/2006)",
    "citation": "740/BRSITZ/2006",
    "session_detail_url": "https://www.parlament.gv.at/gegenstand/BR/BRSITZ/740",
    "protocol_pdf_url": "https://www.parlament.gv.at/dokument/BR/BRSITZ/740/fname_074078.pdf",
    "protocol_html_url": "https://www.parlament.gv.at/dokument/BR/BRSITZ/740/fnameorig_074078.html",
    "uid": "XXIII_BRSITZ_740",
    "raw_path": "steno_protocols/raw_html/XXIII_BRSITZ_740.html",
    "txt_path": "steno_protocols/plain_text/XXIII_BRSITZ_740.txt"
  },
  {
    "session_date_display": "09.03.2022",
    "session_date_iso": "2022-03-09T00:00:00",
    "gp_code": "XXVII",
    "chamber": "BRSITZ",
    "session_number": 938,
    "title": "938. Sitzung (938/BRSITZ/2022)",
    "citation": "938/BRSITZ/2022",
    "session_detail_url": "https://www.parlament.gv.at/gegenstand/BR/BRSITZ/938",
    "protocol_pdf_url": "https://www.parlament.gv.at/dokument/BR/BRSITZ/938/fname_1451767.pdf",
    "protocol_html_url": "https://www.parlament.gv.at/dokument/BR/BRSITZ/938/fnameorig_1451767.html",
    "uid": "XXVII_BRSITZ_938",
    "raw_path": "steno_protocols/raw_html/XXVII_BRSITZ_938.html",
    "txt_path": "steno_protocols/plain_text/XXVII_BRSITZ_938.txt"
  },
  {
    "session_date_display": "25.09.2020",
    "session_date_iso": "2020-09-25T00:00:00",
    "gp_code": "XXVII",
    "chamber": "BRSITZ",
    "session_number": 912,
    "title": "912. Sitzung (912/BRSITZ/2020)",
    "citation": "912/BRSITZ/2020",
    "session_detail_url": "https://www.parlament.gv.at/gegenstand/BR/BRSITZ/912",
    "protocol_pdf_url": "https://www.parlament.gv.at/dokument/BR/BRSITZ/912/fname_850706.pdf",
    "protocol_html_url": "https://www.parlament.gv.at/dokument/BR/BRSITZ/912/fnameorig_850706.html",
    "uid": "XXVII_BRSITZ_912",
    "raw_path": "steno_protocols/raw_html/XXVII_BRSITZ_912.html",
    "txt_path": "steno_protocols/plain_text/XXVII_BRSITZ_912.txt"
  },
  {
    "session_date_display": "03.11.2021",
    "session_date_iso": "2021-11-03T00:00:00",
    "gp_code": "XXVII",
    "chamber": "BRSITZ",
    "session_number": 932,
    "title": "932. Sitzung (932/BRSITZ/2021)",
    "citation": "932/BRSITZ/2021",
    "session_detail_url": "https://www.parlament.gv.at/gegenstand/BR/BRSITZ/932",
    "protocol_pdf_url": "https://www.parlament.gv.at/dokument/BR/BRSITZ/932/fname_1438206.pdf",
    "protocol_html_url": "https://www.parlament.gv.at/dokument/BR/BRSITZ/932/fnameorig_1438206.html",
    "uid": "XXVII_BRSITZ_932",
    "raw_path": "steno_protocols/raw_html/XXVII_BRSITZ_932.html",
    "txt_path": "steno_protocols/plain_text/XXVII_BRSITZ_932.txt"
  },
  {
    "session_date_display": "29.06.2022",
    "session_date_iso": "2022-06-29T00:00:00",
    "gp_code": "XXVII",
    "chamber": "BRSITZ",
    "session_number": 942,
    "title": "942. Sitzung (942/BRSITZ/2022)",
    "citation": "942/BRSITZ/2022",
    "session_detail_url": "https://www.parlament.gv.at/gegenstand/BR/BRSITZ/942",
    "protocol_pdf_url": "https://www.parlament.gv.at/dokument/BR/BRSITZ/942/fname_1557398.pdf",
    "protocol_html_url": "https://www.parlament.gv.at/dokument/BR/BRSITZ/942/fnameorig_1557398.html",
    "uid": "XXVII_BRSITZ_942",
    "raw_path": "steno_protocols/raw_html/XXVII_BRSITZ_942.html",
    "txt_path": "steno_protocols/plain_text/XXVII_BRSITZ_942.txt"
  },
  {
    "session_date_display": "23.06.2005",
    "session_date_iso": "2005-06-23T00:00:00",
    "gp_code": "XXII",
    "chamber": "BRSITZ",
    "session_number": 723,
    "title": "723. Sitzung (723/BRSITZ/2005)",
    "citation": "723/BRSITZ/2005",
    "session_detail_url": "https://www.parlament.gv.at/gegenstand/BR/BRSITZ/723",
    "protocol_pdf_url": "https://www.parlament.gv.at/dokument/BR/BRSITZ/723/fname_048538.pdf",
    "protocol_html_url": "https://www.parlament.gv.at/dokument/BR/BRSITZ/723/fnameorig_048538.html",
    "uid": "XXII_BRSITZ_723",
    "raw_path": "steno_protocols/raw_html/XXII_BRSITZ_723.html",
    "txt_path": "steno_protocols/plain_text/XXII_BRSITZ_723.txt"
  },
  {
    "session_date_display": "01.12.2005",
    "session_date_iso": "2005-12-01T00:00:00",
    "gp_code": "XXII",
    "chamber": "BRSITZ",
    "session_number": 728,
    "title": "728. Sitzung (728/BRSITZ/2005)",
    "citation": "728/BRSITZ/2005",
    "session_detail_url": "https://www.parlament.gv.at/gegenstand/BR/BRSITZ/728",
    "protocol_pdf_url": "https://www.parlament.gv.at/dokument/BR/BRSITZ/728/fname_055010.pdf",
    "protocol_html_url": "https://www.parlament.gv.at/dokument/BR/BRSITZ/728/fnameorig_055010.html",
    "uid": "XXII_BRSITZ_728",
    "raw_path": "steno_protocols/raw_html/XXII_BRSITZ_728.html",
    "txt_path": "steno_protocols/plain_text/XXII_BRSITZ_728.txt"
  },
  {
    "session_date_display": "21.04.2006",
    "session_date_iso": "2006-04-21T00:00:00",
    "gp_code": "XXII",
    "chamber": "BRSITZ",
    "session_number": 733,
    "title": "733. Sitzung (733/BRSITZ/2006)",
    "citation": "733/BRSITZ/2006",
    "session_detail_url": "https://www.parlament.gv.at/gegenstand/BR/BRSITZ/733",
    "protocol_pdf_url": "https://www.parlament.gv.at/dokument/BR/BRSITZ/733/fname_064762.pdf",
    "protocol_html_url": "https://www.parlament.gv.at/dokument/BR/BRSITZ/733/fnameorig_064762.html",
    "uid": "XXII_BRSITZ_733",
    "raw_path": "steno_protocols/raw_html/XXII_BRSITZ_733.html",
    "txt_path": "steno_protocols/plain_text/XXII_BRSITZ_733.txt"
  },
  {
    "session_date_display": "26.02.2014",
    "session_date_iso": "2014-02-26T00:00:00",
    "gp_code": "XXV",
    "chamber": "BRSITZ",
    "session_number": 827,
    "title": "827. Sitzung (827/BRSITZ/2014)",
    "citation": "827/BRSITZ/2014",
    "session_detail_url": "https://www.parlament.gv.at/gegenstand/BR/BRSITZ/827",
    "protocol_pdf_url": "https://www.parlament.gv.at/dokument/BR/BRSITZ/827/fname_349613.pdf",
    "protocol_html_url": "https://www.parlament.gv.at/dokument/BR/BRSITZ/827/fnameorig_349613.html",
    "uid": "XXV_BRSITZ_827",
    "raw_path": "steno_protocols/raw_html/XXV_BRSITZ_827.html",
    "txt_path": "steno_protocols/plain_text/XXV_BRSITZ_827.txt"
  },
  {
    "session_date_display": "17.03.2005",
    "session_date_iso": "2005-03-17T00:00:00",
    "gp_code": "XXII",
    "chamber": "BRSITZ",
    "session_number": 719,
    "title": "719. Sitzung (719/BRSITZ/2005)",
    "citation": "719/BRSITZ/2005",
    "session_detail_url": "https://www.parlament.gv.at/gegenstand/BR/BRSITZ/719",
    "protocol_pdf_url": "https://www.parlament.gv.at/dokument/BR/BRSITZ/719/fname_042095.pdf",
    "protocol_html_url": "https://www.parlament.gv.at/dokument/BR/BRSITZ/719/fnameorig_042095.html",
    "uid": "XXII_BRSITZ_719",
    "raw_path": "steno_protocols/raw_html/XXII_BRSITZ_719.html",
    "txt_path": "steno_protocols/plain_text/XXII_BRSITZ_719.txt"
  },
  {
    "session_date_display": "02.07.1998",
    "session_date_iso": "1998-07-02T00:00:00",
    "gp_code": "XX",
    "chamber": "BRSITZ",
    "session_number": 642,
    "title": "642. Sitzung (642/BRSITZ/98)",
    "citation": "642/BRSITZ/98",
    "session_detail_url": "https://www.parlament.gv.at/gegenstand/BR/BRSITZ/642",
    "protocol_pdf_url": "https://www.parlament.gv.at/dokument/BR/BRSITZ/642/fname_113625.pdf",
    "protocol_html_url": "https://www.parlament.gv.at/dokument/BR/BRSITZ/642/fnameorig_113625.html",
    "uid": "XX_BRSITZ_642",
    "raw_path": "steno_protocols/raw_html/XX_BRSITZ_642.html",
    "txt_path": "steno_protocols/plain_text/XX_BRSITZ_642.txt"
  },
  {
    "session_date_display": "25.05.2005",
    "session_date_iso": "2005-05-25T00:00:00",
    "gp_code": "XXII",
    "chamber": "BRSITZ",
    "session_number": 722,
    "title": "722. Sitzung (722/BRSITZ/2005)",
    "citation": "722/BRSITZ/2005",
    "session_detail_url": "https://www.parlament.gv.at/gegenstand/BR/BRSITZ/722",
    "protocol_pdf_url": "https://www.parlament.gv.at/dokument/BR/BRSITZ/722/fname_047055.pdf",
    "protocol_html_url": "https://www.parlament.gv.at/dokument/BR/BRSITZ/722/fnameorig_047055.html",
    "uid": "XXII_BRSITZ_722",
    "raw_path": "steno_protocols/raw_html/XXII_BRSITZ_722.html",
    "txt_path": "steno_protocols/plain_text/XXII_BRSITZ_722.txt"
  },
  {
    "session_date_display": "05.04.2013",
    "session_date_iso": "2013-04-05T00:00:00",
    "gp_code": "XXIV",
    "chamber": "BRSITZ",
    "session_number": 819,
    "title": "819. Sitzung (819/BRSITZ/2013)",
    "citation": "819/BRSITZ/2013",
    "session_detail_url": "https://www.parlament.gv.at/gegenstand/BR/BRSITZ/819",
    "protocol_pdf_url": "https://www.parlament.gv.at/dokument/BR/BRSITZ/819/fname_312175.pdf",
    "protocol_html_url": "https://www.parlament.gv.at/dokument/BR/BRSITZ/819/fnameorig_312175.html",
    "uid": "XXIV_BRSITZ_819",
    "raw_path": "steno_protocols/raw_html/XXIV_BRSITZ_819.html",
    "txt_path": "steno_protocols/plain_text/XXIV_BRSITZ_819.txt"
  },
  {
    "session_date_display": "09.02.2006",
    "session_date_iso": "2006-02-09T00:00:00",
    "gp_code": "XXII",
    "chamber": "BRSITZ",
    "session_number": 731,
    "title": "731. Sitzung (731/BRSITZ/2006)",
    "citation": "731/BRSITZ/2006",
    "session_detail_url": "https://www.parlament.gv.at/gegenstand/BR/BRSITZ/731",
    "protocol_pdf_url": "https://www.parlament.gv.at/dokument/BR/BRSITZ/731/fname_061041.pdf",
    "protocol_html_url": "https://www.parlament.gv.at/dokument/BR/BRSITZ/731/fnameorig_061041.html",
    "uid": "XXII_BRSITZ_731",
    "raw_path": "steno_protocols/raw_html/XXII_BRSITZ_731.html",
    "txt_path": "steno_protocols/plain_text/XXII_BRSITZ_731.txt"
  },
  {
    "session_date_display": "02.07.2020",
    "session_date_iso": "2020-07-02T00:00:00",
    "gp_code": "XXVII",
    "chamber": "BRSITZ",
    "session_number": 909,
    "title": "909. Sitzung (909/BRSITZ/2020)",
    "citation": "909/BRSITZ/2020",
    "session_detail_url": "https://www.parlament.gv.at/gegenstand/BR/BRSITZ/909",
    "protocol_pdf_url": "https://www.parlament.gv.at/dokument/BR/BRSITZ/909/fname_845438.pdf",
    "protocol_html_url": "https://www.parlament.gv.at/dokument/BR/BRSITZ/909/fnameorig_845438.html",
    "uid": "XXVII_BRSITZ_909",
    "raw_path": "steno_protocols/raw_html/XXVII_BRSITZ_909.html",
    "txt_path": "steno_protocols/plain_text/XXVII_BRSITZ_909.txt"
  },
  {
    "session_date_display": "27.03.1998",
    "session_date_iso": "1998-03-27T00:00:00",
    "gp_code": "XX",
    "chamber": "BRSITZ",
    "session_number": 638,
    "title": "638. Sitzung (638/BRSITZ/98)",
    "citation": "638/BRSITZ/98",
    "session_detail_url": "https://www.parlament.gv.at/gegenstand/BR/BRSITZ/638",
    "protocol_pdf_url": "https://www.parlament.gv.at/dokument/BR/BRSITZ/638/fname_113617.pdf",
    "protocol_html_url": "https://www.parlament.gv.at/dokument/BR/BRSITZ/638/fnameorig_113617.html",
    "uid": "XX_BRSITZ_638",
    "raw_path": "steno_protocols/raw_html/XX_BRSITZ_638.html",
    "txt_path": "steno_protocols/plain_text/XX_BRSITZ_638.txt"
  },
  {
    "session_date_display": "05.11.2004",
    "session_date_iso": "2004-11-05T00:00:00",
    "gp_code": "XXII",
    "chamber": "BRSITZ",
    "session_number": 714,
    "title": "714. Sitzung (714/BRSITZ/2004)",
    "citation": "714/BRSITZ/2004",
    "session_detail_url": "https://www.parlament.gv.at/gegenstand/BR/BRSITZ/714",
    "protocol_pdf_url": "https://www.parlament.gv.at/dokument/BR/BRSITZ/714/fname_032456.pdf",
    "protocol_html_url": "https://www.parlament.gv.at/dokument/BR/BRSITZ/714/fnameorig_032456.html",
    "uid": "XXII_BRSITZ_714",
    "raw_path": "steno_protocols/raw_html/XXII_BRSITZ_714.html",
    "txt_path": "steno_protocols/plain_text/XXII_BRSITZ_714.txt"
  },
  {
    "session_date_display": "01.10.1998",
    "session_date_iso": "1998-10-01T00:00:00",
    "gp_code": "XX",
    "chamber": "BRSITZ",
    "session_number": 644,
    "title": "644. Sitzung (644/BRSITZ/98)",
    "citation": "644/BRSITZ/98",
    "session_detail_url": "https://www.parlament.gv.at/gegenstand/BR/BRSITZ/644",
    "protocol_pdf_url": "https://www.parlament.gv.at/dokument/BR/BRSITZ/644/fname_113629.pdf",
    "protocol_html_url": "https://www.parlament.gv.at/dokument/BR/BRSITZ/644/fnameorig_113629.html",
    "uid": "XX_BRSITZ_644",
    "raw_path": "steno_protocols/raw_html/XX_BRSITZ_644.html",
    "txt_path": "steno_protocols/plain_text/XX_BRSITZ_644.txt"
  },
  {
    "session_date_display": "25.05.2005",
    "session_date_iso": "2005-05-25T00:00:00",
    "gp_code": "XXII",
    "chamber": "BRSITZ",
    "session_number": 721,
    "title": "721. Sitzung (721/BRSITZ/2005)",
    "citation": "721/BRSITZ/2005",
    "session_detail_url": "https://www.parlament.gv.at/gegenstand/BR/BRSITZ/721",
    "protocol_pdf_url": "https://www.parlament.gv.at/dokument/BR/BRSITZ/721/fname_046904.pdf",
    "protocol_html_url": "https://www.parlament.gv.at/dokument/BR/BRSITZ/721/fnameorig_046904.html",
    "uid": "XXII_BRSITZ_721",
    "raw_path": "steno_protocols/raw_html/XXII_BRSITZ_721.html",
    "txt_path": "steno_protocols/plain_text/XXII_BRSITZ_721.txt"
  },
  {
    "session_date_display": "14.01.1999",
    "session_date_iso": "1999-01-14T00:00:00",
    "gp_code": "XX",
    "chamber": "BRSITZ",
    "session_number": 649,
    "title": "649. Sitzung (649/BRSITZ/99)",
    "citation": "649/BRSITZ/99",
    "session_detail_url": "https://www.parlament.gv.at/gegenstand/BR/BRSITZ/649",
    "protocol_pdf_url": "https://www.parlament.gv.at/dokument/BR/BRSITZ/649/fname_113639.pdf",
    "protocol_html_url": "https://www.parlament.gv.at/dokument/BR/BRSITZ/649/fnameorig_113639.html",
    "uid": "XX_BRSITZ_649",
    "raw_path": "steno_protocols/raw_html/XX_BRSITZ_649.html",
    "txt_path": "steno_protocols/plain_text/XX_BRSITZ_649.txt"
  },
  {
    "session_date_display": "05.12.2013",
    "session_date_iso": "2013-12-05T00:00:00",
    "gp_code": "XXV",
    "chamber": "BRSITZ",
    "session_number": 824,
    "title": "824. Sitzung (824/BRSITZ/2013)",
    "citation": "824/BRSITZ/2013",
    "session_detail_url": "https://www.parlament.gv.at/gegenstand/BR/BRSITZ/824",
    "protocol_pdf_url": "https://www.parlament.gv.at/dokument/BR/BRSITZ/824/fname_336255.pdf",
    "protocol_html_url": "https://www.parlament.gv.at/dokument/BR/BRSITZ/824/fnameorig_336255.html",
    "uid": "XXV_BRSITZ_824",
    "raw_path": "steno_protocols/raw_html/XXV_BRSITZ_824.html",
    "txt_path": "steno_protocols/plain_text/XXV_BRSITZ_824.txt"
  },
  {
    "session_date_display": "26.03.1999",
    "session_date_iso": "1999-03-26T00:00:00",
    "gp_code": "XX",
    "chamber": "BRSITZ",
    "session_number": 652,
    "title": "652. Sitzung (652/BRSITZ/99)",
    "citation": "652/BRSITZ/99",
    "session_detail_url": "https://www.parlament.gv.at/gegenstand/BR/BRSITZ/652",
    "protocol_pdf_url": "https://www.parlament.gv.at/dokument/BR/BRSITZ/652/fname_113645.pdf",
    "protocol_html_url": "https://www.parlament.gv.at/dokument/BR/BRSITZ/652/fnameorig_113645.html",
    "uid": "XX_BRSITZ_652",
    "raw_path": "steno_protocols/raw_html/XX_BRSITZ_652.html",
    "txt_path": "steno_protocols/plain_text/XX_BRSITZ_652.txt"
  },
  {
    "session_date_display": "15.04.1999",
    "session_date_iso": "1999-04-15T00:00:00",
    "gp_code": "XX",
    "chamber": "BRSITZ",
    "session_number": 653,
    "title": "653. Sitzung (653/BRSITZ/99)",
    "citation": "653/BRSITZ/99",
    "session_detail_url": "https://www.parlament.gv.at/gegenstand/BR/BRSITZ/653",
    "protocol_pdf_url": "https://www.parlament.gv.at/dokument/BR/BRSITZ/653/fname_113647.pdf",
    "protocol_html_url": "https://www.parlament.gv.at/dokument/BR/BRSITZ/653/fnameorig_113647.html",
    "uid": "XX_BRSITZ_653",
    "raw_path": "steno_protocols/raw_html/XX_BRSITZ_653.html",
    "txt_path": "steno_protocols/plain_text/XX_BRSITZ_653.txt"
  },
  {
    "session_date_display": "31.10.2012",
    "session_date_iso": "2012-10-31T00:00:00",
    "gp_code": "XXIV",
    "chamber": "BRSITZ",
    "session_number": 814,
    "title": "814. Sitzung (814/BRSITZ/2012)",
    "citation": "814/BRSITZ/2012",
    "session_detail_url": "https://www.parlament.gv.at/gegenstand/BR/BRSITZ/814",
    "protocol_pdf_url": "https://www.parlament.gv.at/dokument/BR/BRSITZ/814/fname_286723.pdf",
    "protocol_html_url": "https://www.parlament.gv.at/dokument/BR/BRSITZ/814/fnameorig_286723.html",
    "uid": "XXIV_BRSITZ_814",
    "raw_path": "steno_protocols/raw_html/XXIV_BRSITZ_814.html",
    "txt_path": "steno_protocols/plain_text/XXIV_BRSITZ_814.txt"
  },
  {
    "session_date_display": "29.11.2012",
    "session_date_iso": "2012-11-29T00:00:00",
    "gp_code": "XXIV",
    "chamber": "BRSITZ",
    "session_number": 815,
    "title": "815. Sitzung (815/BRSITZ/2012)",
    "citation": "815/BRSITZ/2012",
    "session_detail_url": "https://www.parlament.gv.at/gegenstand/BR/BRSITZ/815",
    "protocol_pdf_url": "https://www.parlament.gv.at/dokument/BR/BRSITZ/815/fname_291433.pdf",
    "protocol_html_url": "https://www.parlament.gv.at/dokument/BR/BRSITZ/815/fnameorig_291433.html",
    "uid": "XXIV_BRSITZ_815",
    "raw_path": "steno_protocols/raw_html/XXIV_BRSITZ_815.html",
    "txt_path": "steno_protocols/plain_text/XXIV_BRSITZ_815.txt"
  },
  {
    "session_date_display": "02.11.2005",
    "session_date_iso": "2005-11-02T00:00:00",
    "gp_code": "XXII",
    "chamber": "BRSITZ",
    "session_number": 726,
    "title": "726. Sitzung (726/BRSITZ/2005)",
    "citation": "726/BRSITZ/2005",
    "session_detail_url": "https://www.parlament.gv.at/gegenstand/BR/BRSITZ/726",
    "protocol_pdf_url": "https://www.parlament.gv.at/dokument/BR/BRSITZ/726/fname_053108.pdf",
    "protocol_html_url": "https://www.parlament.gv.at/dokument/BR/BRSITZ/726/fnameorig_053108.html",
    "uid": "XXII_BRSITZ_726",
    "raw_path": "steno_protocols/raw_html/XXII_BRSITZ_726.html",
    "txt_path": "steno_protocols/plain_text/XXII_BRSITZ_726.txt"
  },
  {
    "session_date_display": "31.01.2007",
    "session_date_iso": "2007-01-31T00:00:00",
    "gp_code": "XXIII",
    "chamber": "BRSITZ",
    "session_number": 741,
    "title": "741. Sitzung (741/BRSITZ/2007)",
    "citation": "741/BRSITZ/2007",
    "session_detail_url": "https://www.parlament.gv.at/gegenstand/BR/BRSITZ/741",
    "protocol_pdf_url": "https://www.parlament.gv.at/dokument/BR/BRSITZ/741/fname_079719.pdf",
    "protocol_html_url": "https://www.parlament.gv.at/dokument/BR/BRSITZ/741/fnameorig_079719.html",
    "uid": "XXIII_BRSITZ_741",
    "raw_path": "steno_protocols/raw_html/XXIII_BRSITZ_741.html",
    "txt_path": "steno_protocols/plain_text/XXIII_BRSITZ_741.txt"
  },
  {
    "session_date_display": "10.04.2014",
    "session_date_iso": "2014-04-10T00:00:00",
    "gp_code": "XXV",
    "chamber": "BRSITZ",
    "session_number": 828,
    "title": "828. Sitzung (828/BRSITZ/2014)",
    "citation": "828/BRSITZ/2014",
    "session_detail_url": "https://www.parlament.gv.at/gegenstand/BR/BRSITZ/828",
    "protocol_pdf_url": "https://www.parlament.gv.at/dokument/BR/BRSITZ/828/fname_354765.pdf",
    "protocol_html_url": "https://www.parlament.gv.at/dokument/BR/BRSITZ/828/fnameorig_354765.html",
    "uid": "XXV_BRSITZ_828",
    "raw_path": "steno_protocols/raw_html/XXV_BRSITZ_828.html",
    "txt_path": "steno_protocols/plain_text/XXV_BRSITZ_828.txt"
  },
  {
    "session_date_display": "11.10.2007",
    "session_date_iso": "2007-10-11T00:00:00",
    "gp_code": "XXIII",
    "chamber": "BRSITZ",
    "session_number": 748,
    "title": "748. Sitzung (748/BRSITZ/2007)",
    "citation": "748/BRSITZ/2007",
    "session_detail_url": "https://www.parlament.gv.at/gegenstand/BR/BRSITZ/748",
    "protocol_pdf_url": "https://www.parlament.gv.at/dokument/BR/BRSITZ/748/fname_099056.pdf",
    "protocol_html_url": "https://www.parlament.gv.at/dokument/BR/BRSITZ/748/fnameorig_099056.html",
    "uid": "XXIII_BRSITZ_748",
    "raw_path": "steno_protocols/raw_html/XXIII_BRSITZ_748.html",
    "txt_path": "steno_protocols/plain_text/XXIII_BRSITZ_748.txt"
  },
  {
    "session_date_display": "18.12.2014",
    "session_date_iso": "2014-12-18T00:00:00",
    "gp_code": "XXV",
    "chamber": "BRSITZ",
    "session_number": 837,
    "title": "837. Sitzung (837/BRSITZ/2014)",
    "citation": "837/BRSITZ/2014",
    "session_detail_url": "https://www.parlament.gv.at/gegenstand/BR/BRSITZ/837",
    "protocol_pdf_url": "https://www.parlament.gv.at/dokument/BR/BRSITZ/837/fname_411137.pdf",
    "protocol_html_url": "https://www.parlament.gv.at/dokument/BR/BRSITZ/837/fnameorig_411137.html",
    "uid": "XXV_BRSITZ_837",
    "raw_path": "steno_protocols/raw_html/XXV_BRSITZ_837.html",
    "txt_path": "steno_protocols/plain_text/XXV_BRSITZ_837.txt"
  },
  {
    "session_date_display": "12.10.2000",
    "session_date_iso": "2000-10-12T00:00:00",
    "gp_code": "XXI",
    "chamber": "BRSITZ",
    "session_number": 668,
    "title": "668. Sitzung (668/BRSITZ/2000)",
    "citation": "668/BRSITZ/2000",
    "session_detail_url": "https://www.parlament.gv.at/gegenstand/BR/BRSITZ/668",
    "protocol_pdf_url": "https://www.parlament.gv.at/dokument/BR/BRSITZ/668/fname_113933.pdf",
    "protocol_html_url": "https://www.parlament.gv.at/dokument/BR/BRSITZ/668/fnameorig_113933.html",
    "uid": "XXI_BRSITZ_668",
    "raw_path": "steno_protocols/raw_html/XXI_BRSITZ_668.html",
    "txt_path": "steno_protocols/plain_text/XXI_BRSITZ_668.txt"
  },
  {
    "session_date_display": "16.04.2009",
    "session_date_iso": "2009-04-16T00:00:00",
    "gp_code": "XXIV",
    "chamber": "BRSITZ",
    "session_number": 769,
    "title": "769. Sitzung (769/BRSITZ/2009)",
    "citation": "769/BRSITZ/2009",
    "session_detail_url": "https://www.parlament.gv.at/gegenstand/BR/BRSITZ/769",
    "protocol_pdf_url": "https://www.parlament.gv.at/dokument/BR/BRSITZ/769/fname_160284.pdf",
    "protocol_html_url": "https://www.parlament.gv.at/dokument/BR/BRSITZ/769/fnameorig_160284.html",
    "uid": "XXIV_BRSITZ_769",
    "raw_path": "steno_protocols/raw_html/XXIV_BRSITZ_769.html",
    "txt_path": "steno_protocols/plain_text/XXIV_BRSITZ_769.txt"
  },
  {
    "session_date_display": "29.10.2015",
    "session_date_iso": "2015-10-29T00:00:00",
    "gp_code": "XXV",
    "chamber": "BRSITZ",
    "session_number": 846,
    "title": "846. Sitzung (846/BRSITZ/2015)",
    "citation": "846/BRSITZ/2015",
    "session_detail_url": "https://www.parlament.gv.at/gegenstand/BR/BRSITZ/846",
    "protocol_pdf_url": "https://www.parlament.gv.at/dokument/BR/BRSITZ/846/fname_526836.pdf",
    "protocol_html_url": "https://www.parlament.gv.at/dokument/BR/BRSITZ/846/fnameorig_526836.html",
    "uid": "XXV_BRSITZ_846",
    "raw_path": "steno_protocols/raw_html/XXV_BRSITZ_846.html",
    "txt_path": "steno_protocols/plain_text/XXV_BRSITZ_846.txt"
  },
  {
    "session_date_display": "02.07.2009",
    "session_date_iso": "2009-07-02T00:00:00",
    "gp_code": "XXIV",
    "chamber": "BRSITZ",
    "session_number": 772,
    "title": "772. Sitzung (772/BRSITZ/2009)",
    "citation": "772/BRSITZ/2009",
    "session_detail_url": "https://www.parlament.gv.at/gegenstand/BR/BRSITZ/772",
    "protocol_pdf_url": "https://www.parlament.gv.at/dokument/BR/BRSITZ/772/fname_169018.pdf",
    "protocol_html_url": "https://www.parlament.gv.at/dokument/BR/BRSITZ/772/fnameorig_169018.html",
    "uid": "XXIV_BRSITZ_772",
    "raw_path": "steno_protocols/raw_html/XXIV_BRSITZ_772.html",
    "txt_path": "steno_protocols/plain_text/XXIV_BRSITZ_772.txt"
  },
  {
    "session_date_display": "29.07.1999",
    "session_date_iso": "1999-07-29T00:00:00",
    "gp_code": "XX",
    "chamber": "BRSITZ",
    "session_number": 657,
    "title": "657. Sitzung (657/BRSITZ/99)",
    "citation": "657/BRSITZ/99",
    "session_detail_url": "https://www.parlament.gv.at/gegenstand/BR/BRSITZ/657",
    "protocol_pdf_url": "https://www.parlament.gv.at/dokument/BR/BRSITZ/657/fname_113655.pdf",
    "protocol_html_url": "https://www.parlament.gv.at/dokument/BR/BRSITZ/657/fnameorig_113655.html",
    "uid": "XX_BRSITZ_657",
    "raw_path": "steno_protocols/raw_html/XX_BRSITZ_657.html",
    "txt_path": "steno_protocols/plain_text/XX_BRSITZ_657.txt"
  },
  {
    "session_date_display": "23.07.2015",
    "session_date_iso": "2015-07-23T00:00:00",
    "gp_code": "XXV",
    "chamber": "BRSITZ",
    "session_number": 844,
    "title": "844. Sitzung (844/BRSITZ/2015)",
    "citation": "844/BRSITZ/2015",
    "session_detail_url": "https://www.parlament.gv.at/gegenstand/BR/BRSITZ/844",
    "protocol_pdf_url": "https://www.parlament.gv.at/dokument/BR/BRSITZ/844/fname_501529.pdf",
    "protocol_html_url": "https://www.parlament.gv.at/dokument/BR/BRSITZ/844/fnameorig_501529.html",
    "uid": "XXV_BRSITZ_844",
    "raw_path": "steno_protocols/raw_html/XXV_BRSITZ_844.html",
    "txt_path": "steno_protocols/plain_text/XXV_BRSITZ_844.txt"
  },
  {
    "session_date_display": "05.06.2009",
    "session_date_iso": "2009-06-05T00:00:00",
    "gp_code": "XXIV",
    "chamber": "BRSITZ",
    "session_number": 771,
    "title": "771. Sitzung (771/BRSITZ/2009)",
    "citation": "771/BRSITZ/2009",
    "session_detail_url": "https://www.parlament.gv.at/gegenstand/BR/BRSITZ/771",
    "protocol_pdf_url": "https://www.parlament.gv.at/dokument/BR/BRSITZ/771/fname_165082.pdf",
    "protocol_html_url": "https://www.parlament.gv.at/dokument/BR/BRSITZ/771/fnameorig_165082.html",
    "uid": "XXIV_BRSITZ_771",
    "raw_path": "steno_protocols/raw_html/XXIV_BRSITZ_771.html",
    "txt_path": "steno_protocols/plain_text/XXIV_BRSITZ_771.txt"
  },
  {
    "session_date_display": "04.04.2001",
    "session_date_iso": "2001-04-04T00:00:00",
    "gp_code": "XXI",
    "chamber": "BRSITZ",
    "session_number": 674,
    "title": "674. Sitzung (674/BRSITZ/2001)",
    "citation": "674/BRSITZ/2001",
    "session_detail_url": "https://www.parlament.gv.at/gegenstand/BR/BRSITZ/674",
    "protocol_pdf_url": "https://www.parlament.gv.at/dokument/BR/BRSITZ/674/fname_113945.pdf",
    "protocol_html_url": "https://www.parlament.gv.at/dokument/BR/BRSITZ/674/fnameorig_113945.html",
    "uid": "XXI_BRSITZ_674",
    "raw_path": "steno_protocols/raw_html/XXI_BRSITZ_674.html",
    "txt_path": "steno_protocols/plain_text/XXI_BRSITZ_674.txt"
  },
  {
    "session_date_display": "04.12.2014",
    "session_date_iso": "2014-12-04T00:00:00",
    "gp_code": "XXV",
    "chamber": "BRSITZ",
    "session_number": 836,
    "title": "836. Sitzung (836/BRSITZ/2014)",
    "citation": "836/BRSITZ/2014",
    "session_detail_url": "https://www.parlament.gv.at/gegenstand/BR/BRSITZ/836",
    "protocol_pdf_url": "https://www.parlament.gv.at/dokument/BR/BRSITZ/836/fname_386237.pdf",
    "protocol_html_url": "https://www.parlament.gv.at/dokument/BR/BRSITZ/836/fnameorig_386237.html",
    "uid": "XXV_BRSITZ_836",
    "raw_path": "steno_protocols/raw_html/XXV_BRSITZ_836.html",
    "txt_path": "steno_protocols/plain_text/XXV_BRSITZ_836.txt"
  },
  {
    "session_date_display": "16.03.2000",
    "session_date_iso": "2000-03-16T00:00:00",
    "gp_code": "XXI",
    "chamber": "BRSITZ",
    "session_number": 662,
    "title": "662. Sitzung (662/BRSITZ/2000)",
    "citation": "662/BRSITZ/2000",
    "session_detail_url": "https://www.parlament.gv.at/gegenstand/BR/BRSITZ/662",
    "protocol_pdf_url": "https://www.parlament.gv.at/dokument/BR/BRSITZ/662/fname_113921.pdf",
    "protocol_html_url": "https://www.parlament.gv.at/dokument/BR/BRSITZ/662/fnameorig_113921.html",
    "uid": "XXI_BRSITZ_662",
    "raw_path": "steno_protocols/raw_html/XXI_BRSITZ_662.html",
    "txt_path": "steno_protocols/plain_text/XXI_BRSITZ_662.txt"
  },
  {
    "session_date_display": "26.05.2000",
    "session_date_iso": "2000-05-26T00:00:00",
    "gp_code": "XXI",
    "chamber": "BRSITZ",
    "session_number": 665,
    "title": "665. Sitzung (665/BRSITZ/2000)",
    "citation": "665/BRSITZ/2000",
    "session_detail_url": "https://www.parlament.gv.at/gegenstand/BR/BRSITZ/665",
    "protocol_pdf_url": "https://www.parlament.gv.at/dokument/BR/BRSITZ/665/fname_113927.pdf",
    "protocol_html_url": "https://www.parlament.gv.at/dokument/BR/BRSITZ/665/fnameorig_113927.html",
    "uid": "XXI_BRSITZ_665",
    "raw_path": "steno_protocols/raw_html/XXI_BRSITZ_665.html",
    "txt_path": "steno_protocols/plain_text/XXI_BRSITZ_665.txt"
  },
  {
    "session_date_display": "09.11.2000",
    "session_date_iso": "2000-11-09T00:00:00",
    "gp_code": "XXI",
    "chamber": "BRSITZ",
    "session_number": 669,
    "title": "669. Sitzung (669/BRSITZ/2000)",
    "citation": "669/BRSITZ/2000",
    "session_detail_url": "https://www.parlament.gv.at/gegenstand/BR/BRSITZ/669",
    "protocol_pdf_url": "https://www.parlament.gv.at/dokument/BR/BRSITZ/669/fname_113935.pdf",
    "protocol_html_url": "https://www.parlament.gv.at/dokument/BR/BRSITZ/669/fnameorig_113935.html",
    "uid": "XXI_BRSITZ_669",
    "raw_path": "steno_protocols/raw_html/XXI_BRSITZ_669.html",
    "txt_path": "steno_protocols/plain_text/XXI_BRSITZ_669.txt"
  },
  {
    "session_date_display": "15.02.2001",
    "session_date_iso": "2001-02-15T00:00:00",
    "gp_code": "XXI",
    "chamber": "BRSITZ",
    "session_number": 672,
    "title": "672. Sitzung (672/BRSITZ/2001)",
    "citation": "672/BRSITZ/2001",
    "session_detail_url": "https://www.parlament.gv.at/gegenstand/BR/BRSITZ/672",
    "protocol_pdf_url": "https://www.parlament.gv.at/dokument/BR/BRSITZ/672/fname_113941.pdf",
    "protocol_html_url": "https://www.parlament.gv.at/dokument/BR/BRSITZ/672/fnameorig_113941.html",
    "uid": "XXI_BRSITZ_672",
    "raw_path": "steno_protocols/raw_html/XXI_BRSITZ_672.html",
    "txt_path": "steno_protocols/plain_text/XXI_BRSITZ_672.txt"
  },
  {
    "session_date_display": "23.07.2009",
    "session_date_iso": "2009-07-23T00:00:00",
    "gp_code": "XXIV",
    "chamber": "BRSITZ",
    "session_number": 774,
    "title": "774. Sitzung (774/BRSITZ/2009)",
    "citation": "774/BRSITZ/2009",
    "session_detail_url": "https://www.parlament.gv.at/gegenstand/BR/BRSITZ/774",
    "protocol_pdf_url": "https://www.parlament.gv.at/dokument/BR/BRSITZ/774/fname_172845.pdf",
    "protocol_html_url": "https://www.parlament.gv.at/dokument/BR/BRSITZ/774/fnameorig_172845.html",
    "uid": "XXIV_BRSITZ_774",
    "raw_path": "steno_protocols/raw_html/XXIV_BRSITZ_774.html",
    "txt_path": "steno_protocols/plain_text/XXIV_BRSITZ_774.txt"
  },
  {
    "session_date_display": "15.05.2014",
    "session_date_iso": "2014-05-15T00:00:00",
    "gp_code": "XXV",
    "chamber": "BRSITZ",
    "session_number": 829,
    "title": "829. Sitzung (829/BRSITZ/2014)",
    "citation": "829/BRSITZ/2014",
    "session_detail_url": "https://www.parlament.gv.at/gegenstand/BR/BRSITZ/829",
    "protocol_pdf_url": "https://www.parlament.gv.at/dokument/BR/BRSITZ/829/fname_358518.pdf",
    "protocol_html_url": "https://www.parlament.gv.at/dokument/BR/BRSITZ/829/fnameorig_358518.html",
    "uid": "XXV_BRSITZ_829",
    "raw_path": "steno_protocols/raw_html/XXV_BRSITZ_829.html",
    "txt_path": "steno_protocols/plain_text/XXV_BRSITZ_829.txt"
  },
  {
    "session_date_display": "02.06.1999",
    "session_date_iso": "1999-06-02T00:00:00",
    "gp_code": "XX",
    "chamber": "BRSITZ",
    "session_number": 655,
    "title": "655. Sitzung (655/BRSITZ/99)",
    "citation": "655/BRSITZ/99",
    "session_detail_url": "https://www.parlament.gv.at/gegenstand/BR/BRSITZ/655",
    "protocol_pdf_url": "https://www.parlament.gv.at/dokument/BR/BRSITZ/655/fname_113651.pdf",
    "protocol_html_url": "https://www.parlament.gv.at/dokument/BR/BRSITZ/655/fnameorig_113651.html",
    "uid": "XX_BRSITZ_655",
    "raw_path": "steno_protocols/raw_html/XX_BRSITZ_655.html",
    "txt_path": "steno_protocols/plain_text/XX_BRSITZ_655.txt"
  },
  {
    "session_date_display": "02.12.2014",
    "session_date_iso": "2014-12-02T00:00:00",
    "gp_code": "XXV",
    "chamber": "BRSITZ",
    "session_number": 835,
    "title": "835. Sitzung (835/BRSITZ/2014)",
    "citation": "835/BRSITZ/2014",
    "session_detail_url": "https://www.parlament.gv.at/gegenstand/BR/BRSITZ/835",
    "protocol_pdf_url": "https://www.parlament.gv.at/dokument/BR/BRSITZ/835/fname_385043.pdf",
    "protocol_html_url": "https://www.parlament.gv.at/dokument/BR/BRSITZ/835/fnameorig_385043.html",
    "uid": "XXV_BRSITZ_835",
    "raw_path": "steno_protocols/raw_html/XXV_BRSITZ_835.html",
    "txt_path": "steno_protocols/plain_text/XXV_BRSITZ_835.txt"
  },
  {
    "session_date_display": "03.02.2000",
    "session_date_iso": "2000-02-03T00:00:00",
    "gp_code": "XXI",
    "chamber": "BRSITZ",
    "session_number": 660,
    "title": "660. Sitzung (660/BRSITZ/2000)",
    "citation": "660/BRSITZ/2000",
    "session_detail_url": "https://www.parlament.gv.at/gegenstand/BR/BRSITZ/660",
    "protocol_pdf_url": "https://www.parlament.gv.at/dokument/BR/BRSITZ/660/fname_113917.pdf",
    "protocol_html_url": "https://www.parlament.gv.at/dokument/BR/BRSITZ/660/fnameorig_113917.html",
    "uid": "XXI_BRSITZ_660",
    "raw_path": "steno_protocols/raw_html/XXI_BRSITZ_660.html",
    "txt_path": "steno_protocols/plain_text/XXI_BRSITZ_660.txt"
  },
  {
    "session_date_display": "20.07.2007",
    "session_date_iso": "2007-07-20T00:00:00",
    "gp_code": "XXIII",
    "chamber": "BRSITZ",
    "session_number": 747,
    "title": "747. Sitzung (747/BRSITZ/2007)",
    "citation": "747/BRSITZ/2007",
    "session_detail_url": "https://www.parlament.gv.at/gegenstand/BR/BRSITZ/747",
    "protocol_pdf_url": "https://www.parlament.gv.at/dokument/BR/BRSITZ/747/fname_098787.pdf",
    "protocol_html_url": "https://www.parlament.gv.at/dokument/BR/BRSITZ/747/fnameorig_098787.html",
    "uid": "XXIII_BRSITZ_747",
    "raw_path": "steno_protocols/raw_html/XXIII_BRSITZ_747.html",
    "txt_path": "steno_protocols/plain_text/XXIII_BRSITZ_747.txt"
  },
  {
    "session_date_display": "03.06.2015",
    "session_date_iso": "2015-06-03T00:00:00",
    "gp_code": "XXV",
    "chamber": "BRSITZ",
    "session_number": 842,
    "title": "842. Sitzung (842/BRSITZ/2015)",
    "citation": "842/BRSITZ/2015",
    "session_detail_url": "https://www.parlament.gv.at/gegenstand/BR/BRSITZ/842",
    "protocol_pdf_url": "https://www.parlament.gv.at/dokument/BR/BRSITZ/842/fname_476936.pdf",
    "protocol_html_url": "https://www.parlament.gv.at/dokument/BR/BRSITZ/842/fnameorig_476936.html",
    "uid": "XXV_BRSITZ_842",
    "raw_path": "steno_protocols/raw_html/XXV_BRSITZ_842.html",
    "txt_path": "steno_protocols/plain_text/XXV_BRSITZ_842.txt"
  },
  {
    "session_date_display": "25.01.1996",
    "session_date_iso": "1996-01-25T00:00:00",
    "gp_code": "XX",
    "chamber": "BRSITZ",
    "session_number": 608,
    "title": "608. Sitzung (608/BRSITZ/96)",
    "citation": "608/BRSITZ/96",
    "session_detail_url": "https://www.parlament.gv.at/gegenstand/BR/BRSITZ/608",
    "protocol_pdf_url": "https://www.parlament.gv.at/dokument/BR/BRSITZ/608/fname_113556.pdf",
    "protocol_html_url": "https://www.parlament.gv.at/dokument/BR/BRSITZ/608/fnameorig_113556.html",
    "uid": "XX_BRSITZ_608",
    "raw_path": "steno_protocols/raw_html/XX_BRSITZ_608.html",
    "txt_path": "steno_protocols/plain_text/XX_BRSITZ_608.txt"
  },
  {
    "session_date_display": "06.05.1999",
    "session_date_iso": "1999-05-06T00:00:00",
    "gp_code": "XX",
    "chamber": "BRSITZ",
    "session_number": 654,
    "title": "654. Sitzung (654/BRSITZ/99)",
    "citation": "654/BRSITZ/99",
    "session_detail_url": "https://www.parlament.gv.at/gegenstand/BR/BRSITZ/654",
    "protocol_pdf_url": "https://www.parlament.gv.at/dokument/BR/BRSITZ/654/fname_113649.pdf",
    "protocol_html_url": "https://www.parlament.gv.at/dokument/BR/BRSITZ/654/fnameorig_113649.html",
    "uid": "XX_BRSITZ_654",
    "raw_path": "steno_protocols/raw_html/XX_BRSITZ_654.html",
    "txt_path": "steno_protocols/plain_text/XX_BRSITZ_654.txt"
  },
  {
    "session_date_display": "22.03.2007",
    "session_date_iso": "2007-03-22T00:00:00",
    "gp_code": "XXIII",
    "chamber": "BRSITZ",
    "session_number": 743,
    "title": "743. Sitzung (743/BRSITZ/2007)",
    "citation": "743/BRSITZ/2007",
    "session_detail_url": "https://www.parlament.gv.at/gegenstand/BR/BRSITZ/743",
    "protocol_pdf_url": "https://www.parlament.gv.at/dokument/BR/BRSITZ/743/fname_084591.pdf",
    "protocol_html_url": "https://www.parlament.gv.at/dokument/BR/BRSITZ/743/fnameorig_084591.html",
    "uid": "XXIII_BRSITZ_743",
    "raw_path": "steno_protocols/raw_html/XXIII_BRSITZ_743.html",
    "txt_path": "steno_protocols/plain_text/XXIII_BRSITZ_743.txt"
  },
  {
    "session_date_display": "18.02.2000",
    "session_date_iso": "2000-02-18T00:00:00",
    "gp_code": "XXI",
    "chamber": "BRSITZ",
    "session_number": 661,
    "title": "661. Sitzung (661/BRSITZ/2000)",
    "citation": "661/BRSITZ/2000",
    "session_detail_url": "https://www.parlament.gv.at/gegenstand/BR/BRSITZ/661",
    "protocol_pdf_url": "https://www.parlament.gv.at/dokument/BR/BRSITZ/661/fname_113919.pdf",
    "protocol_html_url": "https://www.parlament.gv.at/dokument/BR/BRSITZ/661/fnameorig_113919.html",
    "uid": "XXI_BRSITZ_661",
    "raw_path": "steno_protocols/raw_html/XXI_BRSITZ_661.html",
    "txt_path": "steno_protocols/plain_text/XXI_BRSITZ_661.txt"
  },
  {
    "session_date_display": "05.02.2015",
    "session_date_iso": "2015-02-05T00:00:00",
    "gp_code": "XXV",
    "chamber": "BRSITZ",
    "session_number": 838,
    "title": "838. Sitzung (838/BRSITZ/2015)",
    "citation": "838/BRSITZ/2015",
    "session_detail_url": "https://www.parlament.gv.at/gegenstand/BR/BRSITZ/838",
    "protocol_pdf_url": "https://www.parlament.gv.at/dokument/BR/BRSITZ/838/fname_411143.pdf",
    "protocol_html_url": "https://www.parlament.gv.at/dokument/BR/BRSITZ/838/fnameorig_411143.html",
    "uid": "XXV_BRSITZ_838",
    "raw_path": "steno_protocols/raw_html/XXV_BRSITZ_838.html",
    "txt_path": "steno_protocols/plain_text/XXV_BRSITZ_838.txt"
  },
  {
    "session_date_display": "09.04.2015",
    "session_date_iso": "2015-04-09T00:00:00",
    "gp_code": "XXV",
    "chamber": "BRSITZ",
    "session_number": 840,
    "title": "840. Sitzung (840/BRSITZ/2015)",
    "citation": "840/BRSITZ/2015",
    "session_detail_url": "https://www.parlament.gv.at/gegenstand/BR/BRSITZ/840",
    "protocol_pdf_url": "https://www.parlament.gv.at/dokument/BR/BRSITZ/840/fname_426073.pdf",
    "protocol_html_url": "https://www.parlament.gv.at/dokument/BR/BRSITZ/840/fnameorig_426073.html",
    "uid": "XXV_BRSITZ_840",
    "raw_path": "steno_protocols/raw_html/XXV_BRSITZ_840.html",
    "txt_path": "steno_protocols/plain_text/XXV_BRSITZ_840.txt"
  },
  {
    "session_date_display": "25.09.2015",
    "session_date_iso": "2015-09-25T00:00:00",
    "gp_code": "XXV",
    "chamber": "BRSITZ",
    "session_number": 845,
    "title": "845. Sitzung (845/BRSITZ/2015)",
    "citation": "845/BRSITZ/2015",
    "session_detail_url": "https://www.parlament.gv.at/gegenstand/BR/BRSITZ/845",
    "protocol_pdf_url": "https://www.parlament.gv.at/dokument/BR/BRSITZ/845/fname_523675.pdf",
    "protocol_html_url": "https://www.parlament.gv.at/dokument/BR/BRSITZ/845/fnameorig_523675.html",
    "uid": "XXV_BRSITZ_845",
    "raw_path": "steno_protocols/raw_html/XXV_BRSITZ_845.html",
    "txt_path": "steno_protocols/plain_text/XXV_BRSITZ_845.txt"
  },
  {
    "session_date_display": "14.12.2000",
    "session_date_iso": "2000-12-14T00:00:00",
    "gp_code": "XXI",
    "chamber": "BRSITZ",
    "session_number": 670,
    "title": "670. Sitzung (670/BRSITZ/2000)",
    "citation": "670/BRSITZ/2000",
    "session_detail_url": "https://www.parlament.gv.at/gegenstand/BR/BRSITZ/670",
    "protocol_pdf_url": "https://www.parlament.gv.at/dokument/BR/BRSITZ/670/fname_113937.pdf",
    "protocol_html_url": "https://www.parlament.gv.at/dokument/BR/BRSITZ/670/fnameorig_113937.html",
    "uid": "XXI_BRSITZ_670",
    "raw_path": "steno_protocols/raw_html/XXI_BRSITZ_670.html",
    "txt_path": "steno_protocols/plain_text/XXI_BRSITZ_670.txt"
  },
  {
    "session_date_display": "06.04.2001",
    "session_date_iso": "2001-04-06T00:00:00",
    "gp_code": "XXI",
    "chamber": "BRSITZ",
    "session_number": 675,
    "title": "675. Sitzung (675/BRSITZ/2001)",
    "citation": "675/BRSITZ/2001",
    "session_detail_url": "https://www.parlament.gv.at/gegenstand/BR/BRSITZ/675",
    "protocol_pdf_url": "https://www.parlament.gv.at/dokument/BR/BRSITZ/675/fname_113947.pdf",
    "protocol_html_url": "https://www.parlament.gv.at/dokument/BR/BRSITZ/675/fnameorig_113947.html",
    "uid": "XXI_BRSITZ_675",
    "raw_path": "steno_protocols/raw_html/XXI_BRSITZ_675.html",
    "txt_path": "steno_protocols/plain_text/XXI_BRSITZ_675.txt"
  },
  {
    "session_date_display": "19.04.2001",
    "session_date_iso": "2001-04-19T00:00:00",
    "gp_code": "XXI",
    "chamber": "BRSITZ",
    "session_number": 676,
    "title": "676. Sitzung (676/BRSITZ/2001)",
    "citation": "676/BRSITZ/2001",
    "session_detail_url": "https://www.parlament.gv.at/gegenstand/BR/BRSITZ/676",
    "protocol_pdf_url": "https://www.parlament.gv.at/dokument/BR/BRSITZ/676/fname_113949.pdf",
    "protocol_html_url": "https://www.parlament.gv.at/dokument/BR/BRSITZ/676/fnameorig_113949.html",
    "uid": "XXI_BRSITZ_676",
    "raw_path": "steno_protocols/raw_html/XXI_BRSITZ_676.html",
    "txt_path": "steno_protocols/plain_text/XXI_BRSITZ_676.txt"
  },
  {
    "session_date_display": "03.09.2009",
    "session_date_iso": "2009-09-03T00:00:00",
    "gp_code": "XXIV",
    "chamber": "BRSITZ",
    "session_number": 775,
    "title": "775. Sitzung (775/BRSITZ/2009)",
    "citation": "775/BRSITZ/2009",
    "session_detail_url": "https://www.parlament.gv.at/gegenstand/BR/BRSITZ/775",
    "protocol_pdf_url": "https://www.parlament.gv.at/dokument/BR/BRSITZ/775/fname_172637.pdf",
    "protocol_html_url": "https://www.parlament.gv.at/dokument/BR/BRSITZ/775/fnameorig_172637.html",
    "uid": "XXIV_BRSITZ_775",
    "raw_path": "steno_protocols/raw_html/XXIV_BRSITZ_775.html",
    "txt_path": "steno_protocols/plain_text/XXIV_BRSITZ_775.txt"
  },
  {
    "session_date_display": "31.10.2007",
    "session_date_iso": "2007-10-31T00:00:00",
    "gp_code": "XXIII",
    "chamber": "BRSITZ",
    "session_number": 749,
    "title": "749. Sitzung (749/BRSITZ/2007)",
    "citation": "749/BRSITZ/2007",
    "session_detail_url": "https://www.parlament.gv.at/gegenstand/BR/BRSITZ/749",
    "protocol_pdf_url": "https://www.parlament.gv.at/dokument/BR/BRSITZ/749/fname_101437.pdf",
    "protocol_html_url": "https://www.parlament.gv.at/dokument/BR/BRSITZ/749/fnameorig_101437.html",
    "uid": "XXIII_BRSITZ_749",
    "raw_path": "steno_protocols/raw_html/XXIII_BRSITZ_749.html",
    "txt_path": "steno_protocols/plain_text/XXIII_BRSITZ_749.txt"
  },
  {
    "session_date_display": "12.03.2015",
    "session_date_iso": "2015-03-12T00:00:00",
    "gp_code": "XXV",
    "chamber": "BRSITZ",
    "session_number": 839,
    "title": "839. Sitzung (839/BRSITZ/2015)",
    "citation": "839/BRSITZ/2015",
    "session_detail_url": "https://www.parlament.gv.at/gegenstand/BR/BRSITZ/839",
    "protocol_pdf_url": "https://www.parlament.gv.at/dokument/BR/BRSITZ/839/fname_411828.pdf",
    "protocol_html_url": "https://www.parlament.gv.at/dokument/BR/BRSITZ/839/fnameorig_411828.html",
    "uid": "XXV_BRSITZ_839",
    "raw_path": "steno_protocols/raw_html/XXV_BRSITZ_839.html",
    "txt_path": "steno_protocols/plain_text/XXV_BRSITZ_839.txt"
  },
  {
    "session_date_display": "02.07.2015",
    "session_date_iso": "2015-07-02T00:00:00",
    "gp_code": "XXV",
    "chamber": "BRSITZ",
    "session_number": 843,
    "title": "843. Sitzung (843/BRSITZ/2015)",
    "citation": "843/BRSITZ/2015",
    "session_detail_url": "https://www.parlament.gv.at/gegenstand/BR/BRSITZ/843",
    "protocol_pdf_url": "https://www.parlament.gv.at/dokument/BR/BRSITZ/843/fname_485008.pdf",
    "protocol_html_url": "https://www.parlament.gv.at/dokument/BR/BRSITZ/843/fnameorig_485008.html",
    "uid": "XXV_BRSITZ_843",
    "raw_path": "steno_protocols/raw_html/XXV_BRSITZ_843.html",
    "txt_path": "steno_protocols/plain_text/XXV_BRSITZ_843.txt"
  },
  {
    "session_date_display": "15.12.2000",
    "session_date_iso": "2000-12-15T00:00:00",
    "gp_code": "XXI",
    "chamber": "BRSITZ",
    "session_number": 671,
    "title": "671. Sitzung (671/BRSITZ/2000)",
    "citation": "671/BRSITZ/2000",
    "session_detail_url": "https://www.parlament.gv.at/gegenstand/BR/BRSITZ/671",
    "protocol_pdf_url": "https://www.parlament.gv.at/dokument/BR/BRSITZ/671/fname_113939.pdf",
    "protocol_html_url": "https://www.parlament.gv.at/dokument/BR/BRSITZ/671/fnameorig_113939.html",
    "uid": "XXI_BRSITZ_671",
    "raw_path": "steno_protocols/raw_html/XXI_BRSITZ_671.html",
    "txt_path": "steno_protocols/plain_text/XXI_BRSITZ_671.txt"
  },
  {
    "session_date_display": "08.05.2009",
    "session_date_iso": "2009-05-08T00:00:00",
    "gp_code": "XXIV",
    "chamber": "BRSITZ",
    "session_number": 770,
    "title": "770. Sitzung (770/BRSITZ/2009)",
    "citation": "770/BRSITZ/2009",
    "session_detail_url": "https://www.parlament.gv.at/gegenstand/BR/BRSITZ/770",
    "protocol_pdf_url": "https://www.parlament.gv.at/dokument/BR/BRSITZ/770/fname_161269.pdf",
    "protocol_html_url": "https://www.parlament.gv.at/dokument/BR/BRSITZ/770/fnameorig_161269.html",
    "uid": "XXIV_BRSITZ_770",
    "raw_path": "steno_protocols/raw_html/XXIV_BRSITZ_770.html",
    "txt_path": "steno_protocols/plain_text/XXIV_BRSITZ_770.txt"
  },
  {
    "session_date_display": "28.05.2014",
    "session_date_iso": "2014-05-28T00:00:00",
    "gp_code": "XXV",
    "chamber": "BRSITZ",
    "session_number": 830,
    "title": "830. Sitzung (830/BRSITZ/2014)",
    "citation": "830/BRSITZ/2014",
    "session_detail_url": "https://www.parlament.gv.at/gegenstand/BR/BRSITZ/830",
    "protocol_pdf_url": "https://www.parlament.gv.at/dokument/BR/BRSITZ/830/fname_360498.pdf",
    "protocol_html_url": "https://www.parlament.gv.at/dokument/BR/BRSITZ/830/fnameorig_360498.html",
    "uid": "XXV_BRSITZ_830",
    "raw_path": "steno_protocols/raw_html/XXV_BRSITZ_830.html",
    "txt_path": "steno_protocols/plain_text/XXV_BRSITZ_830.txt"
  },
  {
    "session_date_display": "01.07.1999",
    "session_date_iso": "1999-07-01T00:00:00",
    "gp_code": "XX",
    "chamber": "BRSITZ",
    "session_number": 656,
    "title": "656. Sitzung (656/BRSITZ/99)",
    "citation": "656/BRSITZ/99",
    "session_detail_url": "https://www.parlament.gv.at/gegenstand/BR/BRSITZ/656",
    "protocol_pdf_url": "https://www.parlament.gv.at/dokument/BR/BRSITZ/656/fname_113653.pdf",
    "protocol_html_url": "https://www.parlament.gv.at/dokument/BR/BRSITZ/656/fnameorig_113653.html",
    "uid": "XX_BRSITZ_656",
    "raw_path": "steno_protocols/raw_html/XX_BRSITZ_656.html",
    "txt_path": "steno_protocols/plain_text/XX_BRSITZ_656.txt"
  },
  {
    "session_date_display": "16.02.2007",
    "session_date_iso": "2007-02-16T00:00:00",
    "gp_code": "XXIII",
    "chamber": "BRSITZ",
    "session_number": 742,
    "title": "742. Sitzung (742/BRSITZ/2007)",
    "citation": "742/BRSITZ/2007",
    "session_detail_url": "https://www.parlament.gv.at/gegenstand/BR/BRSITZ/742",
    "protocol_pdf_url": "https://www.parlament.gv.at/dokument/BR/BRSITZ/742/fname_079553.pdf",
    "protocol_html_url": "https://www.parlament.gv.at/dokument/BR/BRSITZ/742/fnameorig_079553.html",
    "uid": "XXIII_BRSITZ_742",
    "raw_path": "steno_protocols/raw_html/XXIII_BRSITZ_742.html",
    "txt_path": "steno_protocols/plain_text/XXIII_BRSITZ_742.txt"
  },
  {
    "session_date_display": "09.10.2014",
    "session_date_iso": "2014-10-09T00:00:00",
    "gp_code": "XXV",
    "chamber": "BRSITZ",
    "session_number": 833,
    "title": "833. Sitzung (833/BRSITZ/2014)",
    "citation": "833/BRSITZ/2014",
    "session_detail_url": "https://www.parlament.gv.at/gegenstand/BR/BRSITZ/833",
    "protocol_pdf_url": "https://www.parlament.gv.at/dokument/BR/BRSITZ/833/fname_371371.pdf",
    "protocol_html_url": "https://www.parlament.gv.at/dokument/BR/BRSITZ/833/fnameorig_371371.html",
    "uid": "XXV_BRSITZ_833",
    "raw_path": "steno_protocols/raw_html/XXV_BRSITZ_833.html",
    "txt_path": "steno_protocols/plain_text/XXV_BRSITZ_833.txt"
  },
  {
    "session_date_display": "21.12.1999",
    "session_date_iso": "1999-12-21T00:00:00",
    "gp_code": "XXI",
    "chamber": "BRSITZ",
    "session_number": 659,
    "title": "659. Sitzung (659/BRSITZ/99)",
    "citation": "659/BRSITZ/99",
    "session_detail_url": "https://www.parlament.gv.at/gegenstand/BR/BRSITZ/659",
    "protocol_pdf_url": "https://www.parlament.gv.at/dokument/BR/BRSITZ/659/fname_113659.pdf",
    "protocol_html_url": "https://www.parlament.gv.at/dokument/BR/BRSITZ/659/fnameorig_113659.html",
    "uid": "XXI_BRSITZ_659",
    "raw_path": "steno_protocols/raw_html/XXI_BRSITZ_659.html",
    "txt_path": "steno_protocols/plain_text/XXI_BRSITZ_659.txt"
  },
  {
    "session_date_display": "22.11.2007",
    "session_date_iso": "2007-11-22T00:00:00",
    "gp_code": "XXIII",
    "chamber": "BRSITZ",
    "session_number": 750,
    "title": "750. Sitzung (750/BRSITZ/2007)",
    "citation": "750/BRSITZ/2007",
    "session_detail_url": "https://www.parlament.gv.at/gegenstand/BR/BRSITZ/750",
    "protocol_pdf_url": "https://www.parlament.gv.at/dokument/BR/BRSITZ/750/fname_104379.pdf",
    "protocol_html_url": "https://www.parlament.gv.at/dokument/BR/BRSITZ/750/fnameorig_104379.html",
    "uid": "XXIII_BRSITZ_750",
    "raw_path": "steno_protocols/raw_html/XXIII_BRSITZ_750.html",
    "txt_path": "steno_protocols/plain_text/XXIII_BRSITZ_750.txt"
  },
  {
    "session_date_display": "20.12.2007",
    "session_date_iso": "2007-12-20T00:00:00",
    "gp_code": "XXIII",
    "chamber": "BRSITZ",
    "session_number": 752,
    "title": "752. Sitzung (752/BRSITZ/2007)",
    "citation": "752/BRSITZ/2007",
    "session_detail_url": "https://www.parlament.gv.at/gegenstand/BR/BRSITZ/752",
    "protocol_pdf_url": "https://www.parlament.gv.at/dokument/BR/BRSITZ/752/fname_111505.pdf",
    "protocol_html_url": "https://www.parlament.gv.at/dokument/BR/BRSITZ/752/fnameorig_111505.html",
    "uid": "XXIII_BRSITZ_752",
    "raw_path": "steno_protocols/raw_html/XXIII_BRSITZ_752.html",
    "txt_path": "steno_protocols/plain_text/XXIII_BRSITZ_752.txt"
  },
  {
    "session_date_display": "03.03.2009",
    "session_date_iso": "2009-03-03T00:00:00",
    "gp_code": "XXIV",
    "chamber": "BRSITZ",
    "session_number": 766,
    "title": "766. Sitzung (766/BRSITZ/2009)",
    "citation": "766/BRSITZ/2009",
    "session_detail_url": "https://www.parlament.gv.at/gegenstand/BR/BRSITZ/766",
    "protocol_pdf_url": "https://www.parlament.gv.at/dokument/BR/BRSITZ/766/fname_153511.pdf",
    "protocol_html_url": "https://www.parlament.gv.at/dokument/BR/BRSITZ/766/fnameorig_153511.html",
    "uid": "XXIV_BRSITZ_766",
    "raw_path": "steno_protocols/raw_html/XXIV_BRSITZ_766.html",
    "txt_path": "steno_protocols/plain_text/XXIV_BRSITZ_766.txt"
  },
  {
    "session_date_display": "13.04.2007",
    "session_date_iso": "2007-04-13T00:00:00",
    "gp_code": "XXIII",
    "chamber": "BRSITZ",
    "session_number": 744,
    "title": "744. Sitzung (744/BRSITZ/2007)",
    "citation": "744/BRSITZ/2007",
    "session_detail_url": "https://www.parlament.gv.at/gegenstand/BR/BRSITZ/744",
    "protocol_pdf_url": "https://www.parlament.gv.at/dokument/BR/BRSITZ/744/fname_088007.pdf",
    "protocol_html_url": "https://www.parlament.gv.at/dokument/BR/BRSITZ/744/fnameorig_088007.html",
    "uid": "XXIII_BRSITZ_744",
    "raw_path": "steno_protocols/raw_html/XXIII_BRSITZ_744.html",
    "txt_path": "steno_protocols/plain_text/XXIII_BRSITZ_744.txt"
  },
  {
    "session_date_display": "10.05.2007",
    "session_date_iso": "2007-05-10T00:00:00",
    "gp_code": "XXIII",
    "chamber": "BRSITZ",
    "session_number": 745,
    "title": "745. Sitzung (745/BRSITZ/2007)",
    "citation": "745/BRSITZ/2007",
    "session_detail_url": "https://www.parlament.gv.at/gegenstand/BR/BRSITZ/745",
    "protocol_pdf_url": "https://www.parlament.gv.at/dokument/BR/BRSITZ/745/fname_096127.pdf",
    "protocol_html_url": "https://www.parlament.gv.at/dokument/BR/BRSITZ/745/fnameorig_096127.html",
    "uid": "XXIII_BRSITZ_745",
    "raw_path": "steno_protocols/raw_html/XXIII_BRSITZ_745.html",
    "txt_path": "steno_protocols/plain_text/XXIII_BRSITZ_745.txt"
  },
  {
    "session_date_display": "18.11.1999",
    "session_date_iso": "1999-11-18T00:00:00",
    "gp_code": "XXI",
    "chamber": "BRSITZ",
    "session_number": 658,
    "title": "658. Sitzung (658/BRSITZ/99)",
    "citation": "658/BRSITZ/99",
    "session_detail_url": "https://www.parlament.gv.at/gegenstand/BR/BRSITZ/658",
    "protocol_pdf_url": "https://www.parlament.gv.at/dokument/BR/BRSITZ/658/fname_113657.pdf",
    "protocol_html_url": "https://www.parlament.gv.at/dokument/BR/BRSITZ/658/fnameorig_113657.html",
    "uid": "XXI_BRSITZ_658",
    "raw_path": "steno_protocols/raw_html/XXI_BRSITZ_658.html",
    "txt_path": "steno_protocols/plain_text/XXI_BRSITZ_658.txt"
  },
  {
    "session_date_display": "06.04.2000",
    "session_date_iso": "2000-04-06T00:00:00",
    "gp_code": "XXI",
    "chamber": "BRSITZ",
    "session_number": 663,
    "title": "663. Sitzung (663/BRSITZ/2000)",
    "citation": "663/BRSITZ/2000",
    "session_detail_url": "https://www.parlament.gv.at/gegenstand/BR/BRSITZ/663",
    "protocol_pdf_url": "https://www.parlament.gv.at/dokument/BR/BRSITZ/663/fname_113923.pdf",
    "protocol_html_url": "https://www.parlament.gv.at/dokument/BR/BRSITZ/663/fnameorig_113923.html",
    "uid": "XXI_BRSITZ_663",
    "raw_path": "steno_protocols/raw_html/XXI_BRSITZ_663.html",
    "txt_path": "steno_protocols/plain_text/XXI_BRSITZ_663.txt"
  },
  {
    "session_date_display": "19.11.2015",
    "session_date_iso": "2015-11-19T00:00:00",
    "gp_code": "XXV",
    "chamber": "BRSITZ",
    "session_number": 847,
    "title": "847. Sitzung (847/BRSITZ/2015)",
    "citation": "847/BRSITZ/2015",
    "session_detail_url": "https://www.parlament.gv.at/gegenstand/BR/BRSITZ/847",
    "protocol_pdf_url": "https://www.parlament.gv.at/dokument/BR/BRSITZ/847/fname_561335.pdf",
    "protocol_html_url": "https://www.parlament.gv.at/dokument/BR/BRSITZ/847/fnameorig_561335.html",
    "uid": "XXV_BRSITZ_847",
    "raw_path": "steno_protocols/raw_html/XXV_BRSITZ_847.html",
    "txt_path": "steno_protocols/plain_text/XXV_BRSITZ_847.txt"
  },
  {
    "session_date_display": "17.12.2015",
    "session_date_iso": "2015-12-17T00:00:00",
    "gp_code": "XXV",
    "chamber": "BRSITZ",
    "session_number": 849,
    "title": "849. Sitzung (849/BRSITZ/2015)",
    "citation": "849/BRSITZ/2015",
    "session_detail_url": "https://www.parlament.gv.at/gegenstand/BR/BRSITZ/849",
    "protocol_pdf_url": "https://www.parlament.gv.at/dokument/BR/BRSITZ/849/fname_540802.pdf",
    "protocol_html_url": "https://www.parlament.gv.at/dokument/BR/BRSITZ/849/fnameorig_540802.html",
    "uid": "XXV_BRSITZ_849",
    "raw_path": "steno_protocols/raw_html/XXV_BRSITZ_849.html",
    "txt_path": "steno_protocols/plain_text/XXV_BRSITZ_849.txt"
  },
  {
    "session_date_display": "29.02.1996",
    "session_date_iso": "1996-02-29T00:00:00",
    "gp_code": "XX",
    "chamber": "BRSITZ",
    "session_number": 609,
    "title": "609. Sitzung (609/BRSITZ/96)",
    "citation": "609/BRSITZ/96",
    "session_detail_url": "https://www.parlament.gv.at/gegenstand/BR/BRSITZ/609",
    "protocol_pdf_url": "https://www.parlament.gv.at/dokument/BR/BRSITZ/609/fname_113558.pdf",
    "protocol_html_url": "https://www.parlament.gv.at/dokument/BR/BRSITZ/609/fnameorig_113558.html",
    "uid": "XX_BRSITZ_609",
    "raw_path": "steno_protocols/raw_html/XX_BRSITZ_609.html",
    "txt_path": "steno_protocols/plain_text/XX_BRSITZ_609.txt"
  },
  {
    "session_date_display": "23.05.2001",
    "session_date_iso": "2001-05-23T00:00:00",
    "gp_code": "XXI",
    "chamber": "BRSITZ",
    "session_number": 677,
    "title": "677. Sitzung (677/BRSITZ/2001)",
    "citation": "677/BRSITZ/2001",
    "session_detail_url": "https://www.parlament.gv.at/gegenstand/BR/BRSITZ/677",
    "protocol_pdf_url": "https://www.parlament.gv.at/dokument/BR/BRSITZ/677/fname_113951.pdf",
    "protocol_html_url": "https://www.parlament.gv.at/dokument/BR/BRSITZ/677/fnameorig_113951.html",
    "uid": "XXI_BRSITZ_677",
    "raw_path": "steno_protocols/raw_html/XXI_BRSITZ_677.html",
    "txt_path": "steno_protocols/plain_text/XXI_BRSITZ_677.txt"
  },
  {
    "session_date_display": "10.07.2009",
    "session_date_iso": "2009-07-10T00:00:00",
    "gp_code": "XXIV",
    "chamber": "BRSITZ",
    "session_number": 773,
    "title": "773. Sitzung (773/BRSITZ/2009)",
    "citation": "773/BRSITZ/2009",
    "session_detail_url": "https://www.parlament.gv.at/gegenstand/BR/BRSITZ/773",
    "protocol_pdf_url": "https://www.parlament.gv.at/dokument/BR/BRSITZ/773/fname_170767.pdf",
    "protocol_html_url": "https://www.parlament.gv.at/dokument/BR/BRSITZ/773/fnameorig_170767.html",
    "uid": "XXIV_BRSITZ_773",
    "raw_path": "steno_protocols/raw_html/XXIV_BRSITZ_773.html",
    "txt_path": "steno_protocols/plain_text/XXIV_BRSITZ_773.txt"
  },
  {
    "session_date_display": "24.05.1996",
    "session_date_iso": "1996-05-24T00:00:00",
    "gp_code": "XX",
    "chamber": "BRSITZ",
    "session_number": 613,
    "title": "613. Sitzung (613/BRSITZ/96)",
    "citation": "613/BRSITZ/96",
    "session_detail_url": "https://www.parlament.gv.at/gegenstand/BR/BRSITZ/613",
    "protocol_pdf_url": "https://www.parlament.gv.at/dokument/BR/BRSITZ/613/fname_113567.pdf",
    "protocol_html_url": "https://www.parlament.gv.at/dokument/BR/BRSITZ/613/fnameorig_113567.html",
    "uid": "XX_BRSITZ_613",
    "raw_path": "steno_protocols/raw_html/XX_BRSITZ_613.html",
    "txt_path": "steno_protocols/plain_text/XX_BRSITZ_613.txt"
  },
  {
    "session_date_display": "08.10.2009",
    "session_date_iso": "2009-10-08T00:00:00",
    "gp_code": "XXIV",
    "chamber": "BRSITZ",
    "session_number": 776,
    "title": "776. Sitzung (776/BRSITZ/2009)",
    "citation": "776/BRSITZ/2009",
    "session_detail_url": "https://www.parlament.gv.at/gegenstand/BR/BRSITZ/776",
    "protocol_pdf_url": "https://www.parlament.gv.at/dokument/BR/BRSITZ/776/fname_177751.pdf",
    "protocol_html_url": "https://www.parlament.gv.at/dokument/BR/BRSITZ/776/fnameorig_177751.html",
    "uid": "XXIV_BRSITZ_776",
    "raw_path": "steno_protocols/raw_html/XXIV_BRSITZ_776.html",
    "txt_path": "steno_protocols/plain_text/XXIV_BRSITZ_776.txt"
  },
  {
    "session_date_display": "03.12.2009",
    "session_date_iso": "2009-12-03T00:00:00",
    "gp_code": "XXIV",
    "chamber": "BRSITZ",
    "session_number": 779,
    "title": "779. Sitzung (779/BRSITZ/2009)",
    "citation": "779/BRSITZ/2009",
    "session_detail_url": "https://www.parlament.gv.at/gegenstand/BR/BRSITZ/779",
    "protocol_pdf_url": "https://www.parlament.gv.at/dokument/BR/BRSITZ/779/fname_180003.pdf",
    "protocol_html_url": "https://www.parlament.gv.at/dokument/BR/BRSITZ/779/fnameorig_180003.html",
    "uid": "XXIV_BRSITZ_779",
    "raw_path": "steno_protocols/raw_html/XXIV_BRSITZ_779.html",
    "txt_path": "steno_protocols/plain_text/XXIV_BRSITZ_779.txt"
  },
  {
    "session_date_display": "25.07.1996",
    "session_date_iso": "1996-07-25T00:00:00",
    "gp_code": "XX",
    "chamber": "BRSITZ",
    "session_number": 616,
    "title": "616. Sitzung (616/BRSITZ/96)",
    "citation": "616/BRSITZ/96",
    "session_detail_url": "https://www.parlament.gv.at/gegenstand/BR/BRSITZ/616",
    "protocol_pdf_url": "https://www.parlament.gv.at/dokument/BR/BRSITZ/616/fname_113573.pdf",
    "protocol_html_url": "https://www.parlament.gv.at/dokument/BR/BRSITZ/616/fnameorig_113573.html",
    "uid": "XX_BRSITZ_616",
    "raw_path": "steno_protocols/raw_html/XX_BRSITZ_616.html",
    "txt_path": "steno_protocols/plain_text/XX_BRSITZ_616.txt"
  },
  {
    "session_date_display": "09.04.2010",
    "session_date_iso": "2010-04-09T00:00:00",
    "gp_code": "XXIV",
    "chamber": "BRSITZ",
    "session_number": 783,
    "title": "783. Sitzung (783/BRSITZ/2010)",
    "citation": "783/BRSITZ/2010",
    "session_detail_url": "https://www.parlament.gv.at/gegenstand/BR/BRSITZ/783",
    "protocol_pdf_url": "https://www.parlament.gv.at/dokument/BR/BRSITZ/783/fname_186902.pdf",
    "protocol_html_url": "https://www.parlament.gv.at/dokument/BR/BRSITZ/783/fnameorig_186902.html",
    "uid": "XXIV_BRSITZ_783",
    "raw_path": "steno_protocols/raw_html/XXIV_BRSITZ_783.html",
    "txt_path": "steno_protocols/plain_text/XXIV_BRSITZ_783.txt"
  },
  {
    "session_date_display": "23.12.2010",
    "session_date_iso": "2010-12-23T00:00:00",
    "gp_code": "XXIV",
    "chamber": "BRSITZ",
    "session_number": 792,
    "title": "792. Sitzung (792/BRSITZ/2010)",
    "citation": "792/BRSITZ/2010",
    "session_detail_url": "https://www.parlament.gv.at/gegenstand/BR/BRSITZ/792",
    "protocol_pdf_url": "https://www.parlament.gv.at/dokument/BR/BRSITZ/792/fname_205920.pdf",
    "protocol_html_url": "https://www.parlament.gv.at/dokument/BR/BRSITZ/792/fnameorig_205920.html",
    "uid": "XXIV_BRSITZ_792",
    "raw_path": "steno_protocols/raw_html/XXIV_BRSITZ_792.html",
    "txt_path": "steno_protocols/plain_text/XXIV_BRSITZ_792.txt"
  },
  {
    "session_date_display": "11.04.2003",
    "session_date_iso": "2003-04-11T00:00:00",
    "gp_code": "XXII",
    "chamber": "BRSITZ",
    "session_number": 695,
    "title": "695. Sitzung (695/BRSITZ/2003)",
    "citation": "695/BRSITZ/2003",
    "session_detail_url": "https://www.parlament.gv.at/gegenstand/BR/BRSITZ/695",
    "protocol_pdf_url": "https://www.parlament.gv.at/dokument/BR/BRSITZ/695/fname_113987.pdf",
    "protocol_html_url": "https://www.parlament.gv.at/dokument/BR/BRSITZ/695/fnameorig_113987.html",
    "uid": "XXII_BRSITZ_695",
    "raw_path": "steno_protocols/raw_html/XXII_BRSITZ_695.html",
    "txt_path": "steno_protocols/plain_text/XXII_BRSITZ_695.txt"
  },
  {
    "session_date_display": "06.05.1997",
    "session_date_iso": "1997-05-06T00:00:00",
    "gp_code": "XX",
    "chamber": "BRSITZ",
    "session_number": 626,
    "title": "626. Sitzung (626/BRSITZ/97)",
    "citation": "626/BRSITZ/97",
    "session_detail_url": "https://www.parlament.gv.at/gegenstand/BR/BRSITZ/626",
    "protocol_pdf_url": "https://www.parlament.gv.at/dokument/BR/BRSITZ/626/fname_113593.pdf",
    "protocol_html_url": "https://www.parlament.gv.at/dokument/BR/BRSITZ/626/fnameorig_113593.html",
    "uid": "XX_BRSITZ_626",
    "raw_path": "steno_protocols/raw_html/XX_BRSITZ_626.html",
    "txt_path": "steno_protocols/plain_text/XX_BRSITZ_626.txt"
  },
  {
    "session_date_display": "09.10.2003",
    "session_date_iso": "2003-10-09T00:00:00",
    "gp_code": "XXII",
    "chamber": "BRSITZ",
    "session_number": 701,
    "title": "701. Sitzung (701/BRSITZ/2003)",
    "citation": "701/BRSITZ/2003",
    "session_detail_url": "https://www.parlament.gv.at/gegenstand/BR/BRSITZ/701",
    "protocol_pdf_url": "https://www.parlament.gv.at/dokument/BR/BRSITZ/701/fname_010889.pdf",
    "protocol_html_url": "https://www.parlament.gv.at/dokument/BR/BRSITZ/701/fnameorig_010889.html",
    "uid": "XXII_BRSITZ_701",
    "raw_path": "steno_protocols/raw_html/XXII_BRSITZ_701.html",
    "txt_path": "steno_protocols/plain_text/XXII_BRSITZ_701.txt"
  },
  {
    "session_date_display": "02.10.1997",
    "session_date_iso": "1997-10-02T00:00:00",
    "gp_code": "XX",
    "chamber": "BRSITZ",
    "session_number": 630,
    "title": "630. Sitzung (630/BRSITZ/97)",
    "citation": "630/BRSITZ/97",
    "session_detail_url": "https://www.parlament.gv.at/gegenstand/BR/BRSITZ/630",
    "protocol_pdf_url": "https://www.parlament.gv.at/dokument/BR/BRSITZ/630/fname_113601.pdf",
    "protocol_html_url": "https://www.parlament.gv.at/dokument/BR/BRSITZ/630/fnameorig_113601.html",
    "uid": "XX_BRSITZ_630",
    "raw_path": "steno_protocols/raw_html/XX_BRSITZ_630.html",
    "txt_path": "steno_protocols/plain_text/XX_BRSITZ_630.txt"
  },
  {
    "session_date_display": "16.04.2004",
    "session_date_iso": "2004-04-16T00:00:00",
    "gp_code": "XXII",
    "chamber": "BRSITZ",
    "session_number": 707,
    "title": "707. Sitzung (707/BRSITZ/2004)",
    "citation": "707/BRSITZ/2004",
    "session_detail_url": "https://www.parlament.gv.at/gegenstand/BR/BRSITZ/707",
    "protocol_pdf_url": "https://www.parlament.gv.at/dokument/BR/BRSITZ/707/fname_020411.pdf",
    "protocol_html_url": "https://www.parlament.gv.at/dokument/BR/BRSITZ/707/fnameorig_020411.html",
    "uid": "XXII_BRSITZ_707",
    "raw_path": "steno_protocols/raw_html/XXII_BRSITZ_707.html",
    "txt_path": "steno_protocols/plain_text/XXII_BRSITZ_707.txt"
  },
  {
    "session_date_display": "17.05.2004",
    "session_date_iso": "2004-05-17T00:00:00",
    "gp_code": "XXII",
    "chamber": "BRSITZ",
    "session_number": 708,
    "title": "708. Sitzung (708/BRSITZ/2004)",
    "citation": "708/BRSITZ/2004",
    "session_detail_url": "https://www.parlament.gv.at/gegenstand/BR/BRSITZ/708",
    "protocol_pdf_url": "https://www.parlament.gv.at/dokument/BR/BRSITZ/708/fname_021613.pdf",
    "protocol_html_url": "https://www.parlament.gv.at/dokument/BR/BRSITZ/708/fnameorig_021613.html",
    "uid": "XXII_BRSITZ_708",
    "raw_path": "steno_protocols/raw_html/XXII_BRSITZ_708.html",
    "txt_path": "steno_protocols/plain_text/XXII_BRSITZ_708.txt"
  },
  {
    "session_date_display": "23.11.2009",
    "session_date_iso": "2009-11-23T00:00:00",
    "gp_code": "XXIV",
    "chamber": "BRSITZ",
    "session_number": 778,
    "title": "778. Sitzung (778/BRSITZ/2009)",
    "citation": "778/BRSITZ/2009",
    "session_detail_url": "https://www.parlament.gv.at/gegenstand/BR/BRSITZ/778",
    "protocol_pdf_url": "https://www.parlament.gv.at/dokument/BR/BRSITZ/778/fname_179597.pdf",
    "protocol_html_url": "https://www.parlament.gv.at/dokument/BR/BRSITZ/778/fnameorig_179597.html",
    "uid": "XXIV_BRSITZ_778",
    "raw_path": "steno_protocols/raw_html/XXIV_BRSITZ_778.html",
    "txt_path": "steno_protocols/plain_text/XXIV_BRSITZ_778.txt"
  },
  {
    "session_date_display": "20.12.2001",
    "session_date_iso": "2001-12-20T00:00:00",
    "gp_code": "XXI",
    "chamber": "BRSITZ",
    "session_number": 683,
    "title": "683. Sitzung (683/BRSITZ/2001)",
    "citation": "683/BRSITZ/2001",
    "session_detail_url": "https://www.parlament.gv.at/gegenstand/BR/BRSITZ/683",
    "protocol_pdf_url": "https://www.parlament.gv.at/dokument/BR/BRSITZ/683/fname_113963.pdf",
    "protocol_html_url": "https://www.parlament.gv.at/dokument/BR/BRSITZ/683/fnameorig_113963.html",
    "uid": "XXI_BRSITZ_683",
    "raw_path": "steno_protocols/raw_html/XXI_BRSITZ_683.html",
    "txt_path": "steno_protocols/plain_text/XXI_BRSITZ_683.txt"
  },
  {
    "session_date_display": "12.12.1996",
    "session_date_iso": "1996-12-12T00:00:00",
    "gp_code": "XX",
    "chamber": "BRSITZ",
    "session_number": 619,
    "title": "619. Sitzung (619/BRSITZ/96)",
    "citation": "619/BRSITZ/96",
    "session_detail_url": "https://www.parlament.gv.at/gegenstand/BR/BRSITZ/619",
    "protocol_pdf_url": "https://www.parlament.gv.at/dokument/BR/BRSITZ/619/fname_113579.pdf",
    "protocol_html_url": "https://www.parlament.gv.at/dokument/BR/BRSITZ/619/fnameorig_113579.html",
    "uid": "XX_BRSITZ_619",
    "raw_path": "steno_protocols/raw_html/XX_BRSITZ_619.html",
    "txt_path": "steno_protocols/plain_text/XX_BRSITZ_619.txt"
  },
  {
    "session_date_display": "13.03.1997",
    "session_date_iso": "1997-03-13T00:00:00",
    "gp_code": "XX",
    "chamber": "BRSITZ",
    "session_number": 623,
    "title": "623. Sitzung (623/BRSITZ/97)",
    "citation": "623/BRSITZ/97",
    "session_detail_url": "https://www.parlament.gv.at/gegenstand/BR/BRSITZ/623",
    "protocol_pdf_url": "https://www.parlament.gv.at/dokument/BR/BRSITZ/623/fname_113587.pdf",
    "protocol_html_url": "https://www.parlament.gv.at/dokument/BR/BRSITZ/623/fnameorig_113587.html",
    "uid": "XX_BRSITZ_623",
    "raw_path": "steno_protocols/raw_html/XX_BRSITZ_623.html",
    "txt_path": "steno_protocols/plain_text/XX_BRSITZ_623.txt"
  },
  {
    "session_date_display": "12.05.2011",
    "session_date_iso": "2011-05-12T00:00:00",
    "gp_code": "XXIV",
    "chamber": "BRSITZ",
    "session_number": 796,
    "title": "796. Sitzung (796/BRSITZ/2011)",
    "citation": "796/BRSITZ/2011",
    "session_detail_url": "https://www.parlament.gv.at/gegenstand/BR/BRSITZ/796",
    "protocol_pdf_url": "https://www.parlament.gv.at/dokument/BR/BRSITZ/796/fname_222217.pdf",
    "protocol_html_url": "https://www.parlament.gv.at/dokument/BR/BRSITZ/796/fnameorig_222217.html",
    "uid": "XXIV_BRSITZ_796",
    "raw_path": "steno_protocols/raw_html/XXIV_BRSITZ_796.html",
    "txt_path": "steno_protocols/plain_text/XXIV_BRSITZ_796.txt"
  },
  {
    "session_date_display": "06.11.2003",
    "session_date_iso": "2003-11-06T00:00:00",
    "gp_code": "XXII",
    "chamber": "BRSITZ",
    "session_number": 702,
    "title": "702. Sitzung (702/BRSITZ/2003)",
    "citation": "702/BRSITZ/2003",
    "session_detail_url": "https://www.parlament.gv.at/gegenstand/BR/BRSITZ/702",
    "protocol_pdf_url": "https://www.parlament.gv.at/dokument/BR/BRSITZ/702/fname_012851.pdf",
    "protocol_html_url": "https://www.parlament.gv.at/dokument/BR/BRSITZ/702/fnameorig_012851.html",
    "uid": "XXII_BRSITZ_702",
    "raw_path": "steno_protocols/raw_html/XXII_BRSITZ_702.html",
    "txt_path": "steno_protocols/plain_text/XXII_BRSITZ_702.txt"
  },
  {
    "session_date_display": "01.06.2011",
    "session_date_iso": "2011-06-01T00:00:00",
    "gp_code": "XXIV",
    "chamber": "BRSITZ",
    "session_number": 797,
    "title": "797. Sitzung (797/BRSITZ/2011)",
    "citation": "797/BRSITZ/2011",
    "session_detail_url": "https://www.parlament.gv.at/gegenstand/BR/BRSITZ/797",
    "protocol_pdf_url": "https://www.parlament.gv.at/dokument/BR/BRSITZ/797/fname_226191.pdf",
    "protocol_html_url": "https://www.parlament.gv.at/dokument/BR/BRSITZ/797/fnameorig_226191.html",
    "uid": "XXIV_BRSITZ_797",
    "raw_path": "steno_protocols/raw_html/XXIV_BRSITZ_797.html",
    "txt_path": "steno_protocols/plain_text/XXIV_BRSITZ_797.txt"
  },
  {
    "session_date_display": "11.03.2004",
    "session_date_iso": "2004-03-11T00:00:00",
    "gp_code": "XXII",
    "chamber": "BRSITZ",
    "session_number": 706,
    "title": "706. Sitzung (706/BRSITZ/2004)",
    "citation": "706/BRSITZ/2004",
    "session_detail_url": "https://www.parlament.gv.at/gegenstand/BR/BRSITZ/706",
    "protocol_pdf_url": "https://www.parlament.gv.at/dokument/BR/BRSITZ/706/fname_019261.pdf",
    "protocol_html_url": "https://www.parlament.gv.at/dokument/BR/BRSITZ/706/fnameorig_019261.html",
    "uid": "XXII_BRSITZ_706",
    "raw_path": "steno_protocols/raw_html/XXII_BRSITZ_706.html",
    "txt_path": "steno_protocols/plain_text/XXII_BRSITZ_706.txt"
  },
  {
    "session_date_display": "13.04.2012",
    "session_date_iso": "2012-04-13T00:00:00",
    "gp_code": "XXIV",
    "chamber": "BRSITZ",
    "session_number": 807,
    "title": "807. Sitzung (807/BRSITZ/2012)",
    "citation": "807/BRSITZ/2012",
    "session_detail_url": "https://www.parlament.gv.at/gegenstand/BR/BRSITZ/807",
    "protocol_pdf_url": "https://www.parlament.gv.at/dokument/BR/BRSITZ/807/fname_260778.pdf",
    "protocol_html_url": "https://www.parlament.gv.at/dokument/BR/BRSITZ/807/fnameorig_260778.html",
    "uid": "XXIV_BRSITZ_807",
    "raw_path": "steno_protocols/raw_html/XXIV_BRSITZ_807.html",
    "txt_path": "steno_protocols/plain_text/XXIV_BRSITZ_807.txt"
  },
  {
    "session_date_display": "20.12.2022",
    "session_date_iso": "2022-12-20T00:00:00",
    "gp_code": "XXVII",
    "chamber": "BRSITZ",
    "session_number": 948,
    "title": "948. Sitzung (948/BRSITZ/2022)",
    "citation": "948/BRSITZ/2022",
    "session_detail_url": "https://www.parlament.gv.at/gegenstand/BR/BRSITZ/948",
    "protocol_pdf_url": "https://www.parlament.gv.at/dokument/BR/BRSITZ/948/fname_1597235.pdf",
    "protocol_html_url": "https://www.parlament.gv.at/dokument/BR/BRSITZ/948/fnameorig_1597235.html",
    "uid": "XXVII_BRSITZ_948",
    "raw_path": "steno_protocols/raw_html/XXVII_BRSITZ_948.html",
    "txt_path": "steno_protocols/plain_text/XXVII_BRSITZ_948.txt"
  },
  {
    "session_date_display": "19.03.1996",
    "session_date_iso": "1996-03-19T00:00:00",
    "gp_code": "XX",
    "chamber": "BRSITZ",
    "session_number": 610,
    "title": "610. Sitzung (610/BRSITZ/96)",
    "citation": "610/BRSITZ/96",
    "session_detail_url": "https://www.parlament.gv.at/gegenstand/BR/BRSITZ/610",
    "protocol_pdf_url": "https://www.parlament.gv.at/dokument/BR/BRSITZ/610/fname_113561.pdf",
    "protocol_html_url": "https://www.parlament.gv.at/dokument/BR/BRSITZ/610/fnameorig_113561.html",
    "uid": "XX_BRSITZ_610",
    "raw_path": "steno_protocols/raw_html/XX_BRSITZ_610.html",
    "txt_path": "steno_protocols/plain_text/XX_BRSITZ_610.txt"
  },
  {
    "session_date_display": "26.03.1996",
    "session_date_iso": "1996-03-26T00:00:00",
    "gp_code": "XX",
    "chamber": "BRSITZ",
    "session_number": 611,
    "title": "611. Sitzung (611/BRSITZ/96)",
    "citation": "611/BRSITZ/96",
    "session_detail_url": "https://www.parlament.gv.at/gegenstand/BR/BRSITZ/611",
    "protocol_pdf_url": "https://www.parlament.gv.at/dokument/BR/BRSITZ/611/fname_113563.pdf",
    "protocol_html_url": "https://www.parlament.gv.at/dokument/BR/BRSITZ/611/fnameorig_113563.html",
    "uid": "XX_BRSITZ_611",
    "raw_path": "steno_protocols/raw_html/XX_BRSITZ_611.html",
    "txt_path": "steno_protocols/plain_text/XX_BRSITZ_611.txt"
  },
  {
    "session_date_display": "06.06.2002",
    "session_date_iso": "2002-06-06T00:00:00",
    "gp_code": "XXI",
    "chamber": "BRSITZ",
    "session_number": 688,
    "title": "688. Sitzung (688/BRSITZ/2002)",
    "citation": "688/BRSITZ/2002",
    "session_detail_url": "https://www.parlament.gv.at/gegenstand/BR/BRSITZ/688",
    "protocol_pdf_url": "https://www.parlament.gv.at/dokument/BR/BRSITZ/688/fname_113973.pdf",
    "protocol_html_url": "https://www.parlament.gv.at/dokument/BR/BRSITZ/688/fnameorig_113973.html",
    "uid": "XXI_BRSITZ_688",
    "raw_path": "steno_protocols/raw_html/XXI_BRSITZ_688.html",
    "txt_path": "steno_protocols/plain_text/XXI_BRSITZ_688.txt"
  },
  {
    "session_date_display": "15.05.2003",
    "session_date_iso": "2003-05-15T00:00:00",
    "gp_code": "XXII",
    "chamber": "BRSITZ",
    "session_number": 696,
    "title": "696. Sitzung (696/BRSITZ/2003)",
    "citation": "696/BRSITZ/2003",
    "session_detail_url": "https://www.parlament.gv.at/gegenstand/BR/BRSITZ/696",
    "protocol_pdf_url": "https://www.parlament.gv.at/dokument/BR/BRSITZ/696/fname_113989.pdf",
    "protocol_html_url": "https://www.parlament.gv.at/dokument/BR/BRSITZ/696/fnameorig_113989.html",
    "uid": "XXII_BRSITZ_696",
    "raw_path": "steno_protocols/raw_html/XXII_BRSITZ_696.html",
    "txt_path": "steno_protocols/plain_text/XXII_BRSITZ_696.txt"
  },
  {
    "session_date_display": "26.06.1997",
    "session_date_iso": "1997-06-26T00:00:00",
    "gp_code": "XX",
    "chamber": "BRSITZ",
    "session_number": 628,
    "title": "628. Sitzung (628/BRSITZ/97)",
    "citation": "628/BRSITZ/97",
    "session_detail_url": "https://www.parlament.gv.at/gegenstand/BR/BRSITZ/628",
    "protocol_pdf_url": "https://www.parlament.gv.at/dokument/BR/BRSITZ/628/fname_113597.pdf",
    "protocol_html_url": "https://www.parlament.gv.at/dokument/BR/BRSITZ/628/fnameorig_113597.html",
    "uid": "XX_BRSITZ_628",
    "raw_path": "steno_protocols/raw_html/XX_BRSITZ_628.html",
    "txt_path": "steno_protocols/plain_text/XX_BRSITZ_628.txt"
  },
  {
    "session_date_display": "06.10.2011",
    "session_date_iso": "2011-10-06T00:00:00",
    "gp_code": "XXIV",
    "chamber": "BRSITZ",
    "session_number": 800,
    "title": "800. Sitzung (800/BRSITZ/2011)",
    "citation": "800/BRSITZ/2011",
    "session_detail_url": "https://www.parlament.gv.at/gegenstand/BR/BRSITZ/800",
    "protocol_pdf_url": "https://www.parlament.gv.at/dokument/BR/BRSITZ/800/fname_233611.pdf",
    "protocol_html_url": "https://www.parlament.gv.at/dokument/BR/BRSITZ/800/fnameorig_233611.html",
    "uid": "XXIV_BRSITZ_800",
    "raw_path": "steno_protocols/raw_html/XXIV_BRSITZ_800.html",
    "txt_path": "steno_protocols/plain_text/XXIV_BRSITZ_800.txt"
  },
  {
    "session_date_display": "23.10.1997",
    "session_date_iso": "1997-10-23T00:00:00",
    "gp_code": "XX",
    "chamber": "BRSITZ",
    "session_number": 631,
    "title": "631. Sitzung (631/BRSITZ/97)",
    "citation": "631/BRSITZ/97",
    "session_detail_url": "https://www.parlament.gv.at/gegenstand/BR/BRSITZ/631",
    "protocol_pdf_url": "https://www.parlament.gv.at/dokument/BR/BRSITZ/631/fname_113603.pdf",
    "protocol_html_url": "https://www.parlament.gv.at/dokument/BR/BRSITZ/631/fnameorig_113603.html",
    "uid": "XX_BRSITZ_631",
    "raw_path": "steno_protocols/raw_html/XX_BRSITZ_631.html",
    "txt_path": "steno_protocols/plain_text/XX_BRSITZ_631.txt"
  },
  {
    "session_date_display": "18.12.2003",
    "session_date_iso": "2003-12-18T00:00:00",
    "gp_code": "XXII",
    "chamber": "BRSITZ",
    "session_number": 704,
    "title": "704. Sitzung (704/BRSITZ/2003)",
    "citation": "704/BRSITZ/2003",
    "session_detail_url": "https://www.parlament.gv.at/gegenstand/BR/BRSITZ/704",
    "protocol_pdf_url": "https://www.parlament.gv.at/dokument/BR/BRSITZ/704/fname_014530.pdf",
    "protocol_html_url": "https://www.parlament.gv.at/dokument/BR/BRSITZ/704/fnameorig_014530.html",
    "uid": "XXII_BRSITZ_704",
    "raw_path": "steno_protocols/raw_html/XXII_BRSITZ_704.html",
    "txt_path": "steno_protocols/plain_text/XXII_BRSITZ_704.txt"
  },
  {
    "session_date_display": "07.10.2004",
    "session_date_iso": "2004-10-07T00:00:00",
    "gp_code": "XXII",
    "chamber": "BRSITZ",
    "session_number": 713,
    "title": "713. Sitzung (713/BRSITZ/2004)",
    "citation": "713/BRSITZ/2004",
    "session_detail_url": "https://www.parlament.gv.at/gegenstand/BR/BRSITZ/713",
    "protocol_pdf_url": "https://www.parlament.gv.at/dokument/BR/BRSITZ/713/fname_029479.pdf",
    "protocol_html_url": "https://www.parlament.gv.at/dokument/BR/BRSITZ/713/fnameorig_029479.html",
    "uid": "XXII_BRSITZ_713",
    "raw_path": "steno_protocols/raw_html/XXII_BRSITZ_713.html",
    "txt_path": "steno_protocols/plain_text/XXII_BRSITZ_713.txt"
  },
  {
    "session_date_display": "30.03.2012",
    "session_date_iso": "2012-03-30T00:00:00",
    "gp_code": "XXIV",
    "chamber": "BRSITZ",
    "session_number": 806,
    "title": "806. Sitzung (806/BRSITZ/2012)",
    "citation": "806/BRSITZ/2012",
    "session_detail_url": "https://www.parlament.gv.at/gegenstand/BR/BRSITZ/806",
    "protocol_pdf_url": "https://www.parlament.gv.at/dokument/BR/BRSITZ/806/fname_256180.pdf",
    "protocol_html_url": "https://www.parlament.gv.at/dokument/BR/BRSITZ/806/fnameorig_256180.html",
    "uid": "XXIV_BRSITZ_806",
    "raw_path": "steno_protocols/raw_html/XXIV_BRSITZ_806.html",
    "txt_path": "steno_protocols/plain_text/XXIV_BRSITZ_806.txt"
  },
  {
    "session_date_display": "11.10.2001",
    "session_date_iso": "2001-10-11T00:00:00",
    "gp_code": "XXI",
    "chamber": "BRSITZ",
    "session_number": 680,
    "title": "680. Sitzung (680/BRSITZ/2001)",
    "citation": "680/BRSITZ/2001",
    "session_detail_url": "https://www.parlament.gv.at/gegenstand/BR/BRSITZ/680",
    "protocol_pdf_url": "https://www.parlament.gv.at/dokument/BR/BRSITZ/680/fname_113957.pdf",
    "protocol_html_url": "https://www.parlament.gv.at/dokument/BR/BRSITZ/680/fnameorig_113957.html",
    "uid": "XXI_BRSITZ_680",
    "raw_path": "steno_protocols/raw_html/XXI_BRSITZ_680.html",
    "txt_path": "steno_protocols/plain_text/XXI_BRSITZ_680.txt"
  },
  {
    "session_date_display": "03.05.2002",
    "session_date_iso": "2002-05-03T00:00:00",
    "gp_code": "XXI",
    "chamber": "BRSITZ",
    "session_number": 687,
    "title": "687. Sitzung (687/BRSITZ/2002)",
    "citation": "687/BRSITZ/2002",
    "session_detail_url": "https://www.parlament.gv.at/gegenstand/BR/BRSITZ/687",
    "protocol_pdf_url": "https://www.parlament.gv.at/dokument/BR/BRSITZ/687/fname_113971.pdf",
    "protocol_html_url": "https://www.parlament.gv.at/dokument/BR/BRSITZ/687/fnameorig_113971.html",
    "uid": "XXI_BRSITZ_687",
    "raw_path": "steno_protocols/raw_html/XXI_BRSITZ_687.html",
    "txt_path": "steno_protocols/plain_text/XXI_BRSITZ_687.txt"
  },
  {
    "session_date_display": "19.12.1996",
    "session_date_iso": "1996-12-19T00:00:00",
    "gp_code": "XX",
    "chamber": "BRSITZ",
    "session_number": 620,
    "title": "620. Sitzung (620/BRSITZ/96)",
    "citation": "620/BRSITZ/96",
    "session_detail_url": "https://www.parlament.gv.at/gegenstand/BR/BRSITZ/620",
    "protocol_pdf_url": "https://www.parlament.gv.at/dokument/BR/BRSITZ/620/fname_113581.pdf",
    "protocol_html_url": "https://www.parlament.gv.at/dokument/BR/BRSITZ/620/fnameorig_113581.html",
    "uid": "XX_BRSITZ_620",
    "raw_path": "steno_protocols/raw_html/XX_BRSITZ_620.html",
    "txt_path": "steno_protocols/plain_text/XX_BRSITZ_620.txt"
  },
  {
    "session_date_display": "22.07.2010",
    "session_date_iso": "2010-07-22T00:00:00",
    "gp_code": "XXIV",
    "chamber": "BRSITZ",
    "session_number": 787,
    "title": "787. Sitzung (787/BRSITZ/2010)",
    "citation": "787/BRSITZ/2010",
    "session_detail_url": "https://www.parlament.gv.at/gegenstand/BR/BRSITZ/787",
    "protocol_pdf_url": "https://www.parlament.gv.at/dokument/BR/BRSITZ/787/fname_195847.pdf",
    "protocol_html_url": "https://www.parlament.gv.at/dokument/BR/BRSITZ/787/fnameorig_195847.html",
    "uid": "XXIV_BRSITZ_787",
    "raw_path": "steno_protocols/raw_html/XXIV_BRSITZ_787.html",
    "txt_path": "steno_protocols/plain_text/XXIV_BRSITZ_787.txt"
  },
  {
    "session_date_display": "03.02.2011",
    "session_date_iso": "2011-02-03T00:00:00",
    "gp_code": "XXIV",
    "chamber": "BRSITZ",
    "session_number": 793,
    "title": "793. Sitzung (793/BRSITZ/2011)",
    "citation": "793/BRSITZ/2011",
    "session_detail_url": "https://www.parlament.gv.at/gegenstand/BR/BRSITZ/793",
    "protocol_pdf_url": "https://www.parlament.gv.at/dokument/BR/BRSITZ/793/fname_208982.pdf",
    "protocol_html_url": "https://www.parlament.gv.at/dokument/BR/BRSITZ/793/fnameorig_208982.html",
    "uid": "XXIV_BRSITZ_793",
    "raw_path": "steno_protocols/raw_html/XXIV_BRSITZ_793.html",
    "txt_path": "steno_protocols/plain_text/XXIV_BRSITZ_793.txt"
  },
  {
    "session_date_display": "24.07.1997",
    "session_date_iso": "1997-07-24T00:00:00",
    "gp_code": "XX",
    "chamber": "BRSITZ",
    "session_number": 629,
    "title": "629. Sitzung (629/BRSITZ/97)",
    "citation": "629/BRSITZ/97",
    "session_detail_url": "https://www.parlament.gv.at/gegenstand/BR/BRSITZ/629",
    "protocol_pdf_url": "https://www.parlament.gv.at/dokument/BR/BRSITZ/629/fname_113599.pdf",
    "protocol_html_url": "https://www.parlament.gv.at/dokument/BR/BRSITZ/629/fnameorig_113599.html",
    "uid": "XX_BRSITZ_629",
    "raw_path": "steno_protocols/raw_html/XX_BRSITZ_629.html",
    "txt_path": "steno_protocols/plain_text/XX_BRSITZ_629.txt"
  },
  {
    "session_date_display": "21.07.2011",
    "session_date_iso": "2011-07-21T00:00:00",
    "gp_code": "XXIV",
    "chamber": "BRSITZ",
    "session_number": 799,
    "title": "799. Sitzung (799/BRSITZ/2011)",
    "citation": "799/BRSITZ/2011",
    "session_detail_url": "https://www.parlament.gv.at/gegenstand/BR/BRSITZ/799",
    "protocol_pdf_url": "https://www.parlament.gv.at/dokument/BR/BRSITZ/799/fname_231330.pdf",
    "protocol_html_url": "https://www.parlament.gv.at/dokument/BR/BRSITZ/799/fnameorig_231330.html",
    "uid": "XXIV_BRSITZ_799",
    "raw_path": "steno_protocols/raw_html/XXIV_BRSITZ_799.html",
    "txt_path": "steno_protocols/plain_text/XXIV_BRSITZ_799.txt"
  },
  {
    "session_date_display": "27.11.2003",
    "session_date_iso": "2003-11-27T00:00:00",
    "gp_code": "XXII",
    "chamber": "BRSITZ",
    "session_number": 703,
    "title": "703. Sitzung (703/BRSITZ/2003)",
    "citation": "703/BRSITZ/2003",
    "session_detail_url": "https://www.parlament.gv.at/gegenstand/BR/BRSITZ/703",
    "protocol_pdf_url": "https://www.parlament.gv.at/dokument/BR/BRSITZ/703/fname_014528.pdf",
    "protocol_html_url": "https://www.parlament.gv.at/dokument/BR/BRSITZ/703/fnameorig_014528.html",
    "uid": "XXII_BRSITZ_703",
    "raw_path": "steno_protocols/raw_html/XXII_BRSITZ_703.html",
    "txt_path": "steno_protocols/plain_text/XXII_BRSITZ_703.txt"
  },
  {
    "session_date_display": "04.11.2011",
    "session_date_iso": "2011-11-04T00:00:00",
    "gp_code": "XXIV",
    "chamber": "BRSITZ",
    "session_number": 801,
    "title": "801. Sitzung (801/BRSITZ/2011)",
    "citation": "801/BRSITZ/2011",
    "session_detail_url": "https://www.parlament.gv.at/gegenstand/BR/BRSITZ/801",
    "protocol_pdf_url": "https://www.parlament.gv.at/dokument/BR/BRSITZ/801/fname_239034.pdf",
    "protocol_html_url": "https://www.parlament.gv.at/dokument/BR/BRSITZ/801/fnameorig_239034.html",
    "uid": "XXIV_BRSITZ_801",
    "raw_path": "steno_protocols/raw_html/XXIV_BRSITZ_801.html",
    "txt_path": "steno_protocols/plain_text/XXIV_BRSITZ_801.txt"
  },
  {
    "session_date_display": "02.02.2012",
    "session_date_iso": "2012-02-02T00:00:00",
    "gp_code": "XXIV",
    "chamber": "BRSITZ",
    "session_number": 804,
    "title": "804. Sitzung (804/BRSITZ/2012)",
    "citation": "804/BRSITZ/2012",
    "session_detail_url": "https://www.parlament.gv.at/gegenstand/BR/BRSITZ/804",
    "protocol_pdf_url": "https://www.parlament.gv.at/dokument/BR/BRSITZ/804/fname_246495.pdf",
    "protocol_html_url": "https://www.parlament.gv.at/dokument/BR/BRSITZ/804/fnameorig_246495.html",
    "uid": "XXIV_BRSITZ_804",
    "raw_path": "steno_protocols/raw_html/XXIV_BRSITZ_804.html",
    "txt_path": "steno_protocols/plain_text/XXIV_BRSITZ_804.txt"
  },
  {
    "session_date_display": "15.01.1998",
    "session_date_iso": "1998-01-15T00:00:00",
    "gp_code": "XX",
    "chamber": "BRSITZ",
    "session_number": 635,
    "title": "635. Sitzung (635/BRSITZ/98)",
    "citation": "635/BRSITZ/98",
    "session_detail_url": "https://www.parlament.gv.at/gegenstand/BR/BRSITZ/635",
    "protocol_pdf_url": "https://www.parlament.gv.at/dokument/BR/BRSITZ/635/fname_113611.pdf",
    "protocol_html_url": "https://www.parlament.gv.at/dokument/BR/BRSITZ/635/fnameorig_113611.html",
    "uid": "XX_BRSITZ_635",
    "raw_path": "steno_protocols/raw_html/XX_BRSITZ_635.html",
    "txt_path": "steno_protocols/plain_text/XX_BRSITZ_635.txt"
  },
  {
    "session_date_display": "12.03.1998",
    "session_date_iso": "1998-03-12T00:00:00",
    "gp_code": "XX",
    "chamber": "BRSITZ",
    "session_number": 637,
    "title": "637. Sitzung (637/BRSITZ/98)",
    "citation": "637/BRSITZ/98",
    "session_detail_url": "https://www.parlament.gv.at/gegenstand/BR/BRSITZ/637",
    "protocol_pdf_url": "https://www.parlament.gv.at/dokument/BR/BRSITZ/637/fname_113615.pdf",
    "protocol_html_url": "https://www.parlament.gv.at/dokument/BR/BRSITZ/637/fnameorig_113615.html",
    "uid": "XX_BRSITZ_637",
    "raw_path": "steno_protocols/raw_html/XX_BRSITZ_637.html",
    "txt_path": "steno_protocols/plain_text/XX_BRSITZ_637.txt"
  },
  {
    "session_date_display": "25.06.1996",
    "session_date_iso": "1996-06-25T00:00:00",
    "gp_code": "XX",
    "chamber": "BRSITZ",
    "session_number": 614,
    "title": "614. Sitzung (614/BRSITZ/96)",
    "citation": "614/BRSITZ/96",
    "session_detail_url": "https://www.parlament.gv.at/gegenstand/BR/BRSITZ/614",
    "protocol_pdf_url": "https://www.parlament.gv.at/dokument/BR/BRSITZ/614/fname_113569.pdf",
    "protocol_html_url": "https://www.parlament.gv.at/dokument/BR/BRSITZ/614/fnameorig_113569.html",
    "uid": "XX_BRSITZ_614",
    "raw_path": "steno_protocols/raw_html/XX_BRSITZ_614.html",
    "txt_path": "steno_protocols/plain_text/XX_BRSITZ_614.txt"
  },
  {
    "session_date_display": "17.10.1996",
    "session_date_iso": "1996-10-17T00:00:00",
    "gp_code": "XX",
    "chamber": "BRSITZ",
    "session_number": 617,
    "title": "617. Sitzung (617/BRSITZ/96)",
    "citation": "617/BRSITZ/96",
    "session_detail_url": "https://www.parlament.gv.at/gegenstand/BR/BRSITZ/617",
    "protocol_pdf_url": "https://www.parlament.gv.at/dokument/BR/BRSITZ/617/fname_113575.pdf",
    "protocol_html_url": "https://www.parlament.gv.at/dokument/BR/BRSITZ/617/fnameorig_113575.html",
    "uid": "XX_BRSITZ_617",
    "raw_path": "steno_protocols/raw_html/XX_BRSITZ_617.html",
    "txt_path": "steno_protocols/plain_text/XX_BRSITZ_617.txt"
  },
  {
    "session_date_display": "21.02.2002",
    "session_date_iso": "2002-02-21T00:00:00",
    "gp_code": "XXI",
    "chamber": "BRSITZ",
    "session_number": 684,
    "title": "684. Sitzung (684/BRSITZ/2002)",
    "citation": "684/BRSITZ/2002",
    "session_detail_url": "https://www.parlament.gv.at/gegenstand/BR/BRSITZ/684",
    "protocol_pdf_url": "https://www.parlament.gv.at/dokument/BR/BRSITZ/684/fname_113965.pdf",
    "protocol_html_url": "https://www.parlament.gv.at/dokument/BR/BRSITZ/684/fnameorig_113965.html",
    "uid": "XXI_BRSITZ_684",
    "raw_path": "steno_protocols/raw_html/XXI_BRSITZ_684.html",
    "txt_path": "steno_protocols/plain_text/XXI_BRSITZ_684.txt"
  },
  {
    "session_date_display": "14.11.1996",
    "session_date_iso": "1996-11-14T00:00:00",
    "gp_code": "XX",
    "chamber": "BRSITZ",
    "session_number": 618,
    "title": "618. Sitzung (618/BRSITZ/96)",
    "citation": "618/BRSITZ/96",
    "session_detail_url": "https://www.parlament.gv.at/gegenstand/BR/BRSITZ/618",
    "protocol_pdf_url": "https://www.parlament.gv.at/dokument/BR/BRSITZ/618/fname_113577.pdf",
    "protocol_html_url": "https://www.parlament.gv.at/dokument/BR/BRSITZ/618/fnameorig_113577.html",
    "uid": "XX_BRSITZ_618",
    "raw_path": "steno_protocols/raw_html/XX_BRSITZ_618.html",
    "txt_path": "steno_protocols/plain_text/XX_BRSITZ_618.txt"
  },
  {
    "session_date_display": "17.12.2002",
    "session_date_iso": "2002-12-17T00:00:00",
    "gp_code": "XXI",
    "chamber": "BRSITZ",
    "session_number": 692,
    "title": "692. Sitzung (692/BRSITZ/2002)",
    "citation": "692/BRSITZ/2002",
    "session_detail_url": "https://www.parlament.gv.at/gegenstand/BR/BRSITZ/692",
    "protocol_pdf_url": "https://www.parlament.gv.at/dokument/BR/BRSITZ/692/fname_113981.pdf",
    "protocol_html_url": "https://www.parlament.gv.at/dokument/BR/BRSITZ/692/fnameorig_113981.html",
    "uid": "XXI_BRSITZ_692",
    "raw_path": "steno_protocols/raw_html/XXI_BRSITZ_692.html",
    "txt_path": "steno_protocols/plain_text/XXI_BRSITZ_692.txt"
  },
  {
    "session_date_display": "02.12.2010",
    "session_date_iso": "2010-12-02T00:00:00",
    "gp_code": "XXIV",
    "chamber": "BRSITZ",
    "session_number": 790,
    "title": "790. Sitzung (790/BRSITZ/2010)",
    "citation": "790/BRSITZ/2010",
    "session_detail_url": "https://www.parlament.gv.at/gegenstand/BR/BRSITZ/790",
    "protocol_pdf_url": "https://www.parlament.gv.at/dokument/BR/BRSITZ/790/fname_204180.pdf",
    "protocol_html_url": "https://www.parlament.gv.at/dokument/BR/BRSITZ/790/fnameorig_204180.html",
    "uid": "XXIV_BRSITZ_790",
    "raw_path": "steno_protocols/raw_html/XXIV_BRSITZ_790.html",
    "txt_path": "steno_protocols/plain_text/XXIV_BRSITZ_790.txt"
  },
  {
    "session_date_display": "30.06.2011",
    "session_date_iso": "2011-06-30T00:00:00",
    "gp_code": "XXIV",
    "chamber": "BRSITZ",
    "session_number": 798,
    "title": "798. Sitzung (798/BRSITZ/2011)",
    "citation": "798/BRSITZ/2011",
    "session_detail_url": "https://www.parlament.gv.at/gegenstand/BR/BRSITZ/798",
    "protocol_pdf_url": "https://www.parlament.gv.at/dokument/BR/BRSITZ/798/fname_229793.pdf",
    "protocol_html_url": "https://www.parlament.gv.at/dokument/BR/BRSITZ/798/fnameorig_229793.html",
    "uid": "XXIV_BRSITZ_798",
    "raw_path": "steno_protocols/raw_html/XXIV_BRSITZ_798.html",
    "txt_path": "steno_protocols/plain_text/XXIV_BRSITZ_798.txt"
  },
  {
    "session_date_display": "20.11.1997",
    "session_date_iso": "1997-11-20T00:00:00",
    "gp_code": "XX",
    "chamber": "BRSITZ",
    "session_number": 632,
    "title": "632. Sitzung (632/BRSITZ/97)",
    "citation": "632/BRSITZ/97",
    "session_detail_url": "https://www.parlament.gv.at/gegenstand/BR/BRSITZ/632",
    "protocol_pdf_url": "https://www.parlament.gv.at/dokument/BR/BRSITZ/632/fname_113605.pdf",
    "protocol_html_url": "https://www.parlament.gv.at/dokument/BR/BRSITZ/632/fnameorig_113605.html",
    "uid": "XX_BRSITZ_632",
    "raw_path": "steno_protocols/raw_html/XX_BRSITZ_632.html",
    "txt_path": "steno_protocols/plain_text/XX_BRSITZ_632.txt"
  },
  {
    "session_date_display": "01.12.2011",
    "session_date_iso": "2011-12-01T00:00:00",
    "gp_code": "XXIV",
    "chamber": "BRSITZ",
    "session_number": 802,
    "title": "802. Sitzung (802/BRSITZ/2011)",
    "citation": "802/BRSITZ/2011",
    "session_detail_url": "https://www.parlament.gv.at/gegenstand/BR/BRSITZ/802",
    "protocol_pdf_url": "https://www.parlament.gv.at/dokument/BR/BRSITZ/802/fname_243221.pdf",
    "protocol_html_url": "https://www.parlament.gv.at/dokument/BR/BRSITZ/802/fnameorig_243221.html",
    "uid": "XXIV_BRSITZ_802",
    "raw_path": "steno_protocols/raw_html/XXIV_BRSITZ_802.html",
    "txt_path": "steno_protocols/plain_text/XXIV_BRSITZ_802.txt"
  },
  {
    "session_date_display": "18.12.1997",
    "session_date_iso": "1997-12-18T00:00:00",
    "gp_code": "XX",
    "chamber": "BRSITZ",
    "session_number": 634,
    "title": "634. Sitzung (634/BRSITZ/97)",
    "citation": "634/BRSITZ/97",
    "session_detail_url": "https://www.parlament.gv.at/gegenstand/BR/BRSITZ/634",
    "protocol_pdf_url": "https://www.parlament.gv.at/dokument/BR/BRSITZ/634/fname_113609.pdf",
    "protocol_html_url": "https://www.parlament.gv.at/dokument/BR/BRSITZ/634/fnameorig_113609.html",
    "uid": "XX_BRSITZ_634",
    "raw_path": "steno_protocols/raw_html/XX_BRSITZ_634.html",
    "txt_path": "steno_protocols/plain_text/XX_BRSITZ_634.txt"
  },
  {
    "session_date_display": "12.02.1998",
    "session_date_iso": "1998-02-12T00:00:00",
    "gp_code": "XX",
    "chamber": "BRSITZ",
    "session_number": 636,
    "title": "636. Sitzung (636/BRSITZ/98)",
    "citation": "636/BRSITZ/98",
    "session_detail_url": "https://www.parlament.gv.at/gegenstand/BR/BRSITZ/636",
    "protocol_pdf_url": "https://www.parlament.gv.at/dokument/BR/BRSITZ/636/fname_113613.pdf",
    "protocol_html_url": "https://www.parlament.gv.at/dokument/BR/BRSITZ/636/fnameorig_113613.html",
    "uid": "XX_BRSITZ_636",
    "raw_path": "steno_protocols/raw_html/XX_BRSITZ_636.html",
    "txt_path": "steno_protocols/plain_text/XX_BRSITZ_636.txt"
  },
  {
    "session_date_display": "09.06.2004",
    "session_date_iso": "2004-06-09T00:00:00",
    "gp_code": "XXII",
    "chamber": "BRSITZ",
    "session_number": 710,
    "title": "710. Sitzung (710/BRSITZ/2004)",
    "citation": "710/BRSITZ/2004",
    "session_detail_url": "https://www.parlament.gv.at/gegenstand/BR/BRSITZ/710",
    "protocol_pdf_url": "https://www.parlament.gv.at/dokument/BR/BRSITZ/710/fname_024903.pdf",
    "protocol_html_url": "https://www.parlament.gv.at/dokument/BR/BRSITZ/710/fnameorig_024903.html",
    "uid": "XXII_BRSITZ_710",
    "raw_path": "steno_protocols/raw_html/XXII_BRSITZ_710.html",
    "txt_path": "steno_protocols/plain_text/XXII_BRSITZ_710.txt"
  },
  {
    "session_date_display": "15.03.2012",
    "session_date_iso": "2012-03-15T00:00:00",
    "gp_code": "XXIV",
    "chamber": "BRSITZ",
    "session_number": 805,
    "title": "805. Sitzung (805/BRSITZ/2012)",
    "citation": "805/BRSITZ/2012",
    "session_detail_url": "https://www.parlament.gv.at/gegenstand/BR/BRSITZ/805",
    "protocol_pdf_url": "https://www.parlament.gv.at/dokument/BR/BRSITZ/805/fname_251951.pdf",
    "protocol_html_url": "https://www.parlament.gv.at/dokument/BR/BRSITZ/805/fnameorig_251951.html",
    "uid": "XXIV_BRSITZ_805",
    "raw_path": "steno_protocols/raw_html/XXIV_BRSITZ_805.html",
    "txt_path": "steno_protocols/plain_text/XXIV_BRSITZ_805.txt"
  },
  {
    "session_date_display": "08.11.2001",
    "session_date_iso": "2001-11-08T00:00:00",
    "gp_code": "XXI",
    "chamber": "BRSITZ",
    "session_number": 681,
    "title": "681. Sitzung (681/BRSITZ/2001)",
    "citation": "681/BRSITZ/2001",
    "session_detail_url": "https://www.parlament.gv.at/gegenstand/BR/BRSITZ/681",
    "protocol_pdf_url": "https://www.parlament.gv.at/dokument/BR/BRSITZ/681/fname_113959.pdf",
    "protocol_html_url": "https://www.parlament.gv.at/dokument/BR/BRSITZ/681/fnameorig_113959.html",
    "uid": "XXI_BRSITZ_681",
    "raw_path": "steno_protocols/raw_html/XXI_BRSITZ_681.html",
    "txt_path": "steno_protocols/plain_text/XXI_BRSITZ_681.txt"
  },
  {
    "session_date_display": "18.02.2010",
    "session_date_iso": "2010-02-18T00:00:00",
    "gp_code": "XXIV",
    "chamber": "BRSITZ",
    "session_number": 781,
    "title": "781. Sitzung (781/BRSITZ/2010)",
    "citation": "781/BRSITZ/2010",
    "session_detail_url": "https://www.parlament.gv.at/gegenstand/BR/BRSITZ/781",
    "protocol_pdf_url": "https://www.parlament.gv.at/dokument/BR/BRSITZ/781/fname_181437.pdf",
    "protocol_html_url": "https://www.parlament.gv.at/dokument/BR/BRSITZ/781/fnameorig_181437.html",
    "uid": "XXIV_BRSITZ_781",
    "raw_path": "steno_protocols/raw_html/XXIV_BRSITZ_781.html",
    "txt_path": "steno_protocols/plain_text/XXIV_BRSITZ_781.txt"
  },
  {
    "session_date_display": "14.03.2002",
    "session_date_iso": "2002-03-14T00:00:00",
    "gp_code": "XXI",
    "chamber": "BRSITZ",
    "session_number": 685,
    "title": "685. Sitzung (685/BRSITZ/2002)",
    "citation": "685/BRSITZ/2002",
    "session_detail_url": "https://www.parlament.gv.at/gegenstand/BR/BRSITZ/685",
    "protocol_pdf_url": "https://www.parlament.gv.at/dokument/BR/BRSITZ/685/fname_113967.pdf",
    "protocol_html_url": "https://www.parlament.gv.at/dokument/BR/BRSITZ/685/fnameorig_113967.html",
    "uid": "XXI_BRSITZ_685",
    "raw_path": "steno_protocols/raw_html/XXI_BRSITZ_685.html",
    "txt_path": "steno_protocols/plain_text/XXI_BRSITZ_685.txt"
  },
  {
    "session_date_display": "13.03.2003",
    "session_date_iso": "2003-03-13T00:00:00",
    "gp_code": "XXII",
    "chamber": "BRSITZ",
    "session_number": 694,
    "title": "694. Sitzung (694/BRSITZ/2003)",
    "citation": "694/BRSITZ/2003",
    "session_detail_url": "https://www.parlament.gv.at/gegenstand/BR/BRSITZ/694",
    "protocol_pdf_url": "https://www.parlament.gv.at/dokument/BR/BRSITZ/694/fname_113985.pdf",
    "protocol_html_url": "https://www.parlament.gv.at/dokument/BR/BRSITZ/694/fnameorig_113985.html",
    "uid": "XXII_BRSITZ_694",
    "raw_path": "steno_protocols/raw_html/XXII_BRSITZ_694.html",
    "txt_path": "steno_protocols/plain_text/XXII_BRSITZ_694.txt"
  },
  {
    "session_date_display": "17.12.2010",
    "session_date_iso": "2010-12-17T00:00:00",
    "gp_code": "XXIV",
    "chamber": "BRSITZ",
    "session_number": 791,
    "title": "791. Sitzung (791/BRSITZ/2010)",
    "citation": "791/BRSITZ/2010",
    "session_detail_url": "https://www.parlament.gv.at/gegenstand/BR/BRSITZ/791",
    "protocol_pdf_url": "https://www.parlament.gv.at/dokument/BR/BRSITZ/791/fname_204192.pdf",
    "protocol_html_url": "https://www.parlament.gv.at/dokument/BR/BRSITZ/791/fnameorig_204192.html",
    "uid": "XXIV_BRSITZ_791",
    "raw_path": "steno_protocols/raw_html/XXIV_BRSITZ_791.html",
    "txt_path": "steno_protocols/plain_text/XXIV_BRSITZ_791.txt"
  },
  {
    "session_date_display": "18.04.1997",
    "session_date_iso": "1997-04-18T00:00:00",
    "gp_code": "XX",
    "chamber": "BRSITZ",
    "session_number": 625,
    "title": "625. Sitzung (625/BRSITZ/97)",
    "citation": "625/BRSITZ/97",
    "session_detail_url": "https://www.parlament.gv.at/gegenstand/BR/BRSITZ/625",
    "protocol_pdf_url": "https://www.parlament.gv.at/dokument/BR/BRSITZ/625/fname_113591.pdf",
    "protocol_html_url": "https://www.parlament.gv.at/dokument/BR/BRSITZ/625/fnameorig_113591.html",
    "uid": "XX_BRSITZ_625",
    "raw_path": "steno_protocols/raw_html/XX_BRSITZ_625.html",
    "txt_path": "steno_protocols/plain_text/XX_BRSITZ_625.txt"
  },
  {
    "session_date_display": "15.12.2011",
    "session_date_iso": "2011-12-15T00:00:00",
    "gp_code": "XXIV",
    "chamber": "BRSITZ",
    "session_number": 803,
    "title": "803. Sitzung (803/BRSITZ/2011)",
    "citation": "803/BRSITZ/2011",
    "session_detail_url": "https://www.parlament.gv.at/gegenstand/BR/BRSITZ/803",
    "protocol_pdf_url": "https://www.parlament.gv.at/dokument/BR/BRSITZ/803/fname_247439.pdf",
    "protocol_html_url": "https://www.parlament.gv.at/dokument/BR/BRSITZ/803/fnameorig_247439.html",
    "uid": "XXIV_BRSITZ_803",
    "raw_path": "steno_protocols/raw_html/XXIV_BRSITZ_803.html",
    "txt_path": "steno_protocols/plain_text/XXIV_BRSITZ_803.txt"
  },
  {
    "session_date_display": "21.06.2001",
    "session_date_iso": "2001-06-21T00:00:00",
    "gp_code": "XXI",
    "chamber": "BRSITZ",
    "session_number": 678,
    "title": "678. Sitzung (678/BRSITZ/2001)",
    "citation": "678/BRSITZ/2001",
    "session_detail_url": "https://www.parlament.gv.at/gegenstand/BR/BRSITZ/678",
    "protocol_pdf_url": "https://www.parlament.gv.at/dokument/BR/BRSITZ/678/fname_113953.pdf",
    "protocol_html_url": "https://www.parlament.gv.at/dokument/BR/BRSITZ/678/fnameorig_113953.html",
    "uid": "XXI_BRSITZ_678",
    "raw_path": "steno_protocols/raw_html/XXI_BRSITZ_678.html",
    "txt_path": "steno_protocols/plain_text/XXI_BRSITZ_678.txt"
  },
  {
    "session_date_display": "12.07.1996",
    "session_date_iso": "1996-07-12T00:00:00",
    "gp_code": "XX",
    "chamber": "BRSITZ",
    "session_number": 615,
    "title": "615. Sitzung (615/BRSITZ/96)",
    "citation": "615/BRSITZ/96",
    "session_detail_url": "https://www.parlament.gv.at/gegenstand/BR/BRSITZ/615",
    "protocol_pdf_url": "https://www.parlament.gv.at/dokument/BR/BRSITZ/615/fname_113571.pdf",
    "protocol_html_url": "https://www.parlament.gv.at/dokument/BR/BRSITZ/615/fnameorig_113571.html",
    "uid": "XX_BRSITZ_615",
    "raw_path": "steno_protocols/raw_html/XX_BRSITZ_615.html",
    "txt_path": "steno_protocols/plain_text/XX_BRSITZ_615.txt"
  },
  {
    "session_date_display": "11.03.2010",
    "session_date_iso": "2010-03-11T00:00:00",
    "gp_code": "XXIV",
    "chamber": "BRSITZ",
    "session_number": 782,
    "title": "782. Sitzung (782/BRSITZ/2010)",
    "citation": "782/BRSITZ/2010",
    "session_detail_url": "https://www.parlament.gv.at/gegenstand/BR/BRSITZ/782",
    "protocol_pdf_url": "https://www.parlament.gv.at/dokument/BR/BRSITZ/782/fname_183046.pdf",
    "protocol_html_url": "https://www.parlament.gv.at/dokument/BR/BRSITZ/782/fnameorig_183046.html",
    "uid": "XXIV_BRSITZ_782",
    "raw_path": "steno_protocols/raw_html/XXIV_BRSITZ_782.html",
    "txt_path": "steno_protocols/plain_text/XXIV_BRSITZ_782.txt"
  },
  {
    "session_date_display": "30.01.2003",
    "session_date_iso": "2003-01-30T00:00:00",
    "gp_code": "XXII",
    "chamber": "BRSITZ",
    "session_number": 693,
    "title": "693. Sitzung (693/BRSITZ/2003)",
    "citation": "693/BRSITZ/2003",
    "session_detail_url": "https://www.parlament.gv.at/gegenstand/BR/BRSITZ/693",
    "protocol_pdf_url": "https://www.parlament.gv.at/dokument/BR/BRSITZ/693/fname_113983.pdf",
    "protocol_html_url": "https://www.parlament.gv.at/dokument/BR/BRSITZ/693/fnameorig_113983.html",
    "uid": "XXII_BRSITZ_693",
    "raw_path": "steno_protocols/raw_html/XXII_BRSITZ_693.html",
    "txt_path": "steno_protocols/plain_text/XXII_BRSITZ_693.txt"
  },
  {
    "session_date_display": "06.02.1997",
    "session_date_iso": "1997-02-06T00:00:00",
    "gp_code": "XX",
    "chamber": "BRSITZ",
    "session_number": 622,
    "title": "622. Sitzung (622/BRSITZ/97)",
    "citation": "622/BRSITZ/97",
    "session_detail_url": "https://www.parlament.gv.at/gegenstand/BR/BRSITZ/622",
    "protocol_pdf_url": "https://www.parlament.gv.at/dokument/BR/BRSITZ/622/fname_113585.pdf",
    "protocol_html_url": "https://www.parlament.gv.at/dokument/BR/BRSITZ/622/fnameorig_113585.html",
    "uid": "XX_BRSITZ_622",
    "raw_path": "steno_protocols/raw_html/XX_BRSITZ_622.html",
    "txt_path": "steno_protocols/plain_text/XX_BRSITZ_622.txt"
  },
  {
    "session_date_display": "23.06.2003",
    "session_date_iso": "2003-06-23T00:00:00",
    "gp_code": "XXII",
    "chamber": "BRSITZ",
    "session_number": 698,
    "title": "698. Sitzung (698/BRSITZ/2003)",
    "citation": "698/BRSITZ/2003",
    "session_detail_url": "https://www.parlament.gv.at/gegenstand/BR/BRSITZ/698",
    "protocol_pdf_url": "https://www.parlament.gv.at/dokument/BR/BRSITZ/698/fname_007579.pdf",
    "protocol_html_url": "https://www.parlament.gv.at/dokument/BR/BRSITZ/698/fnameorig_007579.html",
    "uid": "XXII_BRSITZ_698",
    "raw_path": "steno_protocols/raw_html/XXII_BRSITZ_698.html",
    "txt_path": "steno_protocols/plain_text/XXII_BRSITZ_698.txt"
  },
  {
    "session_date_display": "05.06.1997",
    "session_date_iso": "1997-06-05T00:00:00",
    "gp_code": "XX",
    "chamber": "BRSITZ",
    "session_number": 627,
    "title": "627. Sitzung (627/BRSITZ/97)",
    "citation": "627/BRSITZ/97",
    "session_detail_url": "https://www.parlament.gv.at/gegenstand/BR/BRSITZ/627",
    "protocol_pdf_url": "https://www.parlament.gv.at/dokument/BR/BRSITZ/627/fname_113595.pdf",
    "protocol_html_url": "https://www.parlament.gv.at/dokument/BR/BRSITZ/627/fnameorig_113595.html",
    "uid": "XX_BRSITZ_627",
    "raw_path": "steno_protocols/raw_html/XX_BRSITZ_627.html",
    "txt_path": "steno_protocols/plain_text/XX_BRSITZ_627.txt"
  },
  {
    "session_date_display": "11.07.2003",
    "session_date_iso": "2003-07-11T00:00:00",
    "gp_code": "XXII",
    "chamber": "BRSITZ",
    "session_number": 699,
    "title": "699. Sitzung (699/BRSITZ/2003)",
    "citation": "699/BRSITZ/2003",
    "session_detail_url": "https://www.parlament.gv.at/gegenstand/BR/BRSITZ/699",
    "protocol_pdf_url": "https://www.parlament.gv.at/dokument/BR/BRSITZ/699/fname_008665.pdf",
    "protocol_html_url": "https://www.parlament.gv.at/dokument/BR/BRSITZ/699/fnameorig_008665.html",
    "uid": "XXII_BRSITZ_699",
    "raw_path": "steno_protocols/raw_html/XXII_BRSITZ_699.html",
    "txt_path": "steno_protocols/plain_text/XXII_BRSITZ_699.txt"
  },
  {
    "session_date_display": "25.04.1996",
    "session_date_iso": "1996-04-25T00:00:00",
    "gp_code": "XX",
    "chamber": "BRSITZ",
    "session_number": 612,
    "title": "612. Sitzung (612/BRSITZ/96)",
    "citation": "612/BRSITZ/96",
    "session_detail_url": "https://www.parlament.gv.at/gegenstand/BR/BRSITZ/612",
    "protocol_pdf_url": "https://www.parlament.gv.at/dokument/BR/BRSITZ/612/fname_113565.pdf",
    "protocol_html_url": "https://www.parlament.gv.at/dokument/BR/BRSITZ/612/fnameorig_113565.html",
    "uid": "XX_BRSITZ_612",
    "raw_path": "steno_protocols/raw_html/XX_BRSITZ_612.html",
    "txt_path": "steno_protocols/plain_text/XX_BRSITZ_612.txt"
  },
  {
    "session_date_display": "06.05.2010",
    "session_date_iso": "2010-05-06T00:00:00",
    "gp_code": "XXIV",
    "chamber": "BRSITZ",
    "session_number": 784,
    "title": "784. Sitzung (784/BRSITZ/2010)",
    "citation": "784/BRSITZ/2010",
    "session_detail_url": "https://www.parlament.gv.at/gegenstand/BR/BRSITZ/784",
    "protocol_pdf_url": "https://www.parlament.gv.at/dokument/BR/BRSITZ/784/fname_189971.pdf",
    "protocol_html_url": "https://www.parlament.gv.at/dokument/BR/BRSITZ/784/fnameorig_189971.html",
    "uid": "XXIV_BRSITZ_784",
    "raw_path": "steno_protocols/raw_html/XXIV_BRSITZ_784.html",
    "txt_path": "steno_protocols/plain_text/XXIV_BRSITZ_784.txt"
  },
  {
    "session_date_display": "16.01.1997",
    "session_date_iso": "1997-01-16T00:00:00",
    "gp_code": "XX",
    "chamber": "BRSITZ",
    "session_number": 621,
    "title": "621. Sitzung (621/BRSITZ/97)",
    "citation": "621/BRSITZ/97",
    "session_detail_url": "https://www.parlament.gv.at/gegenstand/BR/BRSITZ/621",
    "protocol_pdf_url": "https://www.parlament.gv.at/dokument/BR/BRSITZ/621/fname_113583.pdf",
    "protocol_html_url": "https://www.parlament.gv.at/dokument/BR/BRSITZ/621/fnameorig_113583.html",
    "uid": "XX_BRSITZ_621",
    "raw_path": "steno_protocols/raw_html/XX_BRSITZ_621.html",
    "txt_path": "steno_protocols/plain_text/XX_BRSITZ_621.txt"
  },
  {
    "session_date_display": "10.04.1997",
    "session_date_iso": "1997-04-10T00:00:00",
    "gp_code": "XX",
    "chamber": "BRSITZ",
    "session_number": 624,
    "title": "624. Sitzung (624/BRSITZ/97)",
    "citation": "624/BRSITZ/97",
    "session_detail_url": "https://www.parlament.gv.at/gegenstand/BR/BRSITZ/624",
    "protocol_pdf_url": "https://www.parlament.gv.at/dokument/BR/BRSITZ/624/fname_113589.pdf",
    "protocol_html_url": "https://www.parlament.gv.at/dokument/BR/BRSITZ/624/fnameorig_113589.html",
    "uid": "XX_BRSITZ_624",
    "raw_path": "steno_protocols/raw_html/XX_BRSITZ_624.html",
    "txt_path": "steno_protocols/plain_text/XX_BRSITZ_624.txt"
  },
  {
    "session_date_display": "23.06.2003",
    "session_date_iso": "2003-06-23T00:00:00",
    "gp_code": "XXII",
    "chamber": "BRSITZ",
    "session_number": 697,
    "title": "697. Sitzung (697/BRSITZ/2003)",
    "citation": "697/BRSITZ/2003",
    "session_detail_url": "https://www.parlament.gv.at/gegenstand/BR/BRSITZ/697",
    "protocol_pdf_url": "https://www.parlament.gv.at/dokument/BR/BRSITZ/697/fname_007576.pdf",
    "protocol_html_url": "https://www.parlament.gv.at/dokument/BR/BRSITZ/697/fnameorig_007576.html",
    "uid": "XXII_BRSITZ_697",
    "raw_path": "steno_protocols/raw_html/XXII_BRSITZ_697.html",
    "txt_path": "steno_protocols/plain_text/XXII_BRSITZ_697.txt"
  },
  {
    "session_date_display": "17.03.2011",
    "session_date_iso": "2011-03-17T00:00:00",
    "gp_code": "XXIV",
    "chamber": "BRSITZ",
    "session_number": 794,
    "title": "794. Sitzung (794/BRSITZ/2011)",
    "citation": "794/BRSITZ/2011",
    "session_detail_url": "https://www.parlament.gv.at/gegenstand/BR/BRSITZ/794",
    "protocol_pdf_url": "https://www.parlament.gv.at/dokument/BR/BRSITZ/794/fname_211494.pdf",
    "protocol_html_url": "https://www.parlament.gv.at/dokument/BR/BRSITZ/794/fnameorig_211494.html",
    "uid": "XXIV_BRSITZ_794",
    "raw_path": "steno_protocols/raw_html/XXIV_BRSITZ_794.html",
    "txt_path": "steno_protocols/plain_text/XXIV_BRSITZ_794.txt"
  },
  {
    "session_date_display": "14.04.2011",
    "session_date_iso": "2011-04-14T00:00:00",
    "gp_code": "XXIV",
    "chamber": "BRSITZ",
    "session_number": 795,
    "title": "795. Sitzung (795/BRSITZ/2011)",
    "citation": "795/BRSITZ/2011",
    "session_detail_url": "https://www.parlament.gv.at/gegenstand/BR/BRSITZ/795",
    "protocol_pdf_url": "https://www.parlament.gv.at/dokument/BR/BRSITZ/795/fname_217501.pdf",
    "protocol_html_url": "https://www.parlament.gv.at/dokument/BR/BRSITZ/795/fnameorig_217501.html",
    "uid": "XXIV_BRSITZ_795",
    "raw_path": "steno_protocols/raw_html/XXIV_BRSITZ_795.html",
    "txt_path": "steno_protocols/plain_text/XXIV_BRSITZ_795.txt"
  },
  {
    "session_date_display": "23.07.2003",
    "session_date_iso": "2003-07-23T00:00:00",
    "gp_code": "XXII",
    "chamber": "BRSITZ",
    "session_number": 700,
    "title": "700. Sitzung (700/BRSITZ/2003)",
    "citation": "700/BRSITZ/2003",
    "session_detail_url": "https://www.parlament.gv.at/gegenstand/BR/BRSITZ/700",
    "protocol_pdf_url": "https://www.parlament.gv.at/dokument/BR/BRSITZ/700/fname_009268.pdf",
    "protocol_html_url": "https://www.parlament.gv.at/dokument/BR/BRSITZ/700/fnameorig_009268.html",
    "uid": "XXII_BRSITZ_700",
    "raw_path": "steno_protocols/raw_html/XXII_BRSITZ_700.html",
    "txt_path": "steno_protocols/plain_text/XXII_BRSITZ_700.txt"
  },
  {
    "session_date_display": "17.12.1997",
    "session_date_iso": "1997-12-17T00:00:00",
    "gp_code": "XX",
    "chamber": "BRSITZ",
    "session_number": 633,
    "title": "633. Sitzung (633/BRSITZ/97)",
    "citation": "633/BRSITZ/97",
    "session_detail_url": "https://www.parlament.gv.at/gegenstand/BR/BRSITZ/633",
    "protocol_pdf_url": "https://www.parlament.gv.at/dokument/BR/BRSITZ/633/fname_113607.pdf",
    "protocol_html_url": "https://www.parlament.gv.at/dokument/BR/BRSITZ/633/fnameorig_113607.html",
    "uid": "XX_BRSITZ_633",
    "raw_path": "steno_protocols/raw_html/XX_BRSITZ_633.html",
    "txt_path": "steno_protocols/plain_text/XX_BRSITZ_633.txt"
  },
  {
    "session_date_display": "03.05.2012",
    "session_date_iso": "2012-05-03T00:00:00",
    "gp_code": "XXIV",
    "chamber": "BRSITZ",
    "session_number": 808,
    "title": "808. Sitzung (808/BRSITZ/2012)",
    "citation": "808/BRSITZ/2012",
    "session_detail_url": "https://www.parlament.gv.at/gegenstand/BR/BRSITZ/808",
    "protocol_pdf_url": "https://www.parlament.gv.at/dokument/BR/BRSITZ/808/fname_270255.pdf",
    "protocol_html_url": "https://www.parlament.gv.at/dokument/BR/BRSITZ/808/fnameorig_270255.html",
    "uid": "XXIV_BRSITZ_808",
    "raw_path": "steno_protocols/raw_html/XXIV_BRSITZ_808.html",
    "txt_path": "steno_protocols/plain_text/XXIV_BRSITZ_808.txt"
  },
  {
    "session_date_display": "17.11.2016",
    "session_date_iso": "2016-11-17T00:00:00",
    "gp_code": "XXV",
    "chamber": "BRSITZ",
    "session_number": 860,
    "title": "860. Sitzung (860/BRSITZ/2016)",
    "citation": "860/BRSITZ/2016",
    "session_detail_url": "https://www.parlament.gv.at/gegenstand/BR/BRSITZ/860",
    "protocol_pdf_url": "https://www.parlament.gv.at/dokument/BR/BRSITZ/860/fname_611759.pdf",
    "protocol_html_url": "https://www.parlament.gv.at/dokument/BR/BRSITZ/860/fnameorig_611759.html",
    "uid": "XXV_BRSITZ_860",
    "raw_path": "steno_protocols/raw_html/XXV_BRSITZ_860.html",
    "txt_path": "steno_protocols/plain_text/XXV_BRSITZ_860.txt"
  },
  {
    "session_date_display": "14.02.2008",
    "session_date_iso": "2008-02-14T00:00:00",
    "gp_code": "XXIII",
    "chamber": "BRSITZ",
    "session_number": 753,
    "title": "753. Sitzung (753/BRSITZ/2008)",
    "citation": "753/BRSITZ/2008",
    "session_detail_url": "https://www.parlament.gv.at/gegenstand/BR/BRSITZ/753",
    "protocol_pdf_url": "https://www.parlament.gv.at/dokument/BR/BRSITZ/753/fname_110714.pdf",
    "protocol_html_url": "https://www.parlament.gv.at/dokument/BR/BRSITZ/753/fnameorig_110714.html",
    "uid": "XXIII_BRSITZ_753",
    "raw_path": "steno_protocols/raw_html/XXIII_BRSITZ_753.html",
    "txt_path": "steno_protocols/plain_text/XXIII_BRSITZ_753.txt"
  },
  {
    "session_date_display": "30.10.2008",
    "session_date_iso": "2008-10-30T00:00:00",
    "gp_code": "XXIV",
    "chamber": "BRSITZ",
    "session_number": 762,
    "title": "762. Sitzung (762/BRSITZ/2008)",
    "citation": "762/BRSITZ/2008",
    "session_detail_url": "https://www.parlament.gv.at/gegenstand/BR/BRSITZ/762",
    "protocol_pdf_url": "https://www.parlament.gv.at/dokument/BR/BRSITZ/762/fname_143836.pdf",
    "protocol_html_url": "https://www.parlament.gv.at/dokument/BR/BRSITZ/762/fnameorig_143836.html",
    "uid": "XXIV_BRSITZ_762",
    "raw_path": "steno_protocols/raw_html/XXIV_BRSITZ_762.html",
    "txt_path": "steno_protocols/plain_text/XXIV_BRSITZ_762.txt"
  },
  {
    "session_date_display": "21.06.2000",
    "session_date_iso": "2000-06-21T00:00:00",
    "gp_code": "XXI",
    "chamber": "BRSITZ",
    "session_number": 666,
    "title": "666. Sitzung (666/BRSITZ/2000)",
    "citation": "666/BRSITZ/2000",
    "session_detail_url": "https://www.parlament.gv.at/gegenstand/BR/BRSITZ/666",
    "protocol_pdf_url": "https://www.parlament.gv.at/dokument/BR/BRSITZ/666/fname_113929.pdf",
    "protocol_html_url": "https://www.parlament.gv.at/dokument/BR/BRSITZ/666/fnameorig_113929.html",
    "uid": "XXI_BRSITZ_666",
    "raw_path": "steno_protocols/raw_html/XXI_BRSITZ_666.html",
    "txt_path": "steno_protocols/plain_text/XXI_BRSITZ_666.txt"
  },
  {
    "session_date_display": "16.03.2006",
    "session_date_iso": "2006-03-16T00:00:00",
    "gp_code": "XXII",
    "chamber": "BRSITZ",
    "session_number": 732,
    "title": "732. Sitzung (732/BRSITZ/2006)",
    "citation": "732/BRSITZ/2006",
    "session_detail_url": "https://www.parlament.gv.at/gegenstand/BR/BRSITZ/732",
    "protocol_pdf_url": "https://www.parlament.gv.at/dokument/BR/BRSITZ/732/fname_062852.pdf",
    "protocol_html_url": "https://www.parlament.gv.at/dokument/BR/BRSITZ/732/fnameorig_062852.html",
    "uid": "XXII_BRSITZ_732",
    "raw_path": "steno_protocols/raw_html/XXII_BRSITZ_732.html",
    "txt_path": "steno_protocols/plain_text/XXII_BRSITZ_732.txt"
  },
  {
    "session_date_display": "26.06.2013",
    "session_date_iso": "2013-06-26T00:00:00",
    "gp_code": "XXIV",
    "chamber": "BRSITZ",
    "session_number": 822,
    "title": "822. Sitzung (822/BRSITZ/2013)",
    "citation": "822/BRSITZ/2013",
    "session_detail_url": "https://www.parlament.gv.at/gegenstand/BR/BRSITZ/822",
    "protocol_pdf_url": "https://www.parlament.gv.at/dokument/BR/BRSITZ/822/fname_329522.pdf",
    "protocol_html_url": "https://www.parlament.gv.at/dokument/BR/BRSITZ/822/fnameorig_329522.html",
    "uid": "XXIV_BRSITZ_822",
    "raw_path": "steno_protocols/raw_html/XXIV_BRSITZ_822.html",
    "txt_path": "steno_protocols/plain_text/XXIV_BRSITZ_822.txt"
  },
  {
    "session_date_display": "05.04.2002",
    "session_date_iso": "2002-04-05T00:00:00",
    "gp_code": "XXI",
    "chamber": "BRSITZ",
    "session_number": 686,
    "title": "686. Sitzung (686/BRSITZ/2002)",
    "citation": "686/BRSITZ/2002",
    "session_detail_url": "https://www.parlament.gv.at/gegenstand/BR/BRSITZ/686",
    "protocol_pdf_url": "https://www.parlament.gv.at/dokument/BR/BRSITZ/686/fname_113969.pdf",
    "protocol_html_url": "https://www.parlament.gv.at/dokument/BR/BRSITZ/686/fnameorig_113969.html",
    "uid": "XXI_BRSITZ_686",
    "raw_path": "steno_protocols/raw_html/XXI_BRSITZ_686.html",
    "txt_path": "steno_protocols/plain_text/XXI_BRSITZ_686.txt"
  },
  {
    "session_date_display": "24.07.2014",
    "session_date_iso": "2014-07-24T00:00:00",
    "gp_code": "XXV",
    "chamber": "BRSITZ",
    "session_number": 832,
    "title": "832. Sitzung (832/BRSITZ/2014)",
    "citation": "832/BRSITZ/2014",
    "session_detail_url": "https://www.parlament.gv.at/gegenstand/BR/BRSITZ/832",
    "protocol_pdf_url": "https://www.parlament.gv.at/dokument/BR/BRSITZ/832/fname_368119.pdf",
    "protocol_html_url": "https://www.parlament.gv.at/dokument/BR/BRSITZ/832/fnameorig_368119.html",
    "uid": "XXV_BRSITZ_832",
    "raw_path": "steno_protocols/raw_html/XXV_BRSITZ_832.html",
    "txt_path": "steno_protocols/plain_text/XXV_BRSITZ_832.txt"
  },
  {
    "session_date_display": "19.07.2001",
    "session_date_iso": "2001-07-19T00:00:00",
    "gp_code": "XXI",
    "chamber": "BRSITZ",
    "session_number": 679,
    "title": "679. Sitzung (679/BRSITZ/2001)",
    "citation": "679/BRSITZ/2001",
    "session_detail_url": "https://www.parlament.gv.at/gegenstand/BR/BRSITZ/679",
    "protocol_pdf_url": "https://www.parlament.gv.at/dokument/BR/BRSITZ/679/fname_113955.pdf",
    "protocol_html_url": "https://www.parlament.gv.at/dokument/BR/BRSITZ/679/fnameorig_113955.html",
    "uid": "XXI_BRSITZ_679",
    "raw_path": "steno_protocols/raw_html/XXI_BRSITZ_679.html",
    "txt_path": "steno_protocols/plain_text/XXI_BRSITZ_679.txt"
  },
  {
    "session_date_display": "21.07.2005",
    "session_date_iso": "2005-07-21T00:00:00",
    "gp_code": "XXII",
    "chamber": "BRSITZ",
    "session_number": 724,
    "title": "724. Sitzung (724/BRSITZ/2005)",
    "citation": "724/BRSITZ/2005",
    "session_detail_url": "https://www.parlament.gv.at/gegenstand/BR/BRSITZ/724",
    "protocol_pdf_url": "https://www.parlament.gv.at/dokument/BR/BRSITZ/724/fname_049849.pdf",
    "protocol_html_url": "https://www.parlament.gv.at/dokument/BR/BRSITZ/724/fnameorig_049849.html",
    "uid": "XXII_BRSITZ_724",
    "raw_path": "steno_protocols/raw_html/XXII_BRSITZ_724.html",
    "txt_path": "steno_protocols/plain_text/XXII_BRSITZ_724.txt"
  },
  {
    "session_date_display": "22.07.2004",
    "session_date_iso": "2004-07-22T00:00:00",
    "gp_code": "XXII",
    "chamber": "BRSITZ",
    "session_number": 712,
    "title": "712. Sitzung (712/BRSITZ/2004)",
    "citation": "712/BRSITZ/2004",
    "session_detail_url": "https://www.parlament.gv.at/gegenstand/BR/BRSITZ/712",
    "protocol_pdf_url": "https://www.parlament.gv.at/dokument/BR/BRSITZ/712/fname_027814.pdf",
    "protocol_html_url": "https://www.parlament.gv.at/dokument/BR/BRSITZ/712/fnameorig_027814.html",
    "uid": "XXII_BRSITZ_712",
    "raw_path": "steno_protocols/raw_html/XXII_BRSITZ_712.html",
    "txt_path": "steno_protocols/plain_text/XXII_BRSITZ_712.txt"
  },
  {
    "session_date_display": "01.06.2017",
    "session_date_iso": "2017-06-01T00:00:00",
    "gp_code": "XXV",
    "chamber": "BRSITZ",
    "session_number": 868,
    "title": "868. Sitzung (868/BRSITZ/2017)",
    "citation": "868/BRSITZ/2017",
    "session_detail_url": "https://www.parlament.gv.at/gegenstand/BR/BRSITZ/868",
    "protocol_pdf_url": "https://www.parlament.gv.at/dokument/BR/BRSITZ/868/fname_672857.pdf",
    "protocol_html_url": "https://www.parlament.gv.at/dokument/BR/BRSITZ/868/fnameorig_672857.html",
    "uid": "XXV_BRSITZ_868",
    "raw_path": "steno_protocols/raw_html/XXV_BRSITZ_868.html",
    "txt_path": "steno_protocols/plain_text/XXV_BRSITZ_868.txt"
  },
  {
    "session_date_display": "25.10.2017",
    "session_date_iso": "2017-10-25T00:00:00",
    "gp_code": "XXV",
    "chamber": "BRSITZ",
    "session_number": 873,
    "title": "873. Sitzung (873/BRSITZ/2017)",
    "citation": "873/BRSITZ/2017",
    "session_detail_url": "https://www.parlament.gv.at/gegenstand/BR/BRSITZ/873",
    "protocol_pdf_url": "https://www.parlament.gv.at/dokument/BR/BRSITZ/873/fname_677978.pdf",
    "protocol_html_url": "https://www.parlament.gv.at/dokument/BR/BRSITZ/873/fnameorig_677978.html",
    "uid": "XXV_BRSITZ_873",
    "raw_path": "steno_protocols/raw_html/XXV_BRSITZ_873.html",
    "txt_path": "steno_protocols/plain_text/XXV_BRSITZ_873.txt"
  },
  {
    "session_date_display": "05.04.2024",
    "session_date_iso": "2024-04-05T00:00:00",
    "gp_code": "XXVII",
    "chamber": "BRSITZ",
    "session_number": 965,
    "title": "965. Sitzung (965/BRSITZ/2024)",
    "citation": "965/BRSITZ/2024",
    "session_detail_url": "https://www.parlament.gv.at/gegenstand/BR/BRSITZ/965",
    "protocol_pdf_url": "https://www.parlament.gv.at/dokument/BR/BRSITZ/965/fname_1665247.pdf",
    "protocol_html_url": "https://www.parlament.gv.at/dokument/BR/BRSITZ/965/fnameorig_1665247.html",
    "uid": "XXVII_BRSITZ_965",
    "raw_path": "steno_protocols/raw_html/XXVII_BRSITZ_965.html",
    "txt_path": "steno_protocols/plain_text/XXVII_BRSITZ_965.txt"
  },
  {
    "session_date_display": "10.07.2024",
    "session_date_iso": "2024-07-10T00:00:00",
    "gp_code": "XXVII",
    "chamber": "BRSITZ",
    "session_number": 969,
    "title": "969. Sitzung (969/BRSITZ/2024)",
    "citation": "969/BRSITZ/2024",
    "session_detail_url": "https://www.parlament.gv.at/gegenstand/BR/BRSITZ/969",
    "protocol_pdf_url": "https://www.parlament.gv.at/dokument/BR/BRSITZ/969/fname_1677539.pdf",
    "protocol_html_url": "https://www.parlament.gv.at/dokument/BR/BRSITZ/969/fnameorig_1677539.html",
    "uid": "XXVII_BRSITZ_969",
    "raw_path": "steno_protocols/raw_html/XXVII_BRSITZ_969.html",
    "txt_path": "steno_protocols/plain_text/XXVII_BRSITZ_969.txt"
  },
  {
    "session_date_display": "05.12.2024",
    "session_date_iso": "2024-12-05T00:00:00",
    "gp_code": "XXVIII",
    "chamber": "BRSITZ",
    "session_number": 972,
    "title": "972. Sitzung (972/BRSITZ/2024)",
    "citation": "972/BRSITZ/2024",
    "session_detail_url": "https://www.parlament.gv.at/gegenstand/BR/BRSITZ/972",
    "protocol_pdf_url": "https://www.parlament.gv.at/dokument/BR/BRSITZ/972/imfname_1700273.pdf",
    "protocol_html_url": "https://www.parlament.gv.at/dokument/BR/BRSITZ/972/fnameorig_1700273.html",
    "uid": "XXVIII_BRSITZ_972",
    "raw_path": "steno_protocols/raw_html/XXVIII_BRSITZ_972.html",
    "txt_path": "steno_protocols/plain_text/XXVIII_BRSITZ_972.txt"
  },
  {
    "session_date_display": "24.02.2021",
    "session_date_iso": "2021-02-24T00:00:00",
    "gp_code": "XXVII",
    "chamber": "NRSITZ",
    "session_number": 86,
    "title": "86. Sitzung (86/NRSITZ)",
    "citation": "86/NRSITZ",
    "session_detail_url": "https://www.parlament.gv.at/gegenstand/XXVII/NRSITZ/86",
    "protocol_pdf_url": "https://www.parlament.gv.at/dokument/XXVII/NRSITZ/86/fname_980702.pdf",
    "protocol_html_url": "https://www.parlament.gv.at/dokument/XXVII/NRSITZ/86/fnameorig_980702.html",
    "uid": "XXVII_NRSITZ_86",
    "raw_path": "steno_protocols/raw_html/XXVII_NRSITZ_86.html",
    "txt_path": "steno_protocols/plain_text/XXVII_NRSITZ_86.txt"
  },
  {
    "session_date_display": "13.10.2022",
    "session_date_iso": "2022-10-13T00:00:00",
    "gp_code": "XXVII",
    "chamber": "NRSITZ",
    "session_number": 180,
    "title": "180. Sitzung (180/NRSITZ)",
    "citation": "180/NRSITZ",
    "session_detail_url": "https://www.parlament.gv.at/gegenstand/XXVII/NRSITZ/180",
    "protocol_pdf_url": "https://www.parlament.gv.at/dokument/XXVII/NRSITZ/180/fname_1577022.pdf",
    "protocol_html_url": "https://www.parlament.gv.at/dokument/XXVII/NRSITZ/180/fnameorig_1577022.html",
    "uid": "XXVII_NRSITZ_180",
    "raw_path": "steno_protocols/raw_html/XXVII_NRSITZ_180.html",
    "txt_path": "steno_protocols/plain_text/XXVII_NRSITZ_180.txt"
  },
  {
    "session_date_display": "23.10.2019",
    "session_date_iso": "2019-10-23T00:00:00",
    "gp_code": "XXVII",
    "chamber": "NRSITZ",
    "session_number": 1,
    "title": "1. Sitzung (1/NRSITZ)",
    "citation": "1/NRSITZ",
    "session_detail_url": "https://www.parlament.gv.at/gegenstand/XXVII/NRSITZ/1",
    "protocol_pdf_url": "https://www.parlament.gv.at/dokument/XXVII/NRSITZ/1/fname_796482.pdf",
    "protocol_html_url": "https://www.parlament.gv.at/dokument/XXVII/NRSITZ/1/fnameorig_796482.html",
    "uid": "XXVII_NRSITZ_1",
    "raw_path": "steno_protocols/raw_html/XXVII_NRSITZ_1.html",
    "txt_path": "steno_protocols/plain_text/XXVII_NRSITZ_1.txt"
  },
  {
    "session_date_display": "06.10.2016",
    "session_date_iso": "2016-10-06T00:00:00",
    "gp_code": "XXV",
    "chamber": "BRSITZ",
    "session_number": 858,
    "title": "858. Sitzung (858/BRSITZ/2016)",
    "citation": "858/BRSITZ/2016",
    "session_detail_url": "https://www.parlament.gv.at/gegenstand/BR/BRSITZ/858",
    "protocol_pdf_url": "https://www.parlament.gv.at/dokument/BR/BRSITZ/858/fname_584152.pdf",
    "protocol_html_url": "https://www.parlament.gv.at/dokument/BR/BRSITZ/858/fnameorig_584152.html",
    "uid": "XXV_BRSITZ_858",
    "raw_path": "steno_protocols/raw_html/XXV_BRSITZ_858.html",
    "txt_path": "steno_protocols/plain_text/XXV_BRSITZ_858.txt"
  },
  {
    "session_date_display": "02.02.2005",
    "session_date_iso": "2005-02-02T00:00:00",
    "gp_code": "XXII",
    "chamber": "BRSITZ",
    "session_number": 718,
    "title": "718. Sitzung (718/BRSITZ/2005)",
    "citation": "718/BRSITZ/2005",
    "session_detail_url": "https://www.parlament.gv.at/gegenstand/BR/BRSITZ/718",
    "protocol_pdf_url": "https://www.parlament.gv.at/dokument/BR/BRSITZ/718/fname_038535.pdf",
    "protocol_html_url": "https://www.parlament.gv.at/dokument/BR/BRSITZ/718/fnameorig_038535.html",
    "uid": "XXII_BRSITZ_718",
    "raw_path": "steno_protocols/raw_html/XXII_BRSITZ_718.html",
    "txt_path": "steno_protocols/plain_text/XXII_BRSITZ_718.txt"
  },
  {
    "session_date_display": "04.05.2020",
    "session_date_iso": "2020-05-04T00:00:00",
    "gp_code": "XXVII",
    "chamber": "BRSITZ",
    "session_number": 906,
    "title": "906. Sitzung (906/BRSITZ/2020)",
    "citation": "906/BRSITZ/2020",
    "session_detail_url": "https://www.parlament.gv.at/gegenstand/BR/BRSITZ/906",
    "protocol_pdf_url": "https://www.parlament.gv.at/dokument/BR/BRSITZ/906/fname_811809.pdf",
    "protocol_html_url": "https://www.parlament.gv.at/dokument/BR/BRSITZ/906/fnameorig_811809.html",
    "uid": "XXVII_BRSITZ_906",
    "raw_path": "steno_protocols/raw_html/XXVII_BRSITZ_906.html",
    "txt_path": "steno_protocols/plain_text/XXVII_BRSITZ_906.txt"
  },
  {
    "session_date_display": "13.10.2005",
    "session_date_iso": "2005-10-13T00:00:00",
    "gp_code": "XXII",
    "chamber": "BRSITZ",
    "session_number": 725,
    "title": "725. Sitzung (725/BRSITZ/2005)",
    "citation": "725/BRSITZ/2005",
    "session_detail_url": "https://www.parlament.gv.at/gegenstand/BR/BRSITZ/725",
    "protocol_pdf_url": "https://www.parlament.gv.at/dokument/BR/BRSITZ/725/fname_053104.pdf",
    "protocol_html_url": "https://www.parlament.gv.at/dokument/BR/BRSITZ/725/fnameorig_053104.html",
    "uid": "XXII_BRSITZ_725",
    "raw_path": "steno_protocols/raw_html/XXII_BRSITZ_725.html",
    "txt_path": "steno_protocols/plain_text/XXII_BRSITZ_725.txt"
  },
  {
    "session_date_display": "27.06.2002",
    "session_date_iso": "2002-06-27T00:00:00",
    "gp_code": "XXI",
    "chamber": "BRSITZ",
    "session_number": 689,
    "title": "689. Sitzung (689/BRSITZ/2002)",
    "citation": "689/BRSITZ/2002",
    "session_detail_url": "https://www.parlament.gv.at/gegenstand/BR/BRSITZ/689",
    "protocol_pdf_url": "https://www.parlament.gv.at/dokument/BR/BRSITZ/689/fname_113975.pdf",
    "protocol_html_url": "https://www.parlament.gv.at/dokument/BR/BRSITZ/689/fnameorig_113975.html",
    "uid": "XXI_BRSITZ_689",
    "raw_path": "steno_protocols/raw_html/XXI_BRSITZ_689.html",
    "txt_path": "steno_protocols/plain_text/XXI_BRSITZ_689.txt"
  },
  {
    "session_date_display": "05.11.2009",
    "session_date_iso": "2009-11-05T00:00:00",
    "gp_code": "XXIV",
    "chamber": "BRSITZ",
    "session_number": 777,
    "title": "777. Sitzung (777/BRSITZ/2009)",
    "citation": "777/BRSITZ/2009",
    "session_detail_url": "https://www.parlament.gv.at/gegenstand/BR/BRSITZ/777",
    "protocol_pdf_url": "https://www.parlament.gv.at/dokument/BR/BRSITZ/777/fname_178143.pdf",
    "protocol_html_url": "https://www.parlament.gv.at/dokument/BR/BRSITZ/777/fnameorig_178143.html",
    "uid": "XXIV_BRSITZ_777",
    "raw_path": "steno_protocols/raw_html/XXIV_BRSITZ_777.html",
    "txt_path": "steno_protocols/plain_text/XXIV_BRSITZ_777.txt"
  },
  {
    "session_date_display": "18.12.2009",
    "session_date_iso": "2009-12-18T00:00:00",
    "gp_code": "XXIV",
    "chamber": "BRSITZ",
    "session_number": 780,
    "title": "780. Sitzung (780/BRSITZ/2009)",
    "citation": "780/BRSITZ/2009",
    "session_detail_url": "https://www.parlament.gv.at/gegenstand/BR/BRSITZ/780",
    "protocol_pdf_url": "https://www.parlament.gv.at/dokument/BR/BRSITZ/780/fname_180937.pdf",
    "protocol_html_url": "https://www.parlament.gv.at/dokument/BR/BRSITZ/780/fnameorig_180937.html",
    "uid": "XXIV_BRSITZ_780",
    "raw_path": "steno_protocols/raw_html/XXIV_BRSITZ_780.html",
    "txt_path": "steno_protocols/plain_text/XXIV_BRSITZ_780.txt"
  },
  {
    "session_date_display": "07.05.2015",
    "session_date_iso": "2015-05-07T00:00:00",
    "gp_code": "XXV",
    "chamber": "BRSITZ",
    "session_number": 841,
    "title": "841. Sitzung (841/BRSITZ/2015)",
    "citation": "841/BRSITZ/2015",
    "session_detail_url": "https://www.parlament.gv.at/gegenstand/BR/BRSITZ/841",
    "protocol_pdf_url": "https://www.parlament.gv.at/dokument/BR/BRSITZ/841/fname_470426.pdf",
    "protocol_html_url": "https://www.parlament.gv.at/dokument/BR/BRSITZ/841/fnameorig_470426.html",
    "uid": "XXV_BRSITZ_841",
    "raw_path": "steno_protocols/raw_html/XXV_BRSITZ_841.html",
    "txt_path": "steno_protocols/plain_text/XXV_BRSITZ_841.txt"
  },
  {
    "session_date_display": "16.02.2023",
    "session_date_iso": "2023-02-16T00:00:00",
    "gp_code": "XXVII",
    "chamber": "BRSITZ",
    "session_number": 950,
    "title": "950. Sitzung (950/BRSITZ/2023)",
    "citation": "950/BRSITZ/2023",
    "session_detail_url": "https://www.parlament.gv.at/gegenstand/BR/BRSITZ/950",
    "protocol_pdf_url": "https://www.parlament.gv.at/dokument/BR/BRSITZ/950/fname_1629028.pdf",
    "protocol_html_url": "https://www.parlament.gv.at/dokument/BR/BRSITZ/950/fnameorig_1629028.html",
    "uid": "XXVII_BRSITZ_950",
    "raw_path": "steno_protocols/raw_html/XXVII_BRSITZ_950.html",
    "txt_path": "steno_protocols/plain_text/XXVII_BRSITZ_950.txt"
  },
  {
    "session_date_display": "22.06.2017",
    "session_date_iso": "2017-06-22T00:00:00",
    "gp_code": "XXV",
    "chamber": "BRSITZ",
    "session_number": 869,
    "title": "869. Sitzung (869/BRSITZ/2017)",
    "citation": "869/BRSITZ/2017",
    "session_detail_url": "https://www.parlament.gv.at/gegenstand/BR/BRSITZ/869",
    "protocol_pdf_url": "https://www.parlament.gv.at/dokument/BR/BRSITZ/869/fname_672859.pdf",
    "protocol_html_url": "https://www.parlament.gv.at/dokument/BR/BRSITZ/869/fnameorig_672859.html",
    "uid": "XXV_BRSITZ_869",
    "raw_path": "steno_protocols/raw_html/XXV_BRSITZ_869.html",
    "txt_path": "steno_protocols/plain_text/XXV_BRSITZ_869.txt"
  },
  {
    "session_date_display": "19.12.2024",
    "session_date_iso": "2024-12-19T00:00:00",
    "gp_code": "XXVIII",
    "chamber": "BRSITZ",
    "session_number": 973,
    "title": "973. Sitzung (973/BRSITZ/2024)",
    "citation": "973/BRSITZ/2024",
    "session_detail_url": "https://www.parlament.gv.at/gegenstand/BR/BRSITZ/973",
    "protocol_pdf_url": "https://www.parlament.gv.at/dokument/BR/BRSITZ/973/imfname_1700283.pdf",
    "protocol_html_url": "https://www.parlament.gv.at/dokument/BR/BRSITZ/973/fnameorig_1700283.html",
    "uid": "XXVIII_BRSITZ_973",
    "raw_path": "steno_protocols/raw_html/XXVIII_BRSITZ_973.html",
    "txt_path": "steno_protocols/plain_text/XXVIII_BRSITZ_973.txt"
  },
  {
    "session_date_display": "24.02.2021",
    "session_date_iso": "2021-02-24T00:00:00",
    "gp_code": "XXVII",
    "chamber": "NRSITZ",
    "session_number": 85,
    "title": "85. Sitzung (85/NRSITZ)",
    "citation": "85/NRSITZ",
    "session_detail_url": "https://www.parlament.gv.at/gegenstand/XXVII/NRSITZ/85",
    "protocol_pdf_url": "https://www.parlament.gv.at/dokument/XXVII/NRSITZ/85/fname_980700.pdf",
    "protocol_html_url": "https://www.parlament.gv.at/dokument/XXVII/NRSITZ/85/fnameorig_980700.html",
    "uid": "XXVII_NRSITZ_85",
    "raw_path": "steno_protocols/raw_html/XXVII_NRSITZ_85.html",
    "txt_path": "steno_protocols/plain_text/XXVII_NRSITZ_85.txt"
  },
  {
    "session_date_display": "08.03.2021",
    "session_date_iso": "2021-03-08T00:00:00",
    "gp_code": "XXVII",
    "chamber": "NRSITZ",
    "session_number": 88,
    "title": "88. Sitzung (88/NRSITZ)",
    "citation": "88/NRSITZ",
    "session_detail_url": "https://www.parlament.gv.at/gegenstand/XXVII/NRSITZ/88",
    "protocol_pdf_url": "https://www.parlament.gv.at/dokument/XXVII/NRSITZ/88/fname_980707.pdf",
    "protocol_html_url": "https://www.parlament.gv.at/dokument/XXVII/NRSITZ/88/fnameorig_980707.html",
    "uid": "XXVII_NRSITZ_88",
    "raw_path": "steno_protocols/raw_html/XXVII_NRSITZ_88.html",
    "txt_path": "steno_protocols/plain_text/XXVII_NRSITZ_88.txt"
  },
  {
    "session_date_display": "04.10.2022",
    "session_date_iso": "2022-10-04T00:00:00",
    "gp_code": "XXVII",
    "chamber": "NRSITZ",
    "session_number": 176,
    "title": "176. Sitzung (176/NRSITZ)",
    "citation": "176/NRSITZ",
    "session_detail_url": "https://www.parlament.gv.at/gegenstand/XXVII/NRSITZ/176",
    "protocol_pdf_url": "https://www.parlament.gv.at/dokument/XXVII/NRSITZ/176/fname_1547878.pdf",
    "protocol_html_url": "https://www.parlament.gv.at/dokument/XXVII/NRSITZ/176/fnameorig_1547878.html",
    "uid": "XXVII_NRSITZ_176",
    "raw_path": "steno_protocols/raw_html/XXVII_NRSITZ_176.html",
    "txt_path": "steno_protocols/plain_text/XXVII_NRSITZ_176.txt"
  },
  {
    "session_date_display": "25.03.2021",
    "session_date_iso": "2021-03-25T00:00:00",
    "gp_code": "XXVII",
    "chamber": "NRSITZ",
    "session_number": 92,
    "title": "92. Sitzung (92/NRSITZ)",
    "citation": "92/NRSITZ",
    "session_detail_url": "https://www.parlament.gv.at/gegenstand/XXVII/NRSITZ/92",
    "protocol_pdf_url": "https://www.parlament.gv.at/dokument/XXVII/NRSITZ/92/fname_989393.pdf",
    "protocol_html_url": "https://www.parlament.gv.at/dokument/XXVII/NRSITZ/92/fnameorig_989393.html",
    "uid": "XXVII_NRSITZ_92",
    "raw_path": "steno_protocols/raw_html/XXVII_NRSITZ_92.html",
    "txt_path": "steno_protocols/plain_text/XXVII_NRSITZ_92.txt"
  },
  {
    "session_date_display": "03.10.2024",
    "session_date_iso": "2024-10-03T00:00:00",
    "gp_code": "XXVII",
    "chamber": "BRSITZ",
    "session_number": 971,
    "title": "971. Sitzung (971/BRSITZ/2024)",
    "citation": "971/BRSITZ/2024",
    "session_detail_url": "https://www.parlament.gv.at/gegenstand/BR/BRSITZ/971",
    "protocol_pdf_url": "https://www.parlament.gv.at/dokument/BR/BRSITZ/971/fname_1700230.pdf",
    "protocol_html_url": "https://www.parlament.gv.at/dokument/BR/BRSITZ/971/fnameorig_1700230.html",
    "uid": "XXVII_BRSITZ_971",
    "raw_path": "steno_protocols/raw_html/XXVII_BRSITZ_971.html",
    "txt_path": "steno_protocols/plain_text/XXVII_BRSITZ_971.txt"
  },
  {
    "session_date_display": "08.11.2023",
    "session_date_iso": "2023-11-08T00:00:00",
    "gp_code": "XXVII",
    "chamber": "BRSITZ",
    "session_number": 959,
    "title": "959. Sitzung (959/BRSITZ/2023)",
    "citation": "959/BRSITZ/2023",
    "session_detail_url": "https://www.parlament.gv.at/gegenstand/BR/BRSITZ/959",
    "protocol_pdf_url": "https://www.parlament.gv.at/dokument/BR/BRSITZ/959/fname_1627361.pdf",
    "protocol_html_url": "https://www.parlament.gv.at/dokument/BR/BRSITZ/959/fnameorig_1627361.html",
    "uid": "XXVII_BRSITZ_959",
    "raw_path": "steno_protocols/raw_html/XXVII_BRSITZ_959.html",
    "txt_path": "steno_protocols/plain_text/XXVII_BRSITZ_959.txt"
  },
  {
    "session_date_display": "21.05.2008",
    "session_date_iso": "2008-05-21T00:00:00",
    "gp_code": "XXIII",
    "chamber": "BRSITZ",
    "session_number": 756,
    "title": "756. Sitzung (756/BRSITZ/2008)",
    "citation": "756/BRSITZ/2008",
    "session_detail_url": "https://www.parlament.gv.at/gegenstand/BR/BRSITZ/756",
    "protocol_pdf_url": "https://www.parlament.gv.at/dokument/BR/BRSITZ/756/fname_113698.pdf",
    "protocol_html_url": "https://www.parlament.gv.at/dokument/BR/BRSITZ/756/fnameorig_113698.html",
    "uid": "XXIII_BRSITZ_756",
    "raw_path": "steno_protocols/raw_html/XXIII_BRSITZ_756.html",
    "txt_path": "steno_protocols/plain_text/XXIII_BRSITZ_756.txt"
  },
  {
    "session_date_display": "08.10.2008",
    "session_date_iso": "2008-10-08T00:00:00",
    "gp_code": "XXIII",
    "chamber": "BRSITZ",
    "session_number": 760,
    "title": "760. Sitzung (760/BRSITZ/2008)",
    "citation": "760/BRSITZ/2008",
    "session_detail_url": "https://www.parlament.gv.at/gegenstand/BR/BRSITZ/760",
    "protocol_pdf_url": "https://www.parlament.gv.at/dokument/BR/BRSITZ/760/fname_144310.pdf",
    "protocol_html_url": "https://www.parlament.gv.at/dokument/BR/BRSITZ/760/fnameorig_144310.html",
    "uid": "XXIII_BRSITZ_760",
    "raw_path": "steno_protocols/raw_html/XXIII_BRSITZ_760.html",
    "txt_path": "steno_protocols/plain_text/XXIII_BRSITZ_760.txt"
  },
  {
    "session_date_display": "22.07.2008",
    "session_date_iso": "2008-07-22T00:00:00",
    "gp_code": "XXIII",
    "chamber": "BRSITZ",
    "session_number": 758,
    "title": "758. Sitzung (758/BRSITZ/2008)",
    "citation": "758/BRSITZ/2008",
    "session_detail_url": "https://www.parlament.gv.at/gegenstand/BR/BRSITZ/758",
    "protocol_pdf_url": "https://www.parlament.gv.at/dokument/BR/BRSITZ/758/fname_142684.pdf",
    "protocol_html_url": "https://www.parlament.gv.at/dokument/BR/BRSITZ/758/fnameorig_142684.html",
    "uid": "XXIII_BRSITZ_758",
    "raw_path": "steno_protocols/raw_html/XXIII_BRSITZ_758.html",
    "txt_path": "steno_protocols/plain_text/XXIII_BRSITZ_758.txt"
  },
  {
    "session_date_display": "19.07.2000",
    "session_date_iso": "2000-07-19T00:00:00",
    "gp_code": "XXI",
    "chamber": "BRSITZ",
    "session_number": 667,
    "title": "667. Sitzung (667/BRSITZ/2000)",
    "citation": "667/BRSITZ/2000",
    "session_detail_url": "https://www.parlament.gv.at/gegenstand/BR/BRSITZ/667",
    "protocol_pdf_url": "https://www.parlament.gv.at/dokument/BR/BRSITZ/667/fname_113931.pdf",
    "protocol_html_url": "https://www.parlament.gv.at/dokument/BR/BRSITZ/667/fnameorig_113931.html",
    "uid": "XXI_BRSITZ_667",
    "raw_path": "steno_protocols/raw_html/XXI_BRSITZ_667.html",
    "txt_path": "steno_protocols/plain_text/XXI_BRSITZ_667.txt"
  },
  {
    "session_date_display": "13.02.2004",
    "session_date_iso": "2004-02-13T00:00:00",
    "gp_code": "XXII",
    "chamber": "BRSITZ",
    "session_number": 705,
    "title": "705. Sitzung (705/BRSITZ/2004)",
    "citation": "705/BRSITZ/2004",
    "session_detail_url": "https://www.parlament.gv.at/gegenstand/BR/BRSITZ/705",
    "protocol_pdf_url": "https://www.parlament.gv.at/dokument/BR/BRSITZ/705/fname_017439.pdf",
    "protocol_html_url": "https://www.parlament.gv.at/dokument/BR/BRSITZ/705/fnameorig_017439.html",
    "uid": "XXII_BRSITZ_705",
    "raw_path": "steno_protocols/raw_html/XXII_BRSITZ_705.html",
    "txt_path": "steno_protocols/plain_text/XXII_BRSITZ_705.txt"
  },
  {
    "session_date_display": "08.05.2013",
    "session_date_iso": "2013-05-08T00:00:00",
    "gp_code": "XXIV",
    "chamber": "BRSITZ",
    "session_number": 820,
    "title": "820. Sitzung (820/BRSITZ/2013)",
    "citation": "820/BRSITZ/2013",
    "session_detail_url": "https://www.parlament.gv.at/gegenstand/BR/BRSITZ/820",
    "protocol_pdf_url": "https://www.parlament.gv.at/dokument/BR/BRSITZ/820/fname_317621.pdf",
    "protocol_html_url": "https://www.parlament.gv.at/dokument/BR/BRSITZ/820/fnameorig_317621.html",
    "uid": "XXIV_BRSITZ_820",
    "raw_path": "steno_protocols/raw_html/XXIV_BRSITZ_820.html",
    "txt_path": "steno_protocols/plain_text/XXIV_BRSITZ_820.txt"
  },
  {
    "session_date_display": "21.06.2007",
    "session_date_iso": "2007-06-21T00:00:00",
    "gp_code": "XXIII",
    "chamber": "BRSITZ",
    "session_number": 746,
    "title": "746. Sitzung (746/BRSITZ/2007)",
    "citation": "746/BRSITZ/2007",
    "session_detail_url": "https://www.parlament.gv.at/gegenstand/BR/BRSITZ/746",
    "protocol_pdf_url": "https://www.parlament.gv.at/dokument/BR/BRSITZ/746/fname_099007.pdf",
    "protocol_html_url": "https://www.parlament.gv.at/dokument/BR/BRSITZ/746/fnameorig_099007.html",
    "uid": "XXIII_BRSITZ_746",
    "raw_path": "steno_protocols/raw_html/XXIII_BRSITZ_746.html",
    "txt_path": "steno_protocols/plain_text/XXIII_BRSITZ_746.txt"
  },
  {
    "session_date_display": "19.05.2004",
    "session_date_iso": "2004-05-19T00:00:00",
    "gp_code": "XXII",
    "chamber": "BRSITZ",
    "session_number": 709,
    "title": "709. Sitzung (709/BRSITZ/2004)",
    "citation": "709/BRSITZ/2004",
    "session_detail_url": "https://www.parlament.gv.at/gegenstand/BR/BRSITZ/709",
    "protocol_pdf_url": "https://www.parlament.gv.at/dokument/BR/BRSITZ/709/fname_022779.pdf",
    "protocol_html_url": "https://www.parlament.gv.at/dokument/BR/BRSITZ/709/fnameorig_022779.html",
    "uid": "XXII_BRSITZ_709",
    "raw_path": "steno_protocols/raw_html/XXII_BRSITZ_709.html",
    "txt_path": "steno_protocols/plain_text/XXII_BRSITZ_709.txt"
  },
  {
    "session_date_display": "10.04.2025",
    "session_date_iso": "2025-04-10T00:00:00",
    "gp_code": "XXVIII",
    "chamber": "BRSITZ",
    "session_number": 976,
    "title": "976. Sitzung (976/BRSITZ/2025)",
    "citation": "976/BRSITZ/2025",
    "session_detail_url": "https://www.parlament.gv.at/gegenstand/BR/BRSITZ/976",
    "protocol_pdf_url": "https://www.parlament.gv.at/dokument/BR/BRSITZ/976/imfname_1713721.pdf",
    "protocol_html_url": "https://www.parlament.gv.at/dokument/BR/BRSITZ/976/fnameorig_1713721.html",
    "uid": "XXVIII_BRSITZ_976",
    "raw_path": "steno_protocols/raw_html/XXVIII_BRSITZ_976.html",
    "txt_path": "steno_protocols/plain_text/XXVIII_BRSITZ_976.txt"
  },
  {
    "session_date_display": "16.02.2021",
    "session_date_iso": "2021-02-16T00:00:00",
    "gp_code": "XXVII",
    "chamber": "NRSITZ",
    "session_number": 83,
    "title": "83. Sitzung (83/NRSITZ)",
    "citation": "83/NRSITZ",
    "session_detail_url": "https://www.parlament.gv.at/gegenstand/XXVII/NRSITZ/83",
    "protocol_pdf_url": "https://www.parlament.gv.at/dokument/XXVII/NRSITZ/83/fname_954402.pdf",
    "protocol_html_url": "https://www.parlament.gv.at/dokument/XXVII/NRSITZ/83/fnameorig_954402.html",
    "uid": "XXVII_NRSITZ_83",
    "raw_path": "steno_protocols/raw_html/XXVII_NRSITZ_83.html",
    "txt_path": "steno_protocols/plain_text/XXVII_NRSITZ_83.txt"
  },
  {
    "session_date_display": "16.02.2021",
    "session_date_iso": "2021-02-16T00:00:00",
    "gp_code": "XXVII",
    "chamber": "NRSITZ",
    "session_number": 84,
    "title": "84. Sitzung (84/NRSITZ)",
    "citation": "84/NRSITZ",
    "session_detail_url": "https://www.parlament.gv.at/gegenstand/XXVII/NRSITZ/84",
    "protocol_pdf_url": "https://www.parlament.gv.at/dokument/XXVII/NRSITZ/84/fname_954408.pdf",
    "protocol_html_url": "https://www.parlament.gv.at/dokument/XXVII/NRSITZ/84/fnameorig_954408.html",
    "uid": "XXVII_NRSITZ_84",
    "raw_path": "steno_protocols/raw_html/XXVII_NRSITZ_84.html",
    "txt_path": "steno_protocols/plain_text/XXVII_NRSITZ_84.txt"
  },
  {
    "session_date_display": "08.03.2021",
    "session_date_iso": "2021-03-08T00:00:00",
    "gp_code": "XXVII",
    "chamber": "NRSITZ",
    "session_number": 87,
    "title": "87. Sitzung (87/NRSITZ)",
    "citation": "87/NRSITZ",
    "session_detail_url": "https://www.parlament.gv.at/gegenstand/XXVII/NRSITZ/87",
    "protocol_pdf_url": "https://www.parlament.gv.at/dokument/XXVII/NRSITZ/87/fname_980705.pdf",
    "protocol_html_url": "https://www.parlament.gv.at/dokument/XXVII/NRSITZ/87/fnameorig_980705.html",
    "uid": "XXVII_NRSITZ_87",
    "raw_path": "steno_protocols/raw_html/XXVII_NRSITZ_87.html",
    "txt_path": "steno_protocols/plain_text/XXVII_NRSITZ_87.txt"
  },
  {
    "session_date_display": "24.03.2021",
    "session_date_iso": "2021-03-24T00:00:00",
    "gp_code": "XXVII",
    "chamber": "NRSITZ",
    "session_number": 90,
    "title": "90. Sitzung (90/NRSITZ)",
    "citation": "90/NRSITZ",
    "session_detail_url": "https://www.parlament.gv.at/gegenstand/XXVII/NRSITZ/90",
    "protocol_pdf_url": "https://www.parlament.gv.at/dokument/XXVII/NRSITZ/90/fname_981351.pdf",
    "protocol_html_url": "https://www.parlament.gv.at/dokument/XXVII/NRSITZ/90/fnameorig_981351.html",
    "uid": "XXVII_NRSITZ_90",
    "raw_path": "steno_protocols/raw_html/XXVII_NRSITZ_90.html",
    "txt_path": "steno_protocols/plain_text/XXVII_NRSITZ_90.txt"
  },
  {
    "session_date_display": "07.06.2023",
    "session_date_iso": "2023-06-07T00:00:00",
    "gp_code": "XXVII",
    "chamber": "BRSITZ",
    "session_number": 954,
    "title": "954. Sitzung (954/BRSITZ/2023)",
    "citation": "954/BRSITZ/2023",
    "session_detail_url": "https://www.parlament.gv.at/gegenstand/BR/BRSITZ/954",
    "protocol_pdf_url": "https://www.parlament.gv.at/dokument/BR/BRSITZ/954/fname_1665237.pdf",
    "protocol_html_url": "https://www.parlament.gv.at/dokument/BR/BRSITZ/954/fnameorig_1665237.html",
    "uid": "XXVII_BRSITZ_954",
    "raw_path": "steno_protocols/raw_html/XXVII_BRSITZ_954.html",
    "txt_path": "steno_protocols/plain_text/XXVII_BRSITZ_954.txt"
  },
  {
    "session_date_display": "24.04.2024",
    "session_date_iso": "2024-04-24T00:00:00",
    "gp_code": "XXVII",
    "chamber": "BRSITZ",
    "session_number": 966,
    "title": "966. Sitzung (966/BRSITZ/2024)",
    "citation": "966/BRSITZ/2024",
    "session_detail_url": "https://www.parlament.gv.at/gegenstand/BR/BRSITZ/966",
    "protocol_pdf_url": "https://www.parlament.gv.at/dokument/BR/BRSITZ/966/fname_1666566.pdf",
    "protocol_html_url": "https://www.parlament.gv.at/dokument/BR/BRSITZ/966/fnameorig_1666566.html",
    "uid": "XXVII_BRSITZ_966",
    "raw_path": "steno_protocols/raw_html/XXVII_BRSITZ_966.html",
    "txt_path": "steno_protocols/plain_text/XXVII_BRSITZ_966.txt"
  },
  {
    "session_date_display": "11.05.2023",
    "session_date_iso": "2023-05-11T00:00:00",
    "gp_code": "XXVII",
    "chamber": "BRSITZ",
    "session_number": 953,
    "title": "953. Sitzung (953/BRSITZ/2023)",
    "citation": "953/BRSITZ/2023",
    "session_detail_url": "https://www.parlament.gv.at/gegenstand/BR/BRSITZ/953",
    "protocol_pdf_url": "https://www.parlament.gv.at/dokument/BR/BRSITZ/953/fname_1597248.pdf",
    "protocol_html_url": "https://www.parlament.gv.at/dokument/BR/BRSITZ/953/fnameorig_1597248.html",
    "uid": "XXVII_BRSITZ_953",
    "raw_path": "steno_protocols/raw_html/XXVII_BRSITZ_953.html",
    "txt_path": "steno_protocols/plain_text/XXVII_BRSITZ_953.txt"
  },
  {
    "session_date_display": "12.07.2023",
    "session_date_iso": "2023-07-12T00:00:00",
    "gp_code": "XXVII",
    "chamber": "BRSITZ",
    "session_number": 956,
    "title": "956. Sitzung (956/BRSITZ/2023)",
    "citation": "956/BRSITZ/2023",
    "session_detail_url": "https://www.parlament.gv.at/gegenstand/BR/BRSITZ/956",
    "protocol_pdf_url": "https://www.parlament.gv.at/dokument/BR/BRSITZ/956/fname_1613100.pdf",
    "protocol_html_url": "https://www.parlament.gv.at/dokument/BR/BRSITZ/956/fnameorig_1613100.html",
    "uid": "XXVII_BRSITZ_956",
    "raw_path": "steno_protocols/raw_html/XXVII_BRSITZ_956.html",
    "txt_path": "steno_protocols/plain_text/XXVII_BRSITZ_956.txt"
  },
  {
    "session_date_display": "05.02.2009",
    "session_date_iso": "2009-02-05T00:00:00",
    "gp_code": "XXIV",
    "chamber": "BRSITZ",
    "session_number": 765,
    "title": "765. Sitzung (765/BRSITZ/2009)",
    "citation": "765/BRSITZ/2009",
    "session_detail_url": "https://www.parlament.gv.at/gegenstand/BR/BRSITZ/765",
    "protocol_pdf_url": "https://www.parlament.gv.at/dokument/BR/BRSITZ/765/fname_151041.pdf",
    "protocol_html_url": "https://www.parlament.gv.at/dokument/BR/BRSITZ/765/fnameorig_151041.html",
    "uid": "XXIV_BRSITZ_765",
    "raw_path": "steno_protocols/raw_html/XXIV_BRSITZ_765.html",
    "txt_path": "steno_protocols/plain_text/XXIV_BRSITZ_765.txt"
  },
  {
    "session_date_display": "05.11.2010",
    "session_date_iso": "2010-11-05T00:00:00",
    "gp_code": "XXIV",
    "chamber": "BRSITZ",
    "session_number": 789,
    "title": "789. Sitzung (789/BRSITZ/2010)",
    "citation": "789/BRSITZ/2010",
    "session_detail_url": "https://www.parlament.gv.at/gegenstand/BR/BRSITZ/789",
    "protocol_pdf_url": "https://www.parlament.gv.at/dokument/BR/BRSITZ/789/fname_201471.pdf",
    "protocol_html_url": "https://www.parlament.gv.at/dokument/BR/BRSITZ/789/fnameorig_201471.html",
    "uid": "XXIV_BRSITZ_789",
    "raw_path": "steno_protocols/raw_html/XXIV_BRSITZ_789.html",
    "txt_path": "steno_protocols/plain_text/XXIV_BRSITZ_789.txt"
  },
  {
    "session_date_display": "26.06.2014",
    "session_date_iso": "2014-06-26T00:00:00",
    "gp_code": "XXV",
    "chamber": "BRSITZ",
    "session_number": 831,
    "title": "831. Sitzung (831/BRSITZ/2014)",
    "citation": "831/BRSITZ/2014",
    "session_detail_url": "https://www.parlament.gv.at/gegenstand/BR/BRSITZ/831",
    "protocol_pdf_url": "https://www.parlament.gv.at/dokument/BR/BRSITZ/831/fname_370201.pdf",
    "protocol_html_url": "https://www.parlament.gv.at/dokument/BR/BRSITZ/831/fnameorig_370201.html",
    "uid": "XXV_BRSITZ_831",
    "raw_path": "steno_protocols/raw_html/XXV_BRSITZ_831.html",
    "txt_path": "steno_protocols/plain_text/XXV_BRSITZ_831.txt"
  },
  {
    "session_date_display": "27.07.2006",
    "session_date_iso": "2006-07-27T00:00:00",
    "gp_code": "XXII",
    "chamber": "BRSITZ",
    "session_number": 737,
    "title": "737. Sitzung (737/BRSITZ/2006)",
    "citation": "737/BRSITZ/2006",
    "session_detail_url": "https://www.parlament.gv.at/gegenstand/BR/BRSITZ/737",
    "protocol_pdf_url": "https://www.parlament.gv.at/dokument/BR/BRSITZ/737/fname_070070.pdf",
    "protocol_html_url": "https://www.parlament.gv.at/dokument/BR/BRSITZ/737/fnameorig_070070.html",
    "uid": "XXII_BRSITZ_737",
    "raw_path": "steno_protocols/raw_html/XXII_BRSITZ_737.html",
    "txt_path": "steno_protocols/plain_text/XXII_BRSITZ_737.txt"
  },
  {
    "session_date_display": "01.07.2010",
    "session_date_iso": "2010-07-01T00:00:00",
    "gp_code": "XXIV",
    "chamber": "BRSITZ",
    "session_number": 786,
    "title": "786. Sitzung (786/BRSITZ/2010)",
    "citation": "786/BRSITZ/2010",
    "session_detail_url": "https://www.parlament.gv.at/gegenstand/BR/BRSITZ/786",
    "protocol_pdf_url": "https://www.parlament.gv.at/dokument/BR/BRSITZ/786/fname_196108.pdf",
    "protocol_html_url": "https://www.parlament.gv.at/dokument/BR/BRSITZ/786/fnameorig_196108.html",
    "uid": "XXIV_BRSITZ_786",
    "raw_path": "steno_protocols/raw_html/XXIV_BRSITZ_786.html",
    "txt_path": "steno_protocols/plain_text/XXIV_BRSITZ_786.txt"
  },
  {
    "session_date_display": "20.12.2012",
    "session_date_iso": "2012-12-20T00:00:00",
    "gp_code": "XXIV",
    "chamber": "BRSITZ",
    "session_number": 816,
    "title": "816. Sitzung (816/BRSITZ/2012)",
    "citation": "816/BRSITZ/2012",
    "session_detail_url": "https://www.parlament.gv.at/gegenstand/BR/BRSITZ/816",
    "protocol_pdf_url": "https://www.parlament.gv.at/dokument/BR/BRSITZ/816/fname_299639.pdf",
    "protocol_html_url": "https://www.parlament.gv.at/dokument/BR/BRSITZ/816/fnameorig_299639.html",
    "uid": "XXIV_BRSITZ_816",
    "raw_path": "steno_protocols/raw_html/XXIV_BRSITZ_816.html",
    "txt_path": "steno_protocols/plain_text/XXIV_BRSITZ_816.txt"
  },
  {
    "session_date_display": "15.03.2001",
    "session_date_iso": "2001-03-15T00:00:00",
    "gp_code": "XXI",
    "chamber": "BRSITZ",
    "session_number": 673,
    "title": "673. Sitzung (673/BRSITZ/2001)",
    "citation": "673/BRSITZ/2001",
    "session_detail_url": "https://www.parlament.gv.at/gegenstand/BR/BRSITZ/673",
    "protocol_pdf_url": "https://www.parlament.gv.at/dokument/BR/BRSITZ/673/fname_113943.pdf",
    "protocol_html_url": "https://www.parlament.gv.at/dokument/BR/BRSITZ/673/fnameorig_113943.html",
    "uid": "XXI_BRSITZ_673",
    "raw_path": "steno_protocols/raw_html/XXI_BRSITZ_673.html",
    "txt_path": "steno_protocols/plain_text/XXI_BRSITZ_673.txt"
  },
  {
    "session_date_display": "19.06.2008",
    "session_date_iso": "2008-06-19T00:00:00",
    "gp_code": "XXIII",
    "chamber": "BRSITZ",
    "session_number": 757,
    "title": "757. Sitzung (757/BRSITZ/2008)",
    "citation": "757/BRSITZ/2008",
    "session_detail_url": "https://www.parlament.gv.at/gegenstand/BR/BRSITZ/757",
    "protocol_pdf_url": "https://www.parlament.gv.at/dokument/BR/BRSITZ/757/fname_141565.pdf",
    "protocol_html_url": "https://www.parlament.gv.at/dokument/BR/BRSITZ/757/fnameorig_141565.html",
    "uid": "XXIII_BRSITZ_757",
    "raw_path": "steno_protocols/raw_html/XXIII_BRSITZ_757.html",
    "txt_path": "steno_protocols/plain_text/XXIII_BRSITZ_757.txt"
  },
  {
    "session_date_display": "22.12.2017",
    "session_date_iso": "2017-12-22T00:00:00",
    "gp_code": "XXVI",
    "chamber": "BRSITZ",
    "session_number": 874,
    "title": "874. Sitzung (874/BRSITZ/2017)",
    "citation": "874/BRSITZ/2017",
    "session_detail_url": "https://www.parlament.gv.at/gegenstand/BR/BRSITZ/874",
    "protocol_pdf_url": "https://www.parlament.gv.at/dokument/BR/BRSITZ/874/fname_681360.pdf",
    "protocol_html_url": "https://www.parlament.gv.at/dokument/BR/BRSITZ/874/fnameorig_681360.html",
    "uid": "XXVI_BRSITZ_874",
    "raw_path": "steno_protocols/raw_html/XXVI_BRSITZ_874.html",
    "txt_path": "steno_protocols/plain_text/XXVI_BRSITZ_874.txt"
  },
  {
    "session_date_display": "16.02.2017",
    "session_date_iso": "2017-02-16T00:00:00",
    "gp_code": "XXV",
    "chamber": "BRSITZ",
    "session_number": 864,
    "title": "864. Sitzung (864/BRSITZ/2017)",
    "citation": "864/BRSITZ/2017",
    "session_detail_url": "https://www.parlament.gv.at/gegenstand/BR/BRSITZ/864",
    "protocol_pdf_url": "https://www.parlament.gv.at/dokument/BR/BRSITZ/864/fname_635045.pdf",
    "protocol_html_url": "https://www.parlament.gv.at/dokument/BR/BRSITZ/864/fnameorig_635045.html",
    "uid": "XXV_BRSITZ_864",
    "raw_path": "steno_protocols/raw_html/XXV_BRSITZ_864.html",
    "txt_path": "steno_protocols/plain_text/XXV_BRSITZ_864.txt"
  },
  {
    "session_date_display": "27.06.2024",
    "session_date_iso": "2024-06-27T00:00:00",
    "gp_code": "XXVII",
    "chamber": "BRSITZ",
    "session_number": 968,
    "title": "968. Sitzung (968/BRSITZ/2024)",
    "citation": "968/BRSITZ/2024",
    "session_detail_url": "https://www.parlament.gv.at/gegenstand/BR/BRSITZ/968",
    "protocol_pdf_url": "https://www.parlament.gv.at/dokument/BR/BRSITZ/968/fname_1672958.pdf",
    "protocol_html_url": "https://www.parlament.gv.at/dokument/BR/BRSITZ/968/fnameorig_1672958.html",
    "uid": "XXVII_BRSITZ_968",
    "raw_path": "steno_protocols/raw_html/XXVII_BRSITZ_968.html",
    "txt_path": "steno_protocols/plain_text/XXVII_BRSITZ_968.txt"
  },
  {
    "session_date_display": "13.03.2025",
    "session_date_iso": "2025-03-13T00:00:00",
    "gp_code": "XXVIII",
    "chamber": "BRSITZ",
    "session_number": 975,
    "title": "975. Sitzung (975/BRSITZ/2025)",
    "citation": "975/BRSITZ/2025",
    "session_detail_url": "https://www.parlament.gv.at/gegenstand/BR/BRSITZ/975",
    "protocol_pdf_url": "https://www.parlament.gv.at/dokument/BR/BRSITZ/975/imfname_1708974.pdf",
    "protocol_html_url": "https://www.parlament.gv.at/dokument/BR/BRSITZ/975/fnameorig_1708974.html",
    "uid": "XXVIII_BRSITZ_975",
    "raw_path": "steno_protocols/raw_html/XXVIII_BRSITZ_975.html",
    "txt_path": "steno_protocols/plain_text/XXVIII_BRSITZ_975.txt"
  },
  {
    "session_date_display": "03.10.2022",
    "session_date_iso": "2022-10-03T00:00:00",
    "gp_code": "XXVII",
    "chamber": "NRSITZ",
    "session_number": 175,
    "title": "175. Sitzung (175/NRSITZ)",
    "citation": "175/NRSITZ",
    "session_detail_url": "https://www.parlament.gv.at/gegenstand/XXVII/NRSITZ/175",
    "protocol_pdf_url": "https://www.parlament.gv.at/dokument/XXVII/NRSITZ/175/fname_1557169.pdf",
    "protocol_html_url": "https://www.parlament.gv.at/dokument/XXVII/NRSITZ/175/fnameorig_1557169.html",
    "uid": "XXVII_NRSITZ_175",
    "raw_path": "steno_protocols/raw_html/XXVII_NRSITZ_175.html",
    "txt_path": "steno_protocols/plain_text/XXVII_NRSITZ_175.txt"
  },
  {
    "session_date_display": "12.10.2022",
    "session_date_iso": "2022-10-12T00:00:00",
    "gp_code": "XXVII",
    "chamber": "NRSITZ",
    "session_number": 178,
    "title": "178. Sitzung (178/NRSITZ)",
    "citation": "178/NRSITZ",
    "session_detail_url": "https://www.parlament.gv.at/gegenstand/XXVII/NRSITZ/178",
    "protocol_pdf_url": "https://www.parlament.gv.at/dokument/XXVII/NRSITZ/178/fname_1547883.pdf",
    "protocol_html_url": "https://www.parlament.gv.at/dokument/XXVII/NRSITZ/178/fnameorig_1547883.html",
    "uid": "XXVII_NRSITZ_178",
    "raw_path": "steno_protocols/raw_html/XXVII_NRSITZ_178.html",
    "txt_path": "steno_protocols/plain_text/XXVII_NRSITZ_178.txt"
  },
  {
    "session_date_display": "05.10.2023",
    "session_date_iso": "2023-10-05T00:00:00",
    "gp_code": "XXVII",
    "chamber": "BRSITZ",
    "session_number": 958,
    "title": "958. Sitzung (958/BRSITZ/2023)",
    "citation": "958/BRSITZ/2023",
    "session_detail_url": "https://www.parlament.gv.at/gegenstand/BR/BRSITZ/958",
    "protocol_pdf_url": "https://www.parlament.gv.at/dokument/BR/BRSITZ/958/fname_1618292.pdf",
    "protocol_html_url": "https://www.parlament.gv.at/dokument/BR/BRSITZ/958/fnameorig_1618292.html",
    "uid": "XXVII_BRSITZ_958",
    "raw_path": "steno_protocols/raw_html/XXVII_BRSITZ_958.html",
    "txt_path": "steno_protocols/plain_text/XXVII_BRSITZ_958.txt"
  },
  {
    "session_date_display": "14.07.2016",
    "session_date_iso": "2016-07-14T00:00:00",
    "gp_code": "XXV",
    "chamber": "BRSITZ",
    "session_number": 856,
    "title": "856. Sitzung (856/BRSITZ/2016)",
    "citation": "856/BRSITZ/2016",
    "session_detail_url": "https://www.parlament.gv.at/gegenstand/BR/BRSITZ/856",
    "protocol_pdf_url": "https://www.parlament.gv.at/dokument/BR/BRSITZ/856/fname_571188.pdf",
    "protocol_html_url": "https://www.parlament.gv.at/dokument/BR/BRSITZ/856/fnameorig_571188.html",
    "uid": "XXV_BRSITZ_856",
    "raw_path": "steno_protocols/raw_html/XXV_BRSITZ_856.html",
    "txt_path": "steno_protocols/plain_text/XXV_BRSITZ_856.txt"
  },
  {
    "session_date_display": "30.06.2016",
    "session_date_iso": "2016-06-30T00:00:00",
    "gp_code": "XXV",
    "chamber": "BRSITZ",
    "session_number": 855,
    "title": "855. Sitzung (855/BRSITZ/2016)",
    "citation": "855/BRSITZ/2016",
    "session_detail_url": "https://www.parlament.gv.at/gegenstand/BR/BRSITZ/855",
    "protocol_pdf_url": "https://www.parlament.gv.at/dokument/BR/BRSITZ/855/fname_572541.pdf",
    "protocol_html_url": "https://www.parlament.gv.at/dokument/BR/BRSITZ/855/fnameorig_572541.html",
    "uid": "XXV_BRSITZ_855",
    "raw_path": "steno_protocols/raw_html/XXV_BRSITZ_855.html",
    "txt_path": "steno_protocols/plain_text/XXV_BRSITZ_855.txt"
  },
  {
    "session_date_display": "21.10.2008",
    "session_date_iso": "2008-10-21T00:00:00",
    "gp_code": "XXIII",
    "chamber": "BRSITZ",
    "session_number": 761,
    "title": "761. Sitzung (761/BRSITZ/2008)",
    "citation": "761/BRSITZ/2008",
    "session_detail_url": "https://www.parlament.gv.at/gegenstand/BR/BRSITZ/761",
    "protocol_pdf_url": "https://www.parlament.gv.at/dokument/BR/BRSITZ/761/fname_145730.pdf",
    "protocol_html_url": "https://www.parlament.gv.at/dokument/BR/BRSITZ/761/fnameorig_145730.html",
    "uid": "XXIII_BRSITZ_761",
    "raw_path": "steno_protocols/raw_html/XXIII_BRSITZ_761.html",
    "txt_path": "steno_protocols/plain_text/XXIII_BRSITZ_761.txt"
  },
  {
    "session_date_display": "09.05.2000",
    "session_date_iso": "2000-05-09T00:00:00",
    "gp_code": "XXI",
    "chamber": "BRSITZ",
    "session_number": 664,
    "title": "664. Sitzung (664/BRSITZ/2000)",
    "citation": "664/BRSITZ/2000",
    "session_detail_url": "https://www.parlament.gv.at/gegenstand/BR/BRSITZ/664",
    "protocol_pdf_url": "https://www.parlament.gv.at/dokument/BR/BRSITZ/664/fname_113925.pdf",
    "protocol_html_url": "https://www.parlament.gv.at/dokument/BR/BRSITZ/664/fnameorig_113925.html",
    "uid": "XXI_BRSITZ_664",
    "raw_path": "steno_protocols/raw_html/XXI_BRSITZ_664.html",
    "txt_path": "steno_protocols/plain_text/XXI_BRSITZ_664.txt"
  },
  {
    "session_date_display": "25.07.2002",
    "session_date_iso": "2002-07-25T00:00:00",
    "gp_code": "XXI",
    "chamber": "BRSITZ",
    "session_number": 690,
    "title": "690. Sitzung (690/BRSITZ/2002)",
    "citation": "690/BRSITZ/2002",
    "session_detail_url": "https://www.parlament.gv.at/gegenstand/BR/BRSITZ/690",
    "protocol_pdf_url": "https://www.parlament.gv.at/dokument/BR/BRSITZ/690/fname_113977.pdf",
    "protocol_html_url": "https://www.parlament.gv.at/dokument/BR/BRSITZ/690/fnameorig_113977.html",
    "uid": "XXI_BRSITZ_690",
    "raw_path": "steno_protocols/raw_html/XXI_BRSITZ_690.html",
    "txt_path": "steno_protocols/plain_text/XXI_BRSITZ_690.txt"
  },
  {
    "session_date_display": "06.12.2001",
    "session_date_iso": "2001-12-06T00:00:00",
    "gp_code": "XXI",
    "chamber": "BRSITZ",
    "session_number": 682,
    "title": "682. Sitzung (682/BRSITZ/2001)",
    "citation": "682/BRSITZ/2001",
    "session_detail_url": "https://www.parlament.gv.at/gegenstand/BR/BRSITZ/682",
    "protocol_pdf_url": "https://www.parlament.gv.at/dokument/BR/BRSITZ/682/fname_113961.pdf",
    "protocol_html_url": "https://www.parlament.gv.at/dokument/BR/BRSITZ/682/fnameorig_113961.html",
    "uid": "XXI_BRSITZ_682",
    "raw_path": "steno_protocols/raw_html/XXI_BRSITZ_682.html",
    "txt_path": "steno_protocols/plain_text/XXI_BRSITZ_682.txt"
  },
  {
    "session_date_display": "01.07.2004",
    "session_date_iso": "2004-07-01T00:00:00",
    "gp_code": "XXII",
    "chamber": "BRSITZ",
    "session_number": 711,
    "title": "711. Sitzung (711/BRSITZ/2004)",
    "citation": "711/BRSITZ/2004",
    "session_detail_url": "https://www.parlament.gv.at/gegenstand/BR/BRSITZ/711",
    "protocol_pdf_url": "https://www.parlament.gv.at/dokument/BR/BRSITZ/711/fname_026200.pdf",
    "protocol_html_url": "https://www.parlament.gv.at/dokument/BR/BRSITZ/711/fnameorig_026200.html",
    "uid": "XXII_BRSITZ_711",
    "raw_path": "steno_protocols/raw_html/XXII_BRSITZ_711.html",
    "txt_path": "steno_protocols/plain_text/XXII_BRSITZ_711.txt"
  },
  {
    "session_date_display": "26.03.2009",
    "session_date_iso": "2009-03-26T00:00:00",
    "gp_code": "XXIV",
    "chamber": "BRSITZ",
    "session_number": 768,
    "title": "768. Sitzung (768/BRSITZ/2009)",
    "citation": "768/BRSITZ/2009",
    "session_detail_url": "https://www.parlament.gv.at/gegenstand/BR/BRSITZ/768",
    "protocol_pdf_url": "https://www.parlament.gv.at/dokument/BR/BRSITZ/768/fname_156518.pdf",
    "protocol_html_url": "https://www.parlament.gv.at/dokument/BR/BRSITZ/768/fnameorig_156518.html",
    "uid": "XXIV_BRSITZ_768",
    "raw_path": "steno_protocols/raw_html/XXIV_BRSITZ_768.html",
    "txt_path": "steno_protocols/plain_text/XXIV_BRSITZ_768.txt"
  },
  {
    "session_date_display": "30.11.2022",
    "session_date_iso": "2022-11-30T00:00:00",
    "gp_code": "XXVII",
    "chamber": "BRSITZ",
    "session_number": 947,
    "title": "947. Sitzung (947/BRSITZ/2022)",
    "citation": "947/BRSITZ/2022",
    "session_detail_url": "https://www.parlament.gv.at/gegenstand/BR/BRSITZ/947",
    "protocol_pdf_url": "https://www.parlament.gv.at/dokument/BR/BRSITZ/947/fname_1591778.pdf",
    "protocol_html_url": "https://www.parlament.gv.at/dokument/BR/BRSITZ/947/fnameorig_1591778.html",
    "uid": "XXVII_BRSITZ_947",
    "raw_path": "steno_protocols/raw_html/XXVII_BRSITZ_947.html",
    "txt_path": "steno_protocols/plain_text/XXVII_BRSITZ_947.txt"
  },
  {
    "session_date_display": "05.07.2017",
    "session_date_iso": "2017-07-05T00:00:00",
    "gp_code": "XXV",
    "chamber": "BRSITZ",
    "session_number": 870,
    "title": "870. Sitzung (870/BRSITZ/2017)",
    "citation": "870/BRSITZ/2017",
    "session_detail_url": "https://www.parlament.gv.at/gegenstand/BR/BRSITZ/870",
    "protocol_pdf_url": "https://www.parlament.gv.at/dokument/BR/BRSITZ/870/fname_674022.pdf",
    "protocol_html_url": "https://www.parlament.gv.at/dokument/BR/BRSITZ/870/fnameorig_674022.html",
    "uid": "XXV_BRSITZ_870",
    "raw_path": "steno_protocols/raw_html/XXV_BRSITZ_870.html",
    "txt_path": "steno_protocols/plain_text/XXV_BRSITZ_870.txt"
  },
  {
    "session_date_display": "16.03.2017",
    "session_date_iso": "2017-03-16T00:00:00",
    "gp_code": "XXV",
    "chamber": "BRSITZ",
    "session_number": 865,
    "title": "865. Sitzung (865/BRSITZ/2017)",
    "citation": "865/BRSITZ/2017",
    "session_detail_url": "https://www.parlament.gv.at/gegenstand/BR/BRSITZ/865",
    "protocol_pdf_url": "https://www.parlament.gv.at/dokument/BR/BRSITZ/865/fname_637941.pdf",
    "protocol_html_url": "https://www.parlament.gv.at/dokument/BR/BRSITZ/865/fnameorig_637941.html",
    "uid": "XXV_BRSITZ_865",
    "raw_path": "steno_protocols/raw_html/XXV_BRSITZ_865.html",
    "txt_path": "steno_protocols/plain_text/XXV_BRSITZ_865.txt"
  },
  {
    "session_date_display": "29.05.2024",
    "session_date_iso": "2024-05-29T00:00:00",
    "gp_code": "XXVII",
    "chamber": "BRSITZ",
    "session_number": 967,
    "title": "967. Sitzung (967/BRSITZ/2024)",
    "citation": "967/BRSITZ/2024",
    "session_detail_url": "https://www.parlament.gv.at/gegenstand/BR/BRSITZ/967",
    "protocol_pdf_url": "https://www.parlament.gv.at/dokument/BR/BRSITZ/967/fname_1668215.pdf",
    "protocol_html_url": "https://www.parlament.gv.at/dokument/BR/BRSITZ/967/fnameorig_1668215.html",
    "uid": "XXVII_BRSITZ_967",
    "raw_path": "steno_protocols/raw_html/XXVII_BRSITZ_967.html",
    "txt_path": "steno_protocols/plain_text/XXVII_BRSITZ_967.txt"
  },
  {
    "session_date_display": "14.03.2024",
    "session_date_iso": "2024-03-14T00:00:00",
    "gp_code": "XXVII",
    "chamber": "BRSITZ",
    "session_number": 964,
    "title": "964. Sitzung (964/BRSITZ/2024)",
    "citation": "964/BRSITZ/2024",
    "session_detail_url": "https://www.parlament.gv.at/gegenstand/BR/BRSITZ/964",
    "protocol_pdf_url": "https://www.parlament.gv.at/dokument/BR/BRSITZ/964/fname_1659949.pdf",
    "protocol_html_url": "https://www.parlament.gv.at/dokument/BR/BRSITZ/964/fnameorig_1659949.html",
    "uid": "XXVII_BRSITZ_964",
    "raw_path": "steno_protocols/raw_html/XXVII_BRSITZ_964.html",
    "txt_path": "steno_protocols/plain_text/XXVII_BRSITZ_964.txt"
  },
  {
    "session_date_display": "21.09.2022",
    "session_date_iso": "2022-09-21T00:00:00",
    "gp_code": "XXVII",
    "chamber": "NRSITZ",
    "session_number": 173,
    "title": "173. Sitzung (173/NRSITZ)",
    "citation": "173/NRSITZ",
    "session_detail_url": "https://www.parlament.gv.at/gegenstand/XXVII/NRSITZ/173",
    "protocol_pdf_url": "https://www.parlament.gv.at/dokument/XXVII/NRSITZ/173/fname_1546190.pdf",
    "protocol_html_url": "https://www.parlament.gv.at/dokument/XXVII/NRSITZ/173/fnameorig_1546190.html",
    "uid": "XXVII_NRSITZ_173",
    "raw_path": "steno_protocols/raw_html/XXVII_NRSITZ_173.html",
    "txt_path": "steno_protocols/plain_text/XXVII_NRSITZ_173.txt"
  },
  {
    "session_date_display": "24.03.2021",
    "session_date_iso": "2021-03-24T00:00:00",
    "gp_code": "XXVII",
    "chamber": "NRSITZ",
    "session_number": 89,
    "title": "89. Sitzung (89/NRSITZ)",
    "citation": "89/NRSITZ",
    "session_detail_url": "https://www.parlament.gv.at/gegenstand/XXVII/NRSITZ/89",
    "protocol_pdf_url": "https://www.parlament.gv.at/dokument/XXVII/NRSITZ/89/fname_981234.pdf",
    "protocol_html_url": "https://www.parlament.gv.at/dokument/XXVII/NRSITZ/89/fnameorig_981234.html",
    "uid": "XXVII_NRSITZ_89",
    "raw_path": "steno_protocols/raw_html/XXVII_NRSITZ_89.html",
    "txt_path": "steno_protocols/plain_text/XXVII_NRSITZ_89.txt"
  },
  {
    "session_date_display": "25.03.2021",
    "session_date_iso": "2021-03-25T00:00:00",
    "gp_code": "XXVII",
    "chamber": "NRSITZ",
    "session_number": 91,
    "title": "91. Sitzung (91/NRSITZ)",
    "citation": "91/NRSITZ",
    "session_detail_url": "https://www.parlament.gv.at/gegenstand/XXVII/NRSITZ/91",
    "protocol_pdf_url": "https://www.parlament.gv.at/dokument/XXVII/NRSITZ/91/fname_989395.pdf",
    "protocol_html_url": "https://www.parlament.gv.at/dokument/XXVII/NRSITZ/91/fnameorig_989395.html",
    "uid": "XXVII_NRSITZ_91",
    "raw_path": "steno_protocols/raw_html/XXVII_NRSITZ_91.html",
    "txt_path": "steno_protocols/plain_text/XXVII_NRSITZ_91.txt"
  },
  {
    "session_date_display": "13.10.2022",
    "session_date_iso": "2022-10-13T00:00:00",
    "gp_code": "XXVII",
    "chamber": "NRSITZ",
    "session_number": 179,
    "title": "179. Sitzung (179/NRSITZ)",
    "citation": "179/NRSITZ",
    "session_detail_url": "https://www.parlament.gv.at/gegenstand/XXVII/NRSITZ/179",
    "protocol_pdf_url": "https://www.parlament.gv.at/dokument/XXVII/NRSITZ/179/fname_1577379.pdf",
    "protocol_html_url": "https://www.parlament.gv.at/dokument/XXVII/NRSITZ/179/fnameorig_1577379.html",
    "uid": "XXVII_NRSITZ_179",
    "raw_path": "steno_protocols/raw_html/XXVII_NRSITZ_179.html",
    "txt_path": "steno_protocols/plain_text/XXVII_NRSITZ_179.txt"
  },
  {
    "session_date_display": "13.11.2019",
    "session_date_iso": "2019-11-13T00:00:00",
    "gp_code": "XXVII",
    "chamber": "NRSITZ",
    "session_number": 4,
    "title": "4. Sitzung (4/NRSITZ)",
    "citation": "4/NRSITZ",
    "session_detail_url": "https://www.parlament.gv.at/gegenstand/XXVII/NRSITZ/4",
    "protocol_pdf_url": "https://www.parlament.gv.at/dokument/XXVII/NRSITZ/4/fname_797718.pdf",
    "protocol_html_url": "https://www.parlament.gv.at/dokument/XXVII/NRSITZ/4/fnameorig_797718.html",
    "uid": "XXVII_NRSITZ_4",
    "raw_path": "steno_protocols/raw_html/XXVII_NRSITZ_4.html",
    "txt_path": "steno_protocols/plain_text/XXVII_NRSITZ_4.txt"
  },
  {
    "session_date_display": "13.07.2023",
    "session_date_iso": "2023-07-13T00:00:00",
    "gp_code": "XXVII",
    "chamber": "BRSITZ",
    "session_number": 957,
    "title": "957. Sitzung (957/BRSITZ/2023)",
    "citation": "957/BRSITZ/2023",
    "session_detail_url": "https://www.parlament.gv.at/gegenstand/BR/BRSITZ/957",
    "protocol_pdf_url": "https://www.parlament.gv.at/dokument/BR/BRSITZ/957/fname_1618280.pdf",
    "protocol_html_url": "https://www.parlament.gv.at/dokument/BR/BRSITZ/957/fnameorig_1618280.html",
    "uid": "XXVII_BRSITZ_957",
    "raw_path": "steno_protocols/raw_html/XXVII_BRSITZ_957.html",
    "txt_path": "steno_protocols/plain_text/XXVII_BRSITZ_957.txt"
  },
  {
    "session_date_display": "11.02.2016",
    "session_date_iso": "2016-02-11T00:00:00",
    "gp_code": "XXV",
    "chamber": "BRSITZ",
    "session_number": 850,
    "title": "850. Sitzung (850/BRSITZ/2016)",
    "citation": "850/BRSITZ/2016",
    "session_detail_url": "https://www.parlament.gv.at/gegenstand/BR/BRSITZ/850",
    "protocol_pdf_url": "https://www.parlament.gv.at/dokument/BR/BRSITZ/850/fname_546250.pdf",
    "protocol_html_url": "https://www.parlament.gv.at/dokument/BR/BRSITZ/850/fnameorig_546250.html",
    "uid": "XXV_BRSITZ_850",
    "raw_path": "steno_protocols/raw_html/XXV_BRSITZ_850.html",
    "txt_path": "steno_protocols/plain_text/XXV_BRSITZ_850.txt"
  },
  {
    "session_date_display": "02.06.2016",
    "session_date_iso": "2016-06-02T00:00:00",
    "gp_code": "XXV",
    "chamber": "BRSITZ",
    "session_number": 854,
    "title": "854. Sitzung (854/BRSITZ/2016)",
    "citation": "854/BRSITZ/2016",
    "session_detail_url": "https://www.parlament.gv.at/gegenstand/BR/BRSITZ/854",
    "protocol_pdf_url": "https://www.parlament.gv.at/dokument/BR/BRSITZ/854/fname_571184.pdf",
    "protocol_html_url": "https://www.parlament.gv.at/dokument/BR/BRSITZ/854/fnameorig_571184.html",
    "uid": "XXV_BRSITZ_854",
    "raw_path": "steno_protocols/raw_html/XXV_BRSITZ_854.html",
    "txt_path": "steno_protocols/plain_text/XXV_BRSITZ_854.txt"
  },
  {
    "session_date_display": "25.07.2008",
    "session_date_iso": "2008-07-25T00:00:00",
    "gp_code": "XXIII",
    "chamber": "BRSITZ",
    "session_number": 759,
    "title": "759. Sitzung (759/BRSITZ/2008)",
    "citation": "759/BRSITZ/2008",
    "session_detail_url": "https://www.parlament.gv.at/gegenstand/BR/BRSITZ/759",
    "protocol_pdf_url": "https://www.parlament.gv.at/dokument/BR/BRSITZ/759/fname_143014.pdf",
    "protocol_html_url": "https://www.parlament.gv.at/dokument/BR/BRSITZ/759/fnameorig_143014.html",
    "uid": "XXIII_BRSITZ_759",
    "raw_path": "steno_protocols/raw_html/XXIII_BRSITZ_759.html",
    "txt_path": "steno_protocols/plain_text/XXIII_BRSITZ_759.txt"
  },
  {
    "session_date_display": "21.12.2005",
    "session_date_iso": "2005-12-21T00:00:00",
    "gp_code": "XXII",
    "chamber": "BRSITZ",
    "session_number": 729,
    "title": "729. Sitzung (729/BRSITZ/2005)",
    "citation": "729/BRSITZ/2005",
    "session_detail_url": "https://www.parlament.gv.at/gegenstand/BR/BRSITZ/729",
    "protocol_pdf_url": "https://www.parlament.gv.at/dokument/BR/BRSITZ/729/fname_059140.pdf",
    "protocol_html_url": "https://www.parlament.gv.at/dokument/BR/BRSITZ/729/fnameorig_059140.html",
    "uid": "XXII_BRSITZ_729",
    "raw_path": "steno_protocols/raw_html/XXII_BRSITZ_729.html",
    "txt_path": "steno_protocols/plain_text/XXII_BRSITZ_729.txt"
  },
  {
    "session_date_display": "02.06.2010",
    "session_date_iso": "2010-06-02T00:00:00",
    "gp_code": "XXIV",
    "chamber": "BRSITZ",
    "session_number": 785,
    "title": "785. Sitzung (785/BRSITZ/2010)",
    "citation": "785/BRSITZ/2010",
    "session_detail_url": "https://www.parlament.gv.at/gegenstand/BR/BRSITZ/785",
    "protocol_pdf_url": "https://www.parlament.gv.at/dokument/BR/BRSITZ/785/fname_189184.pdf",
    "protocol_html_url": "https://www.parlament.gv.at/dokument/BR/BRSITZ/785/fnameorig_189184.html",
    "uid": "XXIV_BRSITZ_785",
    "raw_path": "steno_protocols/raw_html/XXIV_BRSITZ_785.html",
    "txt_path": "steno_protocols/plain_text/XXIV_BRSITZ_785.txt"
  },
  {
    "session_date_display": "07.10.2010",
    "session_date_iso": "2010-10-07T00:00:00",
    "gp_code": "XXIV",
    "chamber": "BRSITZ",
    "session_number": 788,
    "title": "788. Sitzung (788/BRSITZ/2010)",
    "citation": "788/BRSITZ/2010",
    "session_detail_url": "https://www.parlament.gv.at/gegenstand/BR/BRSITZ/788",
    "protocol_pdf_url": "https://www.parlament.gv.at/dokument/BR/BRSITZ/788/fname_198109.pdf",
    "protocol_html_url": "https://www.parlament.gv.at/dokument/BR/BRSITZ/788/fnameorig_198109.html",
    "uid": "XXIV_BRSITZ_788",
    "raw_path": "steno_protocols/raw_html/XXIV_BRSITZ_788.html",
    "txt_path": "steno_protocols/plain_text/XXIV_BRSITZ_788.txt"
  },
  {
    "session_date_display": "11.05.2006",
    "session_date_iso": "2006-05-11T00:00:00",
    "gp_code": "XXII",
    "chamber": "BRSITZ",
    "session_number": 734,
    "title": "734. Sitzung (734/BRSITZ/2006)",
    "citation": "734/BRSITZ/2006",
    "session_detail_url": "https://www.parlament.gv.at/gegenstand/BR/BRSITZ/734",
    "protocol_pdf_url": "https://www.parlament.gv.at/dokument/BR/BRSITZ/734/fname_065987.pdf",
    "protocol_html_url": "https://www.parlament.gv.at/dokument/BR/BRSITZ/734/fnameorig_065987.html",
    "uid": "XXII_BRSITZ_734",
    "raw_path": "steno_protocols/raw_html/XXII_BRSITZ_734.html",
    "txt_path": "steno_protocols/plain_text/XXII_BRSITZ_734.txt"
  },
  {
    "session_date_display": "20.12.2004",
    "session_date_iso": "2004-12-20T00:00:00",
    "gp_code": "XXII",
    "chamber": "BRSITZ",
    "session_number": 717,
    "title": "717. Sitzung (717/BRSITZ/2004)",
    "citation": "717/BRSITZ/2004",
    "session_detail_url": "https://www.parlament.gv.at/gegenstand/BR/BRSITZ/717",
    "protocol_pdf_url": "https://www.parlament.gv.at/dokument/BR/BRSITZ/717/fname_037468.pdf",
    "protocol_html_url": "https://www.parlament.gv.at/dokument/BR/BRSITZ/717/fnameorig_037468.html",
    "uid": "XXII_BRSITZ_717",
    "raw_path": "steno_protocols/raw_html/XXII_BRSITZ_717.html",
    "txt_path": "steno_protocols/plain_text/XXII_BRSITZ_717.txt"
  },
  {
    "session_date_display": "06.07.2017",
    "session_date_iso": "2017-07-06T00:00:00",
    "gp_code": "XXV",
    "chamber": "BRSITZ",
    "session_number": 871,
    "title": "871. Sitzung (871/BRSITZ/2017)",
    "citation": "871/BRSITZ/2017",
    "session_detail_url": "https://www.parlament.gv.at/gegenstand/BR/BRSITZ/871",
    "protocol_pdf_url": "https://www.parlament.gv.at/dokument/BR/BRSITZ/871/fname_675415.pdf",
    "protocol_html_url": "https://www.parlament.gv.at/dokument/BR/BRSITZ/871/fnameorig_675415.html",
    "uid": "XXV_BRSITZ_871",
    "raw_path": "steno_protocols/raw_html/XXV_BRSITZ_871.html",
    "txt_path": "steno_protocols/plain_text/XXV_BRSITZ_871.txt"
  },
  {
    "session_date_display": "05.10.2017",
    "session_date_iso": "2017-10-05T00:00:00",
    "gp_code": "XXV",
    "chamber": "BRSITZ",
    "session_number": 872,
    "title": "872. Sitzung (872/BRSITZ/2017)",
    "citation": "872/BRSITZ/2017",
    "session_detail_url": "https://www.parlament.gv.at/gegenstand/BR/BRSITZ/872",
    "protocol_pdf_url": "https://www.parlament.gv.at/dokument/BR/BRSITZ/872/fname_677603.pdf",
    "protocol_html_url": "https://www.parlament.gv.at/dokument/BR/BRSITZ/872/fnameorig_677603.html",
    "uid": "XXV_BRSITZ_872",
    "raw_path": "steno_protocols/raw_html/XXV_BRSITZ_872.html",
    "txt_path": "steno_protocols/plain_text/XXV_BRSITZ_872.txt"
  },
  {
    "session_date_display": "30.01.2025",
    "session_date_iso": "2025-01-30T00:00:00",
    "gp_code": "XXVIII",
    "chamber": "BRSITZ",
    "session_number": 974,
    "title": "974. Sitzung (974/BRSITZ/2025)",
    "citation": "974/BRSITZ/2025",
    "session_detail_url": "https://www.parlament.gv.at/gegenstand/BR/BRSITZ/974",
    "protocol_pdf_url": "https://www.parlament.gv.at/dokument/BR/BRSITZ/974/imfname_1705080.pdf",
    "protocol_html_url": "https://www.parlament.gv.at/dokument/BR/BRSITZ/974/fnameorig_1705080.html",
    "uid": "XXVIII_BRSITZ_974",
    "raw_path": "steno_protocols/raw_html/XXVIII_BRSITZ_974.html",
    "txt_path": "steno_protocols/plain_text/XXVIII_BRSITZ_974.txt"
  },
  {
    "session_date_display": "07.12.2023",
    "session_date_iso": "2023-12-07T00:00:00",
    "gp_code": "XXVII",
    "chamber": "BRSITZ",
    "session_number": 960,
    "title": "960. Sitzung (960/BRSITZ/2023)",
    "citation": "960/BRSITZ/2023",
    "session_detail_url": "https://www.parlament.gv.at/gegenstand/BR/BRSITZ/960",
    "protocol_pdf_url": "https://www.parlament.gv.at/dokument/BR/BRSITZ/960/fname_1636507.pdf",
    "protocol_html_url": "https://www.parlament.gv.at/dokument/BR/BRSITZ/960/fnameorig_1636507.html",
    "uid": "XXVII_BRSITZ_960",
    "raw_path": "steno_protocols/raw_html/XXVII_BRSITZ_960.html",
    "txt_path": "steno_protocols/plain_text/XXVII_BRSITZ_960.txt"
  },
  {
    "session_date_display": "13.11.2019",
    "session_date_iso": "2019-11-13T00:00:00",
    "gp_code": "XXVII",
    "chamber": "NRSITZ",
    "session_number": 3,
    "title": "3. Sitzung (3/NRSITZ)",
    "citation": "3/NRSITZ",
    "session_detail_url": "https://www.parlament.gv.at/gegenstand/XXVII/NRSITZ/3",
    "protocol_pdf_url": "https://www.parlament.gv.at/dokument/XXVII/NRSITZ/3/fname_797716.pdf",
    "protocol_html_url": "https://www.parlament.gv.at/dokument/XXVII/NRSITZ/3/fnameorig_797716.html",
    "uid": "XXVII_NRSITZ_3",
    "raw_path": "steno_protocols/raw_html/XXVII_NRSITZ_3.html",
    "txt_path": "steno_protocols/plain_text/XXVII_NRSITZ_3.txt"
  },
  {
    "session_date_display": "16.03.2023",
    "session_date_iso": "2023-03-16T00:00:00",
    "gp_code": "XXVII",
    "chamber": "BRSITZ",
    "session_number": 951,
    "title": "951. Sitzung (951/BRSITZ/2023)",
    "citation": "951/BRSITZ/2023",
    "session_detail_url": "https://www.parlament.gv.at/gegenstand/BR/BRSITZ/951",
    "protocol_pdf_url": "https://www.parlament.gv.at/dokument/BR/BRSITZ/951/fname_1591841.pdf",
    "protocol_html_url": "https://www.parlament.gv.at/dokument/BR/BRSITZ/951/fnameorig_1591841.html",
    "uid": "XXVII_BRSITZ_951",
    "raw_path": "steno_protocols/raw_html/XXVII_BRSITZ_951.html",
    "txt_path": "steno_protocols/plain_text/XXVII_BRSITZ_951.txt"
  },
  {
    "session_date_display": "13.03.2009",
    "session_date_iso": "2009-03-13T00:00:00",
    "gp_code": "XXIV",
    "chamber": "BRSITZ",
    "session_number": 767,
    "title": "767. Sitzung (767/BRSITZ/2009)",
    "citation": "767/BRSITZ/2009",
    "session_detail_url": "https://www.parlament.gv.at/gegenstand/BR/BRSITZ/767",
    "protocol_pdf_url": "https://www.parlament.gv.at/dokument/BR/BRSITZ/767/fname_156716.pdf",
    "protocol_html_url": "https://www.parlament.gv.at/dokument/BR/BRSITZ/767/fnameorig_156716.html",
    "uid": "XXIV_BRSITZ_767",
    "raw_path": "steno_protocols/raw_html/XXIV_BRSITZ_767.html",
    "txt_path": "steno_protocols/plain_text/XXIV_BRSITZ_767.txt"
  },
  {
    "session_date_display": "19.12.2008",
    "session_date_iso": "2008-12-19T00:00:00",
    "gp_code": "XXIV",
    "chamber": "BRSITZ",
    "session_number": 763,
    "title": "763. Sitzung (763/BRSITZ/2008)",
    "citation": "763/BRSITZ/2008",
    "session_detail_url": "https://www.parlament.gv.at/gegenstand/BR/BRSITZ/763",
    "protocol_pdf_url": "https://www.parlament.gv.at/dokument/BR/BRSITZ/763/fname_148124.pdf",
    "protocol_html_url": "https://www.parlament.gv.at/dokument/BR/BRSITZ/763/fnameorig_148124.html",
    "uid": "XXIV_BRSITZ_763",
    "raw_path": "steno_protocols/raw_html/XXIV_BRSITZ_763.html",
    "txt_path": "steno_protocols/plain_text/XXIV_BRSITZ_763.txt"
  },
  {
    "session_date_display": "21.12.2016",
    "session_date_iso": "2016-12-21T00:00:00",
    "gp_code": "XXV",
    "chamber": "BRSITZ",
    "session_number": 863,
    "title": "863. Sitzung (863/BRSITZ/2016)",
    "citation": "863/BRSITZ/2016",
    "session_detail_url": "https://www.parlament.gv.at/gegenstand/BR/BRSITZ/863",
    "protocol_pdf_url": "https://www.parlament.gv.at/dokument/BR/BRSITZ/863/fname_646607.pdf",
    "protocol_html_url": "https://www.parlament.gv.at/dokument/BR/BRSITZ/863/fnameorig_646607.html",
    "uid": "XXV_BRSITZ_863",
    "raw_path": "steno_protocols/raw_html/XXV_BRSITZ_863.html",
    "txt_path": "steno_protocols/plain_text/XXV_BRSITZ_863.txt"
  },
  {
    "session_date_display": "23.09.2016",
    "session_date_iso": "2016-09-23T00:00:00",
    "gp_code": "XXV",
    "chamber": "BRSITZ",
    "session_number": 857,
    "title": "857. Sitzung (857/BRSITZ/2016)",
    "citation": "857/BRSITZ/2016",
    "session_detail_url": "https://www.parlament.gv.at/gegenstand/BR/BRSITZ/857",
    "protocol_pdf_url": "https://www.parlament.gv.at/dokument/BR/BRSITZ/857/fname_584147.pdf",
    "protocol_html_url": "https://www.parlament.gv.at/dokument/BR/BRSITZ/857/fnameorig_584147.html",
    "uid": "XXV_BRSITZ_857",
    "raw_path": "steno_protocols/raw_html/XXV_BRSITZ_857.html",
    "txt_path": "steno_protocols/plain_text/XXV_BRSITZ_857.txt"
  },
  {
    "session_date_display": "12.05.2016",
    "session_date_iso": "2016-05-12T00:00:00",
    "gp_code": "XXV",
    "chamber": "BRSITZ",
    "session_number": 853,
    "title": "853. Sitzung (853/BRSITZ/2016)",
    "citation": "853/BRSITZ/2016",
    "session_detail_url": "https://www.parlament.gv.at/gegenstand/BR/BRSITZ/853",
    "protocol_pdf_url": "https://www.parlament.gv.at/dokument/BR/BRSITZ/853/fname_568090.pdf",
    "protocol_html_url": "https://www.parlament.gv.at/dokument/BR/BRSITZ/853/fnameorig_568090.html",
    "uid": "XXV_BRSITZ_853",
    "raw_path": "steno_protocols/raw_html/XXV_BRSITZ_853.html",
    "txt_path": "steno_protocols/plain_text/XXV_BRSITZ_853.txt"
  },
  {
    "session_date_display": "04.11.2005",
    "session_date_iso": "2005-11-04T00:00:00",
    "gp_code": "XXII",
    "chamber": "BRSITZ",
    "session_number": 727,
    "title": "727. Sitzung (727/BRSITZ/2005)",
    "citation": "727/BRSITZ/2005",
    "session_detail_url": "https://www.parlament.gv.at/gegenstand/BR/BRSITZ/727",
    "protocol_pdf_url": "https://www.parlament.gv.at/dokument/BR/BRSITZ/727/fname_054455.pdf",
    "protocol_html_url": "https://www.parlament.gv.at/dokument/BR/BRSITZ/727/fnameorig_054455.html",
    "uid": "XXII_BRSITZ_727",
    "raw_path": "steno_protocols/raw_html/XXII_BRSITZ_727.html",
    "txt_path": "steno_protocols/plain_text/XXII_BRSITZ_727.txt"
  },
  {
    "session_date_display": "31.05.2012",
    "session_date_iso": "2012-05-31T00:00:00",
    "gp_code": "XXIV",
    "chamber": "BRSITZ",
    "session_number": 809,
    "title": "809. Sitzung (809/BRSITZ/2012)",
    "citation": "809/BRSITZ/2012",
    "session_detail_url": "https://www.parlament.gv.at/gegenstand/BR/BRSITZ/809",
    "protocol_pdf_url": "https://www.parlament.gv.at/dokument/BR/BRSITZ/809/fname_270812.pdf",
    "protocol_html_url": "https://www.parlament.gv.at/dokument/BR/BRSITZ/809/fnameorig_270812.html",
    "uid": "XXIV_BRSITZ_809",
    "raw_path": "steno_protocols/raw_html/XXIV_BRSITZ_809.html",
    "txt_path": "steno_protocols/plain_text/XXIV_BRSITZ_809.txt"
  },
  {
    "session_date_display": "14.03.2013",
    "session_date_iso": "2013-03-14T00:00:00",
    "gp_code": "XXIV",
    "chamber": "BRSITZ",
    "session_number": 818,
    "title": "818. Sitzung (818/BRSITZ/2013)",
    "citation": "818/BRSITZ/2013",
    "session_detail_url": "https://www.parlament.gv.at/gegenstand/BR/BRSITZ/818",
    "protocol_pdf_url": "https://www.parlament.gv.at/dokument/BR/BRSITZ/818/fname_305896.pdf",
    "protocol_html_url": "https://www.parlament.gv.at/dokument/BR/BRSITZ/818/fnameorig_305896.html",
    "uid": "XXIV_BRSITZ_818",
    "raw_path": "steno_protocols/raw_html/XXIV_BRSITZ_818.html",
    "txt_path": "steno_protocols/plain_text/XXIV_BRSITZ_818.txt"
  },
  {
    "session_date_display": "09.06.2006",
    "session_date_iso": "2006-06-09T00:00:00",
    "gp_code": "XXII",
    "chamber": "BRSITZ",
    "session_number": 735,
    "title": "735. Sitzung (735/BRSITZ/2006)",
    "citation": "735/BRSITZ/2006",
    "session_detail_url": "https://www.parlament.gv.at/gegenstand/BR/BRSITZ/735",
    "protocol_pdf_url": "https://www.parlament.gv.at/dokument/BR/BRSITZ/735/fname_068324.pdf",
    "protocol_html_url": "https://www.parlament.gv.at/dokument/BR/BRSITZ/735/fnameorig_068324.html",
    "uid": "XXII_BRSITZ_735",
    "raw_path": "steno_protocols/raw_html/XXII_BRSITZ_735.html",
    "txt_path": "steno_protocols/plain_text/XXII_BRSITZ_735.txt"
  },
  {
    "session_date_display": "06.11.2014",
    "session_date_iso": "2014-11-06T00:00:00",
    "gp_code": "XXV",
    "chamber": "BRSITZ",
    "session_number": 834,
    "title": "834. Sitzung (834/BRSITZ/2014)",
    "citation": "834/BRSITZ/2014",
    "session_detail_url": "https://www.parlament.gv.at/gegenstand/BR/BRSITZ/834",
    "protocol_pdf_url": "https://www.parlament.gv.at/dokument/BR/BRSITZ/834/fname_382310.pdf",
    "protocol_html_url": "https://www.parlament.gv.at/dokument/BR/BRSITZ/834/fnameorig_382310.html",
    "uid": "XXV_BRSITZ_834",
    "raw_path": "steno_protocols/raw_html/XXV_BRSITZ_834.html",
    "txt_path": "steno_protocols/plain_text/XXV_BRSITZ_834.txt"
  },
  {
    "session_date_display": "04.10.2012",
    "session_date_iso": "2012-10-04T00:00:00",
    "gp_code": "XXIV",
    "chamber": "BRSITZ",
    "session_number": 813,
    "title": "813. Sitzung (813/BRSITZ/2012)",
    "citation": "813/BRSITZ/2012",
    "session_detail_url": "https://www.parlament.gv.at/gegenstand/BR/BRSITZ/813",
    "protocol_pdf_url": "https://www.parlament.gv.at/dokument/BR/BRSITZ/813/fname_282409.pdf",
    "protocol_html_url": "https://www.parlament.gv.at/dokument/BR/BRSITZ/813/fnameorig_282409.html",
    "uid": "XXIV_BRSITZ_813",
    "raw_path": "steno_protocols/raw_html/XXIV_BRSITZ_813.html",
    "txt_path": "steno_protocols/plain_text/XXIV_BRSITZ_813.txt"
  },
  {
    "session_date_display": "21.12.2022",
    "session_date_iso": "2022-12-21T00:00:00",
    "gp_code": "XXVII",
    "chamber": "BRSITZ",
    "session_number": 949,
    "title": "949. Sitzung (949/BRSITZ/2022)",
    "citation": "949/BRSITZ/2022",
    "session_detail_url": "https://www.parlament.gv.at/gegenstand/BR/BRSITZ/949",
    "protocol_pdf_url": "https://www.parlament.gv.at/dokument/BR/BRSITZ/949/fname_1597239.pdf",
    "protocol_html_url": "https://www.parlament.gv.at/dokument/BR/BRSITZ/949/fnameorig_1597239.html",
    "uid": "XXVII_BRSITZ_949",
    "raw_path": "steno_protocols/raw_html/XXVII_BRSITZ_949.html",
    "txt_path": "steno_protocols/plain_text/XXVII_BRSITZ_949.txt"
  },
  {
    "session_date_display": "26.09.2002",
    "session_date_iso": "2002-09-26T00:00:00",
    "gp_code": "XXI",
    "chamber": "BRSITZ",
    "session_number": 691,
    "title": "691. Sitzung (691/BRSITZ/2002)",
    "citation": "691/BRSITZ/2002",
    "session_detail_url": "https://www.parlament.gv.at/gegenstand/BR/BRSITZ/691",
    "protocol_pdf_url": "https://www.parlament.gv.at/dokument/BR/BRSITZ/691/fname_113979.pdf",
    "protocol_html_url": "https://www.parlament.gv.at/dokument/BR/BRSITZ/691/fnameorig_113979.html",
    "uid": "XXI_BRSITZ_691",
    "raw_path": "steno_protocols/raw_html/XXI_BRSITZ_691.html",
    "txt_path": "steno_protocols/plain_text/XXI_BRSITZ_691.txt"
  },
  {
    "session_date_display": "06.04.2017",
    "session_date_iso": "2017-04-06T00:00:00",
    "gp_code": "XXV",
    "chamber": "BRSITZ",
    "session_number": 866,
    "title": "866. Sitzung (866/BRSITZ/2017)",
    "citation": "866/BRSITZ/2017",
    "session_detail_url": "https://www.parlament.gv.at/gegenstand/BR/BRSITZ/866",
    "protocol_pdf_url": "https://www.parlament.gv.at/dokument/BR/BRSITZ/866/fname_669072.pdf",
    "protocol_html_url": "https://www.parlament.gv.at/dokument/BR/BRSITZ/866/fnameorig_669072.html",
    "uid": "XXV_BRSITZ_866",
    "raw_path": "steno_protocols/raw_html/XXV_BRSITZ_866.html",
    "txt_path": "steno_protocols/plain_text/XXV_BRSITZ_866.txt"
  },
  {
    "session_date_display": "14.07.2022",
    "session_date_iso": "2022-07-14T00:00:00",
    "gp_code": "XXVII",
    "chamber": "BRSITZ",
    "session_number": 944,
    "title": "944. Sitzung (944/BRSITZ/2022)",
    "citation": "944/BRSITZ/2022",
    "session_detail_url": "https://www.parlament.gv.at/gegenstand/BR/BRSITZ/944",
    "protocol_pdf_url": "https://www.parlament.gv.at/dokument/BR/BRSITZ/944/fname_1546380.pdf",
    "protocol_html_url": "https://www.parlament.gv.at/dokument/BR/BRSITZ/944/fnameorig_1546380.html",
    "uid": "XXVII_BRSITZ_944",
    "raw_path": "steno_protocols/raw_html/XXVII_BRSITZ_944.html",
    "txt_path": "steno_protocols/plain_text/XXVII_BRSITZ_944.txt"
  },
  {
    "session_date_display": "25.10.2016",
    "session_date_iso": "2016-10-25T00:00:00",
    "gp_code": "XXV",
    "chamber": "BRSITZ",
    "session_number": 859,
    "title": "859. Sitzung (859/BRSITZ/2016)",
    "citation": "859/BRSITZ/2016",
    "session_detail_url": "https://www.parlament.gv.at/gegenstand/BR/BRSITZ/859",
    "protocol_pdf_url": "https://www.parlament.gv.at/dokument/BR/BRSITZ/859/fname_614026.pdf",
    "protocol_html_url": "https://www.parlament.gv.at/dokument/BR/BRSITZ/859/fnameorig_614026.html",
    "uid": "XXV_BRSITZ_859",
    "raw_path": "steno_protocols/raw_html/XXV_BRSITZ_859.html",
    "txt_path": "steno_protocols/plain_text/XXV_BRSITZ_859.txt"
  },
  {
    "session_date_display": "03.10.2022",
    "session_date_iso": "2022-10-03T00:00:00",
    "gp_code": "XXVII",
    "chamber": "NRSITZ",
    "session_number": 174,
    "title": "174. Sitzung (174/NRSITZ)",
    "citation": "174/NRSITZ",
    "session_detail_url": "https://www.parlament.gv.at/gegenstand/XXVII/NRSITZ/174",
    "protocol_pdf_url": "https://www.parlament.gv.at/dokument/XXVII/NRSITZ/174/fname_1557161.pdf",
    "protocol_html_url": "https://www.parlament.gv.at/dokument/XXVII/NRSITZ/174/fnameorig_1557161.html",
    "uid": "XXVII_NRSITZ_174",
    "raw_path": "steno_protocols/raw_html/XXVII_NRSITZ_174.html",
    "txt_path": "steno_protocols/plain_text/XXVII_NRSITZ_174.txt"
  },
  {
    "session_date_display": "26.03.2021",
    "session_date_iso": "2021-03-26T00:00:00",
    "gp_code": "XXVII",
    "chamber": "NRSITZ",
    "session_number": 93,
    "title": "93. Sitzung (93/NRSITZ)",
    "citation": "93/NRSITZ",
    "session_detail_url": "https://www.parlament.gv.at/gegenstand/XXVII/NRSITZ/93",
    "protocol_pdf_url": "https://www.parlament.gv.at/dokument/XXVII/NRSITZ/93/fname_988836.pdf",
    "protocol_html_url": "https://www.parlament.gv.at/dokument/XXVII/NRSITZ/93/fnameorig_988836.html",
    "uid": "XXVII_NRSITZ_93",
    "raw_path": "steno_protocols/raw_html/XXVII_NRSITZ_93.html",
    "txt_path": "steno_protocols/plain_text/XXVII_NRSITZ_93.txt"
  },
  {
    "session_date_display": "26.03.2021",
    "session_date_iso": "2021-03-26T00:00:00",
    "gp_code": "XXVII",
    "chamber": "NRSITZ",
    "session_number": 94,
    "title": "94. Sitzung (94/NRSITZ)",
    "citation": "94/NRSITZ",
    "session_detail_url": "https://www.parlament.gv.at/gegenstand/XXVII/NRSITZ/94",
    "protocol_pdf_url": "https://www.parlament.gv.at/dokument/XXVII/NRSITZ/94/fname_988847.pdf",
    "protocol_html_url": "https://www.parlament.gv.at/dokument/XXVII/NRSITZ/94/fnameorig_988847.html",
    "uid": "XXVII_NRSITZ_94",
    "raw_path": "steno_protocols/raw_html/XXVII_NRSITZ_94.html",
    "txt_path": "steno_protocols/plain_text/XXVII_NRSITZ_94.txt"
  },
  {
    "session_date_display": "29.06.2023",
    "session_date_iso": "2023-06-29T00:00:00",
    "gp_code": "XXVII",
    "chamber": "BRSITZ",
    "session_number": 955,
    "title": "955. Sitzung (955/BRSITZ/2023)",
    "citation": "955/BRSITZ/2023",
    "session_detail_url": "https://www.parlament.gv.at/gegenstand/BR/BRSITZ/955",
    "protocol_pdf_url": "https://www.parlament.gv.at/dokument/BR/BRSITZ/955/fname_1666465.pdf",
    "protocol_html_url": "https://www.parlament.gv.at/dokument/BR/BRSITZ/955/fnameorig_1666465.html",
    "uid": "XXVII_BRSITZ_955",
    "raw_path": "steno_protocols/raw_html/XXVII_BRSITZ_955.html",
    "txt_path": "steno_protocols/plain_text/XXVII_BRSITZ_955.txt"
  },
  {
    "session_date_display": "31.03.2016",
    "session_date_iso": "2016-03-31T00:00:00",
    "gp_code": "XXV",
    "chamber": "BRSITZ",
    "session_number": 852,
    "title": "852. Sitzung (852/BRSITZ/2016)",
    "citation": "852/BRSITZ/2016",
    "session_detail_url": "https://www.parlament.gv.at/gegenstand/BR/BRSITZ/852",
    "protocol_pdf_url": "https://www.parlament.gv.at/dokument/BR/BRSITZ/852/fname_560726.pdf",
    "protocol_html_url": "https://www.parlament.gv.at/dokument/BR/BRSITZ/852/fnameorig_560726.html",
    "uid": "XXV_BRSITZ_852",
    "raw_path": "steno_protocols/raw_html/XXV_BRSITZ_852.html",
    "txt_path": "steno_protocols/plain_text/XXV_BRSITZ_852.txt"
  },
  {
    "session_date_display": "01.12.2016",
    "session_date_iso": "2016-12-01T00:00:00",
    "gp_code": "XXV",
    "chamber": "BRSITZ",
    "session_number": 861,
    "title": "861. Sitzung (861/BRSITZ/2016)",
    "citation": "861/BRSITZ/2016",
    "session_detail_url": "https://www.parlament.gv.at/gegenstand/BR/BRSITZ/861",
    "protocol_pdf_url": "https://www.parlament.gv.at/dokument/BR/BRSITZ/861/fname_617341.pdf",
    "protocol_html_url": "https://www.parlament.gv.at/dokument/BR/BRSITZ/861/fnameorig_617341.html",
    "uid": "XXV_BRSITZ_861",
    "raw_path": "steno_protocols/raw_html/XXV_BRSITZ_861.html",
    "txt_path": "steno_protocols/plain_text/XXV_BRSITZ_861.txt"
  },
  {
    "session_date_display": "25.01.2006",
    "session_date_iso": "2006-01-25T00:00:00",
    "gp_code": "XXII",
    "chamber": "BRSITZ",
    "session_number": 730,
    "title": "730. Sitzung (730/BRSITZ/2006)",
    "citation": "730/BRSITZ/2006",
    "session_detail_url": "https://www.parlament.gv.at/gegenstand/BR/BRSITZ/730",
    "protocol_pdf_url": "https://www.parlament.gv.at/dokument/BR/BRSITZ/730/fname_059988.pdf",
    "protocol_html_url": "https://www.parlament.gv.at/dokument/BR/BRSITZ/730/fnameorig_059988.html",
    "uid": "XXII_BRSITZ_730",
    "raw_path": "steno_protocols/raw_html/XXII_BRSITZ_730.html",
    "txt_path": "steno_protocols/plain_text/XXII_BRSITZ_730.txt"
  },
  {
    "session_date_display": "19.07.2012",
    "session_date_iso": "2012-07-19T00:00:00",
    "gp_code": "XXIV",
    "chamber": "BRSITZ",
    "session_number": 812,
    "title": "812. Sitzung (812/BRSITZ/2012)",
    "citation": "812/BRSITZ/2012",
    "session_detail_url": "https://www.parlament.gv.at/gegenstand/BR/BRSITZ/812",
    "protocol_pdf_url": "https://www.parlament.gv.at/dokument/BR/BRSITZ/812/fname_278073.pdf",
    "protocol_html_url": "https://www.parlament.gv.at/dokument/BR/BRSITZ/812/fnameorig_278073.html",
    "uid": "XXIV_BRSITZ_812",
    "raw_path": "steno_protocols/raw_html/XXIV_BRSITZ_812.html",
    "txt_path": "steno_protocols/plain_text/XXIV_BRSITZ_812.txt"
  },
  {
    "session_date_display": "24.04.2008",
    "session_date_iso": "2008-04-24T00:00:00",
    "gp_code": "XXIII",
    "chamber": "BRSITZ",
    "session_number": 755,
    "title": "755. Sitzung (755/BRSITZ/2008)",
    "citation": "755/BRSITZ/2008",
    "session_detail_url": "https://www.parlament.gv.at/gegenstand/BR/BRSITZ/755",
    "protocol_pdf_url": "https://www.parlament.gv.at/dokument/BR/BRSITZ/755/fname_116987.pdf",
    "protocol_html_url": "https://www.parlament.gv.at/dokument/BR/BRSITZ/755/fnameorig_116987.html",
    "uid": "XXIII_BRSITZ_755",
    "raw_path": "steno_protocols/raw_html/XXIII_BRSITZ_755.html",
    "txt_path": "steno_protocols/plain_text/XXIII_BRSITZ_755.txt"
  },
  {
    "session_date_display": "06.07.2006",
    "session_date_iso": "2006-07-06T00:00:00",
    "gp_code": "XXII",
    "chamber": "BRSITZ",
    "session_number": 736,
    "title": "736. Sitzung (736/BRSITZ/2006)",
    "citation": "736/BRSITZ/2006",
    "session_detail_url": "https://www.parlament.gv.at/gegenstand/BR/BRSITZ/736",
    "protocol_pdf_url": "https://www.parlament.gv.at/dokument/BR/BRSITZ/736/fname_068960.pdf",
    "protocol_html_url": "https://www.parlament.gv.at/dokument/BR/BRSITZ/736/fnameorig_068960.html",
    "uid": "XXII_BRSITZ_736",
    "raw_path": "steno_protocols/raw_html/XXII_BRSITZ_736.html",
    "txt_path": "steno_protocols/plain_text/XXII_BRSITZ_736.txt"
  },
  {
    "session_date_display": "19.12.2007",
    "session_date_iso": "2007-12-19T00:00:00",
    "gp_code": "XXIII",
    "chamber": "BRSITZ",
    "session_number": 751,
    "title": "751. Sitzung (751/BRSITZ/2007)",
    "citation": "751/BRSITZ/2007",
    "session_detail_url": "https://www.parlament.gv.at/gegenstand/BR/BRSITZ/751",
    "protocol_pdf_url": "https://www.parlament.gv.at/dokument/BR/BRSITZ/751/fname_106989.pdf",
    "protocol_html_url": "https://www.parlament.gv.at/dokument/BR/BRSITZ/751/fnameorig_106989.html",
    "uid": "XXIII_BRSITZ_751",
    "raw_path": "steno_protocols/raw_html/XXIII_BRSITZ_751.html",
    "txt_path": "steno_protocols/plain_text/XXIII_BRSITZ_751.txt"
  },
  {
    "session_date_display": "11.05.2017",
    "session_date_iso": "2017-05-11T00:00:00",
    "gp_code": "XXV",
    "chamber": "BRSITZ",
    "session_number": 867,
    "title": "867. Sitzung (867/BRSITZ/2017)",
    "citation": "867/BRSITZ/2017",
    "session_detail_url": "https://www.parlament.gv.at/gegenstand/BR/BRSITZ/867",
    "protocol_pdf_url": "https://www.parlament.gv.at/dokument/BR/BRSITZ/867/fname_669332.pdf",
    "protocol_html_url": "https://www.parlament.gv.at/dokument/BR/BRSITZ/867/fnameorig_669332.html",
    "uid": "XXV_BRSITZ_867",
    "raw_path": "steno_protocols/raw_html/XXV_BRSITZ_867.html",
    "txt_path": "steno_protocols/plain_text/XXV_BRSITZ_867.txt"
  },
  {
    "session_date_display": "11.07.2024",
    "session_date_iso": "2024-07-11T00:00:00",
    "gp_code": "XXVII",
    "chamber": "BRSITZ",
    "session_number": 970,
    "title": "970. Sitzung (970/BRSITZ/2024)",
    "citation": "970/BRSITZ/2024",
    "session_detail_url": "https://www.parlament.gv.at/gegenstand/BR/BRSITZ/970",
    "protocol_pdf_url": "https://www.parlament.gv.at/dokument/BR/BRSITZ/970/fname_1686356.pdf",
    "protocol_html_url": "https://www.parlament.gv.at/dokument/BR/BRSITZ/970/fnameorig_1686356.html",
    "uid": "XXVII_BRSITZ_970",
    "raw_path": "steno_protocols/raw_html/XXVII_BRSITZ_970.html",
    "txt_path": "steno_protocols/plain_text/XXVII_BRSITZ_970.txt"
  },
  {
    "session_date_display": "20.12.2023",
    "session_date_iso": "2023-12-20T00:00:00",
    "gp_code": "XXVII",
    "chamber": "BRSITZ",
    "session_number": 961,
    "title": "961. Sitzung (961/BRSITZ/2023)",
    "citation": "961/BRSITZ/2023",
    "session_detail_url": "https://www.parlament.gv.at/gegenstand/BR/BRSITZ/961",
    "protocol_pdf_url": "https://www.parlament.gv.at/dokument/BR/BRSITZ/961/fname_1637775.pdf",
    "protocol_html_url": "https://www.parlament.gv.at/dokument/BR/BRSITZ/961/fnameorig_1637775.html",
    "uid": "XXVII_BRSITZ_961",
    "raw_path": "steno_protocols/raw_html/XXVII_BRSITZ_961.html",
    "txt_path": "steno_protocols/plain_text/XXVII_BRSITZ_961.txt"
  },
  {
    "session_date_display": "15.02.2024",
    "session_date_iso": "2024-02-15T00:00:00",
    "gp_code": "XXVII",
    "chamber": "BRSITZ",
    "session_number": 963,
    "title": "963. Sitzung (963/BRSITZ/2024)",
    "citation": "963/BRSITZ/2024",
    "session_detail_url": "https://www.parlament.gv.at/gegenstand/BR/BRSITZ/963",
    "protocol_pdf_url": "https://www.parlament.gv.at/dokument/BR/BRSITZ/963/fname_1659940.pdf",
    "protocol_html_url": "https://www.parlament.gv.at/dokument/BR/BRSITZ/963/fnameorig_1659940.html",
    "uid": "XXVII_BRSITZ_963",
    "raw_path": "steno_protocols/raw_html/XXVII_BRSITZ_963.html",
    "txt_path": "steno_protocols/plain_text/XXVII_BRSITZ_963.txt"
  },
  {
    "session_date_display": "21.12.2023",
    "session_date_iso": "2023-12-21T00:00:00",
    "gp_code": "XXVII",
    "chamber": "BRSITZ",
    "session_number": 962,
    "title": "962. Sitzung (962/BRSITZ/2023)",
    "citation": "962/BRSITZ/2023",
    "session_detail_url": "https://www.parlament.gv.at/gegenstand/BR/BRSITZ/962",
    "protocol_pdf_url": "https://www.parlament.gv.at/dokument/BR/BRSITZ/962/fname_1648643.pdf",
    "protocol_html_url": "https://www.parlament.gv.at/dokument/BR/BRSITZ/962/fnameorig_1648643.html",
    "uid": "XXVII_BRSITZ_962",
    "raw_path": "steno_protocols/raw_html/XXVII_BRSITZ_962.html",
    "txt_path": "steno_protocols/plain_text/XXVII_BRSITZ_962.txt"
  },
  {
    "session_date_display": "14.04.2005",
    "session_date_iso": "2005-04-14T00:00:00",
    "gp_code": "XXII",
    "chamber": "BRSITZ",
    "session_number": 720,
    "title": "720. Sitzung (720/BRSITZ/2005)",
    "citation": "720/BRSITZ/2005",
    "session_detail_url": "https://www.parlament.gv.at/gegenstand/BR/BRSITZ/720",
    "protocol_pdf_url": "https://www.parlament.gv.at/dokument/BR/BRSITZ/720/fname_044485.pdf",
    "protocol_html_url": "https://www.parlament.gv.at/dokument/BR/BRSITZ/720/fnameorig_044485.html",
    "uid": "XXII_BRSITZ_720",
    "raw_path": "steno_protocols/raw_html/XXII_BRSITZ_720.html",
    "txt_path": "steno_protocols/plain_text/XXII_BRSITZ_720.txt"
  },
  {
    "session_date_display": "04.10.2022",
    "session_date_iso": "2022-10-04T00:00:00",
    "gp_code": "XXVII",
    "chamber": "NRSITZ",
    "session_number": 177,
    "title": "177. Sitzung (177/NRSITZ)",
    "citation": "177/NRSITZ",
    "session_detail_url": "https://www.parlament.gv.at/gegenstand/XXVII/NRSITZ/177",
    "protocol_pdf_url": "https://www.parlament.gv.at/dokument/XXVII/NRSITZ/177/fname_1547880.pdf",
    "protocol_html_url": "https://www.parlament.gv.at/dokument/XXVII/NRSITZ/177/fnameorig_1547880.html",
    "uid": "XXVII_NRSITZ_177",
    "raw_path": "steno_protocols/raw_html/XXVII_NRSITZ_177.html",
    "txt_path": "steno_protocols/plain_text/XXVII_NRSITZ_177.txt"
  },
  {
    "session_date_display": "23.10.2019",
    "session_date_iso": "2019-10-23T00:00:00",
    "gp_code": "XXVII",
    "chamber": "NRSITZ",
    "session_number": 2,
    "title": "2. Sitzung (2/NRSITZ)",
    "citation": "2/NRSITZ",
    "session_detail_url": "https://www.parlament.gv.at/gegenstand/XXVII/NRSITZ/2",
    "protocol_pdf_url": "https://www.parlament.gv.at/dokument/XXVII/NRSITZ/2/fname_796484.pdf",
    "protocol_html_url": "https://www.parlament.gv.at/dokument/XXVII/NRSITZ/2/fnameorig_796484.html",
    "uid": "XXVII_NRSITZ_2",
    "raw_path": "steno_protocols/raw_html/XXVII_NRSITZ_2.html",
    "txt_path": "steno_protocols/plain_text/XXVII_NRSITZ_2.txt"
  },
  {
    "session_date_display": "03.05.2021",
    "session_date_iso": "2021-05-03T00:00:00",
    "gp_code": "XXVII",
    "chamber": "NRSITZ",
    "session_number": 101,
    "title": "101. Sitzung (101/NRSITZ)",
    "citation": "101/NRSITZ",
    "session_detail_url": "https://www.parlament.gv.at/gegenstand/XXVII/NRSITZ/101",
    "protocol_pdf_url": "https://www.parlament.gv.at/dokument/XXVII/NRSITZ/101/fname_997507.pdf",
    "protocol_html_url": "https://www.parlament.gv.at/dokument/XXVII/NRSITZ/101/fnameorig_997507.html",
    "uid": "XXVII_NRSITZ_101",
    "raw_path": "steno_protocols/raw_html/XXVII_NRSITZ_101.html",
    "txt_path": "steno_protocols/plain_text/XXVII_NRSITZ_101.txt"
  },
  {
    "session_date_display": "17.05.2021",
    "session_date_iso": "2021-05-17T00:00:00",
    "gp_code": "XXVII",
    "chamber": "NRSITZ",
    "session_number": 103,
    "title": "103. Sitzung (103/NRSITZ)",
    "citation": "103/NRSITZ",
    "session_detail_url": "https://www.parlament.gv.at/gegenstand/XXVII/NRSITZ/103",
    "protocol_pdf_url": "https://www.parlament.gv.at/dokument/XXVII/NRSITZ/103/fname_999795.pdf",
    "protocol_html_url": "https://www.parlament.gv.at/dokument/XXVII/NRSITZ/103/fnameorig_999795.html",
    "uid": "XXVII_NRSITZ_103",
    "raw_path": "steno_protocols/raw_html/XXVII_NRSITZ_103.html",
    "txt_path": "steno_protocols/plain_text/XXVII_NRSITZ_103.txt"
  },
  {
    "session_date_display": "19.05.2021",
    "session_date_iso": "2021-05-19T00:00:00",
    "gp_code": "XXVII",
    "chamber": "NRSITZ",
    "session_number": 105,
    "title": "105. Sitzung (105/NRSITZ)",
    "citation": "105/NRSITZ",
    "session_detail_url": "https://www.parlament.gv.at/gegenstand/XXVII/NRSITZ/105",
    "protocol_pdf_url": "https://www.parlament.gv.at/dokument/XXVII/NRSITZ/105/fname_1009186.pdf",
    "protocol_html_url": "https://www.parlament.gv.at/dokument/XXVII/NRSITZ/105/fnameorig_1009186.html",
    "uid": "XXVII_NRSITZ_105",
    "raw_path": "steno_protocols/raw_html/XXVII_NRSITZ_105.html",
    "txt_path": "steno_protocols/plain_text/XXVII_NRSITZ_105.txt"
  },
  {
    "session_date_display": "19.03.2020",
    "session_date_iso": "2020-03-19T00:00:00",
    "gp_code": "XXVII",
    "chamber": "NRSITZ",
    "session_number": 17,
    "title": "17. Sitzung (17/NRSITZ)",
    "citation": "17/NRSITZ",
    "session_detail_url": "https://www.parlament.gv.at/gegenstand/XXVII/NRSITZ/17",
    "protocol_pdf_url": "https://www.parlament.gv.at/dokument/XXVII/NRSITZ/17/fname_798887.pdf",
    "protocol_html_url": "https://www.parlament.gv.at/dokument/XXVII/NRSITZ/17/fnameorig_798887.html",
    "uid": "XXVII_NRSITZ_17",
    "raw_path": "steno_protocols/raw_html/XXVII_NRSITZ_17.html",
    "txt_path": "steno_protocols/plain_text/XXVII_NRSITZ_17.txt"
  },
  {
    "session_date_display": "22.04.2020",
    "session_date_iso": "2020-04-22T00:00:00",
    "gp_code": "XXVII",
    "chamber": "NRSITZ",
    "session_number": 24,
    "title": "24. Sitzung (24/NRSITZ)",
    "citation": "24/NRSITZ",
    "session_detail_url": "https://www.parlament.gv.at/gegenstand/XXVII/NRSITZ/24",
    "protocol_pdf_url": "https://www.parlament.gv.at/dokument/XXVII/NRSITZ/24/fname_806848.pdf",
    "protocol_html_url": "https://www.parlament.gv.at/dokument/XXVII/NRSITZ/24/fnameorig_806848.html",
    "uid": "XXVII_NRSITZ_24",
    "raw_path": "steno_protocols/raw_html/XXVII_NRSITZ_24.html",
    "txt_path": "steno_protocols/plain_text/XXVII_NRSITZ_24.txt"
  },
  {
    "session_date_display": "22.04.2020",
    "session_date_iso": "2020-04-22T00:00:00",
    "gp_code": "XXVII",
    "chamber": "NRSITZ",
    "session_number": 26,
    "title": "26. Sitzung (26/NRSITZ)",
    "citation": "26/NRSITZ",
    "session_detail_url": "https://www.parlament.gv.at/gegenstand/XXVII/NRSITZ/26",
    "protocol_pdf_url": "https://www.parlament.gv.at/dokument/XXVII/NRSITZ/26/fname_806815.pdf",
    "protocol_html_url": "https://www.parlament.gv.at/dokument/XXVII/NRSITZ/26/fnameorig_806815.html",
    "uid": "XXVII_NRSITZ_26",
    "raw_path": "steno_protocols/raw_html/XXVII_NRSITZ_26.html",
    "txt_path": "steno_protocols/plain_text/XXVII_NRSITZ_26.txt"
  },
  {
    "session_date_display": "13.10.2021",
    "session_date_iso": "2021-10-13T00:00:00",
    "gp_code": "XXVII",
    "chamber": "NRSITZ",
    "session_number": 125,
    "title": "125. Sitzung (125/NRSITZ)",
    "citation": "125/NRSITZ",
    "session_detail_url": "https://www.parlament.gv.at/gegenstand/XXVII/NRSITZ/125",
    "protocol_pdf_url": "https://www.parlament.gv.at/dokument/XXVII/NRSITZ/125/fname_1426372.pdf",
    "protocol_html_url": "https://www.parlament.gv.at/dokument/XXVII/NRSITZ/125/fnameorig_1426372.html",
    "uid": "XXVII_NRSITZ_125",
    "raw_path": "steno_protocols/raw_html/XXVII_NRSITZ_125.html",
    "txt_path": "steno_protocols/plain_text/XXVII_NRSITZ_125.txt"
  },
  {
    "session_date_display": "18.06.2020",
    "session_date_iso": "2020-06-18T00:00:00",
    "gp_code": "XXVII",
    "chamber": "NRSITZ",
    "session_number": 38,
    "title": "38. Sitzung (38/NRSITZ)",
    "citation": "38/NRSITZ",
    "session_detail_url": "https://www.parlament.gv.at/gegenstand/XXVII/NRSITZ/38",
    "protocol_pdf_url": "https://www.parlament.gv.at/dokument/XXVII/NRSITZ/38/fname_841314.pdf",
    "protocol_html_url": "https://www.parlament.gv.at/dokument/XXVII/NRSITZ/38/fnameorig_841314.html",
    "uid": "XXVII_NRSITZ_38",
    "raw_path": "steno_protocols/raw_html/XXVII_NRSITZ_38.html",
    "txt_path": "steno_protocols/plain_text/XXVII_NRSITZ_38.txt"
  },
  {
    "session_date_display": "15.12.2021",
    "session_date_iso": "2021-12-15T00:00:00",
    "gp_code": "XXVII",
    "chamber": "NRSITZ",
    "session_number": 135,
    "title": "135. Sitzung (135/NRSITZ)",
    "citation": "135/NRSITZ",
    "session_detail_url": "https://www.parlament.gv.at/gegenstand/XXVII/NRSITZ/135",
    "protocol_pdf_url": "https://www.parlament.gv.at/dokument/XXVII/NRSITZ/135/fname_1463119.pdf",
    "protocol_html_url": "https://www.parlament.gv.at/dokument/XXVII/NRSITZ/135/fnameorig_1463119.html",
    "uid": "XXVII_NRSITZ_135",
    "raw_path": "steno_protocols/raw_html/XXVII_NRSITZ_135.html",
    "txt_path": "steno_protocols/plain_text/XXVII_NRSITZ_135.txt"
  },
  {
    "session_date_display": "30.06.2020",
    "session_date_iso": "2020-06-30T00:00:00",
    "gp_code": "XXVII",
    "chamber": "NRSITZ",
    "session_number": 42,
    "title": "42. Sitzung (42/NRSITZ)",
    "citation": "42/NRSITZ",
    "session_detail_url": "https://www.parlament.gv.at/gegenstand/XXVII/NRSITZ/42",
    "protocol_pdf_url": "https://www.parlament.gv.at/dokument/XXVII/NRSITZ/42/fname_844428.pdf",
    "protocol_html_url": "https://www.parlament.gv.at/dokument/XXVII/NRSITZ/42/fnameorig_844428.html",
    "uid": "XXVII_NRSITZ_42",
    "raw_path": "steno_protocols/raw_html/XXVII_NRSITZ_42.html",
    "txt_path": "steno_protocols/plain_text/XXVII_NRSITZ_42.txt"
  },
  {
    "session_date_display": "07.07.2020",
    "session_date_iso": "2020-07-07T00:00:00",
    "gp_code": "XXVII",
    "chamber": "NRSITZ",
    "session_number": 43,
    "title": "43. Sitzung (43/NRSITZ)",
    "citation": "43/NRSITZ",
    "session_detail_url": "https://www.parlament.gv.at/gegenstand/XXVII/NRSITZ/43",
    "protocol_pdf_url": "https://www.parlament.gv.at/dokument/XXVII/NRSITZ/43/fname_845422.pdf",
    "protocol_html_url": "https://www.parlament.gv.at/dokument/XXVII/NRSITZ/43/fnameorig_845422.html",
    "uid": "XXVII_NRSITZ_43",
    "raw_path": "steno_protocols/raw_html/XXVII_NRSITZ_43.html",
    "txt_path": "steno_protocols/plain_text/XXVII_NRSITZ_43.txt"
  },
  {
    "session_date_display": "24.02.2022",
    "session_date_iso": "2022-02-24T00:00:00",
    "gp_code": "XXVII",
    "chamber": "NRSITZ",
    "session_number": 143,
    "title": "143. Sitzung (143/NRSITZ)",
    "citation": "143/NRSITZ",
    "session_detail_url": "https://www.parlament.gv.at/gegenstand/XXVII/NRSITZ/143",
    "protocol_pdf_url": "https://www.parlament.gv.at/dokument/XXVII/NRSITZ/143/fname_1449206.pdf",
    "protocol_html_url": "https://www.parlament.gv.at/dokument/XXVII/NRSITZ/143/fnameorig_1449206.html",
    "uid": "XXVII_NRSITZ_143",
    "raw_path": "steno_protocols/raw_html/XXVII_NRSITZ_143.html",
    "txt_path": "steno_protocols/plain_text/XXVII_NRSITZ_143.txt"
  },
  {
    "session_date_display": "24.03.2022",
    "session_date_iso": "2022-03-24T00:00:00",
    "gp_code": "XXVII",
    "chamber": "NRSITZ",
    "session_number": 150,
    "title": "150. Sitzung (150/NRSITZ)",
    "citation": "150/NRSITZ",
    "session_detail_url": "https://www.parlament.gv.at/gegenstand/XXVII/NRSITZ/150",
    "protocol_pdf_url": "https://www.parlament.gv.at/dokument/XXVII/NRSITZ/150/fname_1513837.pdf",
    "protocol_html_url": "https://www.parlament.gv.at/dokument/XXVII/NRSITZ/150/fnameorig_1513837.html",
    "uid": "XXVII_NRSITZ_150",
    "raw_path": "steno_protocols/raw_html/XXVII_NRSITZ_150.html",
    "txt_path": "steno_protocols/plain_text/XXVII_NRSITZ_150.txt"
  },
  {
    "session_date_display": "05.04.2022",
    "session_date_iso": "2022-04-05T00:00:00",
    "gp_code": "XXVII",
    "chamber": "NRSITZ",
    "session_number": 151,
    "title": "151. Sitzung (151/NRSITZ)",
    "citation": "151/NRSITZ",
    "session_detail_url": "https://www.parlament.gv.at/gegenstand/XXVII/NRSITZ/151",
    "protocol_pdf_url": "https://www.parlament.gv.at/dokument/XXVII/NRSITZ/151/fname_1471859.pdf",
    "protocol_html_url": "https://www.parlament.gv.at/dokument/XXVII/NRSITZ/151/fnameorig_1471859.html",
    "uid": "XXVII_NRSITZ_151",
    "raw_path": "steno_protocols/raw_html/XXVII_NRSITZ_151.html",
    "txt_path": "steno_protocols/plain_text/XXVII_NRSITZ_151.txt"
  },
  {
    "session_date_display": "27.04.2022",
    "session_date_iso": "2022-04-27T00:00:00",
    "gp_code": "XXVII",
    "chamber": "NRSITZ",
    "session_number": 153,
    "title": "153. Sitzung (153/NRSITZ)",
    "citation": "153/NRSITZ",
    "session_detail_url": "https://www.parlament.gv.at/gegenstand/XXVII/NRSITZ/153",
    "protocol_pdf_url": "https://www.parlament.gv.at/dokument/XXVII/NRSITZ/153/fname_1470286.pdf",
    "protocol_html_url": "https://www.parlament.gv.at/dokument/XXVII/NRSITZ/153/fnameorig_1470286.html",
    "uid": "XXVII_NRSITZ_153",
    "raw_path": "steno_protocols/raw_html/XXVII_NRSITZ_153.html",
    "txt_path": "steno_protocols/plain_text/XXVII_NRSITZ_153.txt"
  },
  {
    "session_date_display": "20.11.2020",
    "session_date_iso": "2020-11-20T00:00:00",
    "gp_code": "XXVII",
    "chamber": "NRSITZ",
    "session_number": 64,
    "title": "64. Sitzung (64/NRSITZ)",
    "citation": "64/NRSITZ",
    "session_detail_url": "https://www.parlament.gv.at/gegenstand/XXVII/NRSITZ/64",
    "protocol_pdf_url": "https://www.parlament.gv.at/dokument/XXVII/NRSITZ/64/fname_885549.pdf",
    "protocol_html_url": "https://www.parlament.gv.at/dokument/XXVII/NRSITZ/64/fnameorig_885549.html",
    "uid": "XXVII_NRSITZ_64",
    "raw_path": "steno_protocols/raw_html/XXVII_NRSITZ_64.html",
    "txt_path": "steno_protocols/plain_text/XXVII_NRSITZ_64.txt"
  },
  {
    "session_date_display": "19.05.2022",
    "session_date_iso": "2022-05-19T00:00:00",
    "gp_code": "XXVII",
    "chamber": "NRSITZ",
    "session_number": 158,
    "title": "158. Sitzung (158/NRSITZ)",
    "citation": "158/NRSITZ",
    "session_detail_url": "https://www.parlament.gv.at/gegenstand/XXVII/NRSITZ/158",
    "protocol_pdf_url": "https://www.parlament.gv.at/dokument/XXVII/NRSITZ/158/fname_1481175.pdf",
    "protocol_html_url": "https://www.parlament.gv.at/dokument/XXVII/NRSITZ/158/fnameorig_1481175.html",
    "uid": "XXVII_NRSITZ_158",
    "raw_path": "steno_protocols/raw_html/XXVII_NRSITZ_158.html",
    "txt_path": "steno_protocols/plain_text/XXVII_NRSITZ_158.txt"
  },
  {
    "session_date_display": "14.06.2022",
    "session_date_iso": "2022-06-14T00:00:00",
    "gp_code": "XXVII",
    "chamber": "NRSITZ",
    "session_number": 160,
    "title": "160. Sitzung (160/NRSITZ)",
    "citation": "160/NRSITZ",
    "session_detail_url": "https://www.parlament.gv.at/gegenstand/XXVII/NRSITZ/160",
    "protocol_pdf_url": "https://www.parlament.gv.at/dokument/XXVII/NRSITZ/160/fname_1513040.pdf",
    "protocol_html_url": "https://www.parlament.gv.at/dokument/XXVII/NRSITZ/160/fnameorig_1513040.html",
    "uid": "XXVII_NRSITZ_160",
    "raw_path": "steno_protocols/raw_html/XXVII_NRSITZ_160.html",
    "txt_path": "steno_protocols/plain_text/XXVII_NRSITZ_160.txt"
  },
  {
    "session_date_display": "14.06.2022",
    "session_date_iso": "2022-06-14T00:00:00",
    "gp_code": "XXVII",
    "chamber": "NRSITZ",
    "session_number": 161,
    "title": "161. Sitzung (161/NRSITZ)",
    "citation": "161/NRSITZ",
    "session_detail_url": "https://www.parlament.gv.at/gegenstand/XXVII/NRSITZ/161",
    "protocol_pdf_url": "https://www.parlament.gv.at/dokument/XXVII/NRSITZ/161/fname_1513006.pdf",
    "protocol_html_url": "https://www.parlament.gv.at/dokument/XXVII/NRSITZ/161/fnameorig_1513006.html",
    "uid": "XXVII_NRSITZ_161",
    "raw_path": "steno_protocols/raw_html/XXVII_NRSITZ_161.html",
    "txt_path": "steno_protocols/plain_text/XXVII_NRSITZ_161.txt"
  },
  {
    "session_date_display": "21.12.2020",
    "session_date_iso": "2020-12-21T00:00:00",
    "gp_code": "XXVII",
    "chamber": "NRSITZ",
    "session_number": 73,
    "title": "73. Sitzung (73/NRSITZ)",
    "citation": "73/NRSITZ",
    "session_detail_url": "https://www.parlament.gv.at/gegenstand/XXVII/NRSITZ/73",
    "protocol_pdf_url": "https://www.parlament.gv.at/dokument/XXVII/NRSITZ/73/fname_946648.pdf",
    "protocol_html_url": "https://www.parlament.gv.at/dokument/XXVII/NRSITZ/73/fnameorig_946648.html",
    "uid": "XXVII_NRSITZ_73",
    "raw_path": "steno_protocols/raw_html/XXVII_NRSITZ_73.html",
    "txt_path": "steno_protocols/plain_text/XXVII_NRSITZ_73.txt"
  },
  {
    "session_date_display": "08.07.2022",
    "session_date_iso": "2022-07-08T00:00:00",
    "gp_code": "XXVII",
    "chamber": "NRSITZ",
    "session_number": 169,
    "title": "169. Sitzung (169/NRSITZ)",
    "citation": "169/NRSITZ",
    "session_detail_url": "https://www.parlament.gv.at/gegenstand/XXVII/NRSITZ/169",
    "protocol_pdf_url": "https://www.parlament.gv.at/dokument/XXVII/NRSITZ/169/fname_1532111.pdf",
    "protocol_html_url": "https://www.parlament.gv.at/dokument/XXVII/NRSITZ/169/fnameorig_1532111.html",
    "uid": "XXVII_NRSITZ_169",
    "raw_path": "steno_protocols/raw_html/XXVII_NRSITZ_169.html",
    "txt_path": "steno_protocols/plain_text/XXVII_NRSITZ_169.txt"
  },
  {
    "session_date_display": "20.01.2021",
    "session_date_iso": "2021-01-20T00:00:00",
    "gp_code": "XXVII",
    "chamber": "NRSITZ",
    "session_number": 80,
    "title": "80. Sitzung (80/NRSITZ)",
    "citation": "80/NRSITZ",
    "session_detail_url": "https://www.parlament.gv.at/gegenstand/XXVII/NRSITZ/80",
    "protocol_pdf_url": "https://www.parlament.gv.at/dokument/XXVII/NRSITZ/80/fname_954399.pdf",
    "protocol_html_url": "https://www.parlament.gv.at/dokument/XXVII/NRSITZ/80/fnameorig_954399.html",
    "uid": "XXVII_NRSITZ_80",
    "raw_path": "steno_protocols/raw_html/XXVII_NRSITZ_80.html",
    "txt_path": "steno_protocols/plain_text/XXVII_NRSITZ_80.txt"
  },
  {
    "session_date_display": "09.02.2000",
    "session_date_iso": "2000-02-09T00:00:00",
    "gp_code": "XXI",
    "chamber": "NRSITZ",
    "session_number": 9,
    "title": "9. Sitzung (9/NRSITZ)",
    "citation": "9/NRSITZ",
    "session_detail_url": "https://www.parlament.gv.at/gegenstand/XXI/NRSITZ/9",
    "protocol_pdf_url": "https://www.parlament.gv.at/dokument/XXI/NRSITZ/9/fname_114373.pdf",
    "protocol_html_url": "https://www.parlament.gv.at/dokument/XXI/NRSITZ/9/fnameorig_114373.html",
    "uid": "XXI_NRSITZ_9",
    "raw_path": "steno_protocols/raw_html/XXI_NRSITZ_9.html",
    "txt_path": "steno_protocols/plain_text/XXI_NRSITZ_9.txt"
  },
  {
    "session_date_display": "21.03.2000",
    "session_date_iso": "2000-03-21T00:00:00",
    "gp_code": "XXI",
    "chamber": "NRSITZ",
    "session_number": 16,
    "title": "16. Sitzung (16/NRSITZ)",
    "citation": "16/NRSITZ",
    "session_detail_url": "https://www.parlament.gv.at/gegenstand/XXI/NRSITZ/16",
    "protocol_pdf_url": "https://www.parlament.gv.at/dokument/XXI/NRSITZ/16/fname_114387.pdf",
    "protocol_html_url": "https://www.parlament.gv.at/dokument/XXI/NRSITZ/16/fnameorig_114387.html",
    "uid": "XXI_NRSITZ_16",
    "raw_path": "steno_protocols/raw_html/XXI_NRSITZ_16.html",
    "txt_path": "steno_protocols/plain_text/XXI_NRSITZ_16.txt"
  },
  {
    "session_date_display": "13.06.2002",
    "session_date_iso": "2002-06-13T00:00:00",
    "gp_code": "XXI",
    "chamber": "NRSITZ",
    "session_number": 108,
    "title": "108. Sitzung (108/NRSITZ)",
    "citation": "108/NRSITZ",
    "session_detail_url": "https://www.parlament.gv.at/gegenstand/XXI/NRSITZ/108",
    "protocol_pdf_url": "https://www.parlament.gv.at/dokument/XXI/NRSITZ/108/fname_114571.pdf",
    "protocol_html_url": "https://www.parlament.gv.at/dokument/XXI/NRSITZ/108/fnameorig_114571.html",
    "uid": "XXI_NRSITZ_108",
    "raw_path": "steno_protocols/raw_html/XXI_NRSITZ_108.html",
    "txt_path": "steno_protocols/plain_text/XXI_NRSITZ_108.txt"
  },
  {
    "session_date_display": "09.07.2002",
    "session_date_iso": "2002-07-09T00:00:00",
    "gp_code": "XXI",
    "chamber": "NRSITZ",
    "session_number": 109,
    "title": "109. Sitzung (109/NRSITZ)",
    "citation": "109/NRSITZ",
    "session_detail_url": "https://www.parlament.gv.at/gegenstand/XXI/NRSITZ/109",
    "protocol_pdf_url": "https://www.parlament.gv.at/dokument/XXI/NRSITZ/109/fname_114573.pdf",
    "protocol_html_url": "https://www.parlament.gv.at/dokument/XXI/NRSITZ/109/fnameorig_114573.html",
    "uid": "XXI_NRSITZ_109",
    "raw_path": "steno_protocols/raw_html/XXI_NRSITZ_109.html",
    "txt_path": "steno_protocols/plain_text/XXI_NRSITZ_109.txt"
  },
  {
    "session_date_display": "22.03.2000",
    "session_date_iso": "2000-03-22T00:00:00",
    "gp_code": "XXI",
    "chamber": "NRSITZ",
    "session_number": 18,
    "title": "18. Sitzung (18/NRSITZ)",
    "citation": "18/NRSITZ",
    "session_detail_url": "https://www.parlament.gv.at/gegenstand/XXI/NRSITZ/18",
    "protocol_pdf_url": "https://www.parlament.gv.at/dokument/XXI/NRSITZ/18/fname_114391.pdf",
    "protocol_html_url": "https://www.parlament.gv.at/dokument/XXI/NRSITZ/18/fnameorig_114391.html",
    "uid": "XXI_NRSITZ_18",
    "raw_path": "steno_protocols/raw_html/XXI_NRSITZ_18.html",
    "txt_path": "steno_protocols/plain_text/XXI_NRSITZ_18.txt"
  },
  {
    "session_date_display": "07.07.2000",
    "session_date_iso": "2000-07-07T00:00:00",
    "gp_code": "XXI",
    "chamber": "NRSITZ",
    "session_number": 34,
    "title": "34. Sitzung (34/NRSITZ)",
    "citation": "34/NRSITZ",
    "session_detail_url": "https://www.parlament.gv.at/gegenstand/XXI/NRSITZ/34",
    "protocol_pdf_url": "https://www.parlament.gv.at/dokument/XXI/NRSITZ/34/fname_114423.pdf",
    "protocol_html_url": "https://www.parlament.gv.at/dokument/XXI/NRSITZ/34/fnameorig_114423.html",
    "uid": "XXI_NRSITZ_34",
    "raw_path": "steno_protocols/raw_html/XXI_NRSITZ_34.html",
    "txt_path": "steno_protocols/plain_text/XXI_NRSITZ_34.txt"
  },
  {
    "session_date_display": "30.10.2000",
    "session_date_iso": "2000-10-30T00:00:00",
    "gp_code": "XXI",
    "chamber": "NRSITZ",
    "session_number": 43,
    "title": "43. Sitzung (43/NRSITZ)",
    "citation": "43/NRSITZ",
    "session_detail_url": "https://www.parlament.gv.at/gegenstand/XXI/NRSITZ/43",
    "protocol_pdf_url": "https://www.parlament.gv.at/dokument/XXI/NRSITZ/43/fname_114441.pdf",
    "protocol_html_url": "https://www.parlament.gv.at/dokument/XXI/NRSITZ/43/fnameorig_114441.html",
    "uid": "XXI_NRSITZ_43",
    "raw_path": "steno_protocols/raw_html/XXI_NRSITZ_43.html",
    "txt_path": "steno_protocols/plain_text/XXI_NRSITZ_43.txt"
  },
  {
    "session_date_display": "12.03.2001",
    "session_date_iso": "2001-03-12T00:00:00",
    "gp_code": "XXI",
    "chamber": "NRSITZ",
    "session_number": 59,
    "title": "59. Sitzung (59/NRSITZ)",
    "citation": "59/NRSITZ",
    "session_detail_url": "https://www.parlament.gv.at/gegenstand/XXI/NRSITZ/59",
    "protocol_pdf_url": "https://www.parlament.gv.at/dokument/XXI/NRSITZ/59/fname_114473.pdf",
    "protocol_html_url": "https://www.parlament.gv.at/dokument/XXI/NRSITZ/59/fnameorig_114473.html",
    "uid": "XXI_NRSITZ_59",
    "raw_path": "steno_protocols/raw_html/XXI_NRSITZ_59.html",
    "txt_path": "steno_protocols/plain_text/XXI_NRSITZ_59.txt"
  },
  {
    "session_date_display": "20.03.2001",
    "session_date_iso": "2001-03-20T00:00:00",
    "gp_code": "XXI",
    "chamber": "NRSITZ",
    "session_number": 60,
    "title": "60. Sitzung (60/NRSITZ)",
    "citation": "60/NRSITZ",
    "session_detail_url": "https://www.parlament.gv.at/gegenstand/XXI/NRSITZ/60",
    "protocol_pdf_url": "https://www.parlament.gv.at/dokument/XXI/NRSITZ/60/fname_114475.pdf",
    "protocol_html_url": "https://www.parlament.gv.at/dokument/XXI/NRSITZ/60/fnameorig_114475.html",
    "uid": "XXI_NRSITZ_60",
    "raw_path": "steno_protocols/raw_html/XXI_NRSITZ_60.html",
    "txt_path": "steno_protocols/plain_text/XXI_NRSITZ_60.txt"
  },
  {
    "session_date_display": "30.03.2001",
    "session_date_iso": "2001-03-30T00:00:00",
    "gp_code": "XXI",
    "chamber": "NRSITZ",
    "session_number": 64,
    "title": "64. Sitzung (64/NRSITZ)",
    "citation": "64/NRSITZ",
    "session_detail_url": "https://www.parlament.gv.at/gegenstand/XXI/NRSITZ/64",
    "protocol_pdf_url": "https://www.parlament.gv.at/dokument/XXI/NRSITZ/64/fname_114483.pdf",
    "protocol_html_url": "https://www.parlament.gv.at/dokument/XXI/NRSITZ/64/fnameorig_114483.html",
    "uid": "XXI_NRSITZ_64",
    "raw_path": "steno_protocols/raw_html/XXI_NRSITZ_64.html",
    "txt_path": "steno_protocols/plain_text/XXI_NRSITZ_64.txt"
  },
  {
    "session_date_display": "02.04.2001",
    "session_date_iso": "2001-04-02T00:00:00",
    "gp_code": "XXI",
    "chamber": "NRSITZ",
    "session_number": 65,
    "title": "65. Sitzung (65/NRSITZ)",
    "citation": "65/NRSITZ",
    "session_detail_url": "https://www.parlament.gv.at/gegenstand/XXI/NRSITZ/65",
    "protocol_pdf_url": "https://www.parlament.gv.at/dokument/XXI/NRSITZ/65/fname_114485.pdf",
    "protocol_html_url": "https://www.parlament.gv.at/dokument/XXI/NRSITZ/65/fnameorig_114485.html",
    "uid": "XXI_NRSITZ_65",
    "raw_path": "steno_protocols/raw_html/XXI_NRSITZ_65.html",
    "txt_path": "steno_protocols/plain_text/XXI_NRSITZ_65.txt"
  },
  {
    "session_date_display": "04.07.2001",
    "session_date_iso": "2001-07-04T00:00:00",
    "gp_code": "XXI",
    "chamber": "NRSITZ",
    "session_number": 74,
    "title": "74. Sitzung (74/NRSITZ)",
    "citation": "74/NRSITZ",
    "session_detail_url": "https://www.parlament.gv.at/gegenstand/XXI/NRSITZ/74",
    "protocol_pdf_url": "https://www.parlament.gv.at/dokument/XXI/NRSITZ/74/fname_114503.pdf",
    "protocol_html_url": "https://www.parlament.gv.at/dokument/XXI/NRSITZ/74/fnameorig_114503.html",
    "uid": "XXI_NRSITZ_74",
    "raw_path": "steno_protocols/raw_html/XXI_NRSITZ_74.html",
    "txt_path": "steno_protocols/plain_text/XXI_NRSITZ_74.txt"
  },
  {
    "session_date_display": "23.11.2001",
    "session_date_iso": "2001-11-23T00:00:00",
    "gp_code": "XXI",
    "chamber": "NRSITZ",
    "session_number": 86,
    "title": "86. Sitzung (86/NRSITZ)",
    "citation": "86/NRSITZ",
    "session_detail_url": "https://www.parlament.gv.at/gegenstand/XXI/NRSITZ/86",
    "protocol_pdf_url": "https://www.parlament.gv.at/dokument/XXI/NRSITZ/86/fname_114527.pdf",
    "protocol_html_url": "https://www.parlament.gv.at/dokument/XXI/NRSITZ/86/fnameorig_114527.html",
    "uid": "XXI_NRSITZ_86",
    "raw_path": "steno_protocols/raw_html/XXI_NRSITZ_86.html",
    "txt_path": "steno_protocols/plain_text/XXI_NRSITZ_86.txt"
  },
  {
    "session_date_display": "28.02.2002",
    "session_date_iso": "2002-02-28T00:00:00",
    "gp_code": "XXI",
    "chamber": "NRSITZ",
    "session_number": 95,
    "title": "95. Sitzung (95/NRSITZ)",
    "citation": "95/NRSITZ",
    "session_detail_url": "https://www.parlament.gv.at/gegenstand/XXI/NRSITZ/95",
    "protocol_pdf_url": "https://www.parlament.gv.at/dokument/XXI/NRSITZ/95/fname_114545.pdf",
    "protocol_html_url": "https://www.parlament.gv.at/dokument/XXI/NRSITZ/95/fnameorig_114545.html",
    "uid": "XXI_NRSITZ_95",
    "raw_path": "steno_protocols/raw_html/XXI_NRSITZ_95.html",
    "txt_path": "steno_protocols/plain_text/XXI_NRSITZ_95.txt"
  },
  {
    "session_date_display": "28.02.2002",
    "session_date_iso": "2002-02-28T00:00:00",
    "gp_code": "XXI",
    "chamber": "NRSITZ",
    "session_number": 96,
    "title": "96. Sitzung (96/NRSITZ)",
    "citation": "96/NRSITZ",
    "session_detail_url": "https://www.parlament.gv.at/gegenstand/XXI/NRSITZ/96",
    "protocol_pdf_url": "https://www.parlament.gv.at/dokument/XXI/NRSITZ/96/fname_114547.pdf",
    "protocol_html_url": "https://www.parlament.gv.at/dokument/XXI/NRSITZ/96/fnameorig_114547.html",
    "uid": "XXI_NRSITZ_96",
    "raw_path": "steno_protocols/raw_html/XXI_NRSITZ_96.html",
    "txt_path": "steno_protocols/plain_text/XXI_NRSITZ_96.txt"
  },
  {
    "session_date_display": "24.03.2004",
    "session_date_iso": "2004-03-24T00:00:00",
    "gp_code": "XXII",
    "chamber": "NRSITZ",
    "session_number": 55,
    "title": "55. Sitzung (55/NRSITZ)",
    "citation": "55/NRSITZ",
    "session_detail_url": "https://www.parlament.gv.at/gegenstand/XXII/NRSITZ/55",
    "protocol_pdf_url": "https://www.parlament.gv.at/dokument/XXII/NRSITZ/55/fname_020019.pdf",
    "protocol_html_url": "https://www.parlament.gv.at/dokument/XXII/NRSITZ/55/fnameorig_020019.html",
    "uid": "XXII_NRSITZ_55",
    "raw_path": "steno_protocols/raw_html/XXII_NRSITZ_55.html",
    "txt_path": "steno_protocols/plain_text/XXII_NRSITZ_55.txt"
  },
  {
    "session_date_display": "13.11.2003",
    "session_date_iso": "2003-11-13T00:00:00",
    "gp_code": "XXII",
    "chamber": "NRSITZ",
    "session_number": 38,
    "title": "38. Sitzung (38/NRSITZ)",
    "citation": "38/NRSITZ",
    "session_detail_url": "https://www.parlament.gv.at/gegenstand/XXII/NRSITZ/38",
    "protocol_pdf_url": "https://www.parlament.gv.at/dokument/XXII/NRSITZ/38/fname_013730.pdf",
    "protocol_html_url": "https://www.parlament.gv.at/dokument/XXII/NRSITZ/38/fnameorig_013730.html",
    "uid": "XXII_NRSITZ_38",
    "raw_path": "steno_protocols/raw_html/XXII_NRSITZ_38.html",
    "txt_path": "steno_protocols/plain_text/XXII_NRSITZ_38.txt"
  },
  {
    "session_date_display": "26.05.2004",
    "session_date_iso": "2004-05-26T00:00:00",
    "gp_code": "XXII",
    "chamber": "NRSITZ",
    "session_number": 61,
    "title": "61. Sitzung (61/NRSITZ)",
    "citation": "61/NRSITZ",
    "session_detail_url": "https://www.parlament.gv.at/gegenstand/XXII/NRSITZ/61",
    "protocol_pdf_url": "https://www.parlament.gv.at/dokument/XXII/NRSITZ/61/fname_022858.pdf",
    "protocol_html_url": "https://www.parlament.gv.at/dokument/XXII/NRSITZ/61/fnameorig_022858.html",
    "uid": "XXII_NRSITZ_61",
    "raw_path": "steno_protocols/raw_html/XXII_NRSITZ_61.html",
    "txt_path": "steno_protocols/plain_text/XXII_NRSITZ_61.txt"
  },
  {
    "session_date_display": "27.05.2004",
    "session_date_iso": "2004-05-27T00:00:00",
    "gp_code": "XXII",
    "chamber": "NRSITZ",
    "session_number": 62,
    "title": "62. Sitzung (62/NRSITZ)",
    "citation": "62/NRSITZ",
    "session_detail_url": "https://www.parlament.gv.at/gegenstand/XXII/NRSITZ/62",
    "protocol_pdf_url": "https://www.parlament.gv.at/dokument/XXII/NRSITZ/62/fname_023734.pdf",
    "protocol_html_url": "https://www.parlament.gv.at/dokument/XXII/NRSITZ/62/fnameorig_023734.html",
    "uid": "XXII_NRSITZ_62",
    "raw_path": "steno_protocols/raw_html/XXII_NRSITZ_62.html",
    "txt_path": "steno_protocols/plain_text/XXII_NRSITZ_62.txt"
  },
  {
    "session_date_display": "17.06.2004",
    "session_date_iso": "2004-06-17T00:00:00",
    "gp_code": "XXII",
    "chamber": "NRSITZ",
    "session_number": 68,
    "title": "68. Sitzung (68/NRSITZ)",
    "citation": "68/NRSITZ",
    "session_detail_url": "https://www.parlament.gv.at/gegenstand/XXII/NRSITZ/68",
    "protocol_pdf_url": "https://www.parlament.gv.at/dokument/XXII/NRSITZ/68/fname_024814.pdf",
    "protocol_html_url": "https://www.parlament.gv.at/dokument/XXII/NRSITZ/68/fnameorig_024814.html",
    "uid": "XXII_NRSITZ_68",
    "raw_path": "steno_protocols/raw_html/XXII_NRSITZ_68.html",
    "txt_path": "steno_protocols/plain_text/XXII_NRSITZ_68.txt"
  },
  {
    "session_date_display": "12.08.2003",
    "session_date_iso": "2003-08-12T00:00:00",
    "gp_code": "XXII",
    "chamber": "NRSITZ",
    "session_number": 30,
    "title": "30. Sitzung (30/NRSITZ)",
    "citation": "30/NRSITZ",
    "session_detail_url": "https://www.parlament.gv.at/gegenstand/XXII/NRSITZ/30",
    "protocol_pdf_url": "https://www.parlament.gv.at/dokument/XXII/NRSITZ/30/fname_009197.pdf",
    "protocol_html_url": "https://www.parlament.gv.at/dokument/XXII/NRSITZ/30/fnameorig_009197.html",
    "uid": "XXII_NRSITZ_30",
    "raw_path": "steno_protocols/raw_html/XXII_NRSITZ_30.html",
    "txt_path": "steno_protocols/plain_text/XXII_NRSITZ_30.txt"
  },
  {
    "session_date_display": "25.02.2004",
    "session_date_iso": "2004-02-25T00:00:00",
    "gp_code": "XXII",
    "chamber": "NRSITZ",
    "session_number": 50,
    "title": "50. Sitzung (50/NRSITZ)",
    "citation": "50/NRSITZ",
    "session_detail_url": "https://www.parlament.gv.at/gegenstand/XXII/NRSITZ/50",
    "protocol_pdf_url": "https://www.parlament.gv.at/dokument/XXII/NRSITZ/50/fname_018365.pdf",
    "protocol_html_url": "https://www.parlament.gv.at/dokument/XXII/NRSITZ/50/fnameorig_018365.html",
    "uid": "XXII_NRSITZ_50",
    "raw_path": "steno_protocols/raw_html/XXII_NRSITZ_50.html",
    "txt_path": "steno_protocols/plain_text/XXII_NRSITZ_50.txt"
  },
  {
    "session_date_display": "17.11.2004",
    "session_date_iso": "2004-11-17T00:00:00",
    "gp_code": "XXII",
    "chamber": "NRSITZ",
    "session_number": 86,
    "title": "86. Sitzung (86/NRSITZ)",
    "citation": "86/NRSITZ",
    "session_detail_url": "https://www.parlament.gv.at/gegenstand/XXII/NRSITZ/86",
    "protocol_pdf_url": "https://www.parlament.gv.at/dokument/XXII/NRSITZ/86/fname_035323.pdf",
    "protocol_html_url": "https://www.parlament.gv.at/dokument/XXII/NRSITZ/86/fnameorig_035323.html",
    "uid": "XXII_NRSITZ_86",
    "raw_path": "steno_protocols/raw_html/XXII_NRSITZ_86.html",
    "txt_path": "steno_protocols/plain_text/XXII_NRSITZ_86.txt"
  },
  {
    "session_date_display": "18.11.2004",
    "session_date_iso": "2004-11-18T00:00:00",
    "gp_code": "XXII",
    "chamber": "NRSITZ",
    "session_number": 87,
    "title": "87. Sitzung (87/NRSITZ)",
    "citation": "87/NRSITZ",
    "session_detail_url": "https://www.parlament.gv.at/gegenstand/XXII/NRSITZ/87",
    "protocol_pdf_url": "https://www.parlament.gv.at/dokument/XXII/NRSITZ/87/fname_034638.pdf",
    "protocol_html_url": "https://www.parlament.gv.at/dokument/XXII/NRSITZ/87/fnameorig_034638.html",
    "uid": "XXII_NRSITZ_87",
    "raw_path": "steno_protocols/raw_html/XXII_NRSITZ_87.html",
    "txt_path": "steno_protocols/plain_text/XXII_NRSITZ_87.txt"
  },
  {
    "session_date_display": "02.09.2003",
    "session_date_iso": "2003-09-02T00:00:00",
    "gp_code": "XXII",
    "chamber": "NRSITZ",
    "session_number": 31,
    "title": "31. Sitzung (31/NRSITZ)",
    "citation": "31/NRSITZ",
    "session_detail_url": "https://www.parlament.gv.at/gegenstand/XXII/NRSITZ/31",
    "protocol_pdf_url": "https://www.parlament.gv.at/dokument/XXII/NRSITZ/31/fname_009734.pdf",
    "protocol_html_url": "https://www.parlament.gv.at/dokument/XXII/NRSITZ/31/fnameorig_009734.html",
    "uid": "XXII_NRSITZ_31",
    "raw_path": "steno_protocols/raw_html/XXII_NRSITZ_31.html",
    "txt_path": "steno_protocols/plain_text/XXII_NRSITZ_31.txt"
  },
  {
    "session_date_display": "17.05.2017",
    "session_date_iso": "2017-05-17T00:00:00",
    "gp_code": "XXV",
    "chamber": "NRSITZ",
    "session_number": 181,
    "title": "181. Sitzung (181/NRSITZ)",
    "citation": "181/NRSITZ",
    "session_detail_url": "https://www.parlament.gv.at/gegenstand/XXV/NRSITZ/181",
    "protocol_pdf_url": "https://www.parlament.gv.at/dokument/XXV/NRSITZ/181/fname_672181.pdf",
    "protocol_html_url": "https://www.parlament.gv.at/dokument/XXV/NRSITZ/181/fnameorig_672181.html",
    "uid": "XXV_NRSITZ_181",
    "raw_path": "steno_protocols/raw_html/XXV_NRSITZ_181.html",
    "txt_path": "steno_protocols/plain_text/XXV_NRSITZ_181.txt"
  },
  {
    "session_date_display": "28.06.2017",
    "session_date_iso": "2017-06-28T00:00:00",
    "gp_code": "XXV",
    "chamber": "NRSITZ",
    "session_number": 189,
    "title": "189. Sitzung (189/NRSITZ)",
    "citation": "189/NRSITZ",
    "session_detail_url": "https://www.parlament.gv.at/gegenstand/XXV/NRSITZ/189",
    "protocol_pdf_url": "https://www.parlament.gv.at/dokument/XXV/NRSITZ/189/fname_674441.pdf",
    "protocol_html_url": "https://www.parlament.gv.at/dokument/XXV/NRSITZ/189/fnameorig_674441.html",
    "uid": "XXV_NRSITZ_189",
    "raw_path": "steno_protocols/raw_html/XXV_NRSITZ_189.html",
    "txt_path": "steno_protocols/plain_text/XXV_NRSITZ_189.txt"
  },
  {
    "session_date_display": "13.07.2017",
    "session_date_iso": "2017-07-13T00:00:00",
    "gp_code": "XXV",
    "chamber": "NRSITZ",
    "session_number": 193,
    "title": "193. Sitzung (193/NRSITZ)",
    "citation": "193/NRSITZ",
    "session_detail_url": "https://www.parlament.gv.at/gegenstand/XXV/NRSITZ/193",
    "protocol_pdf_url": "https://www.parlament.gv.at/dokument/XXV/NRSITZ/193/fname_676231.pdf",
    "protocol_html_url": "https://www.parlament.gv.at/dokument/XXV/NRSITZ/193/fnameorig_676231.html",
    "uid": "XXV_NRSITZ_193",
    "raw_path": "steno_protocols/raw_html/XXV_NRSITZ_193.html",
    "txt_path": "steno_protocols/plain_text/XXV_NRSITZ_193.txt"
  },
  {
    "session_date_display": "17.12.2013",
    "session_date_iso": "2013-12-17T00:00:00",
    "gp_code": "XXV",
    "chamber": "NRSITZ",
    "session_number": 7,
    "title": "7. Sitzung (7/NRSITZ)",
    "citation": "7/NRSITZ",
    "session_detail_url": "https://www.parlament.gv.at/gegenstand/XXV/NRSITZ/7",
    "protocol_pdf_url": "https://www.parlament.gv.at/dokument/XXV/NRSITZ/7/fname_339842.pdf",
    "protocol_html_url": "https://www.parlament.gv.at/dokument/XXV/NRSITZ/7/fnameorig_339842.html",
    "uid": "XXV_NRSITZ_7",
    "raw_path": "steno_protocols/raw_html/XXV_NRSITZ_7.html",
    "txt_path": "steno_protocols/plain_text/XXV_NRSITZ_7.txt"
  },
  {
    "session_date_display": "12.10.2017",
    "session_date_iso": "2017-10-12T00:00:00",
    "gp_code": "XXV",
    "chamber": "NRSITZ",
    "session_number": 199,
    "title": "199. Sitzung (199/NRSITZ)",
    "citation": "199/NRSITZ",
    "session_detail_url": "https://www.parlament.gv.at/gegenstand/XXV/NRSITZ/199",
    "protocol_pdf_url": "https://www.parlament.gv.at/dokument/XXV/NRSITZ/199/fname_677890.pdf",
    "protocol_html_url": "https://www.parlament.gv.at/dokument/XXV/NRSITZ/199/fnameorig_677890.html",
    "uid": "XXV_NRSITZ_199",
    "raw_path": "steno_protocols/raw_html/XXV_NRSITZ_199.html",
    "txt_path": "steno_protocols/plain_text/XXV_NRSITZ_199.txt"
  },
  {
    "session_date_display": "18.03.2014",
    "session_date_iso": "2014-03-18T00:00:00",
    "gp_code": "XXV",
    "chamber": "NRSITZ",
    "session_number": 16,
    "title": "16. Sitzung (16/NRSITZ)",
    "citation": "16/NRSITZ",
    "session_detail_url": "https://www.parlament.gv.at/gegenstand/XXV/NRSITZ/16",
    "protocol_pdf_url": "https://www.parlament.gv.at/dokument/XXV/NRSITZ/16/fname_349671.pdf",
    "protocol_html_url": "https://www.parlament.gv.at/dokument/XXV/NRSITZ/16/fnameorig_349671.html",
    "uid": "XXV_NRSITZ_16",
    "raw_path": "steno_protocols/raw_html/XXV_NRSITZ_16.html",
    "txt_path": "steno_protocols/plain_text/XXV_NRSITZ_16.txt"
  },
  {
    "session_date_display": "27.01.2016",
    "session_date_iso": "2016-01-27T00:00:00",
    "gp_code": "XXV",
    "chamber": "NRSITZ",
    "session_number": 112,
    "title": "112. Sitzung (112/NRSITZ)",
    "citation": "112/NRSITZ",
    "session_detail_url": "https://www.parlament.gv.at/gegenstand/XXV/NRSITZ/112",
    "protocol_pdf_url": "https://www.parlament.gv.at/dokument/XXV/NRSITZ/112/fname_544061.pdf",
    "protocol_html_url": "https://www.parlament.gv.at/dokument/XXV/NRSITZ/112/fnameorig_544061.html",
    "uid": "XXV_NRSITZ_112",
    "raw_path": "steno_protocols/raw_html/XXV_NRSITZ_112.html",
    "txt_path": "steno_protocols/plain_text/XXV_NRSITZ_112.txt"
  },
  {
    "session_date_display": "29.04.2014",
    "session_date_iso": "2014-04-29T00:00:00",
    "gp_code": "XXV",
    "chamber": "NRSITZ",
    "session_number": 22,
    "title": "22. Sitzung (22/NRSITZ)",
    "citation": "22/NRSITZ",
    "session_detail_url": "https://www.parlament.gv.at/gegenstand/XXV/NRSITZ/22",
    "protocol_pdf_url": "https://www.parlament.gv.at/dokument/XXV/NRSITZ/22/fname_358514.pdf",
    "protocol_html_url": "https://www.parlament.gv.at/dokument/XXV/NRSITZ/22/fnameorig_358514.html",
    "uid": "XXV_NRSITZ_22",
    "raw_path": "steno_protocols/raw_html/XXV_NRSITZ_22.html",
    "txt_path": "steno_protocols/plain_text/XXV_NRSITZ_22.txt"
  },
  {
    "session_date_display": "27.04.2016",
    "session_date_iso": "2016-04-27T00:00:00",
    "gp_code": "XXV",
    "chamber": "NRSITZ",
    "session_number": 123,
    "title": "123. Sitzung (123/NRSITZ)",
    "citation": "123/NRSITZ",
    "session_detail_url": "https://www.parlament.gv.at/gegenstand/XXV/NRSITZ/123",
    "protocol_pdf_url": "https://www.parlament.gv.at/dokument/XXV/NRSITZ/123/fname_566916.pdf",
    "protocol_html_url": "https://www.parlament.gv.at/dokument/XXV/NRSITZ/123/fnameorig_566916.html",
    "uid": "XXV_NRSITZ_123",
    "raw_path": "steno_protocols/raw_html/XXV_NRSITZ_123.html",
    "txt_path": "steno_protocols/plain_text/XXV_NRSITZ_123.txt"
  },
  {
    "session_date_display": "25.06.2014",
    "session_date_iso": "2014-06-25T00:00:00",
    "gp_code": "XXV",
    "chamber": "NRSITZ",
    "session_number": 32,
    "title": "32. Sitzung (32/NRSITZ)",
    "citation": "32/NRSITZ",
    "session_detail_url": "https://www.parlament.gv.at/gegenstand/XXV/NRSITZ/32",
    "protocol_pdf_url": "https://www.parlament.gv.at/dokument/XXV/NRSITZ/32/fname_367325.pdf",
    "protocol_html_url": "https://www.parlament.gv.at/dokument/XXV/NRSITZ/32/fnameorig_367325.html",
    "uid": "XXV_NRSITZ_32",
    "raw_path": "steno_protocols/raw_html/XXV_NRSITZ_32.html",
    "txt_path": "steno_protocols/plain_text/XXV_NRSITZ_32.txt"
  },
  {
    "session_date_display": "09.07.2014",
    "session_date_iso": "2014-07-09T00:00:00",
    "gp_code": "XXV",
    "chamber": "NRSITZ",
    "session_number": 36,
    "title": "36. Sitzung (36/NRSITZ)",
    "citation": "36/NRSITZ",
    "session_detail_url": "https://www.parlament.gv.at/gegenstand/XXV/NRSITZ/36",
    "protocol_pdf_url": "https://www.parlament.gv.at/dokument/XXV/NRSITZ/36/fname_371232.pdf",
    "protocol_html_url": "https://www.parlament.gv.at/dokument/XXV/NRSITZ/36/fnameorig_371232.html",
    "uid": "XXV_NRSITZ_36",
    "raw_path": "steno_protocols/raw_html/XXV_NRSITZ_36.html",
    "txt_path": "steno_protocols/plain_text/XXV_NRSITZ_36.txt"
  },
  {
    "session_date_display": "15.06.2016",
    "session_date_iso": "2016-06-15T00:00:00",
    "gp_code": "XXV",
    "chamber": "NRSITZ",
    "session_number": 132,
    "title": "132. Sitzung (132/NRSITZ)",
    "citation": "132/NRSITZ",
    "session_detail_url": "https://www.parlament.gv.at/gegenstand/XXV/NRSITZ/132",
    "protocol_pdf_url": "https://www.parlament.gv.at/dokument/XXV/NRSITZ/132/fname_571168.pdf",
    "protocol_html_url": "https://www.parlament.gv.at/dokument/XXV/NRSITZ/132/fnameorig_571168.html",
    "uid": "XXV_NRSITZ_132",
    "raw_path": "steno_protocols/raw_html/XXV_NRSITZ_132.html",
    "txt_path": "steno_protocols/plain_text/XXV_NRSITZ_132.txt"
  },
  {
    "session_date_display": "23.09.2014",
    "session_date_iso": "2014-09-23T00:00:00",
    "gp_code": "XXV",
    "chamber": "NRSITZ",
    "session_number": 40,
    "title": "40. Sitzung (40/NRSITZ)",
    "citation": "40/NRSITZ",
    "session_detail_url": "https://www.parlament.gv.at/gegenstand/XXV/NRSITZ/40",
    "protocol_pdf_url": "https://www.parlament.gv.at/dokument/XXV/NRSITZ/40/fname_371236.pdf",
    "protocol_html_url": "https://www.parlament.gv.at/dokument/XXV/NRSITZ/40/fnameorig_371236.html",
    "uid": "XXV_NRSITZ_40",
    "raw_path": "steno_protocols/raw_html/XXV_NRSITZ_40.html",
    "txt_path": "steno_protocols/plain_text/XXV_NRSITZ_40.txt"
  },
  {
    "session_date_display": "22.10.2014",
    "session_date_iso": "2014-10-22T00:00:00",
    "gp_code": "XXV",
    "chamber": "NRSITZ",
    "session_number": 44,
    "title": "44. Sitzung (44/NRSITZ)",
    "citation": "44/NRSITZ",
    "session_detail_url": "https://www.parlament.gv.at/gegenstand/XXV/NRSITZ/44",
    "protocol_pdf_url": "https://www.parlament.gv.at/dokument/XXV/NRSITZ/44/fname_377969.pdf",
    "protocol_html_url": "https://www.parlament.gv.at/dokument/XXV/NRSITZ/44/fnameorig_377969.html",
    "uid": "XXV_NRSITZ_44",
    "raw_path": "steno_protocols/raw_html/XXV_NRSITZ_44.html",
    "txt_path": "steno_protocols/plain_text/XXV_NRSITZ_44.txt"
  },
  {
    "session_date_display": "06.07.2016",
    "session_date_iso": "2016-07-06T00:00:00",
    "gp_code": "XXV",
    "chamber": "NRSITZ",
    "session_number": 136,
    "title": "136. Sitzung (136/NRSITZ)",
    "citation": "136/NRSITZ",
    "session_detail_url": "https://www.parlament.gv.at/gegenstand/XXV/NRSITZ/136",
    "protocol_pdf_url": "https://www.parlament.gv.at/dokument/XXV/NRSITZ/136/fname_607145.pdf",
    "protocol_html_url": "https://www.parlament.gv.at/dokument/XXV/NRSITZ/136/fnameorig_607145.html",
    "uid": "XXV_NRSITZ_136",
    "raw_path": "steno_protocols/raw_html/XXV_NRSITZ_136.html",
    "txt_path": "steno_protocols/plain_text/XXV_NRSITZ_136.txt"
  },
  {
    "session_date_display": "05.11.2014",
    "session_date_iso": "2014-11-05T00:00:00",
    "gp_code": "XXV",
    "chamber": "NRSITZ",
    "session_number": 48,
    "title": "48. Sitzung (48/NRSITZ)",
    "citation": "48/NRSITZ",
    "session_detail_url": "https://www.parlament.gv.at/gegenstand/XXV/NRSITZ/48",
    "protocol_pdf_url": "https://www.parlament.gv.at/dokument/XXV/NRSITZ/48/fname_380160.pdf",
    "protocol_html_url": "https://www.parlament.gv.at/dokument/XXV/NRSITZ/48/fnameorig_380160.html",
    "uid": "XXV_NRSITZ_48",
    "raw_path": "steno_protocols/raw_html/XXV_NRSITZ_48.html",
    "txt_path": "steno_protocols/plain_text/XXV_NRSITZ_48.txt"
  },
  {
    "session_date_display": "19.11.2014",
    "session_date_iso": "2014-11-19T00:00:00",
    "gp_code": "XXV",
    "chamber": "NRSITZ",
    "session_number": 49,
    "title": "49. Sitzung (49/NRSITZ)",
    "citation": "49/NRSITZ",
    "session_detail_url": "https://www.parlament.gv.at/gegenstand/XXV/NRSITZ/49",
    "protocol_pdf_url": "https://www.parlament.gv.at/dokument/XXV/NRSITZ/49/fname_385017.pdf",
    "protocol_html_url": "https://www.parlament.gv.at/dokument/XXV/NRSITZ/49/fnameorig_385017.html",
    "uid": "XXV_NRSITZ_49",
    "raw_path": "steno_protocols/raw_html/XXV_NRSITZ_49.html",
    "txt_path": "steno_protocols/plain_text/XXV_NRSITZ_49.txt"
  },
  {
    "session_date_display": "21.09.2016",
    "session_date_iso": "2016-09-21T00:00:00",
    "gp_code": "XXV",
    "chamber": "NRSITZ",
    "session_number": 144,
    "title": "144. Sitzung (144/NRSITZ)",
    "citation": "144/NRSITZ",
    "session_detail_url": "https://www.parlament.gv.at/gegenstand/XXV/NRSITZ/144",
    "protocol_pdf_url": "https://www.parlament.gv.at/dokument/XXV/NRSITZ/144/fname_611285.pdf",
    "protocol_html_url": "https://www.parlament.gv.at/dokument/XXV/NRSITZ/144/fnameorig_611285.html",
    "uid": "XXV_NRSITZ_144",
    "raw_path": "steno_protocols/raw_html/XXV_NRSITZ_144.html",
    "txt_path": "steno_protocols/plain_text/XXV_NRSITZ_144.txt"
  },
  {
    "session_date_display": "09.04.2021",
    "session_date_iso": "2021-04-09T00:00:00",
    "gp_code": "XXVII",
    "chamber": "NRSITZ",
    "session_number": 95,
    "title": "95. Sitzung (95/NRSITZ)",
    "citation": "95/NRSITZ",
    "session_detail_url": "https://www.parlament.gv.at/gegenstand/XXVII/NRSITZ/95",
    "protocol_pdf_url": "https://www.parlament.gv.at/dokument/XXVII/NRSITZ/95/fname_988850.pdf",
    "protocol_html_url": "https://www.parlament.gv.at/dokument/XXVII/NRSITZ/95/fnameorig_988850.html",
    "uid": "XXVII_NRSITZ_95",
    "raw_path": "steno_protocols/raw_html/XXVII_NRSITZ_95.html",
    "txt_path": "steno_protocols/plain_text/XXVII_NRSITZ_95.txt"
  },
  {
    "session_date_display": "10.01.2020",
    "session_date_iso": "2020-01-10T00:00:00",
    "gp_code": "XXVII",
    "chamber": "NRSITZ",
    "session_number": 8,
    "title": "8. Sitzung (8/NRSITZ)",
    "citation": "8/NRSITZ",
    "session_detail_url": "https://www.parlament.gv.at/gegenstand/XXVII/NRSITZ/8",
    "protocol_pdf_url": "https://www.parlament.gv.at/dokument/XXVII/NRSITZ/8/fname_797363.pdf",
    "protocol_html_url": "https://www.parlament.gv.at/dokument/XXVII/NRSITZ/8/fnameorig_797363.html",
    "uid": "XXVII_NRSITZ_8",
    "raw_path": "steno_protocols/raw_html/XXVII_NRSITZ_8.html",
    "txt_path": "steno_protocols/plain_text/XXVII_NRSITZ_8.txt"
  },
  {
    "session_date_display": "20.05.2021",
    "session_date_iso": "2021-05-20T00:00:00",
    "gp_code": "XXVII",
    "chamber": "NRSITZ",
    "session_number": 107,
    "title": "107. Sitzung (107/NRSITZ)",
    "citation": "107/NRSITZ",
    "session_detail_url": "https://www.parlament.gv.at/gegenstand/XXVII/NRSITZ/107",
    "protocol_pdf_url": "https://www.parlament.gv.at/dokument/XXVII/NRSITZ/107/fname_1438161.pdf",
    "protocol_html_url": "https://www.parlament.gv.at/dokument/XXVII/NRSITZ/107/fnameorig_1438161.html",
    "uid": "XXVII_NRSITZ_107",
    "raw_path": "steno_protocols/raw_html/XXVII_NRSITZ_107.html",
    "txt_path": "steno_protocols/plain_text/XXVII_NRSITZ_107.txt"
  },
  {
    "session_date_display": "07.07.2021",
    "session_date_iso": "2021-07-07T00:00:00",
    "gp_code": "XXVII",
    "chamber": "NRSITZ",
    "session_number": 115,
    "title": "115. Sitzung (115/NRSITZ)",
    "citation": "115/NRSITZ",
    "session_detail_url": "https://www.parlament.gv.at/gegenstand/XXVII/NRSITZ/115",
    "protocol_pdf_url": "https://www.parlament.gv.at/dokument/XXVII/NRSITZ/115/fname_1032818.pdf",
    "protocol_html_url": "https://www.parlament.gv.at/dokument/XXVII/NRSITZ/115/fnameorig_1032818.html",
    "uid": "XXVII_NRSITZ_115",
    "raw_path": "steno_protocols/raw_html/XXVII_NRSITZ_115.html",
    "txt_path": "steno_protocols/plain_text/XXVII_NRSITZ_115.txt"
  },
  {
    "session_date_display": "16.11.2021",
    "session_date_iso": "2021-11-16T00:00:00",
    "gp_code": "XXVII",
    "chamber": "NRSITZ",
    "session_number": 129,
    "title": "129. Sitzung (129/NRSITZ)",
    "citation": "129/NRSITZ",
    "session_detail_url": "https://www.parlament.gv.at/gegenstand/XXVII/NRSITZ/129",
    "protocol_pdf_url": "https://www.parlament.gv.at/dokument/XXVII/NRSITZ/129/fname_1449488.pdf",
    "protocol_html_url": "https://www.parlament.gv.at/dokument/XXVII/NRSITZ/129/fnameorig_1449488.html",
    "uid": "XXVII_NRSITZ_129",
    "raw_path": "steno_protocols/raw_html/XXVII_NRSITZ_129.html",
    "txt_path": "steno_protocols/plain_text/XXVII_NRSITZ_129.txt"
  },
  {
    "session_date_display": "17.06.2020",
    "session_date_iso": "2020-06-17T00:00:00",
    "gp_code": "XXVII",
    "chamber": "NRSITZ",
    "session_number": 36,
    "title": "36. Sitzung (36/NRSITZ)",
    "citation": "36/NRSITZ",
    "session_detail_url": "https://www.parlament.gv.at/gegenstand/XXVII/NRSITZ/36",
    "protocol_pdf_url": "https://www.parlament.gv.at/dokument/XXVII/NRSITZ/36/fname_844432.pdf",
    "protocol_html_url": "https://www.parlament.gv.at/dokument/XXVII/NRSITZ/36/fnameorig_844432.html",
    "uid": "XXVII_NRSITZ_36",
    "raw_path": "steno_protocols/raw_html/XXVII_NRSITZ_36.html",
    "txt_path": "steno_protocols/plain_text/XXVII_NRSITZ_36.txt"
  },
  {
    "session_date_display": "07.07.2020",
    "session_date_iso": "2020-07-07T00:00:00",
    "gp_code": "XXVII",
    "chamber": "NRSITZ",
    "session_number": 44,
    "title": "44. Sitzung (44/NRSITZ)",
    "citation": "44/NRSITZ",
    "session_detail_url": "https://www.parlament.gv.at/gegenstand/XXVII/NRSITZ/44",
    "protocol_pdf_url": "https://www.parlament.gv.at/dokument/XXVII/NRSITZ/44/fname_844426.pdf",
    "protocol_html_url": "https://www.parlament.gv.at/dokument/XXVII/NRSITZ/44/fnameorig_844426.html",
    "uid": "XXVII_NRSITZ_44",
    "raw_path": "steno_protocols/raw_html/XXVII_NRSITZ_44.html",
    "txt_path": "steno_protocols/plain_text/XXVII_NRSITZ_44.txt"
  },
  {
    "session_date_display": "20.01.2022",
    "session_date_iso": "2022-01-20T00:00:00",
    "gp_code": "XXVII",
    "chamber": "NRSITZ",
    "session_number": 140,
    "title": "140. Sitzung (140/NRSITZ)",
    "citation": "140/NRSITZ",
    "session_detail_url": "https://www.parlament.gv.at/gegenstand/XXVII/NRSITZ/140",
    "protocol_pdf_url": "https://www.parlament.gv.at/dokument/XXVII/NRSITZ/140/fname_1463124.pdf",
    "protocol_html_url": "https://www.parlament.gv.at/dokument/XXVII/NRSITZ/140/fnameorig_1463124.html",
    "uid": "XXVII_NRSITZ_140",
    "raw_path": "steno_protocols/raw_html/XXVII_NRSITZ_140.html",
    "txt_path": "steno_protocols/plain_text/XXVII_NRSITZ_140.txt"
  },
  {
    "session_date_display": "23.02.2022",
    "session_date_iso": "2022-02-23T00:00:00",
    "gp_code": "XXVII",
    "chamber": "NRSITZ",
    "session_number": 141,
    "title": "141. Sitzung (141/NRSITZ)",
    "citation": "141/NRSITZ",
    "session_detail_url": "https://www.parlament.gv.at/gegenstand/XXVII/NRSITZ/141",
    "protocol_pdf_url": "https://www.parlament.gv.at/dokument/XXVII/NRSITZ/141/fname_1575988.pdf",
    "protocol_html_url": "https://www.parlament.gv.at/dokument/XXVII/NRSITZ/141/fnameorig_1575988.html",
    "uid": "XXVII_NRSITZ_141",
    "raw_path": "steno_protocols/raw_html/XXVII_NRSITZ_141.html",
    "txt_path": "steno_protocols/plain_text/XXVII_NRSITZ_141.txt"
  },
  {
    "session_date_display": "09.07.2020",
    "session_date_iso": "2020-07-09T00:00:00",
    "gp_code": "XXVII",
    "chamber": "NRSITZ",
    "session_number": 48,
    "title": "48. Sitzung (48/NRSITZ)",
    "citation": "48/NRSITZ",
    "session_detail_url": "https://www.parlament.gv.at/gegenstand/XXVII/NRSITZ/48",
    "protocol_pdf_url": "https://www.parlament.gv.at/dokument/XXVII/NRSITZ/48/fname_850197.pdf",
    "protocol_html_url": "https://www.parlament.gv.at/dokument/XXVII/NRSITZ/48/fnameorig_850197.html",
    "uid": "XXVII_NRSITZ_48",
    "raw_path": "steno_protocols/raw_html/XXVII_NRSITZ_48.html",
    "txt_path": "steno_protocols/plain_text/XXVII_NRSITZ_48.txt"
  },
  {
    "session_date_display": "14.09.2020",
    "session_date_iso": "2020-09-14T00:00:00",
    "gp_code": "XXVII",
    "chamber": "NRSITZ",
    "session_number": 50,
    "title": "50. Sitzung (50/NRSITZ)",
    "citation": "50/NRSITZ",
    "session_detail_url": "https://www.parlament.gv.at/gegenstand/XXVII/NRSITZ/50",
    "protocol_pdf_url": "https://www.parlament.gv.at/dokument/XXVII/NRSITZ/50/fname_850704.pdf",
    "protocol_html_url": "https://www.parlament.gv.at/dokument/XXVII/NRSITZ/50/fnameorig_850704.html",
    "uid": "XXVII_NRSITZ_50",
    "raw_path": "steno_protocols/raw_html/XXVII_NRSITZ_50.html",
    "txt_path": "steno_protocols/plain_text/XXVII_NRSITZ_50.txt"
  },
  {
    "session_date_display": "24.02.2022",
    "session_date_iso": "2022-02-24T00:00:00",
    "gp_code": "XXVII",
    "chamber": "NRSITZ",
    "session_number": 144,
    "title": "144. Sitzung (144/NRSITZ)",
    "citation": "144/NRSITZ",
    "session_detail_url": "https://www.parlament.gv.at/gegenstand/XXVII/NRSITZ/144",
    "protocol_pdf_url": "https://www.parlament.gv.at/dokument/XXVII/NRSITZ/144/fname_1449143.pdf",
    "protocol_html_url": "https://www.parlament.gv.at/dokument/XXVII/NRSITZ/144/fnameorig_1449143.html",
    "uid": "XXVII_NRSITZ_144",
    "raw_path": "steno_protocols/raw_html/XXVII_NRSITZ_144.html",
    "txt_path": "steno_protocols/plain_text/XXVII_NRSITZ_144.txt"
  },
  {
    "session_date_display": "23.03.2022",
    "session_date_iso": "2022-03-23T00:00:00",
    "gp_code": "XXVII",
    "chamber": "NRSITZ",
    "session_number": 147,
    "title": "147. Sitzung (147/NRSITZ)",
    "citation": "147/NRSITZ",
    "session_detail_url": "https://www.parlament.gv.at/gegenstand/XXVII/NRSITZ/147",
    "protocol_pdf_url": "https://www.parlament.gv.at/dokument/XXVII/NRSITZ/147/fname_1470272.pdf",
    "protocol_html_url": "https://www.parlament.gv.at/dokument/XXVII/NRSITZ/147/fnameorig_1470272.html",
    "uid": "XXVII_NRSITZ_147",
    "raw_path": "steno_protocols/raw_html/XXVII_NRSITZ_147.html",
    "txt_path": "steno_protocols/plain_text/XXVII_NRSITZ_147.txt"
  },
  {
    "session_date_display": "07.10.2020",
    "session_date_iso": "2020-10-07T00:00:00",
    "gp_code": "XXVII",
    "chamber": "NRSITZ",
    "session_number": 54,
    "title": "54. Sitzung (54/NRSITZ)",
    "citation": "54/NRSITZ",
    "session_detail_url": "https://www.parlament.gv.at/gegenstand/XXVII/NRSITZ/54",
    "protocol_pdf_url": "https://www.parlament.gv.at/dokument/XXVII/NRSITZ/54/fname_858019.pdf",
    "protocol_html_url": "https://www.parlament.gv.at/dokument/XXVII/NRSITZ/54/fnameorig_858019.html",
    "uid": "XXVII_NRSITZ_54",
    "raw_path": "steno_protocols/raw_html/XXVII_NRSITZ_54.html",
    "txt_path": "steno_protocols/plain_text/XXVII_NRSITZ_54.txt"
  },
  {
    "session_date_display": "15.10.2020",
    "session_date_iso": "2020-10-15T00:00:00",
    "gp_code": "XXVII",
    "chamber": "NRSITZ",
    "session_number": 57,
    "title": "57. Sitzung (57/NRSITZ)",
    "citation": "57/NRSITZ",
    "session_detail_url": "https://www.parlament.gv.at/gegenstand/XXVII/NRSITZ/57",
    "protocol_pdf_url": "https://www.parlament.gv.at/dokument/XXVII/NRSITZ/57/fname_858021.pdf",
    "protocol_html_url": "https://www.parlament.gv.at/dokument/XXVII/NRSITZ/57/fnameorig_858021.html",
    "uid": "XXVII_NRSITZ_57",
    "raw_path": "steno_protocols/raw_html/XXVII_NRSITZ_57.html",
    "txt_path": "steno_protocols/plain_text/XXVII_NRSITZ_57.txt"
  },
  {
    "session_date_display": "19.05.2022",
    "session_date_iso": "2022-05-19T00:00:00",
    "gp_code": "XXVII",
    "chamber": "NRSITZ",
    "session_number": 159,
    "title": "159. Sitzung (159/NRSITZ)",
    "citation": "159/NRSITZ",
    "session_detail_url": "https://www.parlament.gv.at/gegenstand/XXVII/NRSITZ/159",
    "protocol_pdf_url": "https://www.parlament.gv.at/dokument/XXVII/NRSITZ/159/fname_1481169.pdf",
    "protocol_html_url": "https://www.parlament.gv.at/dokument/XXVII/NRSITZ/159/fnameorig_1481169.html",
    "uid": "XXVII_NRSITZ_159",
    "raw_path": "steno_protocols/raw_html/XXVII_NRSITZ_159.html",
    "txt_path": "steno_protocols/plain_text/XXVII_NRSITZ_159.txt"
  },
  {
    "session_date_display": "26.11.2020",
    "session_date_iso": "2020-11-26T00:00:00",
    "gp_code": "XXVII",
    "chamber": "NRSITZ",
    "session_number": 67,
    "title": "67. Sitzung (67/NRSITZ)",
    "citation": "67/NRSITZ",
    "session_detail_url": "https://www.parlament.gv.at/gegenstand/XXVII/NRSITZ/67",
    "protocol_pdf_url": "https://www.parlament.gv.at/dokument/XXVII/NRSITZ/67/fname_884850.pdf",
    "protocol_html_url": "https://www.parlament.gv.at/dokument/XXVII/NRSITZ/67/fnameorig_884850.html",
    "uid": "XXVII_NRSITZ_67",
    "raw_path": "steno_protocols/raw_html/XXVII_NRSITZ_67.html",
    "txt_path": "steno_protocols/plain_text/XXVII_NRSITZ_67.txt"
  },
  {
    "session_date_display": "10.12.2020",
    "session_date_iso": "2020-12-10T00:00:00",
    "gp_code": "XXVII",
    "chamber": "NRSITZ",
    "session_number": 69,
    "title": "69. Sitzung (69/NRSITZ)",
    "citation": "69/NRSITZ",
    "session_detail_url": "https://www.parlament.gv.at/gegenstand/XXVII/NRSITZ/69",
    "protocol_pdf_url": "https://www.parlament.gv.at/dokument/XXVII/NRSITZ/69/fname_936634.pdf",
    "protocol_html_url": "https://www.parlament.gv.at/dokument/XXVII/NRSITZ/69/fnameorig_936634.html",
    "uid": "XXVII_NRSITZ_69",
    "raw_path": "steno_protocols/raw_html/XXVII_NRSITZ_69.html",
    "txt_path": "steno_protocols/plain_text/XXVII_NRSITZ_69.txt"
  },
  {
    "session_date_display": "21.09.2022",
    "session_date_iso": "2022-09-21T00:00:00",
    "gp_code": "XXVII",
    "chamber": "NRSITZ",
    "session_number": 172,
    "title": "172. Sitzung (172/NRSITZ)",
    "citation": "172/NRSITZ",
    "session_detail_url": "https://www.parlament.gv.at/gegenstand/XXVII/NRSITZ/172",
    "protocol_pdf_url": "https://www.parlament.gv.at/dokument/XXVII/NRSITZ/172/fname_1546188.pdf",
    "protocol_html_url": "https://www.parlament.gv.at/dokument/XXVII/NRSITZ/172/fnameorig_1546188.html",
    "uid": "XXVII_NRSITZ_172",
    "raw_path": "steno_protocols/raw_html/XXVII_NRSITZ_172.html",
    "txt_path": "steno_protocols/plain_text/XXVII_NRSITZ_172.txt"
  },
  {
    "session_date_display": "12.06.2002",
    "session_date_iso": "2002-06-12T00:00:00",
    "gp_code": "XXI",
    "chamber": "NRSITZ",
    "session_number": 106,
    "title": "106. Sitzung (106/NRSITZ)",
    "citation": "106/NRSITZ",
    "session_detail_url": "https://www.parlament.gv.at/gegenstand/XXI/NRSITZ/106",
    "protocol_pdf_url": "https://www.parlament.gv.at/dokument/XXI/NRSITZ/106/fname_114567.pdf",
    "protocol_html_url": "https://www.parlament.gv.at/dokument/XXI/NRSITZ/106/fnameorig_114567.html",
    "uid": "XXI_NRSITZ_106",
    "raw_path": "steno_protocols/raw_html/XXI_NRSITZ_106.html",
    "txt_path": "steno_protocols/plain_text/XXI_NRSITZ_106.txt"
  },
  {
    "session_date_display": "02.03.2000",
    "session_date_iso": "2000-03-02T00:00:00",
    "gp_code": "XXI",
    "chamber": "NRSITZ",
    "session_number": 13,
    "title": "13. Sitzung (13/NRSITZ)",
    "citation": "13/NRSITZ",
    "session_detail_url": "https://www.parlament.gv.at/gegenstand/XXI/NRSITZ/13",
    "protocol_pdf_url": "https://www.parlament.gv.at/dokument/XXI/NRSITZ/13/fname_114381.pdf",
    "protocol_html_url": "https://www.parlament.gv.at/dokument/XXI/NRSITZ/13/fnameorig_114381.html",
    "uid": "XXI_NRSITZ_13",
    "raw_path": "steno_protocols/raw_html/XXI_NRSITZ_13.html",
    "txt_path": "steno_protocols/plain_text/XXI_NRSITZ_13.txt"
  },
  {
    "session_date_display": "19.08.2002",
    "session_date_iso": "2002-08-19T00:00:00",
    "gp_code": "XXI",
    "chamber": "NRSITZ",
    "session_number": 114,
    "title": "114. Sitzung (114/NRSITZ)",
    "citation": "114/NRSITZ",
    "session_detail_url": "https://www.parlament.gv.at/gegenstand/XXI/NRSITZ/114",
    "protocol_pdf_url": "https://www.parlament.gv.at/dokument/XXI/NRSITZ/114/fname_114601.pdf",
    "protocol_html_url": "https://www.parlament.gv.at/dokument/XXI/NRSITZ/114/fnameorig_114601.html",
    "uid": "XXI_NRSITZ_114",
    "raw_path": "steno_protocols/raw_html/XXI_NRSITZ_114.html",
    "txt_path": "steno_protocols/plain_text/XXI_NRSITZ_114.txt"
  },
  {
    "session_date_display": "17.05.2000",
    "session_date_iso": "2000-05-17T00:00:00",
    "gp_code": "XXI",
    "chamber": "NRSITZ",
    "session_number": 27,
    "title": "27. Sitzung (27/NRSITZ)",
    "citation": "27/NRSITZ",
    "session_detail_url": "https://www.parlament.gv.at/gegenstand/XXI/NRSITZ/27",
    "protocol_pdf_url": "https://www.parlament.gv.at/dokument/XXI/NRSITZ/27/fname_114409.pdf",
    "protocol_html_url": "https://www.parlament.gv.at/dokument/XXI/NRSITZ/27/fnameorig_114409.html",
    "uid": "XXI_NRSITZ_27",
    "raw_path": "steno_protocols/raw_html/XXI_NRSITZ_27.html",
    "txt_path": "steno_protocols/plain_text/XXI_NRSITZ_27.txt"
  },
  {
    "session_date_display": "07.06.2000",
    "session_date_iso": "2000-06-07T00:00:00",
    "gp_code": "XXI",
    "chamber": "NRSITZ",
    "session_number": 30,
    "title": "30. Sitzung (30/NRSITZ)",
    "citation": "30/NRSITZ",
    "session_detail_url": "https://www.parlament.gv.at/gegenstand/XXI/NRSITZ/30",
    "protocol_pdf_url": "https://www.parlament.gv.at/dokument/XXI/NRSITZ/30/fname_114415.pdf",
    "protocol_html_url": "https://www.parlament.gv.at/dokument/XXI/NRSITZ/30/fnameorig_114415.html",
    "uid": "XXI_NRSITZ_30",
    "raw_path": "steno_protocols/raw_html/XXI_NRSITZ_30.html",
    "txt_path": "steno_protocols/plain_text/XXI_NRSITZ_30.txt"
  },
  {
    "session_date_display": "20.09.2000",
    "session_date_iso": "2000-09-20T00:00:00",
    "gp_code": "XXI",
    "chamber": "NRSITZ",
    "session_number": 36,
    "title": "36. Sitzung (36/NRSITZ)",
    "citation": "36/NRSITZ",
    "session_detail_url": "https://www.parlament.gv.at/gegenstand/XXI/NRSITZ/36",
    "protocol_pdf_url": "https://www.parlament.gv.at/dokument/XXI/NRSITZ/36/fname_114427.pdf",
    "protocol_html_url": "https://www.parlament.gv.at/dokument/XXI/NRSITZ/36/fnameorig_114427.html",
    "uid": "XXI_NRSITZ_36",
    "raw_path": "steno_protocols/raw_html/XXI_NRSITZ_36.html",
    "txt_path": "steno_protocols/plain_text/XXI_NRSITZ_36.txt"
  },
  {
    "session_date_display": "28.11.2000",
    "session_date_iso": "2000-11-28T00:00:00",
    "gp_code": "XXI",
    "chamber": "NRSITZ",
    "session_number": 47,
    "title": "47. Sitzung (47/NRSITZ)",
    "citation": "47/NRSITZ",
    "session_detail_url": "https://www.parlament.gv.at/gegenstand/XXI/NRSITZ/47",
    "protocol_pdf_url": "https://www.parlament.gv.at/dokument/XXI/NRSITZ/47/fname_114449.pdf",
    "protocol_html_url": "https://www.parlament.gv.at/dokument/XXI/NRSITZ/47/fnameorig_114449.html",
    "uid": "XXI_NRSITZ_47",
    "raw_path": "steno_protocols/raw_html/XXI_NRSITZ_47.html",
    "txt_path": "steno_protocols/plain_text/XXI_NRSITZ_47.txt"
  },
  {
    "session_date_display": "31.01.2001",
    "session_date_iso": "2001-01-31T00:00:00",
    "gp_code": "XXI",
    "chamber": "NRSITZ",
    "session_number": 55,
    "title": "55. Sitzung (55/NRSITZ)",
    "citation": "55/NRSITZ",
    "session_detail_url": "https://www.parlament.gv.at/gegenstand/XXI/NRSITZ/55",
    "protocol_pdf_url": "https://www.parlament.gv.at/dokument/XXI/NRSITZ/55/fname_114465.pdf",
    "protocol_html_url": "https://www.parlament.gv.at/dokument/XXI/NRSITZ/55/fnameorig_114465.html",
    "uid": "XXI_NRSITZ_55",
    "raw_path": "steno_protocols/raw_html/XXI_NRSITZ_55.html",
    "txt_path": "steno_protocols/plain_text/XXI_NRSITZ_55.txt"
  },
  {
    "session_date_display": "28.03.2001",
    "session_date_iso": "2001-03-28T00:00:00",
    "gp_code": "XXI",
    "chamber": "NRSITZ",
    "session_number": 62,
    "title": "62. Sitzung (62/NRSITZ)",
    "citation": "62/NRSITZ",
    "session_detail_url": "https://www.parlament.gv.at/gegenstand/XXI/NRSITZ/62",
    "protocol_pdf_url": "https://www.parlament.gv.at/dokument/XXI/NRSITZ/62/fname_114479.pdf",
    "protocol_html_url": "https://www.parlament.gv.at/dokument/XXI/NRSITZ/62/fnameorig_114479.html",
    "uid": "XXI_NRSITZ_62",
    "raw_path": "steno_protocols/raw_html/XXI_NRSITZ_62.html",
    "txt_path": "steno_protocols/plain_text/XXI_NRSITZ_62.txt"
  },
  {
    "session_date_display": "06.06.2001",
    "session_date_iso": "2001-06-06T00:00:00",
    "gp_code": "XXI",
    "chamber": "NRSITZ",
    "session_number": 71,
    "title": "71. Sitzung (71/NRSITZ)",
    "citation": "71/NRSITZ",
    "session_detail_url": "https://www.parlament.gv.at/gegenstand/XXI/NRSITZ/71",
    "protocol_pdf_url": "https://www.parlament.gv.at/dokument/XXI/NRSITZ/71/fname_114497.pdf",
    "protocol_html_url": "https://www.parlament.gv.at/dokument/XXI/NRSITZ/71/fnameorig_114497.html",
    "uid": "XXI_NRSITZ_71",
    "raw_path": "steno_protocols/raw_html/XXI_NRSITZ_71.html",
    "txt_path": "steno_protocols/plain_text/XXI_NRSITZ_71.txt"
  },
  {
    "session_date_display": "26.09.2001",
    "session_date_iso": "2001-09-26T00:00:00",
    "gp_code": "XXI",
    "chamber": "NRSITZ",
    "session_number": 77,
    "title": "77. Sitzung (77/NRSITZ)",
    "citation": "77/NRSITZ",
    "session_detail_url": "https://www.parlament.gv.at/gegenstand/XXI/NRSITZ/77",
    "protocol_pdf_url": "https://www.parlament.gv.at/dokument/XXI/NRSITZ/77/fname_114509.pdf",
    "protocol_html_url": "https://www.parlament.gv.at/dokument/XXI/NRSITZ/77/fnameorig_114509.html",
    "uid": "XXI_NRSITZ_77",
    "raw_path": "steno_protocols/raw_html/XXI_NRSITZ_77.html",
    "txt_path": "steno_protocols/plain_text/XXI_NRSITZ_77.txt"
  },
  {
    "session_date_display": "23.10.2001",
    "session_date_iso": "2001-10-23T00:00:00",
    "gp_code": "XXI",
    "chamber": "NRSITZ",
    "session_number": 80,
    "title": "80. Sitzung (80/NRSITZ)",
    "citation": "80/NRSITZ",
    "session_detail_url": "https://www.parlament.gv.at/gegenstand/XXI/NRSITZ/80",
    "protocol_pdf_url": "https://www.parlament.gv.at/dokument/XXI/NRSITZ/80/fname_114515.pdf",
    "protocol_html_url": "https://www.parlament.gv.at/dokument/XXI/NRSITZ/80/fnameorig_114515.html",
    "uid": "XXI_NRSITZ_80",
    "raw_path": "steno_protocols/raw_html/XXI_NRSITZ_80.html",
    "txt_path": "steno_protocols/plain_text/XXI_NRSITZ_80.txt"
  },
  {
    "session_date_display": "12.12.2001",
    "session_date_iso": "2001-12-12T00:00:00",
    "gp_code": "XXI",
    "chamber": "NRSITZ",
    "session_number": 88,
    "title": "88. Sitzung (88/NRSITZ)",
    "citation": "88/NRSITZ",
    "session_detail_url": "https://www.parlament.gv.at/gegenstand/XXI/NRSITZ/88",
    "protocol_pdf_url": "https://www.parlament.gv.at/dokument/XXI/NRSITZ/88/fname_114531.pdf",
    "protocol_html_url": "https://www.parlament.gv.at/dokument/XXI/NRSITZ/88/fnameorig_114531.html",
    "uid": "XXI_NRSITZ_88",
    "raw_path": "steno_protocols/raw_html/XXI_NRSITZ_88.html",
    "txt_path": "steno_protocols/plain_text/XXI_NRSITZ_88.txt"
  },
  {
    "session_date_display": "31.01.2002",
    "session_date_iso": "2002-01-31T00:00:00",
    "gp_code": "XXI",
    "chamber": "NRSITZ",
    "session_number": 93,
    "title": "93. Sitzung (93/NRSITZ)",
    "citation": "93/NRSITZ",
    "session_detail_url": "https://www.parlament.gv.at/gegenstand/XXI/NRSITZ/93",
    "protocol_pdf_url": "https://www.parlament.gv.at/dokument/XXI/NRSITZ/93/fname_114541.pdf",
    "protocol_html_url": "https://www.parlament.gv.at/dokument/XXI/NRSITZ/93/fnameorig_114541.html",
    "uid": "XXI_NRSITZ_93",
    "raw_path": "steno_protocols/raw_html/XXI_NRSITZ_93.html",
    "txt_path": "steno_protocols/plain_text/XXI_NRSITZ_93.txt"
  },
  {
    "session_date_display": "27.02.2002",
    "session_date_iso": "2002-02-27T00:00:00",
    "gp_code": "XXI",
    "chamber": "NRSITZ",
    "session_number": 94,
    "title": "94. Sitzung (94/NRSITZ)",
    "citation": "94/NRSITZ",
    "session_detail_url": "https://www.parlament.gv.at/gegenstand/XXI/NRSITZ/94",
    "protocol_pdf_url": "https://www.parlament.gv.at/dokument/XXI/NRSITZ/94/fname_114543.pdf",
    "protocol_html_url": "https://www.parlament.gv.at/dokument/XXI/NRSITZ/94/fnameorig_114543.html",
    "uid": "XXI_NRSITZ_94",
    "raw_path": "steno_protocols/raw_html/XXI_NRSITZ_94.html",
    "txt_path": "steno_protocols/plain_text/XXI_NRSITZ_94.txt"
  },
  {
    "session_date_display": "20.03.2002",
    "session_date_iso": "2002-03-20T00:00:00",
    "gp_code": "XXI",
    "chamber": "NRSITZ",
    "session_number": 97,
    "title": "97. Sitzung (97/NRSITZ)",
    "citation": "97/NRSITZ",
    "session_detail_url": "https://www.parlament.gv.at/gegenstand/XXI/NRSITZ/97",
    "protocol_pdf_url": "https://www.parlament.gv.at/dokument/XXI/NRSITZ/97/fname_114549.pdf",
    "protocol_html_url": "https://www.parlament.gv.at/dokument/XXI/NRSITZ/97/fnameorig_114549.html",
    "uid": "XXI_NRSITZ_97",
    "raw_path": "steno_protocols/raw_html/XXI_NRSITZ_97.html",
    "txt_path": "steno_protocols/plain_text/XXI_NRSITZ_97.txt"
  },
  {
    "session_date_display": "23.10.2003",
    "session_date_iso": "2003-10-23T00:00:00",
    "gp_code": "XXII",
    "chamber": "NRSITZ",
    "session_number": 36,
    "title": "36. Sitzung (36/NRSITZ)",
    "citation": "36/NRSITZ",
    "session_detail_url": "https://www.parlament.gv.at/gegenstand/XXII/NRSITZ/36",
    "protocol_pdf_url": "https://www.parlament.gv.at/dokument/XXII/NRSITZ/36/fname_011705.pdf",
    "protocol_html_url": "https://www.parlament.gv.at/dokument/XXII/NRSITZ/36/fnameorig_011705.html",
    "uid": "XXII_NRSITZ_36",
    "raw_path": "steno_protocols/raw_html/XXII_NRSITZ_36.html",
    "txt_path": "steno_protocols/plain_text/XXII_NRSITZ_36.txt"
  },
  {
    "session_date_display": "17.06.2003",
    "session_date_iso": "2003-06-17T00:00:00",
    "gp_code": "XXII",
    "chamber": "NRSITZ",
    "session_number": 24,
    "title": "24. Sitzung (24/NRSITZ)",
    "citation": "24/NRSITZ",
    "session_detail_url": "https://www.parlament.gv.at/gegenstand/XXII/NRSITZ/24",
    "protocol_pdf_url": "https://www.parlament.gv.at/dokument/XXII/NRSITZ/24/fname_007213.pdf",
    "protocol_html_url": "https://www.parlament.gv.at/dokument/XXII/NRSITZ/24/fnameorig_007213.html",
    "uid": "XXII_NRSITZ_24",
    "raw_path": "steno_protocols/raw_html/XXII_NRSITZ_24.html",
    "txt_path": "steno_protocols/plain_text/XXII_NRSITZ_24.txt"
  },
  {
    "session_date_display": "04.06.2004",
    "session_date_iso": "2004-06-04T00:00:00",
    "gp_code": "XXII",
    "chamber": "NRSITZ",
    "session_number": 64,
    "title": "64. Sitzung (64/NRSITZ)",
    "citation": "64/NRSITZ",
    "session_detail_url": "https://www.parlament.gv.at/gegenstand/XXII/NRSITZ/64",
    "protocol_pdf_url": "https://www.parlament.gv.at/dokument/XXII/NRSITZ/64/fname_024806.pdf",
    "protocol_html_url": "https://www.parlament.gv.at/dokument/XXII/NRSITZ/64/fnameorig_024806.html",
    "uid": "XXII_NRSITZ_64",
    "raw_path": "steno_protocols/raw_html/XXII_NRSITZ_64.html",
    "txt_path": "steno_protocols/plain_text/XXII_NRSITZ_64.txt"
  },
  {
    "session_date_display": "16.06.2004",
    "session_date_iso": "2004-06-16T00:00:00",
    "gp_code": "XXII",
    "chamber": "NRSITZ",
    "session_number": 65,
    "title": "65. Sitzung (65/NRSITZ)",
    "citation": "65/NRSITZ",
    "session_detail_url": "https://www.parlament.gv.at/gegenstand/XXII/NRSITZ/65",
    "protocol_pdf_url": "https://www.parlament.gv.at/dokument/XXII/NRSITZ/65/fname_024804.pdf",
    "protocol_html_url": "https://www.parlament.gv.at/dokument/XXII/NRSITZ/65/fnameorig_024804.html",
    "uid": "XXII_NRSITZ_65",
    "raw_path": "steno_protocols/raw_html/XXII_NRSITZ_65.html",
    "txt_path": "steno_protocols/plain_text/XXII_NRSITZ_65.txt"
  },
  {
    "session_date_display": "29.01.2004",
    "session_date_iso": "2004-01-29T00:00:00",
    "gp_code": "XXII",
    "chamber": "NRSITZ",
    "session_number": 46,
    "title": "46. Sitzung (46/NRSITZ)",
    "citation": "46/NRSITZ",
    "session_detail_url": "https://www.parlament.gv.at/gegenstand/XXII/NRSITZ/46",
    "protocol_pdf_url": "https://www.parlament.gv.at/dokument/XXII/NRSITZ/46/fname_018036.pdf",
    "protocol_html_url": "https://www.parlament.gv.at/dokument/XXII/NRSITZ/46/fnameorig_018036.html",
    "uid": "XXII_NRSITZ_46",
    "raw_path": "steno_protocols/raw_html/XXII_NRSITZ_46.html",
    "txt_path": "steno_protocols/plain_text/XXII_NRSITZ_46.txt"
  },
  {
    "session_date_display": "07.07.2004",
    "session_date_iso": "2004-07-07T00:00:00",
    "gp_code": "XXII",
    "chamber": "NRSITZ",
    "session_number": 71,
    "title": "71. Sitzung (71/NRSITZ)",
    "citation": "71/NRSITZ",
    "session_detail_url": "https://www.parlament.gv.at/gegenstand/XXII/NRSITZ/71",
    "protocol_pdf_url": "https://www.parlament.gv.at/dokument/XXII/NRSITZ/71/fname_026373.pdf",
    "protocol_html_url": "https://www.parlament.gv.at/dokument/XXII/NRSITZ/71/fnameorig_026373.html",
    "uid": "XXII_NRSITZ_71",
    "raw_path": "steno_protocols/raw_html/XXII_NRSITZ_71.html",
    "txt_path": "steno_protocols/plain_text/XXII_NRSITZ_71.txt"
  },
  {
    "session_date_display": "09.07.2004",
    "session_date_iso": "2004-07-09T00:00:00",
    "gp_code": "XXII",
    "chamber": "NRSITZ",
    "session_number": 73,
    "title": "73. Sitzung (73/NRSITZ)",
    "citation": "73/NRSITZ",
    "session_detail_url": "https://www.parlament.gv.at/gegenstand/XXII/NRSITZ/73",
    "protocol_pdf_url": "https://www.parlament.gv.at/dokument/XXII/NRSITZ/73/fname_026495.pdf",
    "protocol_html_url": "https://www.parlament.gv.at/dokument/XXII/NRSITZ/73/fnameorig_026495.html",
    "uid": "XXII_NRSITZ_73",
    "raw_path": "steno_protocols/raw_html/XXII_NRSITZ_73.html",
    "txt_path": "steno_protocols/plain_text/XXII_NRSITZ_73.txt"
  },
  {
    "session_date_display": "10.02.2004",
    "session_date_iso": "2004-02-10T00:00:00",
    "gp_code": "XXII",
    "chamber": "NRSITZ",
    "session_number": 49,
    "title": "49. Sitzung (49/NRSITZ)",
    "citation": "49/NRSITZ",
    "session_detail_url": "https://www.parlament.gv.at/gegenstand/XXII/NRSITZ/49",
    "protocol_pdf_url": "https://www.parlament.gv.at/dokument/XXII/NRSITZ/49/fname_017938.pdf",
    "protocol_html_url": "https://www.parlament.gv.at/dokument/XXII/NRSITZ/49/fnameorig_017938.html",
    "uid": "XXII_NRSITZ_49",
    "raw_path": "steno_protocols/raw_html/XXII_NRSITZ_49.html",
    "txt_path": "steno_protocols/plain_text/XXII_NRSITZ_49.txt"
  },
  {
    "session_date_display": "26.02.2004",
    "session_date_iso": "2004-02-26T00:00:00",
    "gp_code": "XXII",
    "chamber": "NRSITZ",
    "session_number": 51,
    "title": "51. Sitzung (51/NRSITZ)",
    "citation": "51/NRSITZ",
    "session_detail_url": "https://www.parlament.gv.at/gegenstand/XXII/NRSITZ/51",
    "protocol_pdf_url": "https://www.parlament.gv.at/dokument/XXII/NRSITZ/51/fname_019032.pdf",
    "protocol_html_url": "https://www.parlament.gv.at/dokument/XXII/NRSITZ/51/fnameorig_019032.html",
    "uid": "XXII_NRSITZ_51",
    "raw_path": "steno_protocols/raw_html/XXII_NRSITZ_51.html",
    "txt_path": "steno_protocols/plain_text/XXII_NRSITZ_51.txt"
  },
  {
    "session_date_display": "11.11.2004",
    "session_date_iso": "2004-11-11T00:00:00",
    "gp_code": "XXII",
    "chamber": "NRSITZ",
    "session_number": 84,
    "title": "84. Sitzung (84/NRSITZ)",
    "citation": "84/NRSITZ",
    "session_detail_url": "https://www.parlament.gv.at/gegenstand/XXII/NRSITZ/84",
    "protocol_pdf_url": "https://www.parlament.gv.at/dokument/XXII/NRSITZ/84/fname_034643.pdf",
    "protocol_html_url": "https://www.parlament.gv.at/dokument/XXII/NRSITZ/84/fnameorig_034643.html",
    "uid": "XXII_NRSITZ_84",
    "raw_path": "steno_protocols/raw_html/XXII_NRSITZ_84.html",
    "txt_path": "steno_protocols/plain_text/XXII_NRSITZ_84.txt"
  },
  {
    "session_date_display": "18.11.2004",
    "session_date_iso": "2004-11-18T00:00:00",
    "gp_code": "XXII",
    "chamber": "NRSITZ",
    "session_number": 88,
    "title": "88. Sitzung (88/NRSITZ)",
    "citation": "88/NRSITZ",
    "session_detail_url": "https://www.parlament.gv.at/gegenstand/XXII/NRSITZ/88",
    "protocol_pdf_url": "https://www.parlament.gv.at/dokument/XXII/NRSITZ/88/fname_034640.pdf",
    "protocol_html_url": "https://www.parlament.gv.at/dokument/XXII/NRSITZ/88/fnameorig_034640.html",
    "uid": "XXII_NRSITZ_88",
    "raw_path": "steno_protocols/raw_html/XXII_NRSITZ_88.html",
    "txt_path": "steno_protocols/plain_text/XXII_NRSITZ_88.txt"
  },
  {
    "session_date_display": "20.12.2002",
    "session_date_iso": "2002-12-20T00:00:00",
    "gp_code": "XXII",
    "chamber": "NRSITZ",
    "session_number": 2,
    "title": "2. Sitzung (2/NRSITZ)",
    "citation": "2/NRSITZ",
    "session_detail_url": "https://www.parlament.gv.at/gegenstand/XXII/NRSITZ/2",
    "protocol_pdf_url": "https://www.parlament.gv.at/dokument/XXII/NRSITZ/2/fname_114613.pdf",
    "protocol_html_url": "https://www.parlament.gv.at/dokument/XXII/NRSITZ/2/fnameorig_114613.html",
    "uid": "XXII_NRSITZ_2",
    "raw_path": "steno_protocols/raw_html/XXII_NRSITZ_2.html",
    "txt_path": "steno_protocols/plain_text/XXII_NRSITZ_2.txt"
  },
  {
    "session_date_display": "16.05.2017",
    "session_date_iso": "2017-05-16T00:00:00",
    "gp_code": "XXV",
    "chamber": "NRSITZ",
    "session_number": 180,
    "title": "180. Sitzung (180/NRSITZ)",
    "citation": "180/NRSITZ",
    "session_detail_url": "https://www.parlament.gv.at/gegenstand/XXV/NRSITZ/180",
    "protocol_pdf_url": "https://www.parlament.gv.at/dokument/XXV/NRSITZ/180/fname_672853.pdf",
    "protocol_html_url": "https://www.parlament.gv.at/dokument/XXV/NRSITZ/180/fnameorig_672853.html",
    "uid": "XXV_NRSITZ_180",
    "raw_path": "steno_protocols/raw_html/XXV_NRSITZ_180.html",
    "txt_path": "steno_protocols/plain_text/XXV_NRSITZ_180.txt"
  },
  {
    "session_date_display": "19.06.2017",
    "session_date_iso": "2017-06-19T00:00:00",
    "gp_code": "XXV",
    "chamber": "NRSITZ",
    "session_number": 186,
    "title": "186. Sitzung (186/NRSITZ)",
    "citation": "186/NRSITZ",
    "session_detail_url": "https://www.parlament.gv.at/gegenstand/XXV/NRSITZ/186",
    "protocol_pdf_url": "https://www.parlament.gv.at/dokument/XXV/NRSITZ/186/fname_673189.pdf",
    "protocol_html_url": "https://www.parlament.gv.at/dokument/XXV/NRSITZ/186/fnameorig_673189.html",
    "uid": "XXV_NRSITZ_186",
    "raw_path": "steno_protocols/raw_html/XXV_NRSITZ_186.html",
    "txt_path": "steno_protocols/plain_text/XXV_NRSITZ_186.txt"
  },
  {
    "session_date_display": "06.10.2015",
    "session_date_iso": "2015-10-06T00:00:00",
    "gp_code": "XXV",
    "chamber": "NRSITZ",
    "session_number": 94,
    "title": "94. Sitzung (94/NRSITZ)",
    "citation": "94/NRSITZ",
    "session_detail_url": "https://www.parlament.gv.at/gegenstand/XXV/NRSITZ/94",
    "protocol_pdf_url": "https://www.parlament.gv.at/dokument/XXV/NRSITZ/94/fname_525316.pdf",
    "protocol_html_url": "https://www.parlament.gv.at/dokument/XXV/NRSITZ/94/fnameorig_525316.html",
    "uid": "XXV_NRSITZ_94",
    "raw_path": "steno_protocols/raw_html/XXV_NRSITZ_94.html",
    "txt_path": "steno_protocols/plain_text/XXV_NRSITZ_94.txt"
  },
  {
    "session_date_display": "14.10.2015",
    "session_date_iso": "2015-10-14T00:00:00",
    "gp_code": "XXV",
    "chamber": "NRSITZ",
    "session_number": 96,
    "title": "96. Sitzung (96/NRSITZ)",
    "citation": "96/NRSITZ",
    "session_detail_url": "https://www.parlament.gv.at/gegenstand/XXV/NRSITZ/96",
    "protocol_pdf_url": "https://www.parlament.gv.at/dokument/XXV/NRSITZ/96/fname_526269.pdf",
    "protocol_html_url": "https://www.parlament.gv.at/dokument/XXV/NRSITZ/96/fnameorig_526269.html",
    "uid": "XXV_NRSITZ_96",
    "raw_path": "steno_protocols/raw_html/XXV_NRSITZ_96.html",
    "txt_path": "steno_protocols/plain_text/XXV_NRSITZ_96.txt"
  },
  {
    "session_date_display": "11.11.2015",
    "session_date_iso": "2015-11-11T00:00:00",
    "gp_code": "XXV",
    "chamber": "NRSITZ",
    "session_number": 100,
    "title": "100. Sitzung (100/NRSITZ)",
    "citation": "100/NRSITZ",
    "session_detail_url": "https://www.parlament.gv.at/gegenstand/XXV/NRSITZ/100",
    "protocol_pdf_url": "https://www.parlament.gv.at/dokument/XXV/NRSITZ/100/fname_543770.pdf",
    "protocol_html_url": "https://www.parlament.gv.at/dokument/XXV/NRSITZ/100/fnameorig_543770.html",
    "uid": "XXV_NRSITZ_100",
    "raw_path": "steno_protocols/raw_html/XXV_NRSITZ_100.html",
    "txt_path": "steno_protocols/plain_text/XXV_NRSITZ_100.txt"
  },
  {
    "session_date_display": "17.02.2014",
    "session_date_iso": "2014-02-17T00:00:00",
    "gp_code": "XXV",
    "chamber": "NRSITZ",
    "session_number": 11,
    "title": "11. Sitzung (11/NRSITZ)",
    "citation": "11/NRSITZ",
    "session_detail_url": "https://www.parlament.gv.at/gegenstand/XXV/NRSITZ/11",
    "protocol_pdf_url": "https://www.parlament.gv.at/dokument/XXV/NRSITZ/11/fname_342428.pdf",
    "protocol_html_url": "https://www.parlament.gv.at/dokument/XXV/NRSITZ/11/fnameorig_342428.html",
    "uid": "XXV_NRSITZ_11",
    "raw_path": "steno_protocols/raw_html/XXV_NRSITZ_11.html",
    "txt_path": "steno_protocols/plain_text/XXV_NRSITZ_11.txt"
  },
  {
    "session_date_display": "10.12.2015",
    "session_date_iso": "2015-12-10T00:00:00",
    "gp_code": "XXV",
    "chamber": "NRSITZ",
    "session_number": 109,
    "title": "109. Sitzung (109/NRSITZ)",
    "citation": "109/NRSITZ",
    "session_detail_url": "https://www.parlament.gv.at/gegenstand/XXV/NRSITZ/109",
    "protocol_pdf_url": "https://www.parlament.gv.at/dokument/XXV/NRSITZ/109/fname_540800.pdf",
    "protocol_html_url": "https://www.parlament.gv.at/dokument/XXV/NRSITZ/109/fnameorig_540800.html",
    "uid": "XXV_NRSITZ_109",
    "raw_path": "steno_protocols/raw_html/XXV_NRSITZ_109.html",
    "txt_path": "steno_protocols/plain_text/XXV_NRSITZ_109.txt"
  },
  {
    "session_date_display": "29.04.2014",
    "session_date_iso": "2014-04-29T00:00:00",
    "gp_code": "XXV",
    "chamber": "NRSITZ",
    "session_number": 21,
    "title": "21. Sitzung (21/NRSITZ)",
    "citation": "21/NRSITZ",
    "session_detail_url": "https://www.parlament.gv.at/gegenstand/XXV/NRSITZ/21",
    "protocol_pdf_url": "https://www.parlament.gv.at/dokument/XXV/NRSITZ/21/fname_358507.pdf",
    "protocol_html_url": "https://www.parlament.gv.at/dokument/XXV/NRSITZ/21/fnameorig_358507.html",
    "uid": "XXV_NRSITZ_21",
    "raw_path": "steno_protocols/raw_html/XXV_NRSITZ_21.html",
    "txt_path": "steno_protocols/plain_text/XXV_NRSITZ_21.txt"
  },
  {
    "session_date_display": "08.03.2016",
    "session_date_iso": "2016-03-08T00:00:00",
    "gp_code": "XXV",
    "chamber": "NRSITZ",
    "session_number": 115,
    "title": "115. Sitzung (115/NRSITZ)",
    "citation": "115/NRSITZ",
    "session_detail_url": "https://www.parlament.gv.at/gegenstand/XXV/NRSITZ/115",
    "protocol_pdf_url": "https://www.parlament.gv.at/dokument/XXV/NRSITZ/115/fname_562448.pdf",
    "protocol_html_url": "https://www.parlament.gv.at/dokument/XXV/NRSITZ/115/fnameorig_562448.html",
    "uid": "XXV_NRSITZ_115",
    "raw_path": "steno_protocols/raw_html/XXV_NRSITZ_115.html",
    "txt_path": "steno_protocols/plain_text/XXV_NRSITZ_115.txt"
  },
  {
    "session_date_display": "23.05.2014",
    "session_date_iso": "2014-05-23T00:00:00",
    "gp_code": "XXV",
    "chamber": "NRSITZ",
    "session_number": 28,
    "title": "28. Sitzung (28/NRSITZ)",
    "citation": "28/NRSITZ",
    "session_detail_url": "https://www.parlament.gv.at/gegenstand/XXV/NRSITZ/28",
    "protocol_pdf_url": "https://www.parlament.gv.at/dokument/XXV/NRSITZ/28/fname_363229.pdf",
    "protocol_html_url": "https://www.parlament.gv.at/dokument/XXV/NRSITZ/28/fnameorig_363229.html",
    "uid": "XXV_NRSITZ_28",
    "raw_path": "steno_protocols/raw_html/XXV_NRSITZ_28.html",
    "txt_path": "steno_protocols/plain_text/XXV_NRSITZ_28.txt"
  },
  {
    "session_date_display": "23.05.2014",
    "session_date_iso": "2014-05-23T00:00:00",
    "gp_code": "XXV",
    "chamber": "NRSITZ",
    "session_number": 29,
    "title": "29. Sitzung (29/NRSITZ)",
    "citation": "29/NRSITZ",
    "session_detail_url": "https://www.parlament.gv.at/gegenstand/XXV/NRSITZ/29",
    "protocol_pdf_url": "https://www.parlament.gv.at/dokument/XXV/NRSITZ/29/fname_363227.pdf",
    "protocol_html_url": "https://www.parlament.gv.at/dokument/XXV/NRSITZ/29/fnameorig_363227.html",
    "uid": "XXV_NRSITZ_29",
    "raw_path": "steno_protocols/raw_html/XXV_NRSITZ_29.html",
    "txt_path": "steno_protocols/plain_text/XXV_NRSITZ_29.txt"
  },
  {
    "session_date_display": "10.07.2014",
    "session_date_iso": "2014-07-10T00:00:00",
    "gp_code": "XXV",
    "chamber": "NRSITZ",
    "session_number": 37,
    "title": "37. Sitzung (37/NRSITZ)",
    "citation": "37/NRSITZ",
    "session_detail_url": "https://www.parlament.gv.at/gegenstand/XXV/NRSITZ/37",
    "protocol_pdf_url": "https://www.parlament.gv.at/dokument/XXV/NRSITZ/37/fname_368110.pdf",
    "protocol_html_url": "https://www.parlament.gv.at/dokument/XXV/NRSITZ/37/fnameorig_368110.html",
    "uid": "XXV_NRSITZ_37",
    "raw_path": "steno_protocols/raw_html/XXV_NRSITZ_37.html",
    "txt_path": "steno_protocols/plain_text/XXV_NRSITZ_37.txt"
  },
  {
    "session_date_display": "10.07.2014",
    "session_date_iso": "2014-07-10T00:00:00",
    "gp_code": "XXV",
    "chamber": "NRSITZ",
    "session_number": 38,
    "title": "38. Sitzung (38/NRSITZ)",
    "citation": "38/NRSITZ",
    "session_detail_url": "https://www.parlament.gv.at/gegenstand/XXV/NRSITZ/38",
    "protocol_pdf_url": "https://www.parlament.gv.at/dokument/XXV/NRSITZ/38/fname_368108.pdf",
    "protocol_html_url": "https://www.parlament.gv.at/dokument/XXV/NRSITZ/38/fnameorig_368108.html",
    "uid": "XXV_NRSITZ_38",
    "raw_path": "steno_protocols/raw_html/XXV_NRSITZ_38.html",
    "txt_path": "steno_protocols/plain_text/XXV_NRSITZ_38.txt"
  },
  {
    "session_date_display": "16.06.2016",
    "session_date_iso": "2016-06-16T00:00:00",
    "gp_code": "XXV",
    "chamber": "NRSITZ",
    "session_number": 135,
    "title": "135. Sitzung (135/NRSITZ)",
    "citation": "135/NRSITZ",
    "session_detail_url": "https://www.parlament.gv.at/gegenstand/XXV/NRSITZ/135",
    "protocol_pdf_url": "https://www.parlament.gv.at/dokument/XXV/NRSITZ/135/fname_577702.pdf",
    "protocol_html_url": "https://www.parlament.gv.at/dokument/XXV/NRSITZ/135/fnameorig_577702.html",
    "uid": "XXV_NRSITZ_135",
    "raw_path": "steno_protocols/raw_html/XXV_NRSITZ_135.html",
    "txt_path": "steno_protocols/plain_text/XXV_NRSITZ_135.txt"
  },
  {
    "session_date_display": "25.02.2015",
    "session_date_iso": "2015-02-25T00:00:00",
    "gp_code": "XXV",
    "chamber": "NRSITZ",
    "session_number": 61,
    "title": "61. Sitzung (61/NRSITZ)",
    "citation": "61/NRSITZ",
    "session_detail_url": "https://www.parlament.gv.at/gegenstand/XXV/NRSITZ/61",
    "protocol_pdf_url": "https://www.parlament.gv.at/dokument/XXV/NRSITZ/61/fname_411101.pdf",
    "protocol_html_url": "https://www.parlament.gv.at/dokument/XXV/NRSITZ/61/fnameorig_411101.html",
    "uid": "XXV_NRSITZ_61",
    "raw_path": "steno_protocols/raw_html/XXV_NRSITZ_61.html",
    "txt_path": "steno_protocols/plain_text/XXV_NRSITZ_61.txt"
  },
  {
    "session_date_display": "18.03.2015",
    "session_date_iso": "2015-03-18T00:00:00",
    "gp_code": "XXV",
    "chamber": "NRSITZ",
    "session_number": 63,
    "title": "63. Sitzung (63/NRSITZ)",
    "citation": "63/NRSITZ",
    "session_detail_url": "https://www.parlament.gv.at/gegenstand/XXV/NRSITZ/63",
    "protocol_pdf_url": "https://www.parlament.gv.at/dokument/XXV/NRSITZ/63/fname_420252.pdf",
    "protocol_html_url": "https://www.parlament.gv.at/dokument/XXV/NRSITZ/63/fnameorig_420252.html",
    "uid": "XXV_NRSITZ_63",
    "raw_path": "steno_protocols/raw_html/XXV_NRSITZ_63.html",
    "txt_path": "steno_protocols/plain_text/XXV_NRSITZ_63.txt"
  },
  {
    "session_date_display": "22.04.2015",
    "session_date_iso": "2015-04-22T00:00:00",
    "gp_code": "XXV",
    "chamber": "NRSITZ",
    "session_number": 68,
    "title": "68. Sitzung (68/NRSITZ)",
    "citation": "68/NRSITZ",
    "session_detail_url": "https://www.parlament.gv.at/gegenstand/XXV/NRSITZ/68",
    "protocol_pdf_url": "https://www.parlament.gv.at/dokument/XXV/NRSITZ/68/fname_437413.pdf",
    "protocol_html_url": "https://www.parlament.gv.at/dokument/XXV/NRSITZ/68/fnameorig_437413.html",
    "uid": "XXV_NRSITZ_68",
    "raw_path": "steno_protocols/raw_html/XXV_NRSITZ_68.html",
    "txt_path": "steno_protocols/plain_text/XXV_NRSITZ_68.txt"
  },
  {
    "session_date_display": "13.10.2016",
    "session_date_iso": "2016-10-13T00:00:00",
    "gp_code": "XXV",
    "chamber": "NRSITZ",
    "session_number": 148,
    "title": "148. Sitzung (148/NRSITZ)",
    "citation": "148/NRSITZ",
    "session_detail_url": "https://www.parlament.gv.at/gegenstand/XXV/NRSITZ/148",
    "protocol_pdf_url": "https://www.parlament.gv.at/dokument/XXV/NRSITZ/148/fname_584143.pdf",
    "protocol_html_url": "https://www.parlament.gv.at/dokument/XXV/NRSITZ/148/fnameorig_584143.html",
    "uid": "XXV_NRSITZ_148",
    "raw_path": "steno_protocols/raw_html/XXV_NRSITZ_148.html",
    "txt_path": "steno_protocols/plain_text/XXV_NRSITZ_148.txt"
  },
  {
    "session_date_display": "29.03.2017",
    "session_date_iso": "2017-03-29T00:00:00",
    "gp_code": "XXV",
    "chamber": "NRSITZ",
    "session_number": 171,
    "title": "171. Sitzung (171/NRSITZ)",
    "citation": "171/NRSITZ",
    "session_detail_url": "https://www.parlament.gv.at/gegenstand/XXV/NRSITZ/171",
    "protocol_pdf_url": "https://www.parlament.gv.at/dokument/XXV/NRSITZ/171/fname_669064.pdf",
    "protocol_html_url": "https://www.parlament.gv.at/dokument/XXV/NRSITZ/171/fnameorig_669064.html",
    "uid": "XXV_NRSITZ_171",
    "raw_path": "steno_protocols/raw_html/XXV_NRSITZ_171.html",
    "txt_path": "steno_protocols/plain_text/XXV_NRSITZ_171.txt"
  },
  {
    "session_date_display": "27.04.2017",
    "session_date_iso": "2017-04-27T00:00:00",
    "gp_code": "XXV",
    "chamber": "NRSITZ",
    "session_number": 177,
    "title": "177. Sitzung (177/NRSITZ)",
    "citation": "177/NRSITZ",
    "session_detail_url": "https://www.parlament.gv.at/gegenstand/XXV/NRSITZ/177",
    "protocol_pdf_url": "https://www.parlament.gv.at/dokument/XXV/NRSITZ/177/fname_670622.pdf",
    "protocol_html_url": "https://www.parlament.gv.at/dokument/XXV/NRSITZ/177/fnameorig_670622.html",
    "uid": "XXV_NRSITZ_177",
    "raw_path": "steno_protocols/raw_html/XXV_NRSITZ_177.html",
    "txt_path": "steno_protocols/plain_text/XXV_NRSITZ_177.txt"
  },
  {
    "session_date_display": "11.12.2019",
    "session_date_iso": "2019-12-11T00:00:00",
    "gp_code": "XXVII",
    "chamber": "NRSITZ",
    "session_number": 7,
    "title": "7. Sitzung (7/NRSITZ)",
    "citation": "7/NRSITZ",
    "session_detail_url": "https://www.parlament.gv.at/gegenstand/XXVII/NRSITZ/7",
    "protocol_pdf_url": "https://www.parlament.gv.at/dokument/XXVII/NRSITZ/7/fname_795938.pdf",
    "protocol_html_url": "https://www.parlament.gv.at/dokument/XXVII/NRSITZ/7/fnameorig_795938.html",
    "uid": "XXVII_NRSITZ_7",
    "raw_path": "steno_protocols/raw_html/XXVII_NRSITZ_7.html",
    "txt_path": "steno_protocols/plain_text/XXVII_NRSITZ_7.txt"
  },
  {
    "session_date_display": "09.04.2021",
    "session_date_iso": "2021-04-09T00:00:00",
    "gp_code": "XXVII",
    "chamber": "NRSITZ",
    "session_number": 96,
    "title": "96. Sitzung (96/NRSITZ)",
    "citation": "96/NRSITZ",
    "session_detail_url": "https://www.parlament.gv.at/gegenstand/XXVII/NRSITZ/96",
    "protocol_pdf_url": "https://www.parlament.gv.at/dokument/XXVII/NRSITZ/96/fname_988859.pdf",
    "protocol_html_url": "https://www.parlament.gv.at/dokument/XXVII/NRSITZ/96/fnameorig_988859.html",
    "uid": "XXVII_NRSITZ_96",
    "raw_path": "steno_protocols/raw_html/XXVII_NRSITZ_96.html",
    "txt_path": "steno_protocols/plain_text/XXVII_NRSITZ_96.txt"
  },
  {
    "session_date_display": "22.04.2021",
    "session_date_iso": "2021-04-22T00:00:00",
    "gp_code": "XXVII",
    "chamber": "NRSITZ",
    "session_number": 99,
    "title": "99. Sitzung (99/NRSITZ)",
    "citation": "99/NRSITZ",
    "session_detail_url": "https://www.parlament.gv.at/gegenstand/XXVII/NRSITZ/99",
    "protocol_pdf_url": "https://www.parlament.gv.at/dokument/XXVII/NRSITZ/99/fname_1001759.pdf",
    "protocol_html_url": "https://www.parlament.gv.at/dokument/XXVII/NRSITZ/99/fnameorig_1001759.html",
    "uid": "XXVII_NRSITZ_99",
    "raw_path": "steno_protocols/raw_html/XXVII_NRSITZ_99.html",
    "txt_path": "steno_protocols/plain_text/XXVII_NRSITZ_99.txt"
  },
  {
    "session_date_display": "20.05.2021",
    "session_date_iso": "2021-05-20T00:00:00",
    "gp_code": "XXVII",
    "chamber": "NRSITZ",
    "session_number": 108,
    "title": "108. Sitzung (108/NRSITZ)",
    "citation": "108/NRSITZ",
    "session_detail_url": "https://www.parlament.gv.at/gegenstand/XXVII/NRSITZ/108",
    "protocol_pdf_url": "https://www.parlament.gv.at/dokument/XXVII/NRSITZ/108/fname_1007646.pdf",
    "protocol_html_url": "https://www.parlament.gv.at/dokument/XXVII/NRSITZ/108/fnameorig_1007646.html",
    "uid": "XXVII_NRSITZ_108",
    "raw_path": "steno_protocols/raw_html/XXVII_NRSITZ_108.html",
    "txt_path": "steno_protocols/plain_text/XXVII_NRSITZ_108.txt"
  },
  {
    "session_date_display": "16.06.2021",
    "session_date_iso": "2021-06-16T00:00:00",
    "gp_code": "XXVII",
    "chamber": "NRSITZ",
    "session_number": 111,
    "title": "111. Sitzung (111/NRSITZ)",
    "citation": "111/NRSITZ",
    "session_detail_url": "https://www.parlament.gv.at/gegenstand/XXVII/NRSITZ/111",
    "protocol_pdf_url": "https://www.parlament.gv.at/dokument/XXVII/NRSITZ/111/fname_1080801.pdf",
    "protocol_html_url": "https://www.parlament.gv.at/dokument/XXVII/NRSITZ/111/fnameorig_1080801.html",
    "uid": "XXVII_NRSITZ_111",
    "raw_path": "steno_protocols/raw_html/XXVII_NRSITZ_111.html",
    "txt_path": "steno_protocols/plain_text/XXVII_NRSITZ_111.txt"
  },
  {
    "session_date_display": "08.07.2021",
    "session_date_iso": "2021-07-08T00:00:00",
    "gp_code": "XXVII",
    "chamber": "NRSITZ",
    "session_number": 117,
    "title": "117. Sitzung (117/NRSITZ)",
    "citation": "117/NRSITZ",
    "session_detail_url": "https://www.parlament.gv.at/gegenstand/XXVII/NRSITZ/117",
    "protocol_pdf_url": "https://www.parlament.gv.at/dokument/XXVII/NRSITZ/117/fname_1426448.pdf",
    "protocol_html_url": "https://www.parlament.gv.at/dokument/XXVII/NRSITZ/117/fnameorig_1426448.html",
    "uid": "XXVII_NRSITZ_117",
    "raw_path": "steno_protocols/raw_html/XXVII_NRSITZ_117.html",
    "txt_path": "steno_protocols/plain_text/XXVII_NRSITZ_117.txt"
  },
  {
    "session_date_display": "28.04.2020",
    "session_date_iso": "2020-04-28T00:00:00",
    "gp_code": "XXVII",
    "chamber": "NRSITZ",
    "session_number": 27,
    "title": "27. Sitzung (27/NRSITZ)",
    "citation": "27/NRSITZ",
    "session_detail_url": "https://www.parlament.gv.at/gegenstand/XXVII/NRSITZ/27",
    "protocol_pdf_url": "https://www.parlament.gv.at/dokument/XXVII/NRSITZ/27/fname_811031.pdf",
    "protocol_html_url": "https://www.parlament.gv.at/dokument/XXVII/NRSITZ/27/fnameorig_811031.html",
    "uid": "XXVII_NRSITZ_27",
    "raw_path": "steno_protocols/raw_html/XXVII_NRSITZ_27.html",
    "txt_path": "steno_protocols/plain_text/XXVII_NRSITZ_27.txt"
  },
  {
    "session_date_display": "22.09.2021",
    "session_date_iso": "2021-09-22T00:00:00",
    "gp_code": "XXVII",
    "chamber": "NRSITZ",
    "session_number": 123,
    "title": "123. Sitzung (123/NRSITZ)",
    "citation": "123/NRSITZ",
    "session_detail_url": "https://www.parlament.gv.at/gegenstand/XXVII/NRSITZ/123",
    "protocol_pdf_url": "https://www.parlament.gv.at/dokument/XXVII/NRSITZ/123/fname_1426355.pdf",
    "protocol_html_url": "https://www.parlament.gv.at/dokument/XXVII/NRSITZ/123/fnameorig_1426355.html",
    "uid": "XXVII_NRSITZ_123",
    "raw_path": "steno_protocols/raw_html/XXVII_NRSITZ_123.html",
    "txt_path": "steno_protocols/plain_text/XXVII_NRSITZ_123.txt"
  },
  {
    "session_date_display": "13.05.2020",
    "session_date_iso": "2020-05-13T00:00:00",
    "gp_code": "XXVII",
    "chamber": "NRSITZ",
    "session_number": 30,
    "title": "30. Sitzung (30/NRSITZ)",
    "citation": "30/NRSITZ",
    "session_detail_url": "https://www.parlament.gv.at/gegenstand/XXVII/NRSITZ/30",
    "protocol_pdf_url": "https://www.parlament.gv.at/dokument/XXVII/NRSITZ/30/fname_811805.pdf",
    "protocol_html_url": "https://www.parlament.gv.at/dokument/XXVII/NRSITZ/30/fnameorig_811805.html",
    "uid": "XXVII_NRSITZ_30",
    "raw_path": "steno_protocols/raw_html/XXVII_NRSITZ_30.html",
    "txt_path": "steno_protocols/plain_text/XXVII_NRSITZ_30.txt"
  },
  {
    "session_date_display": "26.05.2020",
    "session_date_iso": "2020-05-26T00:00:00",
    "gp_code": "XXVII",
    "chamber": "NRSITZ",
    "session_number": 32,
    "title": "32. Sitzung (32/NRSITZ)",
    "citation": "32/NRSITZ",
    "session_detail_url": "https://www.parlament.gv.at/gegenstand/XXVII/NRSITZ/32",
    "protocol_pdf_url": "https://www.parlament.gv.at/dokument/XXVII/NRSITZ/32/fname_839887.pdf",
    "protocol_html_url": "https://www.parlament.gv.at/dokument/XXVII/NRSITZ/32/fnameorig_839887.html",
    "uid": "XXVII_NRSITZ_32",
    "raw_path": "steno_protocols/raw_html/XXVII_NRSITZ_32.html",
    "txt_path": "steno_protocols/plain_text/XXVII_NRSITZ_32.txt"
  },
  {
    "session_date_display": "18.06.2020",
    "session_date_iso": "2020-06-18T00:00:00",
    "gp_code": "XXVII",
    "chamber": "NRSITZ",
    "session_number": 39,
    "title": "39. Sitzung (39/NRSITZ)",
    "citation": "39/NRSITZ",
    "session_detail_url": "https://www.parlament.gv.at/gegenstand/XXVII/NRSITZ/39",
    "protocol_pdf_url": "https://www.parlament.gv.at/dokument/XXVII/NRSITZ/39/fname_841311.pdf",
    "protocol_html_url": "https://www.parlament.gv.at/dokument/XXVII/NRSITZ/39/fnameorig_841311.html",
    "uid": "XXVII_NRSITZ_39",
    "raw_path": "steno_protocols/raw_html/XXVII_NRSITZ_39.html",
    "txt_path": "steno_protocols/plain_text/XXVII_NRSITZ_39.txt"
  },
  {
    "session_date_display": "30.06.2020",
    "session_date_iso": "2020-06-30T00:00:00",
    "gp_code": "XXVII",
    "chamber": "NRSITZ",
    "session_number": 40,
    "title": "40. Sitzung (40/NRSITZ)",
    "citation": "40/NRSITZ",
    "session_detail_url": "https://www.parlament.gv.at/gegenstand/XXVII/NRSITZ/40",
    "protocol_pdf_url": "https://www.parlament.gv.at/dokument/XXVII/NRSITZ/40/fname_844444.pdf",
    "protocol_html_url": "https://www.parlament.gv.at/dokument/XXVII/NRSITZ/40/fnameorig_844444.html",
    "uid": "XXVII_NRSITZ_40",
    "raw_path": "steno_protocols/raw_html/XXVII_NRSITZ_40.html",
    "txt_path": "steno_protocols/plain_text/XXVII_NRSITZ_40.txt"
  },
  {
    "session_date_display": "16.12.2021",
    "session_date_iso": "2021-12-16T00:00:00",
    "gp_code": "XXVII",
    "chamber": "NRSITZ",
    "session_number": 137,
    "title": "137. Sitzung (137/NRSITZ)",
    "citation": "137/NRSITZ",
    "session_detail_url": "https://www.parlament.gv.at/gegenstand/XXVII/NRSITZ/137",
    "protocol_pdf_url": "https://www.parlament.gv.at/dokument/XXVII/NRSITZ/137/fname_1438187.pdf",
    "protocol_html_url": "https://www.parlament.gv.at/dokument/XXVII/NRSITZ/137/fnameorig_1438187.html",
    "uid": "XXVII_NRSITZ_137",
    "raw_path": "steno_protocols/raw_html/XXVII_NRSITZ_137.html",
    "txt_path": "steno_protocols/plain_text/XXVII_NRSITZ_137.txt"
  },
  {
    "session_date_display": "14.09.2020",
    "session_date_iso": "2020-09-14T00:00:00",
    "gp_code": "XXVII",
    "chamber": "NRSITZ",
    "session_number": 49,
    "title": "49. Sitzung (49/NRSITZ)",
    "citation": "49/NRSITZ",
    "session_detail_url": "https://www.parlament.gv.at/gegenstand/XXVII/NRSITZ/49",
    "protocol_pdf_url": "https://www.parlament.gv.at/dokument/XXVII/NRSITZ/49/fname_851311.pdf",
    "protocol_html_url": "https://www.parlament.gv.at/dokument/XXVII/NRSITZ/49/fnameorig_851311.html",
    "uid": "XXVII_NRSITZ_49",
    "raw_path": "steno_protocols/raw_html/XXVII_NRSITZ_49.html",
    "txt_path": "steno_protocols/plain_text/XXVII_NRSITZ_49.txt"
  },
  {
    "session_date_display": "14.10.2020",
    "session_date_iso": "2020-10-14T00:00:00",
    "gp_code": "XXVII",
    "chamber": "NRSITZ",
    "session_number": 56,
    "title": "56. Sitzung (56/NRSITZ)",
    "citation": "56/NRSITZ",
    "session_detail_url": "https://www.parlament.gv.at/gegenstand/XXVII/NRSITZ/56",
    "protocol_pdf_url": "https://www.parlament.gv.at/dokument/XXVII/NRSITZ/56/fname_858015.pdf",
    "protocol_html_url": "https://www.parlament.gv.at/dokument/XXVII/NRSITZ/56/fnameorig_858015.html",
    "uid": "XXVII_NRSITZ_56",
    "raw_path": "steno_protocols/raw_html/XXVII_NRSITZ_56.html",
    "txt_path": "steno_protocols/plain_text/XXVII_NRSITZ_56.txt"
  },
  {
    "session_date_display": "24.03.2022",
    "session_date_iso": "2022-03-24T00:00:00",
    "gp_code": "XXVII",
    "chamber": "NRSITZ",
    "session_number": 149,
    "title": "149. Sitzung (149/NRSITZ)",
    "citation": "149/NRSITZ",
    "session_detail_url": "https://www.parlament.gv.at/gegenstand/XXVII/NRSITZ/149",
    "protocol_pdf_url": "https://www.parlament.gv.at/dokument/XXVII/NRSITZ/149/fname_1513839.pdf",
    "protocol_html_url": "https://www.parlament.gv.at/dokument/XXVII/NRSITZ/149/fnameorig_1513839.html",
    "uid": "XXVII_NRSITZ_149",
    "raw_path": "steno_protocols/raw_html/XXVII_NRSITZ_149.html",
    "txt_path": "steno_protocols/plain_text/XXVII_NRSITZ_149.txt"
  },
  {
    "session_date_display": "05.11.2020",
    "session_date_iso": "2020-11-05T00:00:00",
    "gp_code": "XXVII",
    "chamber": "NRSITZ",
    "session_number": 60,
    "title": "60. Sitzung (60/NRSITZ)",
    "citation": "60/NRSITZ",
    "session_detail_url": "https://www.parlament.gv.at/gegenstand/XXVII/NRSITZ/60",
    "protocol_pdf_url": "https://www.parlament.gv.at/dokument/XXVII/NRSITZ/60/fname_876492.pdf",
    "protocol_html_url": "https://www.parlament.gv.at/dokument/XXVII/NRSITZ/60/fnameorig_876492.html",
    "uid": "XXVII_NRSITZ_60",
    "raw_path": "steno_protocols/raw_html/XXVII_NRSITZ_60.html",
    "txt_path": "steno_protocols/plain_text/XXVII_NRSITZ_60.txt"
  },
  {
    "session_date_display": "19.11.2020",
    "session_date_iso": "2020-11-19T00:00:00",
    "gp_code": "XXVII",
    "chamber": "NRSITZ",
    "session_number": 63,
    "title": "63. Sitzung (63/NRSITZ)",
    "citation": "63/NRSITZ",
    "session_detail_url": "https://www.parlament.gv.at/gegenstand/XXVII/NRSITZ/63",
    "protocol_pdf_url": "https://www.parlament.gv.at/dokument/XXVII/NRSITZ/63/fname_884845.pdf",
    "protocol_html_url": "https://www.parlament.gv.at/dokument/XXVII/NRSITZ/63/fnameorig_884845.html",
    "uid": "XXVII_NRSITZ_63",
    "raw_path": "steno_protocols/raw_html/XXVII_NRSITZ_63.html",
    "txt_path": "steno_protocols/plain_text/XXVII_NRSITZ_63.txt"
  },
  {
    "session_date_display": "18.05.2022",
    "session_date_iso": "2022-05-18T00:00:00",
    "gp_code": "XXVII",
    "chamber": "NRSITZ",
    "session_number": 157,
    "title": "157. Sitzung (157/NRSITZ)",
    "citation": "157/NRSITZ",
    "session_detail_url": "https://www.parlament.gv.at/gegenstand/XXVII/NRSITZ/157",
    "protocol_pdf_url": "https://www.parlament.gv.at/dokument/XXVII/NRSITZ/157/fname_1480590.pdf",
    "protocol_html_url": "https://www.parlament.gv.at/dokument/XXVII/NRSITZ/157/fnameorig_1480590.html",
    "uid": "XXVII_NRSITZ_157",
    "raw_path": "steno_protocols/raw_html/XXVII_NRSITZ_157.html",
    "txt_path": "steno_protocols/plain_text/XXVII_NRSITZ_157.txt"
  },
  {
    "session_date_display": "20.11.2020",
    "session_date_iso": "2020-11-20T00:00:00",
    "gp_code": "XXVII",
    "chamber": "NRSITZ",
    "session_number": 65,
    "title": "65. Sitzung (65/NRSITZ)",
    "citation": "65/NRSITZ",
    "session_detail_url": "https://www.parlament.gv.at/gegenstand/XXVII/NRSITZ/65",
    "protocol_pdf_url": "https://www.parlament.gv.at/dokument/XXVII/NRSITZ/65/fname_885546.pdf",
    "protocol_html_url": "https://www.parlament.gv.at/dokument/XXVII/NRSITZ/65/fnameorig_885546.html",
    "uid": "XXVII_NRSITZ_65",
    "raw_path": "steno_protocols/raw_html/XXVII_NRSITZ_65.html",
    "txt_path": "steno_protocols/plain_text/XXVII_NRSITZ_65.txt"
  },
  {
    "session_date_display": "10.12.2020",
    "session_date_iso": "2020-12-10T00:00:00",
    "gp_code": "XXVII",
    "chamber": "NRSITZ",
    "session_number": 70,
    "title": "70. Sitzung (70/NRSITZ)",
    "citation": "70/NRSITZ",
    "session_detail_url": "https://www.parlament.gv.at/gegenstand/XXVII/NRSITZ/70",
    "protocol_pdf_url": "https://www.parlament.gv.at/dokument/XXVII/NRSITZ/70/fname_936671.pdf",
    "protocol_html_url": "https://www.parlament.gv.at/dokument/XXVII/NRSITZ/70/fnameorig_936671.html",
    "uid": "XXVII_NRSITZ_70",
    "raw_path": "steno_protocols/raw_html/XXVII_NRSITZ_70.html",
    "txt_path": "steno_protocols/plain_text/XXVII_NRSITZ_70.txt"
  },
  {
    "session_date_display": "15.06.2022",
    "session_date_iso": "2022-06-15T00:00:00",
    "gp_code": "XXVII",
    "chamber": "NRSITZ",
    "session_number": 164,
    "title": "164. Sitzung (164/NRSITZ)",
    "citation": "164/NRSITZ",
    "session_detail_url": "https://www.parlament.gv.at/gegenstand/XXVII/NRSITZ/164",
    "protocol_pdf_url": "https://www.parlament.gv.at/dokument/XXVII/NRSITZ/164/fname_1553789.pdf",
    "protocol_html_url": "https://www.parlament.gv.at/dokument/XXVII/NRSITZ/164/fnameorig_1553789.html",
    "uid": "XXVII_NRSITZ_164",
    "raw_path": "steno_protocols/raw_html/XXVII_NRSITZ_164.html",
    "txt_path": "steno_protocols/plain_text/XXVII_NRSITZ_164.txt"
  },
  {
    "session_date_display": "23.06.2022",
    "session_date_iso": "2022-06-23T00:00:00",
    "gp_code": "XXVII",
    "chamber": "NRSITZ",
    "session_number": 166,
    "title": "166. Sitzung (166/NRSITZ)",
    "citation": "166/NRSITZ",
    "session_detail_url": "https://www.parlament.gv.at/gegenstand/XXVII/NRSITZ/166",
    "protocol_pdf_url": "https://www.parlament.gv.at/dokument/XXVII/NRSITZ/166/fname_1513022.pdf",
    "protocol_html_url": "https://www.parlament.gv.at/dokument/XXVII/NRSITZ/166/fnameorig_1513022.html",
    "uid": "XXVII_NRSITZ_166",
    "raw_path": "steno_protocols/raw_html/XXVII_NRSITZ_166.html",
    "txt_path": "steno_protocols/plain_text/XXVII_NRSITZ_166.txt"
  },
  {
    "session_date_display": "13.01.2021",
    "session_date_iso": "2021-01-13T00:00:00",
    "gp_code": "XXVII",
    "chamber": "NRSITZ",
    "session_number": 76,
    "title": "76. Sitzung (76/NRSITZ)",
    "citation": "76/NRSITZ",
    "session_detail_url": "https://www.parlament.gv.at/gegenstand/XXVII/NRSITZ/76",
    "protocol_pdf_url": "https://www.parlament.gv.at/dokument/XXVII/NRSITZ/76/fname_980691.pdf",
    "protocol_html_url": "https://www.parlament.gv.at/dokument/XXVII/NRSITZ/76/fnameorig_980691.html",
    "uid": "XXVII_NRSITZ_76",
    "raw_path": "steno_protocols/raw_html/XXVII_NRSITZ_76.html",
    "txt_path": "steno_protocols/plain_text/XXVII_NRSITZ_76.txt"
  },
  {
    "session_date_display": "21.09.2022",
    "session_date_iso": "2022-09-21T00:00:00",
    "gp_code": "XXVII",
    "chamber": "NRSITZ",
    "session_number": 171,
    "title": "171. Sitzung (171/NRSITZ)",
    "citation": "171/NRSITZ",
    "session_detail_url": "https://www.parlament.gv.at/gegenstand/XXVII/NRSITZ/171",
    "protocol_pdf_url": "https://www.parlament.gv.at/dokument/XXVII/NRSITZ/171/fname_1545076.pdf",
    "protocol_html_url": "https://www.parlament.gv.at/dokument/XXVII/NRSITZ/171/fnameorig_1545076.html",
    "uid": "XXVII_NRSITZ_171",
    "raw_path": "steno_protocols/raw_html/XXVII_NRSITZ_171.html",
    "txt_path": "steno_protocols/plain_text/XXVII_NRSITZ_171.txt"
  },
  {
    "session_date_display": "14.01.2021",
    "session_date_iso": "2021-01-14T00:00:00",
    "gp_code": "XXVII",
    "chamber": "NRSITZ",
    "session_number": 78,
    "title": "78. Sitzung (78/NRSITZ)",
    "citation": "78/NRSITZ",
    "session_detail_url": "https://www.parlament.gv.at/gegenstand/XXVII/NRSITZ/78",
    "protocol_pdf_url": "https://www.parlament.gv.at/dokument/XXVII/NRSITZ/78/fname_949140.pdf",
    "protocol_html_url": "https://www.parlament.gv.at/dokument/XXVII/NRSITZ/78/fnameorig_949140.html",
    "uid": "XXVII_NRSITZ_78",
    "raw_path": "steno_protocols/raw_html/XXVII_NRSITZ_78.html",
    "txt_path": "steno_protocols/plain_text/XXVII_NRSITZ_78.txt"
  },
  {
    "session_date_display": "04.02.2021",
    "session_date_iso": "2021-02-04T00:00:00",
    "gp_code": "XXVII",
    "chamber": "NRSITZ",
    "session_number": 81,
    "title": "81. Sitzung (81/NRSITZ)",
    "citation": "81/NRSITZ",
    "session_detail_url": "https://www.parlament.gv.at/gegenstand/XXVII/NRSITZ/81",
    "protocol_pdf_url": "https://www.parlament.gv.at/dokument/XXVII/NRSITZ/81/fname_980693.pdf",
    "protocol_html_url": "https://www.parlament.gv.at/dokument/XXVII/NRSITZ/81/fnameorig_980693.html",
    "uid": "XXVII_NRSITZ_81",
    "raw_path": "steno_protocols/raw_html/XXVII_NRSITZ_81.html",
    "txt_path": "steno_protocols/plain_text/XXVII_NRSITZ_81.txt"
  },
  {
    "session_date_display": "04.02.2021",
    "session_date_iso": "2021-02-04T00:00:00",
    "gp_code": "XXVII",
    "chamber": "NRSITZ",
    "session_number": 82,
    "title": "82. Sitzung (82/NRSITZ)",
    "citation": "82/NRSITZ",
    "session_detail_url": "https://www.parlament.gv.at/gegenstand/XXVII/NRSITZ/82",
    "protocol_pdf_url": "https://www.parlament.gv.at/dokument/XXVII/NRSITZ/82/fname_980698.pdf",
    "protocol_html_url": "https://www.parlament.gv.at/dokument/XXVII/NRSITZ/82/fnameorig_980698.html",
    "uid": "XXVII_NRSITZ_82",
    "raw_path": "steno_protocols/raw_html/XXVII_NRSITZ_82.html",
    "txt_path": "steno_protocols/plain_text/XXVII_NRSITZ_82.txt"
  },
  {
    "session_date_display": "24.02.2000",
    "session_date_iso": "2000-02-24T00:00:00",
    "gp_code": "XXI",
    "chamber": "NRSITZ",
    "session_number": 11,
    "title": "11. Sitzung (11/NRSITZ)",
    "citation": "11/NRSITZ",
    "session_detail_url": "https://www.parlament.gv.at/gegenstand/XXI/NRSITZ/11",
    "protocol_pdf_url": "https://www.parlament.gv.at/dokument/XXI/NRSITZ/11/fname_114377.pdf",
    "protocol_html_url": "https://www.parlament.gv.at/dokument/XXI/NRSITZ/11/fnameorig_114377.html",
    "uid": "XXI_NRSITZ_11",
    "raw_path": "steno_protocols/raw_html/XXI_NRSITZ_11.html",
    "txt_path": "steno_protocols/plain_text/XXI_NRSITZ_11.txt"
  },
  {
    "session_date_display": "13.06.2002",
    "session_date_iso": "2002-06-13T00:00:00",
    "gp_code": "XXI",
    "chamber": "NRSITZ",
    "session_number": 107,
    "title": "107. Sitzung (107/NRSITZ)",
    "citation": "107/NRSITZ",
    "session_detail_url": "https://www.parlament.gv.at/gegenstand/XXI/NRSITZ/107",
    "protocol_pdf_url": "https://www.parlament.gv.at/dokument/XXI/NRSITZ/107/fname_114569.pdf",
    "protocol_html_url": "https://www.parlament.gv.at/dokument/XXI/NRSITZ/107/fnameorig_114569.html",
    "uid": "XXI_NRSITZ_107",
    "raw_path": "steno_protocols/raw_html/XXI_NRSITZ_107.html",
    "txt_path": "steno_protocols/plain_text/XXI_NRSITZ_107.txt"
  },
  {
    "session_date_display": "10.07.2002",
    "session_date_iso": "2002-07-10T00:00:00",
    "gp_code": "XXI",
    "chamber": "NRSITZ",
    "session_number": 110,
    "title": "110. Sitzung (110/NRSITZ)",
    "citation": "110/NRSITZ",
    "session_detail_url": "https://www.parlament.gv.at/gegenstand/XXI/NRSITZ/110",
    "protocol_pdf_url": "https://www.parlament.gv.at/dokument/XXI/NRSITZ/110/fname_114593.pdf",
    "protocol_html_url": "https://www.parlament.gv.at/dokument/XXI/NRSITZ/110/fnameorig_114593.html",
    "uid": "XXI_NRSITZ_110",
    "raw_path": "steno_protocols/raw_html/XXI_NRSITZ_110.html",
    "txt_path": "steno_protocols/plain_text/XXI_NRSITZ_110.txt"
  },
  {
    "session_date_display": "19.08.2002",
    "session_date_iso": "2002-08-19T00:00:00",
    "gp_code": "XXI",
    "chamber": "NRSITZ",
    "session_number": 113,
    "title": "113. Sitzung (113/NRSITZ)",
    "citation": "113/NRSITZ",
    "session_detail_url": "https://www.parlament.gv.at/gegenstand/XXI/NRSITZ/113",
    "protocol_pdf_url": "https://www.parlament.gv.at/dokument/XXI/NRSITZ/113/fname_114599.pdf",
    "protocol_html_url": "https://www.parlament.gv.at/dokument/XXI/NRSITZ/113/fnameorig_114599.html",
    "uid": "XXI_NRSITZ_113",
    "raw_path": "steno_protocols/raw_html/XXI_NRSITZ_113.html",
    "txt_path": "steno_protocols/plain_text/XXI_NRSITZ_113.txt"
  },
  {
    "session_date_display": "17.05.2000",
    "session_date_iso": "2000-05-17T00:00:00",
    "gp_code": "XXI",
    "chamber": "NRSITZ",
    "session_number": 26,
    "title": "26. Sitzung (26/NRSITZ)",
    "citation": "26/NRSITZ",
    "session_detail_url": "https://www.parlament.gv.at/gegenstand/XXI/NRSITZ/26",
    "protocol_pdf_url": "https://www.parlament.gv.at/dokument/XXI/NRSITZ/26/fname_114407.pdf",
    "protocol_html_url": "https://www.parlament.gv.at/dokument/XXI/NRSITZ/26/fnameorig_114407.html",
    "uid": "XXI_NRSITZ_26",
    "raw_path": "steno_protocols/raw_html/XXI_NRSITZ_26.html",
    "txt_path": "steno_protocols/plain_text/XXI_NRSITZ_26.txt"
  },
  {
    "session_date_display": "18.05.2000",
    "session_date_iso": "2000-05-18T00:00:00",
    "gp_code": "XXI",
    "chamber": "NRSITZ",
    "session_number": 28,
    "title": "28. Sitzung (28/NRSITZ)",
    "citation": "28/NRSITZ",
    "session_detail_url": "https://www.parlament.gv.at/gegenstand/XXI/NRSITZ/28",
    "protocol_pdf_url": "https://www.parlament.gv.at/dokument/XXI/NRSITZ/28/fname_114411.pdf",
    "protocol_html_url": "https://www.parlament.gv.at/dokument/XXI/NRSITZ/28/fnameorig_114411.html",
    "uid": "XXI_NRSITZ_28",
    "raw_path": "steno_protocols/raw_html/XXI_NRSITZ_28.html",
    "txt_path": "steno_protocols/plain_text/XXI_NRSITZ_28.txt"
  },
  {
    "session_date_display": "23.11.2000",
    "session_date_iso": "2000-11-23T00:00:00",
    "gp_code": "XXI",
    "chamber": "NRSITZ",
    "session_number": 45,
    "title": "45. Sitzung (45/NRSITZ)",
    "citation": "45/NRSITZ",
    "session_detail_url": "https://www.parlament.gv.at/gegenstand/XXI/NRSITZ/45",
    "protocol_pdf_url": "https://www.parlament.gv.at/dokument/XXI/NRSITZ/45/fname_114445.pdf",
    "protocol_html_url": "https://www.parlament.gv.at/dokument/XXI/NRSITZ/45/fnameorig_114445.html",
    "uid": "XXI_NRSITZ_45",
    "raw_path": "steno_protocols/raw_html/XXI_NRSITZ_45.html",
    "txt_path": "steno_protocols/plain_text/XXI_NRSITZ_45.txt"
  },
  {
    "session_date_display": "05.12.2000",
    "session_date_iso": "2000-12-05T00:00:00",
    "gp_code": "XXI",
    "chamber": "NRSITZ",
    "session_number": 50,
    "title": "50. Sitzung (50/NRSITZ)",
    "citation": "50/NRSITZ",
    "session_detail_url": "https://www.parlament.gv.at/gegenstand/XXI/NRSITZ/50",
    "protocol_pdf_url": "https://www.parlament.gv.at/dokument/XXI/NRSITZ/50/fname_114455.pdf",
    "protocol_html_url": "https://www.parlament.gv.at/dokument/XXI/NRSITZ/50/fnameorig_114455.html",
    "uid": "XXI_NRSITZ_50",
    "raw_path": "steno_protocols/raw_html/XXI_NRSITZ_50.html",
    "txt_path": "steno_protocols/plain_text/XXI_NRSITZ_50.txt"
  },
  {
    "session_date_display": "14.12.2000",
    "session_date_iso": "2000-12-14T00:00:00",
    "gp_code": "XXI",
    "chamber": "NRSITZ",
    "session_number": 52,
    "title": "52. Sitzung (52/NRSITZ)",
    "citation": "52/NRSITZ",
    "session_detail_url": "https://www.parlament.gv.at/gegenstand/XXI/NRSITZ/52",
    "protocol_pdf_url": "https://www.parlament.gv.at/dokument/XXI/NRSITZ/52/fname_114459.pdf",
    "protocol_html_url": "https://www.parlament.gv.at/dokument/XXI/NRSITZ/52/fnameorig_114459.html",
    "uid": "XXI_NRSITZ_52",
    "raw_path": "steno_protocols/raw_html/XXI_NRSITZ_52.html",
    "txt_path": "steno_protocols/plain_text/XXI_NRSITZ_52.txt"
  },
  {
    "session_date_display": "14.12.2000",
    "session_date_iso": "2000-12-14T00:00:00",
    "gp_code": "XXI",
    "chamber": "NRSITZ",
    "session_number": 53,
    "title": "53. Sitzung (53/NRSITZ)",
    "citation": "53/NRSITZ",
    "session_detail_url": "https://www.parlament.gv.at/gegenstand/XXI/NRSITZ/53",
    "protocol_pdf_url": "https://www.parlament.gv.at/dokument/XXI/NRSITZ/53/fname_114461.pdf",
    "protocol_html_url": "https://www.parlament.gv.at/dokument/XXI/NRSITZ/53/fnameorig_114461.html",
    "uid": "XXI_NRSITZ_53",
    "raw_path": "steno_protocols/raw_html/XXI_NRSITZ_53.html",
    "txt_path": "steno_protocols/plain_text/XXI_NRSITZ_53.txt"
  },
  {
    "session_date_display": "01.03.2001",
    "session_date_iso": "2001-03-01T00:00:00",
    "gp_code": "XXI",
    "chamber": "NRSITZ",
    "session_number": 57,
    "title": "57. Sitzung (57/NRSITZ)",
    "citation": "57/NRSITZ",
    "session_detail_url": "https://www.parlament.gv.at/gegenstand/XXI/NRSITZ/57",
    "protocol_pdf_url": "https://www.parlament.gv.at/dokument/XXI/NRSITZ/57/fname_114469.pdf",
    "protocol_html_url": "https://www.parlament.gv.at/dokument/XXI/NRSITZ/57/fnameorig_114469.html",
    "uid": "XXI_NRSITZ_57",
    "raw_path": "steno_protocols/raw_html/XXI_NRSITZ_57.html",
    "txt_path": "steno_protocols/plain_text/XXI_NRSITZ_57.txt"
  },
  {
    "session_date_display": "03.04.2001",
    "session_date_iso": "2001-04-03T00:00:00",
    "gp_code": "XXI",
    "chamber": "NRSITZ",
    "session_number": 67,
    "title": "67. Sitzung (67/NRSITZ)",
    "citation": "67/NRSITZ",
    "session_detail_url": "https://www.parlament.gv.at/gegenstand/XXI/NRSITZ/67",
    "protocol_pdf_url": "https://www.parlament.gv.at/dokument/XXI/NRSITZ/67/fname_114489.pdf",
    "protocol_html_url": "https://www.parlament.gv.at/dokument/XXI/NRSITZ/67/fnameorig_114489.html",
    "uid": "XXI_NRSITZ_67",
    "raw_path": "steno_protocols/raw_html/XXI_NRSITZ_67.html",
    "txt_path": "steno_protocols/plain_text/XXI_NRSITZ_67.txt"
  },
  {
    "session_date_display": "06.07.2001",
    "session_date_iso": "2001-07-06T00:00:00",
    "gp_code": "XXI",
    "chamber": "NRSITZ",
    "session_number": 76,
    "title": "76. Sitzung (76/NRSITZ)",
    "citation": "76/NRSITZ",
    "session_detail_url": "https://www.parlament.gv.at/gegenstand/XXI/NRSITZ/76",
    "protocol_pdf_url": "https://www.parlament.gv.at/dokument/XXI/NRSITZ/76/fname_114507.pdf",
    "protocol_html_url": "https://www.parlament.gv.at/dokument/XXI/NRSITZ/76/fnameorig_114507.html",
    "uid": "XXI_NRSITZ_76",
    "raw_path": "steno_protocols/raw_html/XXI_NRSITZ_76.html",
    "txt_path": "steno_protocols/plain_text/XXI_NRSITZ_76.txt"
  },
  {
    "session_date_display": "26.09.2001",
    "session_date_iso": "2001-09-26T00:00:00",
    "gp_code": "XXI",
    "chamber": "NRSITZ",
    "session_number": 78,
    "title": "78. Sitzung (78/NRSITZ)",
    "citation": "78/NRSITZ",
    "session_detail_url": "https://www.parlament.gv.at/gegenstand/XXI/NRSITZ/78",
    "protocol_pdf_url": "https://www.parlament.gv.at/dokument/XXI/NRSITZ/78/fname_114511.pdf",
    "protocol_html_url": "https://www.parlament.gv.at/dokument/XXI/NRSITZ/78/fnameorig_114511.html",
    "uid": "XXI_NRSITZ_78",
    "raw_path": "steno_protocols/raw_html/XXI_NRSITZ_78.html",
    "txt_path": "steno_protocols/plain_text/XXI_NRSITZ_78.txt"
  },
  {
    "session_date_display": "26.09.2001",
    "session_date_iso": "2001-09-26T00:00:00",
    "gp_code": "XXI",
    "chamber": "NRSITZ",
    "session_number": 79,
    "title": "79. Sitzung (79/NRSITZ)",
    "citation": "79/NRSITZ",
    "session_detail_url": "https://www.parlament.gv.at/gegenstand/XXI/NRSITZ/79",
    "protocol_pdf_url": "https://www.parlament.gv.at/dokument/XXI/NRSITZ/79/fname_114513.pdf",
    "protocol_html_url": "https://www.parlament.gv.at/dokument/XXI/NRSITZ/79/fnameorig_114513.html",
    "uid": "XXI_NRSITZ_79",
    "raw_path": "steno_protocols/raw_html/XXI_NRSITZ_79.html",
    "txt_path": "steno_protocols/plain_text/XXI_NRSITZ_79.txt"
  },
  {
    "session_date_display": "21.11.2001",
    "session_date_iso": "2001-11-21T00:00:00",
    "gp_code": "XXI",
    "chamber": "NRSITZ",
    "session_number": 83,
    "title": "83. Sitzung (83/NRSITZ)",
    "citation": "83/NRSITZ",
    "session_detail_url": "https://www.parlament.gv.at/gegenstand/XXI/NRSITZ/83",
    "protocol_pdf_url": "https://www.parlament.gv.at/dokument/XXI/NRSITZ/83/fname_114521.pdf",
    "protocol_html_url": "https://www.parlament.gv.at/dokument/XXI/NRSITZ/83/fnameorig_114521.html",
    "uid": "XXI_NRSITZ_83",
    "raw_path": "steno_protocols/raw_html/XXI_NRSITZ_83.html",
    "txt_path": "steno_protocols/plain_text/XXI_NRSITZ_83.txt"
  },
  {
    "session_date_display": "22.11.2001",
    "session_date_iso": "2001-11-22T00:00:00",
    "gp_code": "XXI",
    "chamber": "NRSITZ",
    "session_number": 84,
    "title": "84. Sitzung (84/NRSITZ)",
    "citation": "84/NRSITZ",
    "session_detail_url": "https://www.parlament.gv.at/gegenstand/XXI/NRSITZ/84",
    "protocol_pdf_url": "https://www.parlament.gv.at/dokument/XXI/NRSITZ/84/fname_114523.pdf",
    "protocol_html_url": "https://www.parlament.gv.at/dokument/XXI/NRSITZ/84/fnameorig_114523.html",
    "uid": "XXI_NRSITZ_84",
    "raw_path": "steno_protocols/raw_html/XXI_NRSITZ_84.html",
    "txt_path": "steno_protocols/plain_text/XXI_NRSITZ_84.txt"
  },
  {
    "session_date_display": "29.10.1999",
    "session_date_iso": "1999-10-29T00:00:00",
    "gp_code": "XXI",
    "chamber": "NRSITZ",
    "session_number": 1,
    "title": "1. Sitzung (1/NRSITZ)",
    "citation": "1/NRSITZ",
    "session_detail_url": "https://www.parlament.gv.at/gegenstand/XXI/NRSITZ/1",
    "protocol_pdf_url": "https://www.parlament.gv.at/dokument/XXI/NRSITZ/1/fname_114357.pdf",
    "protocol_html_url": "https://www.parlament.gv.at/dokument/XXI/NRSITZ/1/fnameorig_114357.html",
    "uid": "XXI_NRSITZ_1",
    "raw_path": "steno_protocols/raw_html/XXI_NRSITZ_1.html",
    "txt_path": "steno_protocols/plain_text/XXI_NRSITZ_1.txt"
  },
  {
    "session_date_display": "21.03.2002",
    "session_date_iso": "2002-03-21T00:00:00",
    "gp_code": "XXI",
    "chamber": "NRSITZ",
    "session_number": 98,
    "title": "98. Sitzung (98/NRSITZ)",
    "citation": "98/NRSITZ",
    "session_detail_url": "https://www.parlament.gv.at/gegenstand/XXI/NRSITZ/98",
    "protocol_pdf_url": "https://www.parlament.gv.at/dokument/XXI/NRSITZ/98/fname_114551.pdf",
    "protocol_html_url": "https://www.parlament.gv.at/dokument/XXI/NRSITZ/98/fnameorig_114551.html",
    "uid": "XXI_NRSITZ_98",
    "raw_path": "steno_protocols/raw_html/XXI_NRSITZ_98.html",
    "txt_path": "steno_protocols/plain_text/XXI_NRSITZ_98.txt"
  },
  {
    "session_date_display": "29.04.2003",
    "session_date_iso": "2003-04-29T00:00:00",
    "gp_code": "XXII",
    "chamber": "NRSITZ",
    "session_number": 13,
    "title": "13. Sitzung (13/NRSITZ)",
    "citation": "13/NRSITZ",
    "session_detail_url": "https://www.parlament.gv.at/gegenstand/XXII/NRSITZ/13",
    "protocol_pdf_url": "https://www.parlament.gv.at/dokument/XXII/NRSITZ/13/fname_114635.pdf",
    "protocol_html_url": "https://www.parlament.gv.at/dokument/XXII/NRSITZ/13/fnameorig_114635.html",
    "uid": "XXII_NRSITZ_13",
    "raw_path": "steno_protocols/raw_html/XXII_NRSITZ_13.html",
    "txt_path": "steno_protocols/plain_text/XXII_NRSITZ_13.txt"
  },
  {
    "session_date_display": "07.05.2003",
    "session_date_iso": "2003-05-07T00:00:00",
    "gp_code": "XXII",
    "chamber": "NRSITZ",
    "session_number": 14,
    "title": "14. Sitzung (14/NRSITZ)",
    "citation": "14/NRSITZ",
    "session_detail_url": "https://www.parlament.gv.at/gegenstand/XXII/NRSITZ/14",
    "protocol_pdf_url": "https://www.parlament.gv.at/dokument/XXII/NRSITZ/14/fname_114637.pdf",
    "protocol_html_url": "https://www.parlament.gv.at/dokument/XXII/NRSITZ/14/fnameorig_114637.html",
    "uid": "XXII_NRSITZ_14",
    "raw_path": "steno_protocols/raw_html/XXII_NRSITZ_14.html",
    "txt_path": "steno_protocols/plain_text/XXII_NRSITZ_14.txt"
  },
  {
    "session_date_display": "08.05.2003",
    "session_date_iso": "2003-05-08T00:00:00",
    "gp_code": "XXII",
    "chamber": "NRSITZ",
    "session_number": 15,
    "title": "15. Sitzung (15/NRSITZ)",
    "citation": "15/NRSITZ",
    "session_detail_url": "https://www.parlament.gv.at/gegenstand/XXII/NRSITZ/15",
    "protocol_pdf_url": "https://www.parlament.gv.at/dokument/XXII/NRSITZ/15/fname_114639.pdf",
    "protocol_html_url": "https://www.parlament.gv.at/dokument/XXII/NRSITZ/15/fnameorig_114639.html",
    "uid": "XXII_NRSITZ_15",
    "raw_path": "steno_protocols/raw_html/XXII_NRSITZ_15.html",
    "txt_path": "steno_protocols/plain_text/XXII_NRSITZ_15.txt"
  },
  {
    "session_date_display": "04.06.2003",
    "session_date_iso": "2003-06-04T00:00:00",
    "gp_code": "XXII",
    "chamber": "NRSITZ",
    "session_number": 18,
    "title": "18. Sitzung (18/NRSITZ)",
    "citation": "18/NRSITZ",
    "session_detail_url": "https://www.parlament.gv.at/gegenstand/XXII/NRSITZ/18",
    "protocol_pdf_url": "https://www.parlament.gv.at/dokument/XXII/NRSITZ/18/fname_006694.pdf",
    "protocol_html_url": "https://www.parlament.gv.at/dokument/XXII/NRSITZ/18/fnameorig_006694.html",
    "uid": "XXII_NRSITZ_18",
    "raw_path": "steno_protocols/raw_html/XXII_NRSITZ_18.html",
    "txt_path": "steno_protocols/plain_text/XXII_NRSITZ_18.txt"
  },
  {
    "session_date_display": "10.06.2003",
    "session_date_iso": "2003-06-10T00:00:00",
    "gp_code": "XXII",
    "chamber": "NRSITZ",
    "session_number": 20,
    "title": "20. Sitzung (20/NRSITZ)",
    "citation": "20/NRSITZ",
    "session_detail_url": "https://www.parlament.gv.at/gegenstand/XXII/NRSITZ/20",
    "protocol_pdf_url": "https://www.parlament.gv.at/dokument/XXII/NRSITZ/20/fname_007145.pdf",
    "protocol_html_url": "https://www.parlament.gv.at/dokument/XXII/NRSITZ/20/fnameorig_007145.html",
    "uid": "XXII_NRSITZ_20",
    "raw_path": "steno_protocols/raw_html/XXII_NRSITZ_20.html",
    "txt_path": "steno_protocols/plain_text/XXII_NRSITZ_20.txt"
  },
  {
    "session_date_display": "13.11.2003",
    "session_date_iso": "2003-11-13T00:00:00",
    "gp_code": "XXII",
    "chamber": "NRSITZ",
    "session_number": 39,
    "title": "39. Sitzung (39/NRSITZ)",
    "citation": "39/NRSITZ",
    "session_detail_url": "https://www.parlament.gv.at/gegenstand/XXII/NRSITZ/39",
    "protocol_pdf_url": "https://www.parlament.gv.at/dokument/XXII/NRSITZ/39/fname_014322.pdf",
    "protocol_html_url": "https://www.parlament.gv.at/dokument/XXII/NRSITZ/39/fnameorig_014322.html",
    "uid": "XXII_NRSITZ_39",
    "raw_path": "steno_protocols/raw_html/XXII_NRSITZ_39.html",
    "txt_path": "steno_protocols/plain_text/XXII_NRSITZ_39.txt"
  },
  {
    "session_date_display": "12.06.2003",
    "session_date_iso": "2003-06-12T00:00:00",
    "gp_code": "XXII",
    "chamber": "NRSITZ",
    "session_number": 22,
    "title": "22. Sitzung (22/NRSITZ)",
    "citation": "22/NRSITZ",
    "session_detail_url": "https://www.parlament.gv.at/gegenstand/XXII/NRSITZ/22",
    "protocol_pdf_url": "https://www.parlament.gv.at/dokument/XXII/NRSITZ/22/fname_007149.pdf",
    "protocol_html_url": "https://www.parlament.gv.at/dokument/XXII/NRSITZ/22/fnameorig_007149.html",
    "uid": "XXII_NRSITZ_22",
    "raw_path": "steno_protocols/raw_html/XXII_NRSITZ_22.html",
    "txt_path": "steno_protocols/plain_text/XXII_NRSITZ_22.txt"
  },
  {
    "session_date_display": "16.06.2004",
    "session_date_iso": "2004-06-16T00:00:00",
    "gp_code": "XXII",
    "chamber": "NRSITZ",
    "session_number": 66,
    "title": "66. Sitzung (66/NRSITZ)",
    "citation": "66/NRSITZ",
    "session_detail_url": "https://www.parlament.gv.at/gegenstand/XXII/NRSITZ/66",
    "protocol_pdf_url": "https://www.parlament.gv.at/dokument/XXII/NRSITZ/66/fname_024638.pdf",
    "protocol_html_url": "https://www.parlament.gv.at/dokument/XXII/NRSITZ/66/fnameorig_024638.html",
    "uid": "XXII_NRSITZ_66",
    "raw_path": "steno_protocols/raw_html/XXII_NRSITZ_66.html",
    "txt_path": "steno_protocols/plain_text/XXII_NRSITZ_66.txt"
  },
  {
    "session_date_display": "29.01.2004",
    "session_date_iso": "2004-01-29T00:00:00",
    "gp_code": "XXII",
    "chamber": "NRSITZ",
    "session_number": 47,
    "title": "47. Sitzung (47/NRSITZ)",
    "citation": "47/NRSITZ",
    "session_detail_url": "https://www.parlament.gv.at/gegenstand/XXII/NRSITZ/47",
    "protocol_pdf_url": "https://www.parlament.gv.at/dokument/XXII/NRSITZ/47/fname_017934.pdf",
    "protocol_html_url": "https://www.parlament.gv.at/dokument/XXII/NRSITZ/47/fnameorig_017934.html",
    "uid": "XXII_NRSITZ_47",
    "raw_path": "steno_protocols/raw_html/XXII_NRSITZ_47.html",
    "txt_path": "steno_protocols/plain_text/XXII_NRSITZ_47.txt"
  },
  {
    "session_date_display": "10.02.2004",
    "session_date_iso": "2004-02-10T00:00:00",
    "gp_code": "XXII",
    "chamber": "NRSITZ",
    "session_number": 48,
    "title": "48. Sitzung (48/NRSITZ)",
    "citation": "48/NRSITZ",
    "session_detail_url": "https://www.parlament.gv.at/gegenstand/XXII/NRSITZ/48",
    "protocol_pdf_url": "https://www.parlament.gv.at/dokument/XXII/NRSITZ/48/fname_017936.pdf",
    "protocol_html_url": "https://www.parlament.gv.at/dokument/XXII/NRSITZ/48/fnameorig_017936.html",
    "uid": "XXII_NRSITZ_48",
    "raw_path": "steno_protocols/raw_html/XXII_NRSITZ_48.html",
    "txt_path": "steno_protocols/plain_text/XXII_NRSITZ_48.txt"
  },
  {
    "session_date_display": "14.10.2004",
    "session_date_iso": "2004-10-14T00:00:00",
    "gp_code": "XXII",
    "chamber": "NRSITZ",
    "session_number": 80,
    "title": "80. Sitzung (80/NRSITZ)",
    "citation": "80/NRSITZ",
    "session_detail_url": "https://www.parlament.gv.at/gegenstand/XXII/NRSITZ/80",
    "protocol_pdf_url": "https://www.parlament.gv.at/dokument/XXII/NRSITZ/80/fname_031356.pdf",
    "protocol_html_url": "https://www.parlament.gv.at/dokument/XXII/NRSITZ/80/fnameorig_031356.html",
    "uid": "XXII_NRSITZ_80",
    "raw_path": "steno_protocols/raw_html/XXII_NRSITZ_80.html",
    "txt_path": "steno_protocols/plain_text/XXII_NRSITZ_80.txt"
  },
  {
    "session_date_display": "10.07.2003",
    "session_date_iso": "2003-07-10T00:00:00",
    "gp_code": "XXII",
    "chamber": "NRSITZ",
    "session_number": 29,
    "title": "29. Sitzung (29/NRSITZ)",
    "citation": "29/NRSITZ",
    "session_detail_url": "https://www.parlament.gv.at/gegenstand/XXII/NRSITZ/29",
    "protocol_pdf_url": "https://www.parlament.gv.at/dokument/XXII/NRSITZ/29/fname_008455.pdf",
    "protocol_html_url": "https://www.parlament.gv.at/dokument/XXII/NRSITZ/29/fnameorig_008455.html",
    "uid": "XXII_NRSITZ_29",
    "raw_path": "steno_protocols/raw_html/XXII_NRSITZ_29.html",
    "txt_path": "steno_protocols/plain_text/XXII_NRSITZ_29.txt"
  },
  {
    "session_date_display": "06.03.2003",
    "session_date_iso": "2003-03-06T00:00:00",
    "gp_code": "XXII",
    "chamber": "NRSITZ",
    "session_number": 8,
    "title": "8. Sitzung (8/NRSITZ)",
    "citation": "8/NRSITZ",
    "session_detail_url": "https://www.parlament.gv.at/gegenstand/XXII/NRSITZ/8",
    "protocol_pdf_url": "https://www.parlament.gv.at/dokument/XXII/NRSITZ/8/fname_114625.pdf",
    "protocol_html_url": "https://www.parlament.gv.at/dokument/XXII/NRSITZ/8/fnameorig_114625.html",
    "uid": "XXII_NRSITZ_8",
    "raw_path": "steno_protocols/raw_html/XXII_NRSITZ_8.html",
    "txt_path": "steno_protocols/plain_text/XXII_NRSITZ_8.txt"
  },
  {
    "session_date_display": "19.03.2003",
    "session_date_iso": "2003-03-19T00:00:00",
    "gp_code": "XXII",
    "chamber": "NRSITZ",
    "session_number": 9,
    "title": "9. Sitzung (9/NRSITZ)",
    "citation": "9/NRSITZ",
    "session_detail_url": "https://www.parlament.gv.at/gegenstand/XXII/NRSITZ/9",
    "protocol_pdf_url": "https://www.parlament.gv.at/dokument/XXII/NRSITZ/9/fname_114627.pdf",
    "protocol_html_url": "https://www.parlament.gv.at/dokument/XXII/NRSITZ/9/fnameorig_114627.html",
    "uid": "XXII_NRSITZ_9",
    "raw_path": "steno_protocols/raw_html/XXII_NRSITZ_9.html",
    "txt_path": "steno_protocols/plain_text/XXII_NRSITZ_9.txt"
  },
  {
    "session_date_display": "09.07.2015",
    "session_date_iso": "2015-07-09T00:00:00",
    "gp_code": "XXV",
    "chamber": "NRSITZ",
    "session_number": 87,
    "title": "87. Sitzung (87/NRSITZ)",
    "citation": "87/NRSITZ",
    "session_detail_url": "https://www.parlament.gv.at/gegenstand/XXV/NRSITZ/87",
    "protocol_pdf_url": "https://www.parlament.gv.at/dokument/XXV/NRSITZ/87/fname_497870.pdf",
    "protocol_html_url": "https://www.parlament.gv.at/dokument/XXV/NRSITZ/87/fnameorig_497870.html",
    "uid": "XXV_NRSITZ_87",
    "raw_path": "steno_protocols/raw_html/XXV_NRSITZ_87.html",
    "txt_path": "steno_protocols/plain_text/XXV_NRSITZ_87.txt"
  },
  {
    "session_date_display": "27.04.2017",
    "session_date_iso": "2017-04-27T00:00:00",
    "gp_code": "XXV",
    "chamber": "NRSITZ",
    "session_number": 178,
    "title": "178. Sitzung (178/NRSITZ)",
    "citation": "178/NRSITZ",
    "session_detail_url": "https://www.parlament.gv.at/gegenstand/XXV/NRSITZ/178",
    "protocol_pdf_url": "https://www.parlament.gv.at/dokument/XXV/NRSITZ/178/fname_670620.pdf",
    "protocol_html_url": "https://www.parlament.gv.at/dokument/XXV/NRSITZ/178/fnameorig_670620.html",
    "uid": "XXV_NRSITZ_178",
    "raw_path": "steno_protocols/raw_html/XXV_NRSITZ_178.html",
    "txt_path": "steno_protocols/plain_text/XXV_NRSITZ_178.txt"
  },
  {
    "session_date_display": "01.09.2015",
    "session_date_iso": "2015-09-01T00:00:00",
    "gp_code": "XXV",
    "chamber": "NRSITZ",
    "session_number": 90,
    "title": "90. Sitzung (90/NRSITZ)",
    "citation": "90/NRSITZ",
    "session_detail_url": "https://www.parlament.gv.at/gegenstand/XXV/NRSITZ/90",
    "protocol_pdf_url": "https://www.parlament.gv.at/dokument/XXV/NRSITZ/90/fname_503051.pdf",
    "protocol_html_url": "https://www.parlament.gv.at/dokument/XXV/NRSITZ/90/fnameorig_503051.html",
    "uid": "XXV_NRSITZ_90",
    "raw_path": "steno_protocols/raw_html/XXV_NRSITZ_90.html",
    "txt_path": "steno_protocols/plain_text/XXV_NRSITZ_90.txt"
  },
  {
    "session_date_display": "23.09.2015",
    "session_date_iso": "2015-09-23T00:00:00",
    "gp_code": "XXV",
    "chamber": "NRSITZ",
    "session_number": 91,
    "title": "91. Sitzung (91/NRSITZ)",
    "citation": "91/NRSITZ",
    "session_detail_url": "https://www.parlament.gv.at/gegenstand/XXV/NRSITZ/91",
    "protocol_pdf_url": "https://www.parlament.gv.at/dokument/XXV/NRSITZ/91/fname_523089.pdf",
    "protocol_html_url": "https://www.parlament.gv.at/dokument/XXV/NRSITZ/91/fnameorig_523089.html",
    "uid": "XXV_NRSITZ_91",
    "raw_path": "steno_protocols/raw_html/XXV_NRSITZ_91.html",
    "txt_path": "steno_protocols/plain_text/XXV_NRSITZ_91.txt"
  },
  {
    "session_date_display": "20.11.2013",
    "session_date_iso": "2013-11-20T00:00:00",
    "gp_code": "XXV",
    "chamber": "NRSITZ",
    "session_number": 3,
    "title": "3. Sitzung (3/NRSITZ)",
    "citation": "3/NRSITZ",
    "session_detail_url": "https://www.parlament.gv.at/gegenstand/XXV/NRSITZ/3",
    "protocol_pdf_url": "https://www.parlament.gv.at/dokument/XXV/NRSITZ/3/fname_335021.pdf",
    "protocol_html_url": "https://www.parlament.gv.at/dokument/XXV/NRSITZ/3/fnameorig_335021.html",
    "uid": "XXV_NRSITZ_3",
    "raw_path": "steno_protocols/raw_html/XXV_NRSITZ_3.html",
    "txt_path": "steno_protocols/plain_text/XXV_NRSITZ_3.txt"
  },
  {
    "session_date_display": "17.06.2021",
    "session_date_iso": "2021-06-17T00:00:00",
    "gp_code": "XXVII",
    "chamber": "NRSITZ",
    "session_number": 112,
    "title": "112. Sitzung (112/NRSITZ)",
    "citation": "112/NRSITZ",
    "session_detail_url": "https://www.parlament.gv.at/gegenstand/XXVII/NRSITZ/112",
    "protocol_pdf_url": "https://www.parlament.gv.at/dokument/XXVII/NRSITZ/112/fname_1080720.pdf",
    "protocol_html_url": "https://www.parlament.gv.at/dokument/XXVII/NRSITZ/112/fnameorig_1080720.html",
    "uid": "XXVII_NRSITZ_112",
    "raw_path": "steno_protocols/raw_html/XXVII_NRSITZ_112.html",
    "txt_path": "steno_protocols/plain_text/XXVII_NRSITZ_112.txt"
  },
  {
    "session_date_display": "20.03.2020",
    "session_date_iso": "2020-03-20T00:00:00",
    "gp_code": "XXVII",
    "chamber": "NRSITZ",
    "session_number": 19,
    "title": "19. Sitzung (19/NRSITZ)",
    "citation": "19/NRSITZ",
    "session_detail_url": "https://www.parlament.gv.at/gegenstand/XXVII/NRSITZ/19",
    "protocol_pdf_url": "https://www.parlament.gv.at/dokument/XXVII/NRSITZ/19/fname_801806.pdf",
    "protocol_html_url": "https://www.parlament.gv.at/dokument/XXVII/NRSITZ/19/fnameorig_801806.html",
    "uid": "XXVII_NRSITZ_19",
    "raw_path": "steno_protocols/raw_html/XXVII_NRSITZ_19.html",
    "txt_path": "steno_protocols/plain_text/XXVII_NRSITZ_19.txt"
  },
  {
    "session_date_display": "22.04.2020",
    "session_date_iso": "2020-04-22T00:00:00",
    "gp_code": "XXVII",
    "chamber": "NRSITZ",
    "session_number": 25,
    "title": "25. Sitzung (25/NRSITZ)",
    "citation": "25/NRSITZ",
    "session_detail_url": "https://www.parlament.gv.at/gegenstand/XXVII/NRSITZ/25",
    "protocol_pdf_url": "https://www.parlament.gv.at/dokument/XXVII/NRSITZ/25/fname_806822.pdf",
    "protocol_html_url": "https://www.parlament.gv.at/dokument/XXVII/NRSITZ/25/fnameorig_806822.html",
    "uid": "XXVII_NRSITZ_25",
    "raw_path": "steno_protocols/raw_html/XXVII_NRSITZ_25.html",
    "txt_path": "steno_protocols/plain_text/XXVII_NRSITZ_25.txt"
  },
  {
    "session_date_display": "19.07.2021",
    "session_date_iso": "2021-07-19T00:00:00",
    "gp_code": "XXVII",
    "chamber": "NRSITZ",
    "session_number": 120,
    "title": "120. Sitzung (120/NRSITZ)",
    "citation": "120/NRSITZ",
    "session_detail_url": "https://www.parlament.gv.at/gegenstand/XXVII/NRSITZ/120",
    "protocol_pdf_url": "https://www.parlament.gv.at/dokument/XXVII/NRSITZ/120/fname_1016743.pdf",
    "protocol_html_url": "https://www.parlament.gv.at/dokument/XXVII/NRSITZ/120/fnameorig_1016743.html",
    "uid": "XXVII_NRSITZ_120",
    "raw_path": "steno_protocols/raw_html/XXVII_NRSITZ_120.html",
    "txt_path": "steno_protocols/plain_text/XXVII_NRSITZ_120.txt"
  },
  {
    "session_date_display": "22.09.2021",
    "session_date_iso": "2021-09-22T00:00:00",
    "gp_code": "XXVII",
    "chamber": "NRSITZ",
    "session_number": 121,
    "title": "121. Sitzung (121/NRSITZ)",
    "citation": "121/NRSITZ",
    "session_detail_url": "https://www.parlament.gv.at/gegenstand/XXVII/NRSITZ/121",
    "protocol_pdf_url": "https://www.parlament.gv.at/dokument/XXVII/NRSITZ/121/fname_1426334.pdf",
    "protocol_html_url": "https://www.parlament.gv.at/dokument/XXVII/NRSITZ/121/fnameorig_1426334.html",
    "uid": "XXVII_NRSITZ_121",
    "raw_path": "steno_protocols/raw_html/XXVII_NRSITZ_121.html",
    "txt_path": "steno_protocols/plain_text/XXVII_NRSITZ_121.txt"
  },
  {
    "session_date_display": "12.10.2021",
    "session_date_iso": "2021-10-12T00:00:00",
    "gp_code": "XXVII",
    "chamber": "NRSITZ",
    "session_number": 124,
    "title": "124. Sitzung (124/NRSITZ)",
    "citation": "124/NRSITZ",
    "session_detail_url": "https://www.parlament.gv.at/gegenstand/XXVII/NRSITZ/124",
    "protocol_pdf_url": "https://www.parlament.gv.at/dokument/XXVII/NRSITZ/124/fname_1432643.pdf",
    "protocol_html_url": "https://www.parlament.gv.at/dokument/XXVII/NRSITZ/124/fnameorig_1432643.html",
    "uid": "XXVII_NRSITZ_124",
    "raw_path": "steno_protocols/raw_html/XXVII_NRSITZ_124.html",
    "txt_path": "steno_protocols/plain_text/XXVII_NRSITZ_124.txt"
  },
  {
    "session_date_display": "14.10.2021",
    "session_date_iso": "2021-10-14T00:00:00",
    "gp_code": "XXVII",
    "chamber": "NRSITZ",
    "session_number": 128,
    "title": "128. Sitzung (128/NRSITZ)",
    "citation": "128/NRSITZ",
    "session_detail_url": "https://www.parlament.gv.at/gegenstand/XXVII/NRSITZ/128",
    "protocol_pdf_url": "https://www.parlament.gv.at/dokument/XXVII/NRSITZ/128/fname_1438291.pdf",
    "protocol_html_url": "https://www.parlament.gv.at/dokument/XXVII/NRSITZ/128/fnameorig_1438291.html",
    "uid": "XXVII_NRSITZ_128",
    "raw_path": "steno_protocols/raw_html/XXVII_NRSITZ_128.html",
    "txt_path": "steno_protocols/plain_text/XXVII_NRSITZ_128.txt"
  },
  {
    "session_date_display": "19.11.2021",
    "session_date_iso": "2021-11-19T00:00:00",
    "gp_code": "XXVII",
    "chamber": "NRSITZ",
    "session_number": 131,
    "title": "131. Sitzung (131/NRSITZ)",
    "citation": "131/NRSITZ",
    "session_detail_url": "https://www.parlament.gv.at/gegenstand/XXVII/NRSITZ/131",
    "protocol_pdf_url": "https://www.parlament.gv.at/dokument/XXVII/NRSITZ/131/fname_1438172.pdf",
    "protocol_html_url": "https://www.parlament.gv.at/dokument/XXVII/NRSITZ/131/fnameorig_1438172.html",
    "uid": "XXVII_NRSITZ_131",
    "raw_path": "steno_protocols/raw_html/XXVII_NRSITZ_131.html",
    "txt_path": "steno_protocols/plain_text/XXVII_NRSITZ_131.txt"
  },
  {
    "session_date_display": "08.07.2020",
    "session_date_iso": "2020-07-08T00:00:00",
    "gp_code": "XXVII",
    "chamber": "NRSITZ",
    "session_number": 46,
    "title": "46. Sitzung (46/NRSITZ)",
    "citation": "46/NRSITZ",
    "session_detail_url": "https://www.parlament.gv.at/gegenstand/XXVII/NRSITZ/46",
    "protocol_pdf_url": "https://www.parlament.gv.at/dokument/XXVII/NRSITZ/46/fname_845436.pdf",
    "protocol_html_url": "https://www.parlament.gv.at/dokument/XXVII/NRSITZ/46/fnameorig_845436.html",
    "uid": "XXVII_NRSITZ_46",
    "raw_path": "steno_protocols/raw_html/XXVII_NRSITZ_46.html",
    "txt_path": "steno_protocols/plain_text/XXVII_NRSITZ_46.txt"
  },
  {
    "session_date_display": "23.02.2022",
    "session_date_iso": "2022-02-23T00:00:00",
    "gp_code": "XXVII",
    "chamber": "NRSITZ",
    "session_number": 142,
    "title": "142. Sitzung (142/NRSITZ)",
    "citation": "142/NRSITZ",
    "session_detail_url": "https://www.parlament.gv.at/gegenstand/XXVII/NRSITZ/142",
    "protocol_pdf_url": "https://www.parlament.gv.at/dokument/XXVII/NRSITZ/142/fname_1575550.pdf",
    "protocol_html_url": "https://www.parlament.gv.at/dokument/XXVII/NRSITZ/142/fnameorig_1575550.html",
    "uid": "XXVII_NRSITZ_142",
    "raw_path": "steno_protocols/raw_html/XXVII_NRSITZ_142.html",
    "txt_path": "steno_protocols/plain_text/XXVII_NRSITZ_142.txt"
  },
  {
    "session_date_display": "23.09.2020",
    "session_date_iso": "2020-09-23T00:00:00",
    "gp_code": "XXVII",
    "chamber": "NRSITZ",
    "session_number": 52,
    "title": "52. Sitzung (52/NRSITZ)",
    "citation": "52/NRSITZ",
    "session_detail_url": "https://www.parlament.gv.at/gegenstand/XXVII/NRSITZ/52",
    "protocol_pdf_url": "https://www.parlament.gv.at/dokument/XXVII/NRSITZ/52/fname_853841.pdf",
    "protocol_html_url": "https://www.parlament.gv.at/dokument/XXVII/NRSITZ/52/fnameorig_853841.html",
    "uid": "XXVII_NRSITZ_52",
    "raw_path": "steno_protocols/raw_html/XXVII_NRSITZ_52.html",
    "txt_path": "steno_protocols/plain_text/XXVII_NRSITZ_52.txt"
  },
  {
    "session_date_display": "07.10.2020",
    "session_date_iso": "2020-10-07T00:00:00",
    "gp_code": "XXVII",
    "chamber": "NRSITZ",
    "session_number": 53,
    "title": "53. Sitzung (53/NRSITZ)",
    "citation": "53/NRSITZ",
    "session_detail_url": "https://www.parlament.gv.at/gegenstand/XXVII/NRSITZ/53",
    "protocol_pdf_url": "https://www.parlament.gv.at/dokument/XXVII/NRSITZ/53/fname_858083.pdf",
    "protocol_html_url": "https://www.parlament.gv.at/dokument/XXVII/NRSITZ/53/fnameorig_858083.html",
    "uid": "XXVII_NRSITZ_53",
    "raw_path": "steno_protocols/raw_html/XXVII_NRSITZ_53.html",
    "txt_path": "steno_protocols/plain_text/XXVII_NRSITZ_53.txt"
  },
  {
    "session_date_display": "15.10.2020",
    "session_date_iso": "2020-10-15T00:00:00",
    "gp_code": "XXVII",
    "chamber": "NRSITZ",
    "session_number": 59,
    "title": "59. Sitzung (59/NRSITZ)",
    "citation": "59/NRSITZ",
    "session_detail_url": "https://www.parlament.gv.at/gegenstand/XXVII/NRSITZ/59",
    "protocol_pdf_url": "https://www.parlament.gv.at/dokument/XXVII/NRSITZ/59/fname_878719.pdf",
    "protocol_html_url": "https://www.parlament.gv.at/dokument/XXVII/NRSITZ/59/fnameorig_878719.html",
    "uid": "XXVII_NRSITZ_59",
    "raw_path": "steno_protocols/raw_html/XXVII_NRSITZ_59.html",
    "txt_path": "steno_protocols/plain_text/XXVII_NRSITZ_59.txt"
  },
  {
    "session_date_display": "05.11.2020",
    "session_date_iso": "2020-11-05T00:00:00",
    "gp_code": "XXVII",
    "chamber": "NRSITZ",
    "session_number": 61,
    "title": "61. Sitzung (61/NRSITZ)",
    "citation": "61/NRSITZ",
    "session_detail_url": "https://www.parlament.gv.at/gegenstand/XXVII/NRSITZ/61",
    "protocol_pdf_url": "https://www.parlament.gv.at/dokument/XXVII/NRSITZ/61/fname_876490.pdf",
    "protocol_html_url": "https://www.parlament.gv.at/dokument/XXVII/NRSITZ/61/fnameorig_876490.html",
    "uid": "XXVII_NRSITZ_61",
    "raw_path": "steno_protocols/raw_html/XXVII_NRSITZ_61.html",
    "txt_path": "steno_protocols/plain_text/XXVII_NRSITZ_61.txt"
  },
  {
    "session_date_display": "15.06.2022",
    "session_date_iso": "2022-06-15T00:00:00",
    "gp_code": "XXVII",
    "chamber": "NRSITZ",
    "session_number": 162,
    "title": "162. Sitzung (162/NRSITZ)",
    "citation": "162/NRSITZ",
    "session_detail_url": "https://www.parlament.gv.at/gegenstand/XXVII/NRSITZ/162",
    "protocol_pdf_url": "https://www.parlament.gv.at/dokument/XXVII/NRSITZ/162/fname_1553795.pdf",
    "protocol_html_url": "https://www.parlament.gv.at/dokument/XXVII/NRSITZ/162/fnameorig_1553795.html",
    "uid": "XXVII_NRSITZ_162",
    "raw_path": "steno_protocols/raw_html/XXVII_NRSITZ_162.html",
    "txt_path": "steno_protocols/plain_text/XXVII_NRSITZ_162.txt"
  },
  {
    "session_date_display": "21.12.2020",
    "session_date_iso": "2020-12-21T00:00:00",
    "gp_code": "XXVII",
    "chamber": "NRSITZ",
    "session_number": 74,
    "title": "74. Sitzung (74/NRSITZ)",
    "citation": "74/NRSITZ",
    "session_detail_url": "https://www.parlament.gv.at/gegenstand/XXVII/NRSITZ/74",
    "protocol_pdf_url": "https://www.parlament.gv.at/dokument/XXVII/NRSITZ/74/fname_946652.pdf",
    "protocol_html_url": "https://www.parlament.gv.at/dokument/XXVII/NRSITZ/74/fnameorig_946652.html",
    "uid": "XXVII_NRSITZ_74",
    "raw_path": "steno_protocols/raw_html/XXVII_NRSITZ_74.html",
    "txt_path": "steno_protocols/plain_text/XXVII_NRSITZ_74.txt"
  },
  {
    "session_date_display": "06.07.2022",
    "session_date_iso": "2022-07-06T00:00:00",
    "gp_code": "XXVII",
    "chamber": "NRSITZ",
    "session_number": 167,
    "title": "167. Sitzung (167/NRSITZ)",
    "citation": "167/NRSITZ",
    "session_detail_url": "https://www.parlament.gv.at/gegenstand/XXVII/NRSITZ/167",
    "protocol_pdf_url": "https://www.parlament.gv.at/dokument/XXVII/NRSITZ/167/fname_1532549.pdf",
    "protocol_html_url": "https://www.parlament.gv.at/dokument/XXVII/NRSITZ/167/fnameorig_1532549.html",
    "uid": "XXVII_NRSITZ_167",
    "raw_path": "steno_protocols/raw_html/XXVII_NRSITZ_167.html",
    "txt_path": "steno_protocols/plain_text/XXVII_NRSITZ_167.txt"
  },
  {
    "session_date_display": "08.07.2022",
    "session_date_iso": "2022-07-08T00:00:00",
    "gp_code": "XXVII",
    "chamber": "NRSITZ",
    "session_number": 170,
    "title": "170. Sitzung (170/NRSITZ)",
    "citation": "170/NRSITZ",
    "session_detail_url": "https://www.parlament.gv.at/gegenstand/XXVII/NRSITZ/170",
    "protocol_pdf_url": "https://www.parlament.gv.at/dokument/XXVII/NRSITZ/170/fname_1532104.pdf",
    "protocol_html_url": "https://www.parlament.gv.at/dokument/XXVII/NRSITZ/170/fnameorig_1532104.html",
    "uid": "XXVII_NRSITZ_170",
    "raw_path": "steno_protocols/raw_html/XXVII_NRSITZ_170.html",
    "txt_path": "steno_protocols/plain_text/XXVII_NRSITZ_170.txt"
  },
  {
    "session_date_display": "14.01.2021",
    "session_date_iso": "2021-01-14T00:00:00",
    "gp_code": "XXVII",
    "chamber": "NRSITZ",
    "session_number": 77,
    "title": "77. Sitzung (77/NRSITZ)",
    "citation": "77/NRSITZ",
    "session_detail_url": "https://www.parlament.gv.at/gegenstand/XXVII/NRSITZ/77",
    "protocol_pdf_url": "https://www.parlament.gv.at/dokument/XXVII/NRSITZ/77/fname_949142.pdf",
    "protocol_html_url": "https://www.parlament.gv.at/dokument/XXVII/NRSITZ/77/fnameorig_949142.html",
    "uid": "XXVII_NRSITZ_77",
    "raw_path": "steno_protocols/raw_html/XXVII_NRSITZ_77.html",
    "txt_path": "steno_protocols/plain_text/XXVII_NRSITZ_77.txt"
  },
  {
    "session_date_display": "15.12.1999",
    "session_date_iso": "1999-12-15T00:00:00",
    "gp_code": "XXI",
    "chamber": "NRSITZ",
    "session_number": 5,
    "title": "5. Sitzung (5/NRSITZ)",
    "citation": "5/NRSITZ",
    "session_detail_url": "https://www.parlament.gv.at/gegenstand/XXI/NRSITZ/5",
    "protocol_pdf_url": "https://www.parlament.gv.at/dokument/XXI/NRSITZ/5/fname_114365.pdf",
    "protocol_html_url": "https://www.parlament.gv.at/dokument/XXI/NRSITZ/5/fnameorig_114365.html",
    "uid": "XXI_NRSITZ_5",
    "raw_path": "steno_protocols/raw_html/XXI_NRSITZ_5.html",
    "txt_path": "steno_protocols/plain_text/XXI_NRSITZ_5.txt"
  },
  {
    "session_date_display": "02.03.2000",
    "session_date_iso": "2000-03-02T00:00:00",
    "gp_code": "XXI",
    "chamber": "NRSITZ",
    "session_number": 14,
    "title": "14. Sitzung (14/NRSITZ)",
    "citation": "14/NRSITZ",
    "session_detail_url": "https://www.parlament.gv.at/gegenstand/XXI/NRSITZ/14",
    "protocol_pdf_url": "https://www.parlament.gv.at/dokument/XXI/NRSITZ/14/fname_114383.pdf",
    "protocol_html_url": "https://www.parlament.gv.at/dokument/XXI/NRSITZ/14/fnameorig_114383.html",
    "uid": "XXI_NRSITZ_14",
    "raw_path": "steno_protocols/raw_html/XXI_NRSITZ_14.html",
    "txt_path": "steno_protocols/plain_text/XXI_NRSITZ_14.txt"
  },
  {
    "session_date_display": "26.04.2000",
    "session_date_iso": "2000-04-26T00:00:00",
    "gp_code": "XXI",
    "chamber": "NRSITZ",
    "session_number": 19,
    "title": "19. Sitzung (19/NRSITZ)",
    "citation": "19/NRSITZ",
    "session_detail_url": "https://www.parlament.gv.at/gegenstand/XXI/NRSITZ/19",
    "protocol_pdf_url": "https://www.parlament.gv.at/dokument/XXI/NRSITZ/19/fname_114393.pdf",
    "protocol_html_url": "https://www.parlament.gv.at/dokument/XXI/NRSITZ/19/fnameorig_114393.html",
    "uid": "XXI_NRSITZ_19",
    "raw_path": "steno_protocols/raw_html/XXI_NRSITZ_19.html",
    "txt_path": "steno_protocols/plain_text/XXI_NRSITZ_19.txt"
  },
  {
    "session_date_display": "27.04.2000",
    "session_date_iso": "2000-04-27T00:00:00",
    "gp_code": "XXI",
    "chamber": "NRSITZ",
    "session_number": 20,
    "title": "20. Sitzung (20/NRSITZ)",
    "citation": "20/NRSITZ",
    "session_detail_url": "https://www.parlament.gv.at/gegenstand/XXI/NRSITZ/20",
    "protocol_pdf_url": "https://www.parlament.gv.at/dokument/XXI/NRSITZ/20/fname_114395.pdf",
    "protocol_html_url": "https://www.parlament.gv.at/dokument/XXI/NRSITZ/20/fnameorig_114395.html",
    "uid": "XXI_NRSITZ_20",
    "raw_path": "steno_protocols/raw_html/XXI_NRSITZ_20.html",
    "txt_path": "steno_protocols/plain_text/XXI_NRSITZ_20.txt"
  },
  {
    "session_date_display": "19.09.2002",
    "session_date_iso": "2002-09-19T00:00:00",
    "gp_code": "XXI",
    "chamber": "NRSITZ",
    "session_number": 116,
    "title": "116. Sitzung (116/NRSITZ)",
    "citation": "116/NRSITZ",
    "session_detail_url": "https://www.parlament.gv.at/gegenstand/XXI/NRSITZ/116",
    "protocol_pdf_url": "https://www.parlament.gv.at/dokument/XXI/NRSITZ/116/fname_114605.pdf",
    "protocol_html_url": "https://www.parlament.gv.at/dokument/XXI/NRSITZ/116/fnameorig_114605.html",
    "uid": "XXI_NRSITZ_116",
    "raw_path": "steno_protocols/raw_html/XXI_NRSITZ_116.html",
    "txt_path": "steno_protocols/plain_text/XXI_NRSITZ_116.txt"
  },
  {
    "session_date_display": "20.09.2002",
    "session_date_iso": "2002-09-20T00:00:00",
    "gp_code": "XXI",
    "chamber": "NRSITZ",
    "session_number": 117,
    "title": "117. Sitzung (117/NRSITZ)",
    "citation": "117/NRSITZ",
    "session_detail_url": "https://www.parlament.gv.at/gegenstand/XXI/NRSITZ/117",
    "protocol_pdf_url": "https://www.parlament.gv.at/dokument/XXI/NRSITZ/117/fname_114607.pdf",
    "protocol_html_url": "https://www.parlament.gv.at/dokument/XXI/NRSITZ/117/fnameorig_114607.html",
    "uid": "XXI_NRSITZ_117",
    "raw_path": "steno_protocols/raw_html/XXI_NRSITZ_117.html",
    "txt_path": "steno_protocols/plain_text/XXI_NRSITZ_117.txt"
  },
  {
    "session_date_display": "11.05.2000",
    "session_date_iso": "2000-05-11T00:00:00",
    "gp_code": "XXI",
    "chamber": "NRSITZ",
    "session_number": 23,
    "title": "23. Sitzung (23/NRSITZ)",
    "citation": "23/NRSITZ",
    "session_detail_url": "https://www.parlament.gv.at/gegenstand/XXI/NRSITZ/23",
    "protocol_pdf_url": "https://www.parlament.gv.at/dokument/XXI/NRSITZ/23/fname_114401.pdf",
    "protocol_html_url": "https://www.parlament.gv.at/dokument/XXI/NRSITZ/23/fnameorig_114401.html",
    "uid": "XXI_NRSITZ_23",
    "raw_path": "steno_protocols/raw_html/XXI_NRSITZ_23.html",
    "txt_path": "steno_protocols/plain_text/XXI_NRSITZ_23.txt"
  },
  {
    "session_date_display": "12.05.2000",
    "session_date_iso": "2000-05-12T00:00:00",
    "gp_code": "XXI",
    "chamber": "NRSITZ",
    "session_number": 24,
    "title": "24. Sitzung (24/NRSITZ)",
    "citation": "24/NRSITZ",
    "session_detail_url": "https://www.parlament.gv.at/gegenstand/XXI/NRSITZ/24",
    "protocol_pdf_url": "https://www.parlament.gv.at/dokument/XXI/NRSITZ/24/fname_114403.pdf",
    "protocol_html_url": "https://www.parlament.gv.at/dokument/XXI/NRSITZ/24/fnameorig_114403.html",
    "uid": "XXI_NRSITZ_24",
    "raw_path": "steno_protocols/raw_html/XXI_NRSITZ_24.html",
    "txt_path": "steno_protocols/plain_text/XXI_NRSITZ_24.txt"
  },
  {
    "session_date_display": "16.05.2000",
    "session_date_iso": "2000-05-16T00:00:00",
    "gp_code": "XXI",
    "chamber": "NRSITZ",
    "session_number": 25,
    "title": "25. Sitzung (25/NRSITZ)",
    "citation": "25/NRSITZ",
    "session_detail_url": "https://www.parlament.gv.at/gegenstand/XXI/NRSITZ/25",
    "protocol_pdf_url": "https://www.parlament.gv.at/dokument/XXI/NRSITZ/25/fname_114405.pdf",
    "protocol_html_url": "https://www.parlament.gv.at/dokument/XXI/NRSITZ/25/fnameorig_114405.html",
    "uid": "XXI_NRSITZ_25",
    "raw_path": "steno_protocols/raw_html/XXI_NRSITZ_25.html",
    "txt_path": "steno_protocols/plain_text/XXI_NRSITZ_25.txt"
  },
  {
    "session_date_display": "22.11.2000",
    "session_date_iso": "2000-11-22T00:00:00",
    "gp_code": "XXI",
    "chamber": "NRSITZ",
    "session_number": 44,
    "title": "44. Sitzung (44/NRSITZ)",
    "citation": "44/NRSITZ",
    "session_detail_url": "https://www.parlament.gv.at/gegenstand/XXI/NRSITZ/44",
    "protocol_pdf_url": "https://www.parlament.gv.at/dokument/XXI/NRSITZ/44/fname_114443.pdf",
    "protocol_html_url": "https://www.parlament.gv.at/dokument/XXI/NRSITZ/44/fnameorig_114443.html",
    "uid": "XXI_NRSITZ_44",
    "raw_path": "steno_protocols/raw_html/XXI_NRSITZ_44.html",
    "txt_path": "steno_protocols/plain_text/XXI_NRSITZ_44.txt"
  },
  {
    "session_date_display": "18.01.2001",
    "session_date_iso": "2001-01-18T00:00:00",
    "gp_code": "XXI",
    "chamber": "NRSITZ",
    "session_number": 54,
    "title": "54. Sitzung (54/NRSITZ)",
    "citation": "54/NRSITZ",
    "session_detail_url": "https://www.parlament.gv.at/gegenstand/XXI/NRSITZ/54",
    "protocol_pdf_url": "https://www.parlament.gv.at/dokument/XXI/NRSITZ/54/fname_114463.pdf",
    "protocol_html_url": "https://www.parlament.gv.at/dokument/XXI/NRSITZ/54/fnameorig_114463.html",
    "uid": "XXI_NRSITZ_54",
    "raw_path": "steno_protocols/raw_html/XXI_NRSITZ_54.html",
    "txt_path": "steno_protocols/plain_text/XXI_NRSITZ_54.txt"
  },
  {
    "session_date_display": "07.06.2001",
    "session_date_iso": "2001-06-07T00:00:00",
    "gp_code": "XXI",
    "chamber": "NRSITZ",
    "session_number": 72,
    "title": "72. Sitzung (72/NRSITZ)",
    "citation": "72/NRSITZ",
    "session_detail_url": "https://www.parlament.gv.at/gegenstand/XXI/NRSITZ/72",
    "protocol_pdf_url": "https://www.parlament.gv.at/dokument/XXI/NRSITZ/72/fname_114499.pdf",
    "protocol_html_url": "https://www.parlament.gv.at/dokument/XXI/NRSITZ/72/fnameorig_114499.html",
    "uid": "XXI_NRSITZ_72",
    "raw_path": "steno_protocols/raw_html/XXI_NRSITZ_72.html",
    "txt_path": "steno_protocols/plain_text/XXI_NRSITZ_72.txt"
  },
  {
    "session_date_display": "07.06.2001",
    "session_date_iso": "2001-06-07T00:00:00",
    "gp_code": "XXI",
    "chamber": "NRSITZ",
    "session_number": 73,
    "title": "73. Sitzung (73/NRSITZ)",
    "citation": "73/NRSITZ",
    "session_detail_url": "https://www.parlament.gv.at/gegenstand/XXI/NRSITZ/73",
    "protocol_pdf_url": "https://www.parlament.gv.at/dokument/XXI/NRSITZ/73/fname_114501.pdf",
    "protocol_html_url": "https://www.parlament.gv.at/dokument/XXI/NRSITZ/73/fnameorig_114501.html",
    "uid": "XXI_NRSITZ_73",
    "raw_path": "steno_protocols/raw_html/XXI_NRSITZ_73.html",
    "txt_path": "steno_protocols/plain_text/XXI_NRSITZ_73.txt"
  },
  {
    "session_date_display": "23.11.2001",
    "session_date_iso": "2001-11-23T00:00:00",
    "gp_code": "XXI",
    "chamber": "NRSITZ",
    "session_number": 85,
    "title": "85. Sitzung (85/NRSITZ)",
    "citation": "85/NRSITZ",
    "session_detail_url": "https://www.parlament.gv.at/gegenstand/XXI/NRSITZ/85",
    "protocol_pdf_url": "https://www.parlament.gv.at/dokument/XXI/NRSITZ/85/fname_114525.pdf",
    "protocol_html_url": "https://www.parlament.gv.at/dokument/XXI/NRSITZ/85/fnameorig_114525.html",
    "uid": "XXI_NRSITZ_85",
    "raw_path": "steno_protocols/raw_html/XXI_NRSITZ_85.html",
    "txt_path": "steno_protocols/plain_text/XXI_NRSITZ_85.txt"
  },
  {
    "session_date_display": "30.01.2002",
    "session_date_iso": "2002-01-30T00:00:00",
    "gp_code": "XXI",
    "chamber": "NRSITZ",
    "session_number": 91,
    "title": "91. Sitzung (91/NRSITZ)",
    "citation": "91/NRSITZ",
    "session_detail_url": "https://www.parlament.gv.at/gegenstand/XXI/NRSITZ/91",
    "protocol_pdf_url": "https://www.parlament.gv.at/dokument/XXI/NRSITZ/91/fname_114537.pdf",
    "protocol_html_url": "https://www.parlament.gv.at/dokument/XXI/NRSITZ/91/fnameorig_114537.html",
    "uid": "XXI_NRSITZ_91",
    "raw_path": "steno_protocols/raw_html/XXI_NRSITZ_91.html",
    "txt_path": "steno_protocols/plain_text/XXI_NRSITZ_91.txt"
  },
  {
    "session_date_display": "31.01.2002",
    "session_date_iso": "2002-01-31T00:00:00",
    "gp_code": "XXI",
    "chamber": "NRSITZ",
    "session_number": 92,
    "title": "92. Sitzung (92/NRSITZ)",
    "citation": "92/NRSITZ",
    "session_detail_url": "https://www.parlament.gv.at/gegenstand/XXI/NRSITZ/92",
    "protocol_pdf_url": "https://www.parlament.gv.at/dokument/XXI/NRSITZ/92/fname_114539.pdf",
    "protocol_html_url": "https://www.parlament.gv.at/dokument/XXI/NRSITZ/92/fnameorig_114539.html",
    "uid": "XXI_NRSITZ_92",
    "raw_path": "steno_protocols/raw_html/XXI_NRSITZ_92.html",
    "txt_path": "steno_protocols/plain_text/XXI_NRSITZ_92.txt"
  },
  {
    "session_date_display": "24.09.2003",
    "session_date_iso": "2003-09-24T00:00:00",
    "gp_code": "XXII",
    "chamber": "NRSITZ",
    "session_number": 33,
    "title": "33. Sitzung (33/NRSITZ)",
    "citation": "33/NRSITZ",
    "session_detail_url": "https://www.parlament.gv.at/gegenstand/XXII/NRSITZ/33",
    "protocol_pdf_url": "https://www.parlament.gv.at/dokument/XXII/NRSITZ/33/fname_009915.pdf",
    "protocol_html_url": "https://www.parlament.gv.at/dokument/XXII/NRSITZ/33/fnameorig_009915.html",
    "uid": "XXII_NRSITZ_33",
    "raw_path": "steno_protocols/raw_html/XXII_NRSITZ_33.html",
    "txt_path": "steno_protocols/plain_text/XXII_NRSITZ_33.txt"
  },
  {
    "session_date_display": "22.10.2003",
    "session_date_iso": "2003-10-22T00:00:00",
    "gp_code": "XXII",
    "chamber": "NRSITZ",
    "session_number": 34,
    "title": "34. Sitzung (34/NRSITZ)",
    "citation": "34/NRSITZ",
    "session_detail_url": "https://www.parlament.gv.at/gegenstand/XXII/NRSITZ/34",
    "protocol_pdf_url": "https://www.parlament.gv.at/dokument/XXII/NRSITZ/34/fname_011151.pdf",
    "protocol_html_url": "https://www.parlament.gv.at/dokument/XXII/NRSITZ/34/fnameorig_011151.html",
    "uid": "XXII_NRSITZ_34",
    "raw_path": "steno_protocols/raw_html/XXII_NRSITZ_34.html",
    "txt_path": "steno_protocols/plain_text/XXII_NRSITZ_34.txt"
  },
  {
    "session_date_display": "23.05.2003",
    "session_date_iso": "2003-05-23T00:00:00",
    "gp_code": "XXII",
    "chamber": "NRSITZ",
    "session_number": 17,
    "title": "17. Sitzung (17/NRSITZ)",
    "citation": "17/NRSITZ",
    "session_detail_url": "https://www.parlament.gv.at/gegenstand/XXII/NRSITZ/17",
    "protocol_pdf_url": "https://www.parlament.gv.at/dokument/XXII/NRSITZ/17/fname_114643.pdf",
    "protocol_html_url": "https://www.parlament.gv.at/dokument/XXII/NRSITZ/17/fnameorig_114643.html",
    "uid": "XXII_NRSITZ_17",
    "raw_path": "steno_protocols/raw_html/XXII_NRSITZ_17.html",
    "txt_path": "steno_protocols/plain_text/XXII_NRSITZ_17.txt"
  },
  {
    "session_date_display": "04.12.2003",
    "session_date_iso": "2003-12-04T00:00:00",
    "gp_code": "XXII",
    "chamber": "NRSITZ",
    "session_number": 41,
    "title": "41. Sitzung (41/NRSITZ)",
    "citation": "41/NRSITZ",
    "session_detail_url": "https://www.parlament.gv.at/gegenstand/XXII/NRSITZ/41",
    "protocol_pdf_url": "https://www.parlament.gv.at/dokument/XXII/NRSITZ/41/fname_014532.pdf",
    "protocol_html_url": "https://www.parlament.gv.at/dokument/XXII/NRSITZ/41/fnameorig_014532.html",
    "uid": "XXII_NRSITZ_41",
    "raw_path": "steno_protocols/raw_html/XXII_NRSITZ_41.html",
    "txt_path": "steno_protocols/plain_text/XXII_NRSITZ_41.txt"
  },
  {
    "session_date_display": "04.12.2003",
    "session_date_iso": "2003-12-04T00:00:00",
    "gp_code": "XXII",
    "chamber": "NRSITZ",
    "session_number": 42,
    "title": "42. Sitzung (42/NRSITZ)",
    "citation": "42/NRSITZ",
    "session_detail_url": "https://www.parlament.gv.at/gegenstand/XXII/NRSITZ/42",
    "protocol_pdf_url": "https://www.parlament.gv.at/dokument/XXII/NRSITZ/42/fname_014534.pdf",
    "protocol_html_url": "https://www.parlament.gv.at/dokument/XXII/NRSITZ/42/fnameorig_014534.html",
    "uid": "XXII_NRSITZ_42",
    "raw_path": "steno_protocols/raw_html/XXII_NRSITZ_42.html",
    "txt_path": "steno_protocols/plain_text/XXII_NRSITZ_42.txt"
  },
  {
    "session_date_display": "22.09.2004",
    "session_date_iso": "2004-09-22T00:00:00",
    "gp_code": "XXII",
    "chamber": "NRSITZ",
    "session_number": 76,
    "title": "76. Sitzung (76/NRSITZ)",
    "citation": "76/NRSITZ",
    "session_detail_url": "https://www.parlament.gv.at/gegenstand/XXII/NRSITZ/76",
    "protocol_pdf_url": "https://www.parlament.gv.at/dokument/XXII/NRSITZ/76/fname_028821.pdf",
    "protocol_html_url": "https://www.parlament.gv.at/dokument/XXII/NRSITZ/76/fnameorig_028821.html",
    "uid": "XXII_NRSITZ_76",
    "raw_path": "steno_protocols/raw_html/XXII_NRSITZ_76.html",
    "txt_path": "steno_protocols/plain_text/XXII_NRSITZ_76.txt"
  },
  {
    "session_date_display": "08.07.2003",
    "session_date_iso": "2003-07-08T00:00:00",
    "gp_code": "XXII",
    "chamber": "NRSITZ",
    "session_number": 27,
    "title": "27. Sitzung (27/NRSITZ)",
    "citation": "27/NRSITZ",
    "session_detail_url": "https://www.parlament.gv.at/gegenstand/XXII/NRSITZ/27",
    "protocol_pdf_url": "https://www.parlament.gv.at/dokument/XXII/NRSITZ/27/fname_007364.pdf",
    "protocol_html_url": "https://www.parlament.gv.at/dokument/XXII/NRSITZ/27/fnameorig_007364.html",
    "uid": "XXII_NRSITZ_27",
    "raw_path": "steno_protocols/raw_html/XXII_NRSITZ_27.html",
    "txt_path": "steno_protocols/plain_text/XXII_NRSITZ_27.txt"
  },
  {
    "session_date_display": "10.11.2004",
    "session_date_iso": "2004-11-10T00:00:00",
    "gp_code": "XXII",
    "chamber": "NRSITZ",
    "session_number": 83,
    "title": "83. Sitzung (83/NRSITZ)",
    "citation": "83/NRSITZ",
    "session_detail_url": "https://www.parlament.gv.at/gegenstand/XXII/NRSITZ/83",
    "protocol_pdf_url": "https://www.parlament.gv.at/dokument/XXII/NRSITZ/83/fname_033782.pdf",
    "protocol_html_url": "https://www.parlament.gv.at/dokument/XXII/NRSITZ/83/fnameorig_033782.html",
    "uid": "XXII_NRSITZ_83",
    "raw_path": "steno_protocols/raw_html/XXII_NRSITZ_83.html",
    "txt_path": "steno_protocols/plain_text/XXII_NRSITZ_83.txt"
  },
  {
    "session_date_display": "26.02.2003",
    "session_date_iso": "2003-02-26T00:00:00",
    "gp_code": "XXII",
    "chamber": "NRSITZ",
    "session_number": 5,
    "title": "5. Sitzung (5/NRSITZ)",
    "citation": "5/NRSITZ",
    "session_detail_url": "https://www.parlament.gv.at/gegenstand/XXII/NRSITZ/5",
    "protocol_pdf_url": "https://www.parlament.gv.at/dokument/XXII/NRSITZ/5/fname_114619.pdf",
    "protocol_html_url": "https://www.parlament.gv.at/dokument/XXII/NRSITZ/5/fnameorig_114619.html",
    "uid": "XXII_NRSITZ_5",
    "raw_path": "steno_protocols/raw_html/XXII_NRSITZ_5.html",
    "txt_path": "steno_protocols/plain_text/XXII_NRSITZ_5.txt"
  },
  {
    "session_date_display": "26.02.2003",
    "session_date_iso": "2003-02-26T00:00:00",
    "gp_code": "XXII",
    "chamber": "NRSITZ",
    "session_number": 6,
    "title": "6. Sitzung (6/NRSITZ)",
    "citation": "6/NRSITZ",
    "session_detail_url": "https://www.parlament.gv.at/gegenstand/XXII/NRSITZ/6",
    "protocol_pdf_url": "https://www.parlament.gv.at/dokument/XXII/NRSITZ/6/fname_114621.pdf",
    "protocol_html_url": "https://www.parlament.gv.at/dokument/XXII/NRSITZ/6/fnameorig_114621.html",
    "uid": "XXII_NRSITZ_6",
    "raw_path": "steno_protocols/raw_html/XXII_NRSITZ_6.html",
    "txt_path": "steno_protocols/plain_text/XXII_NRSITZ_6.txt"
  },
  {
    "session_date_display": "07.07.2015",
    "session_date_iso": "2015-07-07T00:00:00",
    "gp_code": "XXV",
    "chamber": "NRSITZ",
    "session_number": 84,
    "title": "84. Sitzung (84/NRSITZ)",
    "citation": "84/NRSITZ",
    "session_detail_url": "https://www.parlament.gv.at/gegenstand/XXV/NRSITZ/84",
    "protocol_pdf_url": "https://www.parlament.gv.at/dokument/XXV/NRSITZ/84/fname_489432.pdf",
    "protocol_html_url": "https://www.parlament.gv.at/dokument/XXV/NRSITZ/84/fnameorig_489432.html",
    "uid": "XXV_NRSITZ_84",
    "raw_path": "steno_protocols/raw_html/XXV_NRSITZ_84.html",
    "txt_path": "steno_protocols/plain_text/XXV_NRSITZ_84.txt"
  },
  {
    "session_date_display": "07.06.2017",
    "session_date_iso": "2017-06-07T00:00:00",
    "gp_code": "XXV",
    "chamber": "NRSITZ",
    "session_number": 185,
    "title": "185. Sitzung (185/NRSITZ)",
    "citation": "185/NRSITZ",
    "session_detail_url": "https://www.parlament.gv.at/gegenstand/XXV/NRSITZ/185",
    "protocol_pdf_url": "https://www.parlament.gv.at/dokument/XXV/NRSITZ/185/fname_674020.pdf",
    "protocol_html_url": "https://www.parlament.gv.at/dokument/XXV/NRSITZ/185/fnameorig_674020.html",
    "uid": "XXV_NRSITZ_185",
    "raw_path": "steno_protocols/raw_html/XXV_NRSITZ_185.html",
    "txt_path": "steno_protocols/plain_text/XXV_NRSITZ_185.txt"
  },
  {
    "session_date_display": "19.06.2017",
    "session_date_iso": "2017-06-19T00:00:00",
    "gp_code": "XXV",
    "chamber": "NRSITZ",
    "session_number": 187,
    "title": "187. Sitzung (187/NRSITZ)",
    "citation": "187/NRSITZ",
    "session_detail_url": "https://www.parlament.gv.at/gegenstand/XXV/NRSITZ/187",
    "protocol_pdf_url": "https://www.parlament.gv.at/dokument/XXV/NRSITZ/187/fname_673187.pdf",
    "protocol_html_url": "https://www.parlament.gv.at/dokument/XXV/NRSITZ/187/fnameorig_673187.html",
    "uid": "XXV_NRSITZ_187",
    "raw_path": "steno_protocols/raw_html/XXV_NRSITZ_187.html",
    "txt_path": "steno_protocols/plain_text/XXV_NRSITZ_187.txt"
  },
  {
    "session_date_display": "06.10.2015",
    "session_date_iso": "2015-10-06T00:00:00",
    "gp_code": "XXV",
    "chamber": "NRSITZ",
    "session_number": 95,
    "title": "95. Sitzung (95/NRSITZ)",
    "citation": "95/NRSITZ",
    "session_detail_url": "https://www.parlament.gv.at/gegenstand/XXV/NRSITZ/95",
    "protocol_pdf_url": "https://www.parlament.gv.at/dokument/XXV/NRSITZ/95/fname_525309.pdf",
    "protocol_html_url": "https://www.parlament.gv.at/dokument/XXV/NRSITZ/95/fnameorig_525309.html",
    "uid": "XXV_NRSITZ_95",
    "raw_path": "steno_protocols/raw_html/XXV_NRSITZ_95.html",
    "txt_path": "steno_protocols/plain_text/XXV_NRSITZ_95.txt"
  },
  {
    "session_date_display": "14.10.2015",
    "session_date_iso": "2015-10-14T00:00:00",
    "gp_code": "XXV",
    "chamber": "NRSITZ",
    "session_number": 97,
    "title": "97. Sitzung (97/NRSITZ)",
    "citation": "97/NRSITZ",
    "session_detail_url": "https://www.parlament.gv.at/gegenstand/XXV/NRSITZ/97",
    "protocol_pdf_url": "https://www.parlament.gv.at/dokument/XXV/NRSITZ/97/fname_526834.pdf",
    "protocol_html_url": "https://www.parlament.gv.at/dokument/XXV/NRSITZ/97/fnameorig_526834.html",
    "uid": "XXV_NRSITZ_97",
    "raw_path": "steno_protocols/raw_html/XXV_NRSITZ_97.html",
    "txt_path": "steno_protocols/plain_text/XXV_NRSITZ_97.txt"
  },
  {
    "session_date_display": "20.09.2017",
    "session_date_iso": "2017-09-20T00:00:00",
    "gp_code": "XXV",
    "chamber": "NRSITZ",
    "session_number": 194,
    "title": "194. Sitzung (194/NRSITZ)",
    "citation": "194/NRSITZ",
    "session_detail_url": "https://www.parlament.gv.at/gegenstand/XXV/NRSITZ/194",
    "protocol_pdf_url": "https://www.parlament.gv.at/dokument/XXV/NRSITZ/194/fname_677597.pdf",
    "protocol_html_url": "https://www.parlament.gv.at/dokument/XXV/NRSITZ/194/fnameorig_677597.html",
    "uid": "XXV_NRSITZ_194",
    "raw_path": "steno_protocols/raw_html/XXV_NRSITZ_194.html",
    "txt_path": "steno_protocols/plain_text/XXV_NRSITZ_194.txt"
  },
  {
    "session_date_display": "11.11.2015",
    "session_date_iso": "2015-11-11T00:00:00",
    "gp_code": "XXV",
    "chamber": "NRSITZ",
    "session_number": 101,
    "title": "101. Sitzung (101/NRSITZ)",
    "citation": "101/NRSITZ",
    "session_detail_url": "https://www.parlament.gv.at/gegenstand/XXV/NRSITZ/101",
    "protocol_pdf_url": "https://www.parlament.gv.at/dokument/XXV/NRSITZ/101/fname_543768.pdf",
    "protocol_html_url": "https://www.parlament.gv.at/dokument/XXV/NRSITZ/101/fnameorig_543768.html",
    "uid": "XXV_NRSITZ_101",
    "raw_path": "steno_protocols/raw_html/XXV_NRSITZ_101.html",
    "txt_path": "steno_protocols/plain_text/XXV_NRSITZ_101.txt"
  },
  {
    "session_date_display": "24.11.2015",
    "session_date_iso": "2015-11-24T00:00:00",
    "gp_code": "XXV",
    "chamber": "NRSITZ",
    "session_number": 104,
    "title": "104. Sitzung (104/NRSITZ)",
    "citation": "104/NRSITZ",
    "session_detail_url": "https://www.parlament.gv.at/gegenstand/XXV/NRSITZ/104",
    "protocol_pdf_url": "https://www.parlament.gv.at/dokument/XXV/NRSITZ/104/fname_561333.pdf",
    "protocol_html_url": "https://www.parlament.gv.at/dokument/XXV/NRSITZ/104/fnameorig_561333.html",
    "uid": "XXV_NRSITZ_104",
    "raw_path": "steno_protocols/raw_html/XXV_NRSITZ_104.html",
    "txt_path": "steno_protocols/plain_text/XXV_NRSITZ_104.txt"
  },
  {
    "session_date_display": "04.10.2017",
    "session_date_iso": "2017-10-04T00:00:00",
    "gp_code": "XXV",
    "chamber": "NRSITZ",
    "session_number": 198,
    "title": "198. Sitzung (198/NRSITZ)",
    "citation": "198/NRSITZ",
    "session_detail_url": "https://www.parlament.gv.at/gegenstand/XXV/NRSITZ/198",
    "protocol_pdf_url": "https://www.parlament.gv.at/dokument/XXV/NRSITZ/198/fname_677880.pdf",
    "protocol_html_url": "https://www.parlament.gv.at/dokument/XXV/NRSITZ/198/fnameorig_677880.html",
    "uid": "XXV_NRSITZ_198",
    "raw_path": "steno_protocols/raw_html/XXV_NRSITZ_198.html",
    "txt_path": "steno_protocols/plain_text/XXV_NRSITZ_198.txt"
  },
  {
    "session_date_display": "25.02.2014",
    "session_date_iso": "2014-02-25T00:00:00",
    "gp_code": "XXV",
    "chamber": "NRSITZ",
    "session_number": 14,
    "title": "14. Sitzung (14/NRSITZ)",
    "citation": "14/NRSITZ",
    "session_detail_url": "https://www.parlament.gv.at/gegenstand/XXV/NRSITZ/14",
    "protocol_pdf_url": "https://www.parlament.gv.at/dokument/XXV/NRSITZ/14/fname_345314.pdf",
    "protocol_html_url": "https://www.parlament.gv.at/dokument/XXV/NRSITZ/14/fnameorig_345314.html",
    "uid": "XXV_NRSITZ_14",
    "raw_path": "steno_protocols/raw_html/XXV_NRSITZ_14.html",
    "txt_path": "steno_protocols/plain_text/XXV_NRSITZ_14.txt"
  },
  {
    "session_date_display": "27.03.2014",
    "session_date_iso": "2014-03-27T00:00:00",
    "gp_code": "XXV",
    "chamber": "NRSITZ",
    "session_number": 19,
    "title": "19. Sitzung (19/NRSITZ)",
    "citation": "19/NRSITZ",
    "session_detail_url": "https://www.parlament.gv.at/gegenstand/XXV/NRSITZ/19",
    "protocol_pdf_url": "https://www.parlament.gv.at/dokument/XXV/NRSITZ/19/fname_349675.pdf",
    "protocol_html_url": "https://www.parlament.gv.at/dokument/XXV/NRSITZ/19/fnameorig_349675.html",
    "uid": "XXV_NRSITZ_19",
    "raw_path": "steno_protocols/raw_html/XXV_NRSITZ_19.html",
    "txt_path": "steno_protocols/plain_text/XXV_NRSITZ_19.txt"
  },
  {
    "session_date_display": "16.03.2016",
    "session_date_iso": "2016-03-16T00:00:00",
    "gp_code": "XXV",
    "chamber": "NRSITZ",
    "session_number": 117,
    "title": "117. Sitzung (117/NRSITZ)",
    "citation": "117/NRSITZ",
    "session_detail_url": "https://www.parlament.gv.at/gegenstand/XXV/NRSITZ/117",
    "protocol_pdf_url": "https://www.parlament.gv.at/dokument/XXV/NRSITZ/117/fname_562452.pdf",
    "protocol_html_url": "https://www.parlament.gv.at/dokument/XXV/NRSITZ/117/fnameorig_562452.html",
    "uid": "XXV_NRSITZ_117",
    "raw_path": "steno_protocols/raw_html/XXV_NRSITZ_117.html",
    "txt_path": "steno_protocols/plain_text/XXV_NRSITZ_117.txt"
  },
  {
    "session_date_display": "21.05.2014",
    "session_date_iso": "2014-05-21T00:00:00",
    "gp_code": "XXV",
    "chamber": "NRSITZ",
    "session_number": 27,
    "title": "27. Sitzung (27/NRSITZ)",
    "citation": "27/NRSITZ",
    "session_detail_url": "https://www.parlament.gv.at/gegenstand/XXV/NRSITZ/27",
    "protocol_pdf_url": "https://www.parlament.gv.at/dokument/XXV/NRSITZ/27/fname_363241.pdf",
    "protocol_html_url": "https://www.parlament.gv.at/dokument/XXV/NRSITZ/27/fnameorig_363241.html",
    "uid": "XXV_NRSITZ_27",
    "raw_path": "steno_protocols/raw_html/XXV_NRSITZ_27.html",
    "txt_path": "steno_protocols/plain_text/XXV_NRSITZ_27.txt"
  },
  {
    "session_date_display": "12.06.2014",
    "session_date_iso": "2014-06-12T00:00:00",
    "gp_code": "XXV",
    "chamber": "NRSITZ",
    "session_number": 30,
    "title": "30. Sitzung (30/NRSITZ)",
    "citation": "30/NRSITZ",
    "session_detail_url": "https://www.parlament.gv.at/gegenstand/XXV/NRSITZ/30",
    "protocol_pdf_url": "https://www.parlament.gv.at/dokument/XXV/NRSITZ/30/fname_366377.pdf",
    "protocol_html_url": "https://www.parlament.gv.at/dokument/XXV/NRSITZ/30/fnameorig_366377.html",
    "uid": "XXV_NRSITZ_30",
    "raw_path": "steno_protocols/raw_html/XXV_NRSITZ_30.html",
    "txt_path": "steno_protocols/plain_text/XXV_NRSITZ_30.txt"
  },
  {
    "session_date_display": "28.04.2016",
    "session_date_iso": "2016-04-28T00:00:00",
    "gp_code": "XXV",
    "chamber": "NRSITZ",
    "session_number": 126,
    "title": "126. Sitzung (126/NRSITZ)",
    "citation": "126/NRSITZ",
    "session_detail_url": "https://www.parlament.gv.at/gegenstand/XXV/NRSITZ/126",
    "protocol_pdf_url": "https://www.parlament.gv.at/dokument/XXV/NRSITZ/126/fname_566920.pdf",
    "protocol_html_url": "https://www.parlament.gv.at/dokument/XXV/NRSITZ/126/fnameorig_566920.html",
    "uid": "XXV_NRSITZ_126",
    "raw_path": "steno_protocols/raw_html/XXV_NRSITZ_126.html",
    "txt_path": "steno_protocols/plain_text/XXV_NRSITZ_126.txt"
  },
  {
    "session_date_display": "21.09.2016",
    "session_date_iso": "2016-09-21T00:00:00",
    "gp_code": "XXV",
    "chamber": "NRSITZ",
    "session_number": 145,
    "title": "145. Sitzung (145/NRSITZ)",
    "citation": "145/NRSITZ",
    "session_detail_url": "https://www.parlament.gv.at/gegenstand/XXV/NRSITZ/145",
    "protocol_pdf_url": "https://www.parlament.gv.at/dokument/XXV/NRSITZ/145/fname_611283.pdf",
    "protocol_html_url": "https://www.parlament.gv.at/dokument/XXV/NRSITZ/145/fnameorig_611283.html",
    "uid": "XXV_NRSITZ_145",
    "raw_path": "steno_protocols/raw_html/XXV_NRSITZ_145.html",
    "txt_path": "steno_protocols/plain_text/XXV_NRSITZ_145.txt"
  },
  {
    "session_date_display": "20.11.2014",
    "session_date_iso": "2014-11-20T00:00:00",
    "gp_code": "XXV",
    "chamber": "NRSITZ",
    "session_number": 52,
    "title": "52. Sitzung (52/NRSITZ)",
    "citation": "52/NRSITZ",
    "session_detail_url": "https://www.parlament.gv.at/gegenstand/XXV/NRSITZ/52",
    "protocol_pdf_url": "https://www.parlament.gv.at/dokument/XXV/NRSITZ/52/fname_385041.pdf",
    "protocol_html_url": "https://www.parlament.gv.at/dokument/XXV/NRSITZ/52/fnameorig_385041.html",
    "uid": "XXV_NRSITZ_52",
    "raw_path": "steno_protocols/raw_html/XXV_NRSITZ_52.html",
    "txt_path": "steno_protocols/plain_text/XXV_NRSITZ_52.txt"
  },
  {
    "session_date_display": "10.12.2014",
    "session_date_iso": "2014-12-10T00:00:00",
    "gp_code": "XXV",
    "chamber": "NRSITZ",
    "session_number": 53,
    "title": "53. Sitzung (53/NRSITZ)",
    "citation": "53/NRSITZ",
    "session_detail_url": "https://www.parlament.gv.at/gegenstand/XXV/NRSITZ/53",
    "protocol_pdf_url": "https://www.parlament.gv.at/dokument/XXV/NRSITZ/53/fname_390290.pdf",
    "protocol_html_url": "https://www.parlament.gv.at/dokument/XXV/NRSITZ/53/fnameorig_390290.html",
    "uid": "XXV_NRSITZ_53",
    "raw_path": "steno_protocols/raw_html/XXV_NRSITZ_53.html",
    "txt_path": "steno_protocols/plain_text/XXV_NRSITZ_53.txt"
  },
  {
    "session_date_display": "11.12.2014",
    "session_date_iso": "2014-12-11T00:00:00",
    "gp_code": "XXV",
    "chamber": "NRSITZ",
    "session_number": 55,
    "title": "55. Sitzung (55/NRSITZ)",
    "citation": "55/NRSITZ",
    "session_detail_url": "https://www.parlament.gv.at/gegenstand/XXV/NRSITZ/55",
    "protocol_pdf_url": "https://www.parlament.gv.at/dokument/XXV/NRSITZ/55/fname_397751.pdf",
    "protocol_html_url": "https://www.parlament.gv.at/dokument/XXV/NRSITZ/55/fnameorig_397751.html",
    "uid": "XXV_NRSITZ_55",
    "raw_path": "steno_protocols/raw_html/XXV_NRSITZ_55.html",
    "txt_path": "steno_protocols/plain_text/XXV_NRSITZ_55.txt"
  },
  {
    "session_date_display": "21.04.2021",
    "session_date_iso": "2021-04-21T00:00:00",
    "gp_code": "XXVII",
    "chamber": "NRSITZ",
    "session_number": 98,
    "title": "98. Sitzung (98/NRSITZ)",
    "citation": "98/NRSITZ",
    "session_detail_url": "https://www.parlament.gv.at/gegenstand/XXVII/NRSITZ/98",
    "protocol_pdf_url": "https://www.parlament.gv.at/dokument/XXVII/NRSITZ/98/fname_996938.pdf",
    "protocol_html_url": "https://www.parlament.gv.at/dokument/XXVII/NRSITZ/98/fnameorig_996938.html",
    "uid": "XXVII_NRSITZ_98",
    "raw_path": "steno_protocols/raw_html/XXVII_NRSITZ_98.html",
    "txt_path": "steno_protocols/plain_text/XXVII_NRSITZ_98.txt"
  },
  {
    "session_date_display": "22.04.2021",
    "session_date_iso": "2021-04-22T00:00:00",
    "gp_code": "XXVII",
    "chamber": "NRSITZ",
    "session_number": 100,
    "title": "100. Sitzung (100/NRSITZ)",
    "citation": "100/NRSITZ",
    "session_detail_url": "https://www.parlament.gv.at/gegenstand/XXVII/NRSITZ/100",
    "protocol_pdf_url": "https://www.parlament.gv.at/dokument/XXVII/NRSITZ/100/fname_1001761.pdf",
    "protocol_html_url": "https://www.parlament.gv.at/dokument/XXVII/NRSITZ/100/fnameorig_1001761.html",
    "uid": "XXVII_NRSITZ_100",
    "raw_path": "steno_protocols/raw_html/XXVII_NRSITZ_100.html",
    "txt_path": "steno_protocols/plain_text/XXVII_NRSITZ_100.txt"
  },
  {
    "session_date_display": "22.01.2020",
    "session_date_iso": "2020-01-22T00:00:00",
    "gp_code": "XXVII",
    "chamber": "NRSITZ",
    "session_number": 10,
    "title": "10. Sitzung (10/NRSITZ)",
    "citation": "10/NRSITZ",
    "session_detail_url": "https://www.parlament.gv.at/gegenstand/XXVII/NRSITZ/10",
    "protocol_pdf_url": "https://www.parlament.gv.at/dokument/XXVII/NRSITZ/10/fname_802597.pdf",
    "protocol_html_url": "https://www.parlament.gv.at/dokument/XXVII/NRSITZ/10/fnameorig_802597.html",
    "uid": "XXVII_NRSITZ_10",
    "raw_path": "steno_protocols/raw_html/XXVII_NRSITZ_10.html",
    "txt_path": "steno_protocols/plain_text/XXVII_NRSITZ_10.txt"
  },
  {
    "session_date_display": "19.05.2021",
    "session_date_iso": "2021-05-19T00:00:00",
    "gp_code": "XXVII",
    "chamber": "NRSITZ",
    "session_number": 106,
    "title": "106. Sitzung (106/NRSITZ)",
    "citation": "106/NRSITZ",
    "session_detail_url": "https://www.parlament.gv.at/gegenstand/XXVII/NRSITZ/106",
    "protocol_pdf_url": "https://www.parlament.gv.at/dokument/XXVII/NRSITZ/106/fname_1009190.pdf",
    "protocol_html_url": "https://www.parlament.gv.at/dokument/XXVII/NRSITZ/106/fnameorig_1009190.html",
    "uid": "XXVII_NRSITZ_106",
    "raw_path": "steno_protocols/raw_html/XXVII_NRSITZ_106.html",
    "txt_path": "steno_protocols/plain_text/XXVII_NRSITZ_106.txt"
  },
  {
    "session_date_display": "02.04.2020",
    "session_date_iso": "2020-04-02T00:00:00",
    "gp_code": "XXVII",
    "chamber": "NRSITZ",
    "session_number": 21,
    "title": "21. Sitzung (21/NRSITZ)",
    "citation": "21/NRSITZ",
    "session_detail_url": "https://www.parlament.gv.at/gegenstand/XXVII/NRSITZ/21",
    "protocol_pdf_url": "https://www.parlament.gv.at/dokument/XXVII/NRSITZ/21/fname_797797.pdf",
    "protocol_html_url": "https://www.parlament.gv.at/dokument/XXVII/NRSITZ/21/fnameorig_797797.html",
    "uid": "XXVII_NRSITZ_21",
    "raw_path": "steno_protocols/raw_html/XXVII_NRSITZ_21.html",
    "txt_path": "steno_protocols/plain_text/XXVII_NRSITZ_21.txt"
  },
  {
    "session_date_display": "17.06.2021",
    "session_date_iso": "2021-06-17T00:00:00",
    "gp_code": "XXVII",
    "chamber": "NRSITZ",
    "session_number": 113,
    "title": "113. Sitzung (113/NRSITZ)",
    "citation": "113/NRSITZ",
    "session_detail_url": "https://www.parlament.gv.at/gegenstand/XXVII/NRSITZ/113",
    "protocol_pdf_url": "https://www.parlament.gv.at/dokument/XXVII/NRSITZ/113/fname_1009194.pdf",
    "protocol_html_url": "https://www.parlament.gv.at/dokument/XXVII/NRSITZ/113/fnameorig_1009194.html",
    "uid": "XXVII_NRSITZ_113",
    "raw_path": "steno_protocols/raw_html/XXVII_NRSITZ_113.html",
    "txt_path": "steno_protocols/plain_text/XXVII_NRSITZ_113.txt"
  },
  {
    "session_date_display": "19.07.2021",
    "session_date_iso": "2021-07-19T00:00:00",
    "gp_code": "XXVII",
    "chamber": "NRSITZ",
    "session_number": 119,
    "title": "119. Sitzung (119/NRSITZ)",
    "citation": "119/NRSITZ",
    "session_detail_url": "https://www.parlament.gv.at/gegenstand/XXVII/NRSITZ/119",
    "protocol_pdf_url": "https://www.parlament.gv.at/dokument/XXVII/NRSITZ/119/fname_1016748.pdf",
    "protocol_html_url": "https://www.parlament.gv.at/dokument/XXVII/NRSITZ/119/fnameorig_1016748.html",
    "uid": "XXVII_NRSITZ_119",
    "raw_path": "steno_protocols/raw_html/XXVII_NRSITZ_119.html",
    "txt_path": "steno_protocols/plain_text/XXVII_NRSITZ_119.txt"
  },
  {
    "session_date_display": "08.05.2020",
    "session_date_iso": "2020-05-08T00:00:00",
    "gp_code": "XXVII",
    "chamber": "NRSITZ",
    "session_number": 29,
    "title": "29. Sitzung (29/NRSITZ)",
    "citation": "29/NRSITZ",
    "session_detail_url": "https://www.parlament.gv.at/gegenstand/XXVII/NRSITZ/29",
    "protocol_pdf_url": "https://www.parlament.gv.at/dokument/XXVII/NRSITZ/29/fname_808340.pdf",
    "protocol_html_url": "https://www.parlament.gv.at/dokument/XXVII/NRSITZ/29/fnameorig_808340.html",
    "uid": "XXVII_NRSITZ_29",
    "raw_path": "steno_protocols/raw_html/XXVII_NRSITZ_29.html",
    "txt_path": "steno_protocols/plain_text/XXVII_NRSITZ_29.txt"
  },
  {
    "session_date_display": "13.10.2021",
    "session_date_iso": "2021-10-13T00:00:00",
    "gp_code": "XXVII",
    "chamber": "NRSITZ",
    "session_number": 126,
    "title": "126. Sitzung (126/NRSITZ)",
    "citation": "126/NRSITZ",
    "session_detail_url": "https://www.parlament.gv.at/gegenstand/XXVII/NRSITZ/126",
    "protocol_pdf_url": "https://www.parlament.gv.at/dokument/XXVII/NRSITZ/126/fname_1426426.pdf",
    "protocol_html_url": "https://www.parlament.gv.at/dokument/XXVII/NRSITZ/126/fnameorig_1426426.html",
    "uid": "XXVII_NRSITZ_126",
    "raw_path": "steno_protocols/raw_html/XXVII_NRSITZ_126.html",
    "txt_path": "steno_protocols/plain_text/XXVII_NRSITZ_126.txt"
  },
  {
    "session_date_display": "19.11.2021",
    "session_date_iso": "2021-11-19T00:00:00",
    "gp_code": "XXVII",
    "chamber": "NRSITZ",
    "session_number": 132,
    "title": "132. Sitzung (132/NRSITZ)",
    "citation": "132/NRSITZ",
    "session_detail_url": "https://www.parlament.gv.at/gegenstand/XXVII/NRSITZ/132",
    "protocol_pdf_url": "https://www.parlament.gv.at/dokument/XXVII/NRSITZ/132/fname_1438183.pdf",
    "protocol_html_url": "https://www.parlament.gv.at/dokument/XXVII/NRSITZ/132/fnameorig_1438183.html",
    "uid": "XXVII_NRSITZ_132",
    "raw_path": "steno_protocols/raw_html/XXVII_NRSITZ_132.html",
    "txt_path": "steno_protocols/plain_text/XXVII_NRSITZ_132.txt"
  },
  {
    "session_date_display": "09.12.2021",
    "session_date_iso": "2021-12-09T00:00:00",
    "gp_code": "XXVII",
    "chamber": "NRSITZ",
    "session_number": 134,
    "title": "134. Sitzung (134/NRSITZ)",
    "citation": "134/NRSITZ",
    "session_detail_url": "https://www.parlament.gv.at/gegenstand/XXVII/NRSITZ/134",
    "protocol_pdf_url": "https://www.parlament.gv.at/dokument/XXVII/NRSITZ/134/fname_1444469.pdf",
    "protocol_html_url": "https://www.parlament.gv.at/dokument/XXVII/NRSITZ/134/fnameorig_1444469.html",
    "uid": "XXVII_NRSITZ_134",
    "raw_path": "steno_protocols/raw_html/XXVII_NRSITZ_134.html",
    "txt_path": "steno_protocols/plain_text/XXVII_NRSITZ_134.txt"
  },
  {
    "session_date_display": "23.03.2022",
    "session_date_iso": "2022-03-23T00:00:00",
    "gp_code": "XXVII",
    "chamber": "NRSITZ",
    "session_number": 148,
    "title": "148. Sitzung (148/NRSITZ)",
    "citation": "148/NRSITZ",
    "session_detail_url": "https://www.parlament.gv.at/gegenstand/XXVII/NRSITZ/148",
    "protocol_pdf_url": "https://www.parlament.gv.at/dokument/XXVII/NRSITZ/148/fname_1470279.pdf",
    "protocol_html_url": "https://www.parlament.gv.at/dokument/XXVII/NRSITZ/148/fnameorig_1470279.html",
    "uid": "XXVII_NRSITZ_148",
    "raw_path": "steno_protocols/raw_html/XXVII_NRSITZ_148.html",
    "txt_path": "steno_protocols/plain_text/XXVII_NRSITZ_148.txt"
  },
  {
    "session_date_display": "14.10.2020",
    "session_date_iso": "2020-10-14T00:00:00",
    "gp_code": "XXVII",
    "chamber": "NRSITZ",
    "session_number": 55,
    "title": "55. Sitzung (55/NRSITZ)",
    "citation": "55/NRSITZ",
    "session_detail_url": "https://www.parlament.gv.at/gegenstand/XXVII/NRSITZ/55",
    "protocol_pdf_url": "https://www.parlament.gv.at/dokument/XXVII/NRSITZ/55/fname_858104.pdf",
    "protocol_html_url": "https://www.parlament.gv.at/dokument/XXVII/NRSITZ/55/fnameorig_858104.html",
    "uid": "XXVII_NRSITZ_55",
    "raw_path": "steno_protocols/raw_html/XXVII_NRSITZ_55.html",
    "txt_path": "steno_protocols/plain_text/XXVII_NRSITZ_55.txt"
  },
  {
    "session_date_display": "05.04.2022",
    "session_date_iso": "2022-04-05T00:00:00",
    "gp_code": "XXVII",
    "chamber": "NRSITZ",
    "session_number": 152,
    "title": "152. Sitzung (152/NRSITZ)",
    "citation": "152/NRSITZ",
    "session_detail_url": "https://www.parlament.gv.at/gegenstand/XXVII/NRSITZ/152",
    "protocol_pdf_url": "https://www.parlament.gv.at/dokument/XXVII/NRSITZ/152/fname_1470282.pdf",
    "protocol_html_url": "https://www.parlament.gv.at/dokument/XXVII/NRSITZ/152/fnameorig_1470282.html",
    "uid": "XXVII_NRSITZ_152",
    "raw_path": "steno_protocols/raw_html/XXVII_NRSITZ_152.html",
    "txt_path": "steno_protocols/plain_text/XXVII_NRSITZ_152.txt"
  },
  {
    "session_date_display": "20.11.2020",
    "session_date_iso": "2020-11-20T00:00:00",
    "gp_code": "XXVII",
    "chamber": "NRSITZ",
    "session_number": 66,
    "title": "66. Sitzung (66/NRSITZ)",
    "citation": "66/NRSITZ",
    "session_detail_url": "https://www.parlament.gv.at/gegenstand/XXVII/NRSITZ/66",
    "protocol_pdf_url": "https://www.parlament.gv.at/dokument/XXVII/NRSITZ/66/fname_885544.pdf",
    "protocol_html_url": "https://www.parlament.gv.at/dokument/XXVII/NRSITZ/66/fnameorig_885544.html",
    "uid": "XXVII_NRSITZ_66",
    "raw_path": "steno_protocols/raw_html/XXVII_NRSITZ_66.html",
    "txt_path": "steno_protocols/plain_text/XXVII_NRSITZ_66.txt"
  },
  {
    "session_date_display": "11.12.2020",
    "session_date_iso": "2020-12-11T00:00:00",
    "gp_code": "XXVII",
    "chamber": "NRSITZ",
    "session_number": 72,
    "title": "72. Sitzung (72/NRSITZ)",
    "citation": "72/NRSITZ",
    "session_detail_url": "https://www.parlament.gv.at/gegenstand/XXVII/NRSITZ/72",
    "protocol_pdf_url": "https://www.parlament.gv.at/dokument/XXVII/NRSITZ/72/fname_936676.pdf",
    "protocol_html_url": "https://www.parlament.gv.at/dokument/XXVII/NRSITZ/72/fnameorig_936676.html",
    "uid": "XXVII_NRSITZ_72",
    "raw_path": "steno_protocols/raw_html/XXVII_NRSITZ_72.html",
    "txt_path": "steno_protocols/plain_text/XXVII_NRSITZ_72.txt"
  },
  {
    "session_date_display": "21.12.2020",
    "session_date_iso": "2020-12-21T00:00:00",
    "gp_code": "XXVII",
    "chamber": "NRSITZ",
    "session_number": 75,
    "title": "75. Sitzung (75/NRSITZ)",
    "citation": "75/NRSITZ",
    "session_detail_url": "https://www.parlament.gv.at/gegenstand/XXVII/NRSITZ/75",
    "protocol_pdf_url": "https://www.parlament.gv.at/dokument/XXVII/NRSITZ/75/fname_946654.pdf",
    "protocol_html_url": "https://www.parlament.gv.at/dokument/XXVII/NRSITZ/75/fnameorig_946654.html",
    "uid": "XXVII_NRSITZ_75",
    "raw_path": "steno_protocols/raw_html/XXVII_NRSITZ_75.html",
    "txt_path": "steno_protocols/plain_text/XXVII_NRSITZ_75.txt"
  },
  {
    "session_date_display": "20.01.2021",
    "session_date_iso": "2021-01-20T00:00:00",
    "gp_code": "XXVII",
    "chamber": "NRSITZ",
    "session_number": 79,
    "title": "79. Sitzung (79/NRSITZ)",
    "citation": "79/NRSITZ",
    "session_detail_url": "https://www.parlament.gv.at/gegenstand/XXVII/NRSITZ/79",
    "protocol_pdf_url": "https://www.parlament.gv.at/dokument/XXVII/NRSITZ/79/fname_981208.pdf",
    "protocol_html_url": "https://www.parlament.gv.at/dokument/XXVII/NRSITZ/79/fnameorig_981208.html",
    "uid": "XXVII_NRSITZ_79",
    "raw_path": "steno_protocols/raw_html/XXVII_NRSITZ_79.html",
    "txt_path": "steno_protocols/plain_text/XXVII_NRSITZ_79.txt"
  },
  {
    "session_date_display": "26.01.2000",
    "session_date_iso": "2000-01-26T00:00:00",
    "gp_code": "XXI",
    "chamber": "NRSITZ",
    "session_number": 6,
    "title": "6. Sitzung (6/NRSITZ)",
    "citation": "6/NRSITZ",
    "session_detail_url": "https://www.parlament.gv.at/gegenstand/XXI/NRSITZ/6",
    "protocol_pdf_url": "https://www.parlament.gv.at/dokument/XXI/NRSITZ/6/fname_114367.pdf",
    "protocol_html_url": "https://www.parlament.gv.at/dokument/XXI/NRSITZ/6/fnameorig_114367.html",
    "uid": "XXI_NRSITZ_6",
    "raw_path": "steno_protocols/raw_html/XXI_NRSITZ_6.html",
    "txt_path": "steno_protocols/plain_text/XXI_NRSITZ_6.txt"
  },
  {
    "session_date_display": "08.02.2000",
    "session_date_iso": "2000-02-08T00:00:00",
    "gp_code": "XXI",
    "chamber": "NRSITZ",
    "session_number": 8,
    "title": "8. Sitzung (8/NRSITZ)",
    "citation": "8/NRSITZ",
    "session_detail_url": "https://www.parlament.gv.at/gegenstand/XXI/NRSITZ/8",
    "protocol_pdf_url": "https://www.parlament.gv.at/dokument/XXI/NRSITZ/8/fname_114371.pdf",
    "protocol_html_url": "https://www.parlament.gv.at/dokument/XXI/NRSITZ/8/fnameorig_114371.html",
    "uid": "XXI_NRSITZ_8",
    "raw_path": "steno_protocols/raw_html/XXI_NRSITZ_8.html",
    "txt_path": "steno_protocols/plain_text/XXI_NRSITZ_8.txt"
  },
  {
    "session_date_display": "23.05.2002",
    "session_date_iso": "2002-05-23T00:00:00",
    "gp_code": "XXI",
    "chamber": "NRSITZ",
    "session_number": 105,
    "title": "105. Sitzung (105/NRSITZ)",
    "citation": "105/NRSITZ",
    "session_detail_url": "https://www.parlament.gv.at/gegenstand/XXI/NRSITZ/105",
    "protocol_pdf_url": "https://www.parlament.gv.at/dokument/XXI/NRSITZ/105/fname_114565.pdf",
    "protocol_html_url": "https://www.parlament.gv.at/dokument/XXI/NRSITZ/105/fnameorig_114565.html",
    "uid": "XXI_NRSITZ_105",
    "raw_path": "steno_protocols/raw_html/XXI_NRSITZ_105.html",
    "txt_path": "steno_protocols/plain_text/XXI_NRSITZ_105.txt"
  },
  {
    "session_date_display": "14.03.2000",
    "session_date_iso": "2000-03-14T00:00:00",
    "gp_code": "XXI",
    "chamber": "NRSITZ",
    "session_number": 15,
    "title": "15. Sitzung (15/NRSITZ)",
    "citation": "15/NRSITZ",
    "session_detail_url": "https://www.parlament.gv.at/gegenstand/XXI/NRSITZ/15",
    "protocol_pdf_url": "https://www.parlament.gv.at/dokument/XXI/NRSITZ/15/fname_114385.pdf",
    "protocol_html_url": "https://www.parlament.gv.at/dokument/XXI/NRSITZ/15/fnameorig_114385.html",
    "uid": "XXI_NRSITZ_15",
    "raw_path": "steno_protocols/raw_html/XXI_NRSITZ_15.html",
    "txt_path": "steno_protocols/plain_text/XXI_NRSITZ_15.txt"
  },
  {
    "session_date_display": "22.03.2000",
    "session_date_iso": "2000-03-22T00:00:00",
    "gp_code": "XXI",
    "chamber": "NRSITZ",
    "session_number": 17,
    "title": "17. Sitzung (17/NRSITZ)",
    "citation": "17/NRSITZ",
    "session_detail_url": "https://www.parlament.gv.at/gegenstand/XXI/NRSITZ/17",
    "protocol_pdf_url": "https://www.parlament.gv.at/dokument/XXI/NRSITZ/17/fname_114389.pdf",
    "protocol_html_url": "https://www.parlament.gv.at/dokument/XXI/NRSITZ/17/fnameorig_114389.html",
    "uid": "XXI_NRSITZ_17",
    "raw_path": "steno_protocols/raw_html/XXI_NRSITZ_17.html",
    "txt_path": "steno_protocols/plain_text/XXI_NRSITZ_17.txt"
  },
  {
    "session_date_display": "10.05.2000",
    "session_date_iso": "2000-05-10T00:00:00",
    "gp_code": "XXI",
    "chamber": "NRSITZ",
    "session_number": 22,
    "title": "22. Sitzung (22/NRSITZ)",
    "citation": "22/NRSITZ",
    "session_detail_url": "https://www.parlament.gv.at/gegenstand/XXI/NRSITZ/22",
    "protocol_pdf_url": "https://www.parlament.gv.at/dokument/XXI/NRSITZ/22/fname_114399.pdf",
    "protocol_html_url": "https://www.parlament.gv.at/dokument/XXI/NRSITZ/22/fnameorig_114399.html",
    "uid": "XXI_NRSITZ_22",
    "raw_path": "steno_protocols/raw_html/XXI_NRSITZ_22.html",
    "txt_path": "steno_protocols/plain_text/XXI_NRSITZ_22.txt"
  },
  {
    "session_date_display": "19.10.2000",
    "session_date_iso": "2000-10-19T00:00:00",
    "gp_code": "XXI",
    "chamber": "NRSITZ",
    "session_number": 41,
    "title": "41. Sitzung (41/NRSITZ)",
    "citation": "41/NRSITZ",
    "session_detail_url": "https://www.parlament.gv.at/gegenstand/XXI/NRSITZ/41",
    "protocol_pdf_url": "https://www.parlament.gv.at/dokument/XXI/NRSITZ/41/fname_114437.pdf",
    "protocol_html_url": "https://www.parlament.gv.at/dokument/XXI/NRSITZ/41/fnameorig_114437.html",
    "uid": "XXI_NRSITZ_41",
    "raw_path": "steno_protocols/raw_html/XXI_NRSITZ_41.html",
    "txt_path": "steno_protocols/plain_text/XXI_NRSITZ_41.txt"
  },
  {
    "session_date_display": "29.11.2000",
    "session_date_iso": "2000-11-29T00:00:00",
    "gp_code": "XXI",
    "chamber": "NRSITZ",
    "session_number": 48,
    "title": "48. Sitzung (48/NRSITZ)",
    "citation": "48/NRSITZ",
    "session_detail_url": "https://www.parlament.gv.at/gegenstand/XXI/NRSITZ/48",
    "protocol_pdf_url": "https://www.parlament.gv.at/dokument/XXI/NRSITZ/48/fname_114451.pdf",
    "protocol_html_url": "https://www.parlament.gv.at/dokument/XXI/NRSITZ/48/fnameorig_114451.html",
    "uid": "XXI_NRSITZ_48",
    "raw_path": "steno_protocols/raw_html/XXI_NRSITZ_48.html",
    "txt_path": "steno_protocols/plain_text/XXI_NRSITZ_48.txt"
  },
  {
    "session_date_display": "12.12.2001",
    "session_date_iso": "2001-12-12T00:00:00",
    "gp_code": "XXI",
    "chamber": "NRSITZ",
    "session_number": 87,
    "title": "87. Sitzung (87/NRSITZ)",
    "citation": "87/NRSITZ",
    "session_detail_url": "https://www.parlament.gv.at/gegenstand/XXI/NRSITZ/87",
    "protocol_pdf_url": "https://www.parlament.gv.at/dokument/XXI/NRSITZ/87/fname_114529.pdf",
    "protocol_html_url": "https://www.parlament.gv.at/dokument/XXI/NRSITZ/87/fnameorig_114529.html",
    "uid": "XXI_NRSITZ_87",
    "raw_path": "steno_protocols/raw_html/XXI_NRSITZ_87.html",
    "txt_path": "steno_protocols/plain_text/XXI_NRSITZ_87.txt"
  },
  {
    "session_date_display": "21.03.2002",
    "session_date_iso": "2002-03-21T00:00:00",
    "gp_code": "XXI",
    "chamber": "NRSITZ",
    "session_number": 99,
    "title": "99. Sitzung (99/NRSITZ)",
    "citation": "99/NRSITZ",
    "session_detail_url": "https://www.parlament.gv.at/gegenstand/XXI/NRSITZ/99",
    "protocol_pdf_url": "https://www.parlament.gv.at/dokument/XXI/NRSITZ/99/fname_114553.pdf",
    "protocol_html_url": "https://www.parlament.gv.at/dokument/XXI/NRSITZ/99/fnameorig_114553.html",
    "uid": "XXI_NRSITZ_99",
    "raw_path": "steno_protocols/raw_html/XXI_NRSITZ_99.html",
    "txt_path": "steno_protocols/plain_text/XXI_NRSITZ_99.txt"
  },
  {
    "session_date_display": "29.04.2003",
    "session_date_iso": "2003-04-29T00:00:00",
    "gp_code": "XXII",
    "chamber": "NRSITZ",
    "session_number": 12,
    "title": "12. Sitzung (12/NRSITZ)",
    "citation": "12/NRSITZ",
    "session_detail_url": "https://www.parlament.gv.at/gegenstand/XXII/NRSITZ/12",
    "protocol_pdf_url": "https://www.parlament.gv.at/dokument/XXII/NRSITZ/12/fname_114633.pdf",
    "protocol_html_url": "https://www.parlament.gv.at/dokument/XXII/NRSITZ/12/fnameorig_114633.html",
    "uid": "XXII_NRSITZ_12",
    "raw_path": "steno_protocols/raw_html/XXII_NRSITZ_12.html",
    "txt_path": "steno_protocols/plain_text/XXII_NRSITZ_12.txt"
  },
  {
    "session_date_display": "08.05.2003",
    "session_date_iso": "2003-05-08T00:00:00",
    "gp_code": "XXII",
    "chamber": "NRSITZ",
    "session_number": 16,
    "title": "16. Sitzung (16/NRSITZ)",
    "citation": "16/NRSITZ",
    "session_detail_url": "https://www.parlament.gv.at/gegenstand/XXII/NRSITZ/16",
    "protocol_pdf_url": "https://www.parlament.gv.at/dokument/XXII/NRSITZ/16/fname_114641.pdf",
    "protocol_html_url": "https://www.parlament.gv.at/dokument/XXII/NRSITZ/16/fnameorig_114641.html",
    "uid": "XXII_NRSITZ_16",
    "raw_path": "steno_protocols/raw_html/XXII_NRSITZ_16.html",
    "txt_path": "steno_protocols/plain_text/XXII_NRSITZ_16.txt"
  },
  {
    "session_date_display": "05.05.2004",
    "session_date_iso": "2004-05-05T00:00:00",
    "gp_code": "XXII",
    "chamber": "NRSITZ",
    "session_number": 58,
    "title": "58. Sitzung (58/NRSITZ)",
    "citation": "58/NRSITZ",
    "session_detail_url": "https://www.parlament.gv.at/gegenstand/XXII/NRSITZ/58",
    "protocol_pdf_url": "https://www.parlament.gv.at/dokument/XXII/NRSITZ/58/fname_021013.pdf",
    "protocol_html_url": "https://www.parlament.gv.at/dokument/XXII/NRSITZ/58/fnameorig_021013.html",
    "uid": "XXII_NRSITZ_58",
    "raw_path": "steno_protocols/raw_html/XXII_NRSITZ_58.html",
    "txt_path": "steno_protocols/plain_text/XXII_NRSITZ_58.txt"
  },
  {
    "session_date_display": "04.06.2003",
    "session_date_iso": "2003-06-04T00:00:00",
    "gp_code": "XXII",
    "chamber": "NRSITZ",
    "session_number": 19,
    "title": "19. Sitzung (19/NRSITZ)",
    "citation": "19/NRSITZ",
    "session_detail_url": "https://www.parlament.gv.at/gegenstand/XXII/NRSITZ/19",
    "protocol_pdf_url": "https://www.parlament.gv.at/dokument/XXII/NRSITZ/19/fname_006740.pdf",
    "protocol_html_url": "https://www.parlament.gv.at/dokument/XXII/NRSITZ/19/fnameorig_006740.html",
    "uid": "XXII_NRSITZ_19",
    "raw_path": "steno_protocols/raw_html/XXII_NRSITZ_19.html",
    "txt_path": "steno_protocols/plain_text/XXII_NRSITZ_19.txt"
  },
  {
    "session_date_display": "03.12.2003",
    "session_date_iso": "2003-12-03T00:00:00",
    "gp_code": "XXII",
    "chamber": "NRSITZ",
    "session_number": 40,
    "title": "40. Sitzung (40/NRSITZ)",
    "citation": "40/NRSITZ",
    "session_detail_url": "https://www.parlament.gv.at/gegenstand/XXII/NRSITZ/40",
    "protocol_pdf_url": "https://www.parlament.gv.at/dokument/XXII/NRSITZ/40/fname_014320.pdf",
    "protocol_html_url": "https://www.parlament.gv.at/dokument/XXII/NRSITZ/40/fnameorig_014320.html",
    "uid": "XXII_NRSITZ_40",
    "raw_path": "steno_protocols/raw_html/XXII_NRSITZ_40.html",
    "txt_path": "steno_protocols/plain_text/XXII_NRSITZ_40.txt"
  },
  {
    "session_date_display": "06.05.2004",
    "session_date_iso": "2004-05-06T00:00:00",
    "gp_code": "XXII",
    "chamber": "NRSITZ",
    "session_number": 60,
    "title": "60. Sitzung (60/NRSITZ)",
    "citation": "60/NRSITZ",
    "session_detail_url": "https://www.parlament.gv.at/gegenstand/XXII/NRSITZ/60",
    "protocol_pdf_url": "https://www.parlament.gv.at/dokument/XXII/NRSITZ/60/fname_021611.pdf",
    "protocol_html_url": "https://www.parlament.gv.at/dokument/XXII/NRSITZ/60/fnameorig_021611.html",
    "uid": "XXII_NRSITZ_60",
    "raw_path": "steno_protocols/raw_html/XXII_NRSITZ_60.html",
    "txt_path": "steno_protocols/plain_text/XXII_NRSITZ_60.txt"
  },
  {
    "session_date_display": "11.06.2003",
    "session_date_iso": "2003-06-11T00:00:00",
    "gp_code": "XXII",
    "chamber": "NRSITZ",
    "session_number": 21,
    "title": "21. Sitzung (21/NRSITZ)",
    "citation": "21/NRSITZ",
    "session_detail_url": "https://www.parlament.gv.at/gegenstand/XXII/NRSITZ/21",
    "protocol_pdf_url": "https://www.parlament.gv.at/dokument/XXII/NRSITZ/21/fname_007147.pdf",
    "protocol_html_url": "https://www.parlament.gv.at/dokument/XXII/NRSITZ/21/fnameorig_007147.html",
    "uid": "XXII_NRSITZ_21",
    "raw_path": "steno_protocols/raw_html/XXII_NRSITZ_21.html",
    "txt_path": "steno_protocols/plain_text/XXII_NRSITZ_21.txt"
  },
  {
    "session_date_display": "07.07.2004",
    "session_date_iso": "2004-07-07T00:00:00",
    "gp_code": "XXII",
    "chamber": "NRSITZ",
    "session_number": 72,
    "title": "72. Sitzung (72/NRSITZ)",
    "citation": "72/NRSITZ",
    "session_detail_url": "https://www.parlament.gv.at/gegenstand/XXII/NRSITZ/72",
    "protocol_pdf_url": "https://www.parlament.gv.at/dokument/XXII/NRSITZ/72/fname_026375.pdf",
    "protocol_html_url": "https://www.parlament.gv.at/dokument/XXII/NRSITZ/72/fnameorig_026375.html",
    "uid": "XXII_NRSITZ_72",
    "raw_path": "steno_protocols/raw_html/XXII_NRSITZ_72.html",
    "txt_path": "steno_protocols/plain_text/XXII_NRSITZ_72.txt"
  },
  {
    "session_date_display": "18.06.2003",
    "session_date_iso": "2003-06-18T00:00:00",
    "gp_code": "XXII",
    "chamber": "NRSITZ",
    "session_number": 26,
    "title": "26. Sitzung (26/NRSITZ)",
    "citation": "26/NRSITZ",
    "session_detail_url": "https://www.parlament.gv.at/gegenstand/XXII/NRSITZ/26",
    "protocol_pdf_url": "https://www.parlament.gv.at/dokument/XXII/NRSITZ/26/fname_007238.pdf",
    "protocol_html_url": "https://www.parlament.gv.at/dokument/XXII/NRSITZ/26/fnameorig_007238.html",
    "uid": "XXII_NRSITZ_26",
    "raw_path": "steno_protocols/raw_html/XXII_NRSITZ_26.html",
    "txt_path": "steno_protocols/plain_text/XXII_NRSITZ_26.txt"
  },
  {
    "session_date_display": "13.10.2004",
    "session_date_iso": "2004-10-13T00:00:00",
    "gp_code": "XXII",
    "chamber": "NRSITZ",
    "session_number": 78,
    "title": "78. Sitzung (78/NRSITZ)",
    "citation": "78/NRSITZ",
    "session_detail_url": "https://www.parlament.gv.at/gegenstand/XXII/NRSITZ/78",
    "protocol_pdf_url": "https://www.parlament.gv.at/dokument/XXII/NRSITZ/78/fname_029247.pdf",
    "protocol_html_url": "https://www.parlament.gv.at/dokument/XXII/NRSITZ/78/fnameorig_029247.html",
    "uid": "XXII_NRSITZ_78",
    "raw_path": "steno_protocols/raw_html/XXII_NRSITZ_78.html",
    "txt_path": "steno_protocols/plain_text/XXII_NRSITZ_78.txt"
  },
  {
    "session_date_display": "26.03.2003",
    "session_date_iso": "2003-03-26T00:00:00",
    "gp_code": "XXII",
    "chamber": "NRSITZ",
    "session_number": 11,
    "title": "11. Sitzung (11/NRSITZ)",
    "citation": "11/NRSITZ",
    "session_detail_url": "https://www.parlament.gv.at/gegenstand/XXII/NRSITZ/11",
    "protocol_pdf_url": "https://www.parlament.gv.at/dokument/XXII/NRSITZ/11/fname_114631.pdf",
    "protocol_html_url": "https://www.parlament.gv.at/dokument/XXII/NRSITZ/11/fnameorig_114631.html",
    "uid": "XXII_NRSITZ_11",
    "raw_path": "steno_protocols/raw_html/XXII_NRSITZ_11.html",
    "txt_path": "steno_protocols/plain_text/XXII_NRSITZ_11.txt"
  },
  {
    "session_date_display": "26.02.2004",
    "session_date_iso": "2004-02-26T00:00:00",
    "gp_code": "XXII",
    "chamber": "NRSITZ",
    "session_number": 53,
    "title": "53. Sitzung (53/NRSITZ)",
    "citation": "53/NRSITZ",
    "session_detail_url": "https://www.parlament.gv.at/gegenstand/XXII/NRSITZ/53",
    "protocol_pdf_url": "https://www.parlament.gv.at/dokument/XXII/NRSITZ/53/fname_019037.pdf",
    "protocol_html_url": "https://www.parlament.gv.at/dokument/XXII/NRSITZ/53/fnameorig_019037.html",
    "uid": "XXII_NRSITZ_53",
    "raw_path": "steno_protocols/raw_html/XXII_NRSITZ_53.html",
    "txt_path": "steno_protocols/plain_text/XXII_NRSITZ_53.txt"
  },
  {
    "session_date_display": "17.05.2017",
    "session_date_iso": "2017-05-17T00:00:00",
    "gp_code": "XXV",
    "chamber": "NRSITZ",
    "session_number": 182,
    "title": "182. Sitzung (182/NRSITZ)",
    "citation": "182/NRSITZ",
    "session_detail_url": "https://www.parlament.gv.at/gegenstand/XXV/NRSITZ/182",
    "protocol_pdf_url": "https://www.parlament.gv.at/dokument/XXV/NRSITZ/182/fname_672179.pdf",
    "protocol_html_url": "https://www.parlament.gv.at/dokument/XXV/NRSITZ/182/fnameorig_672179.html",
    "uid": "XXV_NRSITZ_182",
    "raw_path": "steno_protocols/raw_html/XXV_NRSITZ_182.html",
    "txt_path": "steno_protocols/plain_text/XXV_NRSITZ_182.txt"
  },
  {
    "session_date_display": "28.06.2017",
    "session_date_iso": "2017-06-28T00:00:00",
    "gp_code": "XXV",
    "chamber": "NRSITZ",
    "session_number": 188,
    "title": "188. Sitzung (188/NRSITZ)",
    "citation": "188/NRSITZ",
    "session_detail_url": "https://www.parlament.gv.at/gegenstand/XXV/NRSITZ/188",
    "protocol_pdf_url": "https://www.parlament.gv.at/dokument/XXV/NRSITZ/188/fname_674444.pdf",
    "protocol_html_url": "https://www.parlament.gv.at/dokument/XXV/NRSITZ/188/fnameorig_674444.html",
    "uid": "XXV_NRSITZ_188",
    "raw_path": "steno_protocols/raw_html/XXV_NRSITZ_188.html",
    "txt_path": "steno_protocols/plain_text/XXV_NRSITZ_188.txt"
  },
  {
    "session_date_display": "29.06.2017",
    "session_date_iso": "2017-06-29T00:00:00",
    "gp_code": "XXV",
    "chamber": "NRSITZ",
    "session_number": 190,
    "title": "190. Sitzung (190/NRSITZ)",
    "citation": "190/NRSITZ",
    "session_detail_url": "https://www.parlament.gv.at/gegenstand/XXV/NRSITZ/190",
    "protocol_pdf_url": "https://www.parlament.gv.at/dokument/XXV/NRSITZ/190/fname_674873.pdf",
    "protocol_html_url": "https://www.parlament.gv.at/dokument/XXV/NRSITZ/190/fnameorig_674873.html",
    "uid": "XXV_NRSITZ_190",
    "raw_path": "steno_protocols/raw_html/XXV_NRSITZ_190.html",
    "txt_path": "steno_protocols/plain_text/XXV_NRSITZ_190.txt"
  },
  {
    "session_date_display": "29.06.2017",
    "session_date_iso": "2017-06-29T00:00:00",
    "gp_code": "XXV",
    "chamber": "NRSITZ",
    "session_number": 191,
    "title": "191. Sitzung (191/NRSITZ)",
    "citation": "191/NRSITZ",
    "session_detail_url": "https://www.parlament.gv.at/gegenstand/XXV/NRSITZ/191",
    "protocol_pdf_url": "https://www.parlament.gv.at/dokument/XXV/NRSITZ/191/fname_674871.pdf",
    "protocol_html_url": "https://www.parlament.gv.at/dokument/XXV/NRSITZ/191/fnameorig_674871.html",
    "uid": "XXV_NRSITZ_191",
    "raw_path": "steno_protocols/raw_html/XXV_NRSITZ_191.html",
    "txt_path": "steno_protocols/plain_text/XXV_NRSITZ_191.txt"
  },
  {
    "session_date_display": "17.12.2013",
    "session_date_iso": "2013-12-17T00:00:00",
    "gp_code": "XXV",
    "chamber": "NRSITZ",
    "session_number": 8,
    "title": "8. Sitzung (8/NRSITZ)",
    "citation": "8/NRSITZ",
    "session_detail_url": "https://www.parlament.gv.at/gegenstand/XXV/NRSITZ/8",
    "protocol_pdf_url": "https://www.parlament.gv.at/dokument/XXV/NRSITZ/8/fname_339840.pdf",
    "protocol_html_url": "https://www.parlament.gv.at/dokument/XXV/NRSITZ/8/fnameorig_339840.html",
    "uid": "XXV_NRSITZ_8",
    "raw_path": "steno_protocols/raw_html/XXV_NRSITZ_8.html",
    "txt_path": "steno_protocols/plain_text/XXV_NRSITZ_8.txt"
  },
  {
    "session_date_display": "24.02.2014",
    "session_date_iso": "2014-02-24T00:00:00",
    "gp_code": "XXV",
    "chamber": "NRSITZ",
    "session_number": 13,
    "title": "13. Sitzung (13/NRSITZ)",
    "citation": "13/NRSITZ",
    "session_detail_url": "https://www.parlament.gv.at/gegenstand/XXV/NRSITZ/13",
    "protocol_pdf_url": "https://www.parlament.gv.at/dokument/XXV/NRSITZ/13/fname_344797.pdf",
    "protocol_html_url": "https://www.parlament.gv.at/dokument/XXV/NRSITZ/13/fnameorig_344797.html",
    "uid": "XXV_NRSITZ_13",
    "raw_path": "steno_protocols/raw_html/XXV_NRSITZ_13.html",
    "txt_path": "steno_protocols/plain_text/XXV_NRSITZ_13.txt"
  },
  {
    "session_date_display": "09.12.2015",
    "session_date_iso": "2015-12-09T00:00:00",
    "gp_code": "XXV",
    "chamber": "NRSITZ",
    "session_number": 108,
    "title": "108. Sitzung (108/NRSITZ)",
    "citation": "108/NRSITZ",
    "session_detail_url": "https://www.parlament.gv.at/gegenstand/XXV/NRSITZ/108",
    "protocol_pdf_url": "https://www.parlament.gv.at/dokument/XXV/NRSITZ/108/fname_538491.pdf",
    "protocol_html_url": "https://www.parlament.gv.at/dokument/XXV/NRSITZ/108/fnameorig_538491.html",
    "uid": "XXV_NRSITZ_108",
    "raw_path": "steno_protocols/raw_html/XXV_NRSITZ_108.html",
    "txt_path": "steno_protocols/plain_text/XXV_NRSITZ_108.txt"
  },
  {
    "session_date_display": "27.03.2014",
    "session_date_iso": "2014-03-27T00:00:00",
    "gp_code": "XXV",
    "chamber": "NRSITZ",
    "session_number": 18,
    "title": "18. Sitzung (18/NRSITZ)",
    "citation": "18/NRSITZ",
    "session_detail_url": "https://www.parlament.gv.at/gegenstand/XXV/NRSITZ/18",
    "protocol_pdf_url": "https://www.parlament.gv.at/dokument/XXV/NRSITZ/18/fname_349673.pdf",
    "protocol_html_url": "https://www.parlament.gv.at/dokument/XXV/NRSITZ/18/fnameorig_349673.html",
    "uid": "XXV_NRSITZ_18",
    "raw_path": "steno_protocols/raw_html/XXV_NRSITZ_18.html",
    "txt_path": "steno_protocols/plain_text/XXV_NRSITZ_18.txt"
  },
  {
    "session_date_display": "17.03.2016",
    "session_date_iso": "2016-03-17T00:00:00",
    "gp_code": "XXV",
    "chamber": "NRSITZ",
    "session_number": 119,
    "title": "119. Sitzung (119/NRSITZ)",
    "citation": "119/NRSITZ",
    "session_detail_url": "https://www.parlament.gv.at/gegenstand/XXV/NRSITZ/119",
    "protocol_pdf_url": "https://www.parlament.gv.at/dokument/XXV/NRSITZ/119/fname_561329.pdf",
    "protocol_html_url": "https://www.parlament.gv.at/dokument/XXV/NRSITZ/119/fnameorig_561329.html",
    "uid": "XXV_NRSITZ_119",
    "raw_path": "steno_protocols/raw_html/XXV_NRSITZ_119.html",
    "txt_path": "steno_protocols/plain_text/XXV_NRSITZ_119.txt"
  },
  {
    "session_date_display": "18.05.2016",
    "session_date_iso": "2016-05-18T00:00:00",
    "gp_code": "XXV",
    "chamber": "NRSITZ",
    "session_number": 128,
    "title": "128. Sitzung (128/NRSITZ)",
    "citation": "128/NRSITZ",
    "session_detail_url": "https://www.parlament.gv.at/gegenstand/XXV/NRSITZ/128",
    "protocol_pdf_url": "https://www.parlament.gv.at/dokument/XXV/NRSITZ/128/fname_568765.pdf",
    "protocol_html_url": "https://www.parlament.gv.at/dokument/XXV/NRSITZ/128/fnameorig_568765.html",
    "uid": "XXV_NRSITZ_128",
    "raw_path": "steno_protocols/raw_html/XXV_NRSITZ_128.html",
    "txt_path": "steno_protocols/plain_text/XXV_NRSITZ_128.txt"
  },
  {
    "session_date_display": "08.07.2014",
    "session_date_iso": "2014-07-08T00:00:00",
    "gp_code": "XXV",
    "chamber": "NRSITZ",
    "session_number": 34,
    "title": "34. Sitzung (34/NRSITZ)",
    "citation": "34/NRSITZ",
    "session_detail_url": "https://www.parlament.gv.at/gegenstand/XXV/NRSITZ/34",
    "protocol_pdf_url": "https://www.parlament.gv.at/dokument/XXV/NRSITZ/34/fname_367432.pdf",
    "protocol_html_url": "https://www.parlament.gv.at/dokument/XXV/NRSITZ/34/fnameorig_367432.html",
    "uid": "XXV_NRSITZ_34",
    "raw_path": "steno_protocols/raw_html/XXV_NRSITZ_34.html",
    "txt_path": "steno_protocols/plain_text/XXV_NRSITZ_34.txt"
  },
  {
    "session_date_display": "15.06.2016",
    "session_date_iso": "2016-06-15T00:00:00",
    "gp_code": "XXV",
    "chamber": "NRSITZ",
    "session_number": 133,
    "title": "133. Sitzung (133/NRSITZ)",
    "citation": "133/NRSITZ",
    "session_detail_url": "https://www.parlament.gv.at/gegenstand/XXV/NRSITZ/133",
    "protocol_pdf_url": "https://www.parlament.gv.at/dokument/XXV/NRSITZ/133/fname_571172.pdf",
    "protocol_html_url": "https://www.parlament.gv.at/dokument/XXV/NRSITZ/133/fnameorig_571172.html",
    "uid": "XXV_NRSITZ_133",
    "raw_path": "steno_protocols/raw_html/XXV_NRSITZ_133.html",
    "txt_path": "steno_protocols/plain_text/XXV_NRSITZ_133.txt"
  },
  {
    "session_date_display": "19.11.2014",
    "session_date_iso": "2014-11-19T00:00:00",
    "gp_code": "XXV",
    "chamber": "NRSITZ",
    "session_number": 50,
    "title": "50. Sitzung (50/NRSITZ)",
    "citation": "50/NRSITZ",
    "session_detail_url": "https://www.parlament.gv.at/gegenstand/XXV/NRSITZ/50",
    "protocol_pdf_url": "https://www.parlament.gv.at/dokument/XXV/NRSITZ/50/fname_384868.pdf",
    "protocol_html_url": "https://www.parlament.gv.at/dokument/XXV/NRSITZ/50/fnameorig_384868.html",
    "uid": "XXV_NRSITZ_50",
    "raw_path": "steno_protocols/raw_html/XXV_NRSITZ_50.html",
    "txt_path": "steno_protocols/plain_text/XXV_NRSITZ_50.txt"
  },
  {
    "session_date_display": "12.10.2016",
    "session_date_iso": "2016-10-12T00:00:00",
    "gp_code": "XXV",
    "chamber": "NRSITZ",
    "session_number": 146,
    "title": "146. Sitzung (146/NRSITZ)",
    "citation": "146/NRSITZ",
    "session_detail_url": "https://www.parlament.gv.at/gegenstand/XXV/NRSITZ/146",
    "protocol_pdf_url": "https://www.parlament.gv.at/dokument/XXV/NRSITZ/146/fname_618301.pdf",
    "protocol_html_url": "https://www.parlament.gv.at/dokument/XXV/NRSITZ/146/fnameorig_618301.html",
    "uid": "XXV_NRSITZ_146",
    "raw_path": "steno_protocols/raw_html/XXV_NRSITZ_146.html",
    "txt_path": "steno_protocols/plain_text/XXV_NRSITZ_146.txt"
  },
  {
    "session_date_display": "10.12.2014",
    "session_date_iso": "2014-12-10T00:00:00",
    "gp_code": "XXV",
    "chamber": "NRSITZ",
    "session_number": 54,
    "title": "54. Sitzung (54/NRSITZ)",
    "citation": "54/NRSITZ",
    "session_detail_url": "https://www.parlament.gv.at/gegenstand/XXV/NRSITZ/54",
    "protocol_pdf_url": "https://www.parlament.gv.at/dokument/XXV/NRSITZ/54/fname_390288.pdf",
    "protocol_html_url": "https://www.parlament.gv.at/dokument/XXV/NRSITZ/54/fnameorig_390288.html",
    "uid": "XXV_NRSITZ_54",
    "raw_path": "steno_protocols/raw_html/XXV_NRSITZ_54.html",
    "txt_path": "steno_protocols/plain_text/XXV_NRSITZ_54.txt"
  },
  {
    "session_date_display": "24.11.2016",
    "session_date_iso": "2016-11-24T00:00:00",
    "gp_code": "XXV",
    "chamber": "NRSITZ",
    "session_number": 156,
    "title": "156. Sitzung (156/NRSITZ)",
    "citation": "156/NRSITZ",
    "session_detail_url": "https://www.parlament.gv.at/gegenstand/XXV/NRSITZ/156",
    "protocol_pdf_url": "https://www.parlament.gv.at/dokument/XXV/NRSITZ/156/fname_626593.pdf",
    "protocol_html_url": "https://www.parlament.gv.at/dokument/XXV/NRSITZ/156/fnameorig_626593.html",
    "uid": "XXV_NRSITZ_156",
    "raw_path": "steno_protocols/raw_html/XXV_NRSITZ_156.html",
    "txt_path": "steno_protocols/plain_text/XXV_NRSITZ_156.txt"
  },
  {
    "session_date_display": "25.03.2015",
    "session_date_iso": "2015-03-25T00:00:00",
    "gp_code": "XXV",
    "chamber": "NRSITZ",
    "session_number": 65,
    "title": "65. Sitzung (65/NRSITZ)",
    "citation": "65/NRSITZ",
    "session_detail_url": "https://www.parlament.gv.at/gegenstand/XXV/NRSITZ/65",
    "protocol_pdf_url": "https://www.parlament.gv.at/dokument/XXV/NRSITZ/65/fname_419484.pdf",
    "protocol_html_url": "https://www.parlament.gv.at/dokument/XXV/NRSITZ/65/fnameorig_419484.html",
    "uid": "XXV_NRSITZ_65",
    "raw_path": "steno_protocols/raw_html/XXV_NRSITZ_65.html",
    "txt_path": "steno_protocols/plain_text/XXV_NRSITZ_65.txt"
  },
  {
    "session_date_display": "01.02.2017",
    "session_date_iso": "2017-02-01T00:00:00",
    "gp_code": "XXV",
    "chamber": "NRSITZ",
    "session_number": 163,
    "title": "163. Sitzung (163/NRSITZ)",
    "citation": "163/NRSITZ",
    "session_detail_url": "https://www.parlament.gv.at/gegenstand/XXV/NRSITZ/163",
    "protocol_pdf_url": "https://www.parlament.gv.at/dokument/XXV/NRSITZ/163/fname_635026.pdf",
    "protocol_html_url": "https://www.parlament.gv.at/dokument/XXV/NRSITZ/163/fnameorig_635026.html",
    "uid": "XXV_NRSITZ_163",
    "raw_path": "steno_protocols/raw_html/XXV_NRSITZ_163.html",
    "txt_path": "steno_protocols/plain_text/XXV_NRSITZ_163.txt"
  },
  {
    "session_date_display": "23.04.2015",
    "session_date_iso": "2015-04-23T00:00:00",
    "gp_code": "XXV",
    "chamber": "NRSITZ",
    "session_number": 70,
    "title": "70. Sitzung (70/NRSITZ)",
    "citation": "70/NRSITZ",
    "session_detail_url": "https://www.parlament.gv.at/gegenstand/XXV/NRSITZ/70",
    "protocol_pdf_url": "https://www.parlament.gv.at/dokument/XXV/NRSITZ/70/fname_447734.pdf",
    "protocol_html_url": "https://www.parlament.gv.at/dokument/XXV/NRSITZ/70/fnameorig_447734.html",
    "uid": "XXV_NRSITZ_70",
    "raw_path": "steno_protocols/raw_html/XXV_NRSITZ_70.html",
    "txt_path": "steno_protocols/plain_text/XXV_NRSITZ_70.txt"
  },
  {
    "session_date_display": "14.03.2017",
    "session_date_iso": "2017-03-14T00:00:00",
    "gp_code": "XXV",
    "chamber": "NRSITZ",
    "session_number": 169,
    "title": "169. Sitzung (169/NRSITZ)",
    "citation": "169/NRSITZ",
    "session_detail_url": "https://www.parlament.gv.at/gegenstand/XXV/NRSITZ/169",
    "protocol_pdf_url": "https://www.parlament.gv.at/dokument/XXV/NRSITZ/169/fname_642597.pdf",
    "protocol_html_url": "https://www.parlament.gv.at/dokument/XXV/NRSITZ/169/fnameorig_642597.html",
    "uid": "XXV_NRSITZ_169",
    "raw_path": "steno_protocols/raw_html/XXV_NRSITZ_169.html",
    "txt_path": "steno_protocols/plain_text/XXV_NRSITZ_169.txt"
  },
  {
    "session_date_display": "17.06.2015",
    "session_date_iso": "2015-06-17T00:00:00",
    "gp_code": "XXV",
    "chamber": "NRSITZ",
    "session_number": 80,
    "title": "80. Sitzung (80/NRSITZ)",
    "citation": "80/NRSITZ",
    "session_detail_url": "https://www.parlament.gv.at/gegenstand/XXV/NRSITZ/80",
    "protocol_pdf_url": "https://www.parlament.gv.at/dokument/XXV/NRSITZ/80/fname_480239.pdf",
    "protocol_html_url": "https://www.parlament.gv.at/dokument/XXV/NRSITZ/80/fnameorig_480239.html",
    "uid": "XXV_NRSITZ_80",
    "raw_path": "steno_protocols/raw_html/XXV_NRSITZ_80.html",
    "txt_path": "steno_protocols/plain_text/XXV_NRSITZ_80.txt"
  },
  {
    "session_date_display": "21.05.2015",
    "session_date_iso": "2015-05-21T00:00:00",
    "gp_code": "XXV",
    "chamber": "NRSITZ",
    "session_number": 75,
    "title": "75. Sitzung (75/NRSITZ)",
    "citation": "75/NRSITZ",
    "session_detail_url": "https://www.parlament.gv.at/gegenstand/XXV/NRSITZ/75",
    "protocol_pdf_url": "https://www.parlament.gv.at/dokument/XXV/NRSITZ/75/fname_472252.pdf",
    "protocol_html_url": "https://www.parlament.gv.at/dokument/XXV/NRSITZ/75/fnameorig_472252.html",
    "uid": "XXV_NRSITZ_75",
    "raw_path": "steno_protocols/raw_html/XXV_NRSITZ_75.html",
    "txt_path": "steno_protocols/plain_text/XXV_NRSITZ_75.txt"
  },
  {
    "session_date_display": "08.06.2015",
    "session_date_iso": "2015-06-08T00:00:00",
    "gp_code": "XXV",
    "chamber": "NRSITZ",
    "session_number": 77,
    "title": "77. Sitzung (77/NRSITZ)",
    "citation": "77/NRSITZ",
    "session_detail_url": "https://www.parlament.gv.at/gegenstand/XXV/NRSITZ/77",
    "protocol_pdf_url": "https://www.parlament.gv.at/dokument/XXV/NRSITZ/77/fname_477234.pdf",
    "protocol_html_url": "https://www.parlament.gv.at/dokument/XXV/NRSITZ/77/fnameorig_477234.html",
    "uid": "XXV_NRSITZ_77",
    "raw_path": "steno_protocols/raw_html/XXV_NRSITZ_77.html",
    "txt_path": "steno_protocols/plain_text/XXV_NRSITZ_77.txt"
  },
  {
    "session_date_display": "30.03.2017",
    "session_date_iso": "2017-03-30T00:00:00",
    "gp_code": "XXV",
    "chamber": "NRSITZ",
    "session_number": 173,
    "title": "173. Sitzung (173/NRSITZ)",
    "citation": "173/NRSITZ",
    "session_detail_url": "https://www.parlament.gv.at/gegenstand/XXV/NRSITZ/173",
    "protocol_pdf_url": "https://www.parlament.gv.at/dokument/XXV/NRSITZ/173/fname_648015.pdf",
    "protocol_html_url": "https://www.parlament.gv.at/dokument/XXV/NRSITZ/173/fnameorig_648015.html",
    "uid": "XXV_NRSITZ_173",
    "raw_path": "steno_protocols/raw_html/XXV_NRSITZ_173.html",
    "txt_path": "steno_protocols/plain_text/XXV_NRSITZ_173.txt"
  },
  {
    "session_date_display": "30.03.2017",
    "session_date_iso": "2017-03-30T00:00:00",
    "gp_code": "XXV",
    "chamber": "NRSITZ",
    "session_number": 174,
    "title": "174. Sitzung (174/NRSITZ)",
    "citation": "174/NRSITZ",
    "session_detail_url": "https://www.parlament.gv.at/gegenstand/XXV/NRSITZ/174",
    "protocol_pdf_url": "https://www.parlament.gv.at/dokument/XXV/NRSITZ/174/fname_648020.pdf",
    "protocol_html_url": "https://www.parlament.gv.at/dokument/XXV/NRSITZ/174/fnameorig_648020.html",
    "uid": "XXV_NRSITZ_174",
    "raw_path": "steno_protocols/raw_html/XXV_NRSITZ_174.html",
    "txt_path": "steno_protocols/plain_text/XXV_NRSITZ_174.txt"
  },
  {
    "session_date_display": "26.04.2017",
    "session_date_iso": "2017-04-26T00:00:00",
    "gp_code": "XXV",
    "chamber": "NRSITZ",
    "session_number": 176,
    "title": "176. Sitzung (176/NRSITZ)",
    "citation": "176/NRSITZ",
    "session_detail_url": "https://www.parlament.gv.at/gegenstand/XXV/NRSITZ/176",
    "protocol_pdf_url": "https://www.parlament.gv.at/dokument/XXV/NRSITZ/176/fname_669070.pdf",
    "protocol_html_url": "https://www.parlament.gv.at/dokument/XXV/NRSITZ/176/fnameorig_669070.html",
    "uid": "XXV_NRSITZ_176",
    "raw_path": "steno_protocols/raw_html/XXV_NRSITZ_176.html",
    "txt_path": "steno_protocols/plain_text/XXV_NRSITZ_176.txt"
  },
  {
    "session_date_display": "22.10.2019",
    "session_date_iso": "2019-10-22T00:00:00",
    "gp_code": "XXVI",
    "chamber": "NRSITZ",
    "session_number": 90,
    "title": "Nachtrag (90/NRSITZ)",
    "citation": "90/NRSITZ",
    "session_detail_url": "https://www.parlament.gv.at/gegenstand/XXVI/NRSITZ/90",
    "protocol_pdf_url": "https://www.parlament.gv.at/dokument/XXVI/NRSITZ/90/fname_1477967.pdf",
    "protocol_html_url": "https://www.parlament.gv.at/dokument/XXVI/NRSITZ/90/fnameorig_1477967.html",
    "uid": "XXVI_NRSITZ_90",
    "raw_path": "steno_protocols/raw_html/XXVI_NRSITZ_90.html",
    "txt_path": "steno_protocols/plain_text/XXVI_NRSITZ_90.txt"
  },
  {
    "session_date_display": "18.11.2022",
    "session_date_iso": "2022-11-18T00:00:00",
    "gp_code": "XXVII",
    "chamber": "NRSITZ",
    "session_number": 186,
    "title": "186. Sitzung (186/NRSITZ)",
    "citation": "186/NRSITZ",
    "session_detail_url": "https://www.parlament.gv.at/gegenstand/XXVII/NRSITZ/186",
    "protocol_pdf_url": "https://www.parlament.gv.at/dokument/XXVII/NRSITZ/186/fname_1585001.pdf",
    "protocol_html_url": "https://www.parlament.gv.at/dokument/XXVII/NRSITZ/186/fnameorig_1585001.html",
    "uid": "XXVII_NRSITZ_186",
    "raw_path": "steno_protocols/raw_html/XXVII_NRSITZ_186.html",
    "txt_path": "steno_protocols/plain_text/XXVII_NRSITZ_186.txt"
  },
  {
    "session_date_display": "13.07.2017",
    "session_date_iso": "2017-07-13T00:00:00",
    "gp_code": "XXV",
    "chamber": "NRSITZ",
    "session_number": 192,
    "title": "192. Sitzung (192/NRSITZ)",
    "citation": "192/NRSITZ",
    "session_detail_url": "https://www.parlament.gv.at/gegenstand/XXV/NRSITZ/192",
    "protocol_pdf_url": "https://www.parlament.gv.at/dokument/XXV/NRSITZ/192/fname_676229.pdf",
    "protocol_html_url": "https://www.parlament.gv.at/dokument/XXV/NRSITZ/192/fnameorig_676229.html",
    "uid": "XXV_NRSITZ_192",
    "raw_path": "steno_protocols/raw_html/XXV_NRSITZ_192.html",
    "txt_path": "steno_protocols/plain_text/XXV_NRSITZ_192.txt"
  },
  {
    "session_date_display": "20.09.2017",
    "session_date_iso": "2017-09-20T00:00:00",
    "gp_code": "XXV",
    "chamber": "NRSITZ",
    "session_number": 195,
    "title": "195. Sitzung (195/NRSITZ)",
    "citation": "195/NRSITZ",
    "session_detail_url": "https://www.parlament.gv.at/gegenstand/XXV/NRSITZ/195",
    "protocol_pdf_url": "https://www.parlament.gv.at/dokument/XXV/NRSITZ/195/fname_677599.pdf",
    "protocol_html_url": "https://www.parlament.gv.at/dokument/XXV/NRSITZ/195/fnameorig_677599.html",
    "uid": "XXV_NRSITZ_195",
    "raw_path": "steno_protocols/raw_html/XXV_NRSITZ_195.html",
    "txt_path": "steno_protocols/plain_text/XXV_NRSITZ_195.txt"
  },
  {
    "session_date_display": "20.11.2013",
    "session_date_iso": "2013-11-20T00:00:00",
    "gp_code": "XXV",
    "chamber": "NRSITZ",
    "session_number": 5,
    "title": "5. Sitzung (5/NRSITZ)",
    "citation": "5/NRSITZ",
    "session_detail_url": "https://www.parlament.gv.at/gegenstand/XXV/NRSITZ/5",
    "protocol_pdf_url": "https://www.parlament.gv.at/dokument/XXV/NRSITZ/5/fname_335017.pdf",
    "protocol_html_url": "https://www.parlament.gv.at/dokument/XXV/NRSITZ/5/fnameorig_335017.html",
    "uid": "XXV_NRSITZ_5",
    "raw_path": "steno_protocols/raw_html/XXV_NRSITZ_5.html",
    "txt_path": "steno_protocols/plain_text/XXV_NRSITZ_5.txt"
  },
  {
    "session_date_display": "03.12.2013",
    "session_date_iso": "2013-12-03T00:00:00",
    "gp_code": "XXV",
    "chamber": "NRSITZ",
    "session_number": 6,
    "title": "6. Sitzung (6/NRSITZ)",
    "citation": "6/NRSITZ",
    "session_detail_url": "https://www.parlament.gv.at/gegenstand/XXV/NRSITZ/6",
    "protocol_pdf_url": "https://www.parlament.gv.at/dokument/XXV/NRSITZ/6/fname_336222.pdf",
    "protocol_html_url": "https://www.parlament.gv.at/dokument/XXV/NRSITZ/6/fnameorig_336222.html",
    "uid": "XXV_NRSITZ_6",
    "raw_path": "steno_protocols/raw_html/XXV_NRSITZ_6.html",
    "txt_path": "steno_protocols/plain_text/XXV_NRSITZ_6.txt"
  },
  {
    "session_date_display": "12.11.2015",
    "session_date_iso": "2015-11-12T00:00:00",
    "gp_code": "XXV",
    "chamber": "NRSITZ",
    "session_number": 102,
    "title": "102. Sitzung (102/NRSITZ)",
    "citation": "102/NRSITZ",
    "session_detail_url": "https://www.parlament.gv.at/gegenstand/XXV/NRSITZ/102",
    "protocol_pdf_url": "https://www.parlament.gv.at/dokument/XXV/NRSITZ/102/fname_545588.pdf",
    "protocol_html_url": "https://www.parlament.gv.at/dokument/XXV/NRSITZ/102/fnameorig_545588.html",
    "uid": "XXV_NRSITZ_102",
    "raw_path": "steno_protocols/raw_html/XXV_NRSITZ_102.html",
    "txt_path": "steno_protocols/plain_text/XXV_NRSITZ_102.txt"
  },
  {
    "session_date_display": "04.10.2017",
    "session_date_iso": "2017-10-04T00:00:00",
    "gp_code": "XXV",
